Rank,WSIT,Running Backs (Team),Bye,Age,Best,Worst,Avg,Std Dev,Notes
1,,Saquon BarkleyS. Barkley NYG,11,22,1,2,1.4,0.5
2,,Christian McCaffreyC. McCaffrey CAR,7,23,1,2,1.6,0.5
3,,Alvin KamaraA. Kamara NO,9,24,3,5,3.4,0.5
4,,Ezekiel ElliottE. Elliott DAL,8,24,3,5,4.0,0.5
5,,Dalvin CookD. Cook MIN,12,24,3,6,4.6,0.7
6,,Nick ChubbN. Chubb CLE,7,23,5,11,6.4,0.7
7,,Leonard FournetteL. Fournette JAC,10,24,6,13,8.1,0.8
8,,Josh JacobsJ. Jacobs OAK,6,21,6,30,9.6,2.8
9,,Melvin GordonM. Gordon LAC,12,26,6,14,10.1,2.3
10,,Joe MixonJ. Mixon CIN,9,23,8,14,10.1,1.7
11,,Aaron JonesA. Jones GB,11,24,7,18,10.7,1.6
12,,Todd GurleyT. Gurley LAR,9,25,10,18,13.7,1.5
13,,James ConnerJ. Conner PIT,7,24,8,18,14.7,1.7
14,,Miles SandersM. Sanders PHI,10,22,9,31,14.9,4.5
15,,Le'Veon BellL. Bell NYJ,4,27,7,24,15.0,1.7
16,,Kerryon JohnsonK. Johnson DET,5,22,11,18,15.0,1.5
17,,Derrick HenryD. Henry TEN,11,25,10,33,15.7,4.4
18,,David JohnsonD. Johnson ARI,12,27,11,25,17.4,2.1
19,,Marlon MackM. Mack IND,6,23,15,22,18.4,1.7
20,,David MontgomeryD. Montgomery CHI,6,22,10,22,19.4,3.1
21,,Chris CarsonC. Carson SEA,11,25,10,32,19.9,2.0
22,,Sony MichelS. Michel NE,10,24,18,25,21.6,1.2
23,,Phillip LindsayP. Lindsay DEN,10,25,22,30,24.7,2.2
24,,Tevin ColemanT. Coleman SF,4,26,20,31,26.4,1.8
25,,Austin EkelerA. Ekeler LAC,12,24,22,35,26.7,3.1
26,,Derrius GuiceD. Guice WAS,10,22,19,39,27.1,4.8
27,,Mark IngramM. Ingram BAL,8,29,23,34,28.3,1.6
28,,Kareem HuntK. Hunt CLE,7,24,19,49,29.1,7.0
29,,Devin SingletaryD. Singletary BUF,6,22,18,63,29.6,6.7
30,,Devonta FreemanD. Freeman ATL,9,27,21,41,30.6,3.9
31,,Darrell HendersonD. Henderson LAR,9,22,26,56,30.9,5.3
32,,Rashaad PennyR. Penny SEA,11,23,27,40,31.7,2.4
33,,James WhiteJ. White NE,10,27,26,46,33.4,3.5
34,,Damien WilliamsD. Williams KC,12,27,24,49,34.0,4.5
35,,Tarik CohenT. Cohen CHI,6,24,29,50,35.3,2.1
36,,Royce FreemanR. Freeman DEN,10,23,24,42,36.4,3.3
37,,Matt BreidaM. Breida SF,4,24,25,46,36.7,4.8
38,,Justice HillJ. Hill BAL,8,22,29,67,39.3,5.8
39,,Kenyan DrakeK. Drake ARI,12,25,25,47,39.6,3.1
40,,Ronald Jones IIR. Jones TB,7,22,30,47,40.7,2.6
41,,Damien HarrisD. Harris NE,10,22,27,66,41.1,2.9
42,,Alexander MattisonA. Mattison MIN,12,21,33,76,41.3,3.1
43,,Jordan HowardJ. Howard PHI,10,25,32,48,42.3,3.7
44,,Latavius MurrayL. Murray NO,9,29,32,62,43.9,6.4
45,,Chase EdmondsC. Edmonds ARI,12,23,31,70,44.1,5.7
46,,Tony PollardT. Pollard DAL,8,22,29,108,44.7,4.0
47,,Duke JohnsonD. Johnson HOU,10,26,35,51,45.1,4.5
48,,Jaylen SamuelsJ. Samuels PIT,7,23,42,61,48.3,3.8
49,,LeSean McCoyL. McCoy KC,12,31,38,63,49.6,2.4
50,,Ito SmithI. Smith ATL,9,24,40,66,49.6,3.3
"50

                                              googletag.cmd.push(function() { googletag.display('div-gpt-ad-1404326895972-0'); });"
51,,Darwin ThompsonD. Thompson KC,12,22,43,94,51.9,4.9
52,,Nyheim HinesN. Hines IND,6,23,45,63,52.4,3.2
53,,Giovani BernardG. Bernard CIN,9,28,53,73,56.1,1.6
54,,Jamaal WilliamsJ. Williams GB,11,24,42,97,56.4,9.7
55,,Carlos HydeC. Hyde HOU,10,28,47,75,56.6,7.4
56,,Malcolm BrownM. Brown LAR,9,26,48,69,56.9,5.8
57,,Lamar MillerL. Miller HOU,10,28,37,80,57.9,3.8
58,,Chris ThompsonC. Thompson WAS,10,29,46,76,57.9,2.9
59,,Peyton BarberP. Barber TB,7,25,41,67,60.9,3.9
60,,Justin JacksonJ. Jackson LAC,12,23,55,74,62.6,5.6
61,,Ty JohnsonT. Johnson DET,5,22,54,151,62.7,7.8
62,,Dion LewisD. Lewis TEN,11,29,43,86,62.9,6.6
63,,Kalen BallageK. Ballage MIA,5,23,52,78,64.9,5.7
64,,Benny Snell Jr.B. Snell PIT,7,21,48,85,66.7,9.5
65,,Rex BurkheadR. Burkhead NE,10,29,54,81,67.0,7.3
66,,Ty MontgomeryT. Montgomery NYJ,4,26,61,87,69.0,8.0
67,,Jalen RichardJ. Richard OAK,6,26,60,80,70.1,4.6
68,,Wayne GallmanW. Gallman NYG,11,25,62,86,70.1,5.2
69,,Ryquell ArmsteadR. Armstead JAC,10,23,51,82,71.0,7.8
70,,Bryce LoveB. Love WAS,10,22,56,96,71.1,6.1
71,,Jerick McKinnonJ. McKinnon SF,4,27,39,88,71.9,10.0
72,,Mike DavisM. Davis CAR,7,26,54,81,72.1,5.1
73,,Adrian PetersonA. Peterson WAS,10,34,48,86,73.1,7.8
74,,Gus EdwardsG. Edwards BAL,8,,60,87,74.4,4.7
75,,Dexter WilliamsD. Williams GB,11,,59,102,75.7,9.8
76,,Mark WaltonM. Walton FA,,22,57,100,77.4,13.0
77,,Trayveon WilliamsT. Williams CIN,9,22,60,105,78.1,8.3
78,,Brian HillB. Hill ATL,9,24,61,125,78.6,8.2
79,,Dare OgunbowaleD. Ogunbowale TB,7,25,59,152,79.1,9.3
80,,Frank GoreF. Gore BUF,6,36,62,100,79.4,7.8
81,,T.J. YeldonT. Yeldon BUF,6,26,64,96,82.4,6.1
82,,Darrel WilliamsD. Williams KC,12,24,58,116,83.1,16.4
83,,Jordan WilkinsJ. Wilkins IND,6,25,77,99,83.9,2.9
84,,Raheem MostertR. Mostert SF,4,27,50,134,85.0,20.8
85,,Rodney AndersonR. Anderson CIN,9,,81,106,90.1,8.4
86,,Jordan ScarlettJ. Scarlett CAR,7,23,72,114,92.1,10.0
87,,Myles GaskinM. Gaskin MIA,5,22,75,103,92.1,4.1
88,,Qadree OllisonQ. Ollison ATL,9,23,68,131,93.9,18.1
89,,Kenneth DixonK. Dixon FA,,25,57,96,88.7,4.3
90,,Jeff WilsonJ. Wilson SF,4,24,82,98,89.5,5.3
91,,C.J. AndersonC. Anderson FA,,28,53,100,89.8,8.4
92,,Theo RiddickT. Riddick DEN,10,28,70,103,92.7,10.6
93,,Jay AjayiJ. Ajayi PHI,10,26,68,103,85.4,13.3
94,,Reggie BonnafonR. Bonnafon CAR,7,23,73,153,98.3,25.8
95,,Dontrell HilliardD. Hilliard CLE,7,24,75,95,89.6,5.6
96,,Corey ClementC. Clement PHI,10,25,76,130,96.8,16.5
97,,Elijah McGuireE. McGuire FA,,25,62,105,90.0,15.1
98,,DeAndre WashingtonD. Washington OAK,6,26,75,135,99.2,18.6
99,,Travis HomerT. Homer SEA,11,21,77,122,99.0,15.2
100,,Wendell SmallwoodW. Smallwood WAS,10,25,82,128,99.2,14.0
101,,C.J. ProsiseC. Prosise SEA,11,25,74,142,102.0,21.8
102,,Damarea CrockettD. Crockett GB,11,21,70,105,94.2,6.3
103,,Devontae BookerD. Booker DEN,10,27,81,131,102.7,13.8
104,,John KellyJ. Kelly FA,,23,84,112,96.8,10.8
105,,Bruce AndersonB. Anderson IND,6,,79,104,97.0,5.2
106,,Bilal PowellB. Powell NYJ,4,31,97,112,103.7,6.0
107,,Spencer WareS. Ware FA,,28,79,113,99.2,11.5
108,,Josh AdamsJ. Adams NYJ,4,23,73,115,101.8,9.0
109,,J.D. McKissicJ. McKissic DET,5,26,77,126,102.0,16.5
110,,Trenton CannonT. Cannon NYJ,4,25,97,132,109.6,13.0
111,,Darren SprolesD. Sproles PHI,10,36,98,114,104.8,7.0
112,,D'Onta ForemanD. Foreman FA,,23,46,108,77.0,31.0
113,,Mike WeberM. Weber DAL,8,22,89,111,100.0,9.0
114,,Brandon BoldenB. Bolden NE,10,29,95,110,100.3,6.8
115,,Jonathan WilliamsJ. Williams IND,6,25,83,117,101.3,14.0
116,,Marcus MurphyM. Murphy FA,,28,95,111,101.7,6.8
117,,Elijah HolyfieldE. Holyfield CAR,7,,98,123,111.3,9.1
118,,Corey GrantC. Grant FA,,27,92,129,111.5,13.5
119,,Isaiah CrowellI. Crowell OAK,6,26,97,110,104.7,5.6
120,,Doug MartinD. Martin FA,,30,75,109,92.0,17.0
121,,Ameer AbdullahA. Abdullah MIN,12,26,95,119,105.7,10.0
122,,Mike BooneM. Boone MIN,12,24,77,111,94.0,17.0
123,,Devine OzigboD. Ozigbo JAC,10,23,94,139,112.3,19.3
124,,Alex BarnesA. Barnes FA,,23,99,149,121.5,17.9
125,,Boston ScottB. Scott PHI,10,24,99,110,104.5,5.5
126,,Dwayne WashingtonD. Washington NO,9,25,93,145,118.0,21.3
127,,Alfred BlueA. Blue FA,,28,83,127,105.0,22.0
128,,Rod SmithR. Smith FA,,27,92,124,108.0,16.0
129,,Trey WilliamsT. Williams FA,,26,100,118,109.0,9.0
130,,Alfred MorrisA. Morris FA,,30,101,119,110.0,9.0
131,,Javorius AllenJ. Allen NYG,11,28,112,114,113.0,1.0
132,,Samaje PerineS. Perine CIN,9,24,106,140,124.0,14.0
133,,Kyle JuszczykK. Juszczyk SF,4,28,113,138,125.3,10.2
134,,James WilliamsJ. Williams FA,,23,117,123,120.0,3.0
135,,Karan HigdonK. Higdon HOU,10,23,118,127,122.5,4.5
136,,Roc ThomasR. Thomas FA,,24,120,141,130.5,10.5
