Rank,WSIT,Running Backs (Team),Bye,Age,Best,Worst,Avg,Std Dev,Notes
1,,Saquon BarkleyS. Barkley NYG,11,22,1,3,1.5,0.5
2,,Christian McCaffreyC. McCaffrey CAR,7,23,1,3,1.5,0.5
3,,Alvin KamaraA. Kamara NO,9,24,2,6,3.5,0.8
4,,Ezekiel ElliottE. Elliott DAL,8,24,2,6,4.0,0.4
5,,Dalvin CookD. Cook MIN,12,24,3,6,5.1,0.9
6,,Nick ChubbN. Chubb CLE,7,23,4,11,5.5,0.8
7,,Leonard FournetteL. Fournette JAC,10,24,6,15,9.5,2.8
8,,Joe MixonJ. Mixon CIN,9,23,7,16,9.6,2.1
9,,Melvin GordonM. Gordon LAC,12,26,5,22,10.8,2.8
10,,David JohnsonD. Johnson ARI,12,27,7,19,10.9,3.0
11,,Josh JacobsJ. Jacobs OAK,6,21,7,23,11.9,3.7
12,,Kerryon JohnsonK. Johnson DET,5,22,9,17,12.6,1.6
13,,Todd GurleyT. Gurley LAR,9,25,8,20,12.8,2.9
14,,Le'Veon BellL. Bell NYJ,4,27,8,17,13.2,2.7
15,,James ConnerJ. Conner PIT,7,24,8,29,14.9,2.0
16,,Aaron JonesA. Jones GB,11,24,7,27,15.3,3.2
17,,Derrick HenryD. Henry TEN,11,25,10,33,17.4,4.4
18,,Miles SandersM. Sanders PHI,10,22,11,39,18.6,3.3
19,,Marlon MackM. Mack IND,6,23,11,27,18.6,1.5
20,,David MontgomeryD. Montgomery CHI,6,22,12,30,19.2,2.4
21,,Chris CarsonC. Carson SEA,11,25,9,32,19.4,4.0
22,,Sony MichelS. Michel NE,10,24,16,23,20.8,1.8
23,,Phillip LindsayP. Lindsay DEN,10,25,21,30,24.0,1.7
24,,Devonta FreemanD. Freeman ATL,9,27,16,41,25.4,3.9
25,,Mark IngramM. Ingram BAL,8,29,14,41,28.2,3.1
26,,Austin EkelerA. Ekeler LAC,12,24,21,43,28.3,4.2
27,,Tevin ColemanT. Coleman SF,4,26,20,49,29.0,5.8
28,,Devin SingletaryD. Singletary BUF,6,22,23,41,29.2,4.5
29,,Derrius GuiceD. Guice WAS,10,22,18,39,29.6,5.5
30,,Rashaad PennyR. Penny SEA,11,23,26,42,29.9,2.3
31,,Darrell HendersonD. Henderson LAR,9,22,24,68,32.5,5.4
32,,Royce FreemanR. Freeman DEN,10,23,24,42,33.5,3.8
33,,James WhiteJ. White NE,10,27,26,52,34.1,5.1
34,,Damien WilliamsD. Williams KC,12,27,21,49,34.3,5.3
35,,Tarik CohenT. Cohen CHI,6,24,29,52,35.1,2.1
36,,Matt BreidaM. Breida SF,4,24,26,46,35.6,5.4
37,,Kareem HuntK. Hunt CLE,7,24,19,65,36.1,9.0
38,,Justice HillJ. Hill BAL,8,21,27,51,38.6,6.0
39,,Kenyan DrakeK. Drake ARI,12,25,30,54,39.8,3.9
40,,Damien HarrisD. Harris NE,10,22,25,53,41.7,3.3
41,,Alexander MattisonA. Mattison MIN,12,21,33,52,41.7,3.7
42,,Jordan HowardJ. Howard PHI,10,25,25,59,42.1,3.6
43,,Ronald Jones IIR. Jones TB,7,22,24,47,42.2,2.3
44,,Duke JohnsonD. Johnson HOU,10,26,27,50,43.1,5.2
45,,Tony PollardT. Pollard DAL,8,22,29,55,44.5,6.1
46,,Latavius MurrayL. Murray NO,9,29,32,63,45.5,5.7
47,,Jaylen SamuelsJ. Samuels PIT,7,23,40,54,46.3,4.0
48,,Chase EdmondsC. Edmonds ARI,12,23,24,70,48.4,12.3
49,,LeSean McCoyL. McCoy KC,12,31,35,63,50.0,5.6
50,,Darwin ThompsonD. Thompson KC,12,22,42,59,51.1,4.8
"50

                                              googletag.cmd.push(function() { googletag.display('div-gpt-ad-1404326895972-0'); });"
51,,Nyheim HinesN. Hines IND,6,22,45,69,51.9,5.2
52,,Ito SmithI. Smith ATL,9,24,39,66,52.9,4.7
53,,Malcolm BrownM. Brown LAR,9,26,44,71,55.6,6.6
54,,Carlos HydeC. Hyde HOU,10,28,35,75,57.6,8.0
55,,Chris ThompsonC. Thompson WAS,10,29,46,76,58.1,5.9
56,,Giovani BernardG. Bernard CIN,9,27,43,93,58.4,5.7
57,,Jamaal WilliamsJ. Williams GB,11,24,42,97,58.5,9.4
58,,Peyton BarberP. Barber TB,7,25,41,65,59.7,3.8
59,,Justin JacksonJ. Jackson LAC,12,23,34,75,60.2,6.0
60,,Dion LewisD. Lewis TEN,11,29,51,86,60.9,6.2
61,,Lamar MillerL. Miller HOU,10,28,48,93,62.2,11.8
62,,Benny Snell Jr.B. Snell PIT,7,21,48,85,64.9,8.9
63,,Kalen BallageK. Ballage MIA,5,23,29,94,66.0,6.8
64,,Rex BurkheadR. Burkhead NE,10,29,53,91,67.1,8.2
65,,Ryquell ArmsteadR. Armstead JAC,10,23,50,81,68.8,8.6
66,,Mike DavisM. Davis CHI,6,26,58,80,69.3,5.4
67,,Ty MontgomeryT. Montgomery NYJ,4,26,61,88,69.5,7.3
68,,Jalen RichardJ. Richard OAK,6,26,50,95,69.6,6.9
69,,Ty JohnsonT. Johnson DET,5,22,55,89,70.5,10.4
70,,Adrian PetersonA. Peterson WAS,10,34,57,86,71.0,8.0
71,,Gus EdwardsG. Edwards BAL,8,,44,87,71.5,7.2
72,,Wayne GallmanW. Gallman NYG,11,25,61,86,72.1,6.6
73,,Bryce LoveB. Love WAS,10,22,56,94,72.3,8.6
74,,Raheem MostertR. Mostert SF,4,27,50,87,73.1,9.3
75,,Dexter WilliamsD. Williams GB,11,,59,93,73.6,8.2
76,,Jerick McKinnonJ. McKinnon SF,4,27,48,88,74.5,11.4
77,,Trayveon WilliamsT. Williams CIN,9,22,60,92,78.1,6.9
78,,T.J. YeldonT. Yeldon BUF,6,26,60,96,78.3,10.5
79,,Mark WaltonM. Walton MIA,5,22,37,125,81.9,19.8
80,,Darrel WilliamsD. Williams KC,12,24,54,116,83.3,17.3
81,,Frank GoreF. Gore BUF,6,36,52,114,83.5,13.6
82,,Dare OgunbowaleD. Ogunbowale TB,7,25,59,90,80.6,8.2
83,,Jordan WilkinsJ. Wilkins IND,6,25,72,99,86.6,6.5
84,,C.J. AndersonC. Anderson FA,,28,60,99,83.4,9.4
85,,Qadree OllisonQ. Ollison ATL,9,23,59,105,86.1,11.3
86,,Brian HillB. Hill ATL,9,24,74,98,87.5,6.5
87,,Jordan ScarlettJ. Scarlett CAR,7,23,72,113,93.5,8.3
88,,Rodney AndersonR. Anderson CIN,9,,81,132,93.8,14.4
89,,Theo RiddickT. Riddick DEN,10,28,70,103,90.7,9.0
90,,Kenneth DixonK. Dixon FA,,25,68,97,89.2,5.2
91,,Jeff WilsonJ. Wilson SF,4,23,71,106,89.3,7.5
92,,Myles GaskinM. Gaskin MIA,5,22,74,98,91.2,6.1
93,,Corey ClementC. Clement PHI,10,25,66,130,97.7,13.4
94,,Travis HomerT. Homer SEA,11,21,77,122,96.2,12.6
95,,Dontrell HilliardD. Hilliard CLE,7,24,75,99,89.3,7.1
96,,Reggie BonnafonR. Bonnafon CAR,7,23,66,91,84.0,7.2
97,,Devontae BookerD. Booker DEN,10,27,80,131,100.3,13.7
98,,Jay AjayiJ. Ajayi FA,,26,66,106,92.1,12.7
99,,Josh AdamsJ. Adams NYJ,4,23,82,115,98.9,7.8
100,,C.J. ProsiseC. Prosise SEA,11,25,73,119,94.7,15.6
101,,Elijah McGuireE. McGuire FA,,25,71,111,97.9,9.0
102,,John KellyJ. Kelly LAR,9,23,70,115,98.7,11.9
103,,Mike WeberM. Weber DAL,8,22,80,111,94.2,10.1
104,,Damarea CrockettD. Crockett GB,11,21,70,105,94.8,5.4
105,,Devine OzigboD. Ozigbo JAC,10,23,75,104,92.4,9.9
106,,Bruce AndersonB. Anderson FA,,,79,105,99.2,5.7
107,,D'Onta ForemanD. Foreman FA,,23,83,124,100.0,14.1
108,,DeAndre WashingtonD. Washington OAK,6,26,75,128,100.3,14.3
109,,Mike BooneM. Boone MIN,12,24,77,108,87.8,12.0
110,,Alfred MorrisA. Morris FA,,30,84,114,97.2,10.1
111,,Spencer WareS. Ware FA,,27,88,112,103.3,6.3
112,,Wendell SmallwoodW. Smallwood WAS,10,25,85,128,103.7,12.0
113,,Darren SprolesD. Sproles PHI,10,36,86,113,98.6,8.6
114,,Isaiah CrowellI. Crowell OAK,6,26,94,110,101.8,6.2
115,,Elijah HolyfieldE. Holyfield CAR,7,,78,123,105.8,14.3
116,,J.D. McKissicJ. McKissic DET,5,26,88,112,100.0,9.5
117,,Bilal PowellB. Powell NYJ,4,31,97,116,107.2,6.2
118,,Javorius AllenJ. Allen NYG,11,28,97,118,108.8,8.6
119,,Brandon BoldenB. Bolden NE,10,29,82,102,93.3,8.4
120,,Alex BarnesA. Barnes FA,,23,77,121,104.3,18.0
121,,Dwayne WashingtonD. Washington NO,9,25,91,116,100.0,11.3
122,,Trenton CannonT. Cannon NYJ,4,25,73,132,113.4,11.6
123,,Alfred BlueA. Blue FA,,28,78,130,109.0,21.2
124,,Doug MartinD. Martin FA,,30,96,109,102.3,5.3
125,,Corey GrantC. Grant FA,,27,92,129,110.8,13.1
126,,Ameer AbdullahA. Abdullah MIN,12,26,89,119,103.7,12.3
127,,Andre EllingtonA. Ellington FA,,30,90,97,93.5,3.5
128,,LeGarrette BlountL. Blount FA,,32,98,121,112.3,10.2
129,,Marcus MurphyM. Murphy FA,,28,94,111,102.5,8.5
130,,Karan HigdonK. Higdon HOU,10,23,89,118,103.5,14.5
131,,Bo ScarbroughB. Scarbrough FA,,23,86,131,108.5,22.5
132,,Samaje PerineS. Perine CIN,9,24,106,126,118.0,8.6
133,,James WilliamsJ. Williams FA,,23,110,117,113.5,3.5
134,,Rod SmithR. Smith TEN,11,27,104,124,114.0,10.0
135,,Kyle JuszczykK. Juszczyk SF,4,28,113,126,121.3,5.9
