Rank,WSID,Running Backs (Team),Bye,Age,Best,Worst,Avg,Std Dev,Notes
1,,Saquon BarkleyS. Barkley NYG,,22,1,1,1.0,0.0
2,,Ezekiel ElliottE. Elliott DAL,,23,2,4,2.7,0.7
3,,Christian McCaffreyC. McCaffrey CAR,,22,2,5,3.4,0.8
4,,Alvin KamaraA. Kamara NO,,23,3,7,4.0,0.8
5,,Todd GurleyT. Gurley LAR,,24,2,9,4.4,1.9
6,,Joe MixonJ. Mixon CIN,,22,5,10,6.4,1.0
7,,Melvin GordonM. Gordon LAC,,25,6,9,7.1,0.9
8,,Dalvin CookD. Cook MIN,,23,5,13,8.6,1.9
9,,David JohnsonD. Johnson ARI,,27,7,12,9.2,0.9
10,,Nick ChubbN. Chubb CLE,,23,6,15,10.1,1.8
11,,Le'Veon BellL. Bell NYJ,,27,5,14,11.3,1.9
12,,James ConnerJ. Conner PIT,,23,8,15,11.4,1.3
13,,Sony MichelS. Michel NE,,24,12,17,13.9,1.0
14,,Kerryon JohnsonK. Johnson DET,,21,10,20,15.0,2.5
15,,Aaron JonesA. Jones GB,,24,11,18,15.3,1.0
16,,Derrius GuiceD. Guice WAS,,21,11,23,16.6,1.0
17,,Leonard FournetteL. Fournette JAC,,24,8,27,17.3,2.5
18,,Phillip LindsayP. Lindsay DEN,,24,16,24,18.8,1.2
19,,Marlon MackM. Mack IND,,23,14,30,20.1,2.8
20,,Derrick HenryD. Henry TEN,,24,16,32,20.6,2.2
21,,Rashaad PennyR. Penny SEA,,23,19,29,23.1,2.5
22,,Devonta FreemanD. Freeman ATL,,27,14,32,23.6,2.6
23,,Kareem HuntK. Hunt CLE,,23,13,34,24.3,5.2
24,,Tarik CohenT. Cohen CHI,,23,22,32,24.5,2.3
25,,Tevin ColemanT. Coleman SF,,25,20,31,26.3,2.5
26,,Mark IngramM. Ingram BAL,,29,21,36,27.3,2.3
27,,Chris CarsonC. Carson SEA,,24,15,40,28.5,4.7
28,,Royce FreemanR. Freeman DEN,,23,23,38,29.2,2.8
29,,Kenyan DrakeK. Drake MIA,,25,26,49,29.2,1.7
30,,Damien WilliamsD. Williams KC,,26,11,48,30.4,9.4
31,,James WhiteJ. White NE,,27,26,42,33.0,3.4
32,,Jerick McKinnonJ. McKinnon SF,,26,23,63,33.2,5.0
33,,Jordan HowardJ. Howard CHI,,24,25,77,33.2,3.1
34,,Matt BreidaM. Breida SF,,24,26,50,34.8,3.3
35,,Lamar MillerL. Miller HOU,,27,29,76,36.5,1.8
36,,Ronald Jones IIR. Jones TB,,21,33,49,40.2,4.5
37,,Duke JohnsonD. Johnson CLE,,25,33,65,40.7,5.1
38,,Nyheim HinesN. Hines IND,,22,28,50,40.8,3.3
39,,Dion LewisD. Lewis TEN,,28,37,55,41.6,3.1
40,,Austin EkelerA. Ekeler LAC,,23,33,54,44.0,4.2
41,,T.J. YeldonT. Yeldon FA,,25,36,67,44.9,8.9
42,,LeSean McCoyL. McCoy BUF,,30,37,70,46.6,2.8
43,,Carlos HydeC. Hyde KC,,27,38,57,46.9,4.9
44,,Ito SmithI. Smith ATL,,23,34,90,47.7,5.1
45,,Jay AjayiJ. Ajayi FA,,25,28,85,47.8,14.1
46,,Gus EdwardsG. Edwards BAL,,,37,62,49.8,4.9
47,,Chris ThompsonC. Thompson WAS,,28,44,68,50.8,7.0
48,,Kenneth DixonK. Dixon BAL,,25,37,64,52.9,5.3
49,,Latavius MurrayL. Murray NO,,29,32,79,54.2,11.7
50,,Elijah McGuireE. McGuire NYJ,,24,40,77,54.2,11.8
"50

                                              googletag.cmd.push(function() { googletag.display('div-gpt-ad-1404326895972-0'); });"
51,,Kalen BallageK. Ballage MIA,,23,41,61,54.2,4.7
52,,D'Onta ForemanD. Foreman HOU,,22,38,70,55.1,7.3
53,,Josh AdamsJ. Adams PHI,,22,45,84,55.7,9.2
54,,Isaiah CrowellI. Crowell FA,,26,47,74,57.3,8.4
55,,Jamaal WilliamsJ. Williams GB,,23,52,94,60.5,11.6
56,,Giovani BernardG. Bernard CIN,,27,45,86,61.5,9.5
57,,Jalen RichardJ. Richard FA,,25,54,87,62.8,8.1
58,,Alex CollinsA. Collins FA,,24,43,91,64.3,15.7
59,,Chase EdmondsC. Edmonds ARI,,22,45,101,64.7,7.4
60,,C.J. AndersonC. Anderson LAR,,28,56,83,65.0,7.6
61,,Rex BurkheadR. Burkhead NE,,28,57,100,65.9,12.4
62,,Adrian PetersonA. Peterson WAS,,34,57,78,66.2,5.5
63,,John KellyJ. Kelly LAR,,22,53,107,67.8,12.2
64,,Peyton BarberP. Barber TB,,24,49,99,68.0,12.0
65,,Jordan WilkinsJ. Wilkins IND,,24,61,108,69.2,12.8
66,,Mike DavisM. Davis CHI,,26,35,99,71.1,11.3
67,,Spencer WareS. Ware FA,,27,61,76,67.4,5.1
68,,Jaylen SamuelsJ. Samuels PIT,,,39,117,69.5,17.2
69,,Marshawn LynchM. Lynch FA,,32,67,88,75.2,5.1
70,,Theo RiddickT. Riddick DET,,27,56,103,75.3,9.2
71,,Doug MartinD. Martin FA,,30,68,113,76.8,12.4
72,,Ty MontgomeryT. Montgomery FA,,26,58,113,80.4,13.3
73,,Mark WaltonM. Walton CIN,,22,70,112,81.1,11.2
74,,Malcolm BrownM. Brown LAR,,25,56,93,77.0,6.5
75,,Corey ClementC. Clement PHI,,24,61,111,78.1,11.8
76,,Devontae BookerD. Booker DEN,,26,68,101,85.0,9.1
77,,Wendell SmallwoodW. Smallwood PHI,,25,71,99,85.0,8.1
78,,David MontgomeryD. Montgomery FA,,,13,91,53.0,27.8
79,,Justin JacksonJ. Jackson LAC,,22,51,97,82.9,8.0
80,,Wayne GallmanW. Gallman NYG,,24,49,128,87.2,15.0
81,,Josh JacobsJ. Jacobs FA,,,20,85,56.1,25.1
82,,Javorius AllenJ. Allen FA,,27,72,121,87.7,12.3
83,,Rod SmithR. Smith FA,,27,77,119,88.7,11.8
84,,Frank GoreF. Gore BUF,,35,71,100,88.8,6.4
85,,Damien HarrisD. Harris FA,,,29,88,61.0,22.7
86,,Bilal PowellB. Powell FA,,30,75,114,87.6,9.6
87,,Ameer AbdullahA. Abdullah MIN,,25,50,101,88.5,6.2
88,,LeGarrette BlountL. Blount FA,,32,81,115,95.6,10.1
89,,Corey GrantC. Grant FA,,27,79,106,89.4,7.9
90,,Miles SandersM. Sanders FA,,,36,98,62.3,25.1
91,,Jeff WilsonJ. Wilson SF,,23,75,114,91.5,8.5
92,,Devin SingletaryD. Singletary FA,,,12,95,65.3,25.9
93,,Rodney AndersonR. Anderson FA,,,20,93,68.3,26.7
94,,Justice HillJ. Hill FA,,,35,93,72.3,18.9
95,,Samaje PerineS. Perine WAS,,23,84,126,99.5,10.6
96,,Benjamin Snell Jr.B. Snell FA,,,33,92,75.8,18.3
97,,Bryce LoveB. Love FA,,,49,94,77.7,17.2
98,,Darrell HendersonD. Henderson FA,,,22,96,53.8,27.5
99,,Jeremy HillJ. Hill FA,,26,83,106,97.6,6.7
100,,Chris IvoryC. Ivory BUF,,31,82,125,101.9,10.3
101,,Elijah HolyfieldE. Holyfield FA,,,46,97,83.2,13.2
102,,Trenton CannonT. Cannon NYJ,,24,59,109,97.1,8.6
103,,Mike WeberM. Weber FA,,,61,100,84.6,12.3
104,,LJ ScottL. Scott FA,,,19,82,54.7,26.4
105,,Karan HigdonK. Higdon FA,,,56,99,86.8,13.5
106,,DeAndre WashingtonD. Washington OAK,,26,85,130,102.9,12.9
107,,Myles GaskinM. Gaskin,,,53,88,67.0,15.1
108,,Roc ThomasR. Thomas MIN,,23,84,116,95.6,12.0
109,,Alfred MorrisA. Morris FA,,30,88,107,99.8,5.8
110,,Mike BooneM. Boone MIN,,23,55,97,81.0,18.5
111,,Alfred BlueA. Blue FA,,27,86,110,101.6,7.3
112,,C.J. ProsiseC. Prosise SEA,,24,93,124,107.0,9.9
113,,Chris Warren IIIC. Warren OAK,,22,80,98,86.7,8.1
114,,Marcus MurphyM. Murphy BUF,,27,84,115,104.4,7.6
115,,Jacquizz RodgersJ. Rodgers FA,,29,93,122,106.6,10.3
116,,Darrel WilliamsD. Williams KC,,23,86,118,102.0,12.3
117,,Bo ScarbroughB. Scarbrough SEA,,22,95,127,111.2,11.8
118,,Kyle JuszczykK. Juszczyk SF,,27,92,120,112.4,8.1
119,,Travis HomerT. Homer FA,,,78,93,85.5,7.5
120,,Cordarrelle PattersonC. Patterson CHI,,28,89,91,90.0,1.0
121,,Robert KelleyR. Kelley FA,,26,99,116,106.0,7.3
122,,Boston ScottB. Scott PHI,,23,101,106,103.5,2.5
123,,Charcandrick WestC. West FA,,27,98,111,104.5,6.5
124,,Cameron Artis-PayneC. Artis-Payne FA,,28,110,119,114.5,4.5
125,,De'Angelo HendersonD. Henderson NYJ,,26,117,121,119.0,2.0
126,,T.J. LoganT. Logan ARI,,24,118,120,119.0,1.0
127,,Mike GillisleeM. Gillislee FA,,28,111,134,122.5,11.5
128,,Jonathan StewartJ. Stewart FA,,32,112,132,122.0,10.0
129,,Orleans DarkwaO. Darkwa FA,,27,119,137,128.0,9.0
