Rank,WSIT,Running Backs (Team),Bye,Age,Best,Worst,Avg,Std Dev,Notes
1,,Saquon BarkleyS. Barkley NYG,11,22,1,4,1.1,0.4
2,,Christian McCaffreyC. McCaffrey CAR,7,23,1,5,2.3,0.7
3,,Alvin KamaraA. Kamara NO,9,24,2,4,3.1,0.5
4,,Ezekiel ElliottE. Elliott DAL,8,24,2,7,3.5,0.8
5,,Joe MixonJ. Mixon CIN,9,23,5,11,6.4,1.7
6,,Nick ChubbN. Chubb CLE,7,23,4,11,7.0,1.7
7,,David JohnsonD. Johnson ARI,12,27,5,15,8.0,2.4
8,,Todd GurleyT. Gurley LAR,9,25,2,18,8.6,3.0
9,,Dalvin CookD. Cook MIN,12,24,5,15,8.9,1.6
10,,Melvin GordonM. Gordon LAC,12,26,5,17,9.1,2.3
11,,James ConnerJ. Conner PIT,7,24,6,22,10.8,3.1
12,,Le'Veon BellL. Bell NYJ,4,27,7,20,11.9,2.0
13,,Kerryon JohnsonK. Johnson DET,5,22,11,22,13.3,2.0
14,,Leonard FournetteL. Fournette JAC,10,24,7,32,15.4,2.9
15,,Aaron JonesA. Jones GB,11,24,11,33,16.5,3.8
16,,Josh JacobsJ. Jacobs OAK,6,21,10,30,16.5,4.1
17,,Sony MichelS. Michel NE,10,24,11,31,17.8,2.6
18,,David MontgomeryD. Montgomery CHI,6,22,12,34,19.5,5.0
19,,Marlon MackM. Mack IND,6,23,12,32,20.8,3.7
20,,Derrius GuiceD. Guice WAS,10,22,12,35,21.4,4.2
21,,Derrick HenryD. Henry TEN,11,25,12,31,21.6,2.9
22,,Miles SandersM. Sanders PHI,10,22,13,44,21.9,5.9
23,,Devonta FreemanD. Freeman ATL,9,27,13,34,21.9,4.0
24,,Phillip LindsayP. Lindsay DEN,10,25,15,33,24.1,3.5
25,,Damien WilliamsD. Williams KC,12,27,14,41,26.0,5.2
26,,Rashaad PennyR. Penny SEA,11,23,19,35,27.1,4.1
27,,Chris CarsonC. Carson SEA,11,24,13,40,27.4,6.7
28,,Tarik CohenT. Cohen CHI,6,24,22,51,28.8,3.3
29,,Tevin ColemanT. Coleman SF,4,26,23,40,29.8,3.2
30,,Mark IngramM. Ingram BAL,8,29,23,41,31.6,3.9
31,,Kenyan DrakeK. Drake MIA,5,25,22,55,31.8,5.4
32,,Kareem HuntK. Hunt CLE,7,24,15,64,31.8,8.5
33,,James WhiteJ. White NE,10,27,23,50,33.8,4.6
34,,Royce FreemanR. Freeman DEN,10,23,25,42,34.5,4.0
35,,Darrell HendersonD. Henderson LAR,9,22,20,82,36.4,12.9
36,,Duke JohnsonD. Johnson HOU,10,25,21,76,37.5,7.5
37,,Justice HillJ. Hill BAL,8,21,26,67,38.8,8.6
38,,Damien HarrisD. Harris NE,10,22,20,66,39.2,8.2
39,,Devin SingletaryD. Singletary BUF,6,22,21,63,39.2,8.2
40,,Austin EkelerA. Ekeler LAC,12,24,31,51,39.3,5.0
41,,Matt BreidaM. Breida SF,4,24,28,56,41.3,4.7
42,,Latavius MurrayL. Murray NO,9,29,27,66,42.3,5.8
43,,Jordan HowardJ. Howard PHI,10,24,31,59,43.0,5.3
44,,Ronald Jones IIR. Jones TB,7,22,33,69,43.3,4.9
45,,Nyheim HinesN. Hines IND,6,22,37,67,47.1,5.2
46,,Jaylen SamuelsJ. Samuels PIT,7,23,36,84,48.0,5.6
47,,Kalen BallageK. Ballage MIA,5,23,30,84,51.1,7.1
48,,Dion LewisD. Lewis TEN,11,28,39,74,51.4,5.4
49,,Ito SmithI. Smith ATL,9,24,39,92,52.1,10.1
50,,Alexander MattisonA. Mattison MIN,12,21,36,76,52.2,7.6
"50

                                              googletag.cmd.push(function() { googletag.display('div-gpt-ad-1404326895972-0'); });"
51,,Darwin ThompsonD. Thompson KC,12,22,30,94,50.4,12.1
52,,Lamar MillerL. Miller HOU,10,28,25,95,53.8,12.8
53,,LeSean McCoyL. McCoy KC,12,31,36,85,54.4,7.5
54,,Jerick McKinnonJ. McKinnon SF,4,27,34,80,55.4,12.8
55,,Peyton BarberP. Barber TB,7,25,34,81,59.9,7.4
56,,Giovani BernardG. Bernard CIN,9,27,41,79,60.7,8.2
57,,Chris ThompsonC. Thompson WAS,10,28,44,81,62.0,8.6
58,,Jamaal WilliamsJ. Williams GB,11,24,45,98,63.0,10.0
59,,Jalen RichardJ. Richard OAK,6,25,40,87,63.6,8.3
60,,Mike DavisM. Davis CHI,6,26,42,98,63.6,8.1
61,,Carlos HydeC. Hyde HOU,10,27,47,92,63.9,10.3
62,,Chase EdmondsC. Edmonds ARI,12,23,39,98,64.9,13.2
63,,C.J. AndersonC. Anderson DET,5,28,49,89,66.6,9.3
64,,Justin JacksonJ. Jackson LAC,12,23,40,96,66.6,12.0
65,,Adrian PetersonA. Peterson WAS,10,34,48,90,67.2,10.0
66,,Tony PollardT. Pollard DAL,8,22,33,108,53.7,14.9
67,,Ryquell ArmsteadR. Armstead JAC,10,22,44,80,65.4,7.3
68,,T.J. YeldonT. Yeldon BUF,6,25,51,94,67.0,10.2
69,,Malcolm BrownM. Brown LAR,9,26,41,99,70.3,11.6
70,,Benny Snell Jr.B. Snell PIT,7,21,34,87,64.5,9.9
71,,Bryce LoveB. Love WAS,10,22,47,96,68.7,8.9
72,,Gus EdwardsG. Edwards BAL,8,,55,92,74.8,9.5
73,,Rex BurkheadR. Burkhead NE,10,29,58,94,73.6,7.8
74,,Elijah McGuireE. McGuire CLE,7,25,49,99,74.5,12.6
75,,Dexter WilliamsD. Williams GB,11,,52,102,70.9,12.2
76,,Trayveon WilliamsT. Williams CIN,9,21,61,105,74.1,8.9
77,,Ty MontgomeryT. Montgomery NYJ,4,26,48,103,77.4,12.0
78,,Jordan WilkinsJ. Wilkins IND,6,25,64,96,81.0,7.2
79,,Rodney AndersonR. Anderson CIN,9,,38,106,76.3,13.3
80,,D'Onta ForemanD. Foreman FA,,23,46,97,71.1,15.9
81,,Theo RiddickT. Riddick DEN,10,28,67,104,83.7,10.1
82,,Kenneth DixonK. Dixon FA,,25,54,93,78.6,9.1
83,,Josh AdamsJ. Adams NYJ,4,22,54,117,84.3,14.0
84,,Spencer WareS. Ware IND,6,27,71,100,83.5,7.6
85,,John KellyJ. Kelly LAR,9,22,69,104,85.7,9.8
86,,Devontae BookerD. Booker DEN,10,27,72,125,92.9,12.3
87,,Corey ClementC. Clement PHI,10,24,58,123,88.5,11.8
88,,Frank GoreF. Gore BUF,6,36,64,119,90.5,12.0
89,,Jay AjayiJ. Ajayi FA,,26,51,126,85.0,15.6
90,,Isaiah CrowellI. Crowell OAK,6,26,71,107,90.5,9.4
91,,Qadree OllisonQ. Ollison ATL,9,23,62,131,85.0,13.4
92,,Brian HillB. Hill ATL,9,23,53,125,86.6,19.7
93,,Mark WaltonM. Walton MIA,5,22,66,116,96.9,10.7
94,,Mike WeberM. Weber DAL,8,22,62,109,91.3,7.7
95,,Doug MartinD. Martin FA,,30,75,116,94.4,10.7
96,,Wayne GallmanW. Gallman NYG,11,24,62,120,94.7,10.6
97,,Jordan ScarlettJ. Scarlett CAR,7,23,53,114,89.4,12.4
98,,Bruce AndersonB. Anderson FA,,,68,121,90.8,11.3
99,,Myles GaskinM. Gaskin MIA,5,22,59,113,93.1,10.6
100,,Wendell SmallwoodW. Smallwood WAS,10,25,73,121,102.0,11.4
101,,Damarea CrockettD. Crockett OAK,6,21,67,109,89.5,10.4
102,,Dare OgunbowaleD. Ogunbowale TB,7,25,59,92,78.8,8.0
103,,Darrel WilliamsD. Williams KC,12,24,63,116,95.8,12.7
104,,Devine OzigboD. Ozigbo JAC,10,22,52,139,89.8,17.2
105,,Javorius AllenJ. Allen FA,,28,84,149,103.6,16.4
106,,DeAndre WashingtonD. Washington OAK,6,26,65,135,101.4,18.0
107,,Rod SmithR. Smith NYG,11,27,76,115,97.8,12.7
108,,Jeff WilsonJ. Wilson SF,4,23,87,129,105.8,11.4
109,,Travis HomerT. Homer SEA,11,21,77,116,95.3,12.0
110,,Ty JohnsonT. Johnson DET,5,21,54,113,86.0,13.6
111,,Bilal PowellB. Powell NYJ,4,30,85,131,105.0,12.8
112,,Trenton CannonT. Cannon NYJ,4,25,71,126,105.6,11.6
113,,Ameer AbdullahA. Abdullah MIN,12,26,80,140,102.5,13.6
114,,Alfred BlueA. Blue JAC,10,28,77,122,104.5,10.7
115,,C.J. ProsiseC. Prosise SEA,11,25,88,142,109.1,11.7
116,,Elijah HolyfieldE. Holyfield CAR,7,,60,121,104.6,13.2
117,,LeGarrette BlountL. Blount FA,,32,84,134,102.7,13.3
118,,Mike BooneM. Boone MIN,12,24,74,111,92.5,10.9
119,,Alex BarnesA. Barnes FA,,22,85,149,109.8,19.3
120,,Dontrell HilliardD. Hilliard CLE,7,24,59,99,82.8,10.6
121,,Samaje PerineS. Perine CIN,9,23,81,145,113.6,16.0
122,,Karan HigdonK. Higdon HOU,10,23,43,127,101.0,16.4
123,,Alfred MorrisA. Morris FA,,30,67,124,107.0,9.5
124,,Alex CollinsA. Collins FA,,25,67,123,98.7,13.5
125,,Corey GrantC. Grant FA,,27,72,148,110.2,16.0
126,,Marcus MurphyM. Murphy FA,,27,94,128,113.9,9.6
127,,James WilliamsJ. Williams FA,,23,63,125,109.9,10.2
128,,Kyle JuszczykK. Juszczyk SF,4,28,97,146,119.1,14.4
129,,Cameron Artis-PayneC. Artis-Payne FA,,29,90,142,116.1,16.2
130,,Andre EllingtonA. Ellington FA,,30,80,126,108.2,16.5
131,,Chris Warren IIIC. Warren FA,,23,95,124,115.2,5.1
132,,Jacquizz RodgersJ. Rodgers FA,,29,99,136,116.2,12.6
133,,Bo ScarbroughB. Scarbrough FA,,22,86,137,116.8,11.1
134,,Darren SprolesD. Sproles PHI,10,36,80,125,111.0,10.4
135,,Chris IvoryC. Ivory FA,,31,84,118,102.8,12.2
136,,Roc ThomasR. Thomas FA,,24,105,141,118.5,11.8
137,,Boston ScottB. Scott PHI,10,24,102,138,114.2,13.0
138,,Raheem MostertR. Mostert SF,4,27,74,134,114.8,17.6
139,,Zach ZennerZ. Zenner FA,,28,93,144,115.2,19.8
140,,Jeremy HillJ. Hill FA,,26,95,130,106.8,13.8
141,,J.D. McKissicJ. McKissic DET,5,26,92,126,112.3,12.7
142,,Dwayne WashingtonD. Washington NO,9,25,92,145,120.8,17.0
143,,Paul PerkinsP. Perkins NYG,11,24,96,133,116.3,13.2
144,,Kerrith WhyteK. Whyte CHI,6,22,83,147,108.3,27.8
145,,Tavon AustinT. Austin DAL,8,28,105,121,112.0,6.7
146,,De'Angelo HendersonD. Henderson FA,,26,109,132,123.3,8.8
147,,Marshawn LynchM. Lynch FA,,33,88,108,98.0,10.0
148,,Jalin MooreJ. Moore NYJ,4,23,89,107,98.0,9.0
149,,Jonathan StewartJ. Stewart FA,,32,100,111,105.5,5.5
150,,Robert KelleyR. Kelley FA,,26,103,109,106.0,3.0
151,,Elijhaa PennyE. Penny NYG,11,26,115,135,122.7,8.8
152,,Jordan LynchJ. Lynch FA,,28,104,122,113.0,9.0
153,,Detrez NewsomeD. Newsome LAC,12,25,114,147,131.5,13.2
154,,Jeremy McNicholsJ. McNichols FA,,23,124,127,126.0,1.4
155,,T.J. LoganT. Logan TB,7,25,130,136,133.0,3.0
