Rank,WSID,Wide Receivers (Team),Bye,Age,Best,Worst,Avg,Std Dev,Notes
1,,DeAndre HopkinsD. Hopkins HOU,10,26,1,4,1.2,0.5
2,,Odell Beckham Jr.O. Beckham CLE,7,26,1,5,2.3,0.8
3,,Michael ThomasM. Thomas NO,9,26,2,5,3.1,0.7
4,,Davante AdamsD. Adams GB,11,26,2,7,4.0,1.0
5,,JuJu Smith-SchusterJ. Smith-Schuster PIT,7,22,1,9,4.7,1.1
6,,Mike EvansM. Evans TB,7,25,4,9,6.1,0.8
7,,Julio JonesJ. Jones ATL,9,30,5,16,7.3,0.9
8,,Amari CooperA. Cooper DAL,8,24,6,12,8.9,1.4
9,,Keenan AllenK. Allen LAC,12,27,5,17,9.7,1.9
10,,Antonio BrownA. Brown OAK,6,30,7,13,9.9,1.1
11,,Stefon DiggsS. Diggs MIN,12,25,6,19,10.2,1.6
12,,A.J. GreenA. Green CIN,9,30,10,44,13.9,2.1
13,,Kenny GolladayK. Golladay DET,5,25,7,19,14.1,1.9
14,,Brandin CooksB. Cooks LAR,9,25,10,22,14.1,2.2
15,,Adam ThielenA. Thielen MIN,12,28,10,19,14.7,2.1
16,,T.Y. HiltonT. Hilton IND,6,29,10,31,15.3,2.5
17,,D.J. MooreD. Moore CAR,7,22,10,29,18.4,2.9
18,,Robert WoodsR. Woods LAR,9,27,15,42,20.1,4.8
19,,Cooper KuppC. Kupp LAR,9,25,15,38,20.1,2.9
20,,Corey DavisC. Davis TEN,11,24,12,35,21.0,4.0
21,,Calvin RidleyC. Ridley ATL,9,24,8,33,22.8,3.2
22,,Chris GodwinC. Godwin TB,7,23,15,40,23.0,3.3
23,,Allen RobinsonA. Robinson CHI,6,25,14,44,24.3,4.8
24,,Jarvis LandryJ. Landry CLE,7,26,18,37,26.7,3.7
25,,Sammy WatkinsS. Watkins KC,12,25,19,46,27.2,4.9
26,,Mike WilliamsM. Williams LAC,12,24,21,44,27.5,4.2
27,,N'Keal HarryN. Harry NE,10,,14,63,28.6,10.7
28,,Courtland SuttonC. Sutton DEN,10,23,18,46,29.7,5.2
29,,Tyler BoydT. Boyd CIN,9,24,20,48,31.3,5.0
30,,Alshon JefferyA. Jeffery PHI,10,29,16,51,32.4,5.5
31,,Will FullerW. Fuller HOU,10,25,21,50,32.5,3.6
32,,Tyler LockettT. Lockett SEA,11,26,20,48,34.0,6.1
33,,Christian KirkC. Kirk ARI,12,22,24,45,34.0,4.3
34,,Dante PettisD. Pettis SF,4,23,27,50,36.2,5.9
35,,A.J. BrownA. Brown TEN,11,,20,59,36.9,10.0
36,,D.K. MetcalfD. Metcalf SEA,11,,21,73,39.4,14.2
37,,Robby AndersonR. Anderson NYJ,4,26,23,61,40.3,8.9
38,,Tyreek HillT. Hill KC,12,25,11,92,40.7,21.2
39,,Sterling ShepardS. Shepard NYG,11,26,30,57,41.3,6.2
40,,Anthony MillerA. Miller CHI,6,23,31,69,42.5,7.5
41,,Marvin JonesM. Jones DET,5,29,34,67,43.0,5.9
42,,James WashingtonJ. Washington PIT,7,23,29,58,46.6,5.4
43,,Dede WestbrookD. Westbrook JAC,10,25,36,80,47.6,5.3
44,,Michael GallupM. Gallup DAL,8,23,33,77,47.8,8.0
45,,Keke CouteeK. Coutee HOU,10,22,37,78,48.8,6.4
46,,Golden TateG. Tate NYG,11,30,32,65,50.2,5.2
47,,Parris CampbellP. Campbell IND,6,,23,89,44.8,16.9
48,,Marquise BrownM. Brown BAL,8,,24,84,44.8,11.7
49,,Julian EdelmanJ. Edelman NE,10,33,35,72,51.7,9.7
50,,Deebo SamuelD. Samuel SF,4,,26,126,52.7,22.6
"50

                                              googletag.cmd.push(function() { googletag.display('div-gpt-ad-1404326895972-0'); });"
51,,Curtis SamuelC. Samuel CAR,7,22,38,105,54.2,7.2
52,,Tre'Quan SmithT. Smith NO,9,23,32,81,54.6,7.0
53,,Hakeem ButlerH. Butler ARI,12,,26,91,55.2,15.3
54,,DaeSean HamiltonD. Hamilton DEN,10,24,23,94,57.0,10.0
55,,John BrownJ. Brown BUF,6,29,44,82,58.4,9.0
56,,Devin FunchessD. Funchess IND,6,25,49,88,58.5,7.2
57,,J.J. Arcega-WhitesideJ. Arcega-Whiteside PHI,10,,27,93,54.0,14.8
58,,Emmanuel SandersE. Sanders DEN,10,32,44,85,61.3,10.2
59,,Marquez Valdes-ScantlingM. Valdes-Scantling GB,11,24,37,87,61.3,8.5
60,,Mecole HardmanM. Hardman KC,12,,30,80,50.1,12.0
61,,Tyrell WilliamsT. Williams OAK,6,27,46,105,68.3,12.6
62,,Marquise GoodwinM. Goodwin SF,4,28,42,86,63.2,10.9
63,,Antonio CallawayA. Callaway CLE,7,22,47,99,68.7,12.6
64,,Donte MoncriefD. Moncrief PIT,7,25,46,96,69.3,10.7
65,,Andy IsabellaA. Isabella ARI,12,,23,95,52.6,15.9
66,,Robert FosterR. Foster BUF,6,25,46,114,69.7,12.7
67,,Geronimo AllisonG. Allison GB,11,25,40,157,70.0,22.5
68,,Kenny StillsK. Stills MIA,5,27,46,119,70.1,10.5
69,,Jamison CrowderJ. Crowder NYJ,4,25,44,98,70.7,10.7
70,,Devante ParkerD. Parker MIA,5,26,49,89,66.3,11.5
71,,Quincy EnunwaQ. Enunwa NYJ,4,27,55,98,72.0,10.1
72,,Larry FitzgeraldL. Fitzgerald ARI,12,35,59,94,74.7,9.7
73,,Marqise LeeM. Lee JAC,10,27,55,98,75.8,8.7
74,,Nelson AgholorN. Agholor PHI,10,26,61,107,78.6,11.8
75,,Zay JonesZ. Jones BUF,6,24,49,128,79.5,14.0
76,,DeSean JacksonD. Jackson PHI,10,32,52,103,79.5,12.1
77,,John RossJ. Ross CIN,9,24,60,109,79.7,12.0
78,,D.J. CharkD. Chark JAC,10,22,54,104,80.3,10.5
79,,Josh ReynoldsJ. Reynolds LAR,9,24,41,136,81.8,17.3
80,,Albert WilsonA. Wilson MIA,5,26,63,129,85.0,17.5
81,,Josh DoctsonJ. Doctson WAS,10,26,63,110,81.8,11.5
82,,Kelvin HarmonK. Harmon WAS,10,,35,120,77.6,16.1
83,,Equanimeous St. BrownE. St. GB,11,22,66,102,83.0,7.9
84,,Adam HumphriesA. Humphries TEN,11,25,56,103,85.2,12.3
85,,Randall CobbR. Cobb DAL,8,28,65,121,90.9,11.7
86,,Miles BoykinM. Boykin BAL,8,,39,110,78.2,17.4
87,,Diontae JohnsonD. Johnson PIT,7,,42,116,75.8,16.8
88,,Doug BaldwinD. Baldwin FA,,30,35,123,70.6,25.0
89,,Taywan TaylorT. Taylor TEN,11,24,67,124,91.2,12.8
90,,Mohamed SanuM. Sanu ATL,9,29,73,114,91.6,9.5
91,,Keelan ColeK. Cole JAC,10,26,71,122,91.4,10.7
92,,Josh GordonJ. Gordon FA,,28,44,114,87.1,16.0
93,,Deon CainD. Cain IND,6,22,74,113,98.0,9.3
94,,Paul RichardsonP. Richardson WAS,10,27,77,120,98.8,8.8
95,,Jalen HurdJ. Hurd SF,4,,61,115,83.0,14.0
96,,Trey QuinnT. Quinn WAS,10,23,74,160,97.4,19.2
97,,Demaryius ThomasD. Thomas NE,10,31,69,124,93.2,12.7
98,,David MooreD. Moore SEA,11,24,65,115,89.3,11.5
99,,Taylor GabrielT. Gabriel CHI,6,28,70,113,90.8,11.3
100,,Riley RidleyR. Ridley CHI,6,,59,132,95.7,16.7
101,,Chris HoganC. Hogan CAR,7,31,79,138,101.2,13.7
102,,Terry McLaurinT. McLaurin WAS,10,,53,117,83.4,19.1
103,,Willie SneadW. Snead BAL,8,26,74,116,98.7,9.7
104,,Phillip DorsettP. Dorsett NE,10,26,81,165,104.0,17.6
105,,J'Mon MooreJ. Moore GB,11,24,92,129,107.8,8.6
106,,Cameron MeredithC. Meredith NO,9,26,88,148,107.6,15.1
107,,Keith KirkwoodK. Kirkwood NO,9,25,83,140,109.1,11.5
108,,Ted GinnT. Ginn NO,9,34,69,153,109.4,13.7
109,,Michael CrabtreeM. Crabtree FA,,31,78,140,103.1,15.3
110,,Allen HurnsA. Hurns DAL,8,27,89,166,117.7,16.3
111,,Laquon TreadwellL. Treadwell MIN,12,23,96,147,115.5,14.2
112,,Corey ColemanC. Coleman NYG,11,24,92,146,120.3,11.9
113,,Ryan GrantR. Grant OAK,6,28,99,169,121.7,16.6
114,,Chris ConleyC. Conley JAC,10,26,87,121,107.1,10.3
115,,Demarcus RobinsonD. Robinson KC,12,24,67,151,105.0,26.9
116,,Danny AmendolaD. Amendola DET,5,33,86,146,120.0,14.8
117,,Pierre GarconP. Garcon FA,,32,87,160,116.9,16.6
118,,Cole BeasleyC. Beasley BUF,6,30,90,142,118.3,8.3
119,,Kelvin BenjaminK. Benjamin FA,,28,95,163,118.6,17.6
120,,KeeSean JohnsonK. Johnson ARI,12,,70,127,106.1,15.0
121,,Emanuel HallE. Hall CHI,6,,63,151,115.5,17.8
122,,Jordan MatthewsJ. Matthews SF,4,26,101,141,122.8,11.2
123,,Martavis BryantM. Bryant FA,,27,97,171,117.9,19.4
124,,Chad WilliamsC. Williams ARI,12,24,105,162,126.9,13.1
125,,Gary JenningsG. Jennings SEA,11,,67,162,118.7,25.2
126,,Dez BryantD. Bryant FA,,30,93,138,119.8,9.4
127,,Travis BenjaminT. Benjamin LAC,12,29,89,144,121.5,13.2
128,,Hunter RenfrowH. Renfrow OAK,6,,70,155,118.9,19.7
129,,Breshad PerrimanB. Perriman TB,7,25,86,135,120.2,13.1
130,,Rishard MatthewsR. Matthews FA,,29,107,179,131.4,20.0
131,,Cordarrelle PattersonC. Patterson CHI,6,28,97,152,120.8,13.0
132,,Tajae SharpeT. Sharpe TEN,11,24,102,152,133.1,14.0
133,,Jakeem GrantJ. Grant MIA,5,26,101,142,122.7,9.3
134,,Jermaine KearseJ. Kearse FA,,29,104,181,136.0,21.5
135,,Rashard HigginsR. Higgins CLE,7,24,111,133,122.8,6.9
136,,Bruce EllingtonB. Ellington FA,,27,100,153,129.6,12.7
137,,Ryan SwitzerR. Switzer PIT,7,24,92,173,136.2,18.9
138,,Jordy NelsonJ. Nelson FA,,34,94,181,124.3,24.4
139,,Preston WilliamsP. Williams MIA,5,,47,160,119.0,30.6
140,,DaMarkus LodgeD. Lodge TB,7,,94,153,120.3,17.8
141,,Chester RogersC. Rogers IND,6,25,106,152,136.0,9.2
142,,Kendrick BourneK. Bourne SF,4,23,120,142,132.9,7.2
143,,Terrelle PryorT. Pryor FA,,29,106,154,125.7,14.7
144,,Justin WatsonJ. Watson TB,7,24,79,162,130.2,24.8
145,,Braxton BerriosB. Berrios NE,10,23,100,171,141.4,16.1
146,,Lil'Jordan HumphreyL. Humphrey NO,9,,91,161,127.0,27.4
147,,Jake KumerowJ. Kumerow GB,11,27,107,176,136.3,25.1
148,,Darius SlaytonD. Slayton NYG,11,,98,132,114.5,12.8
149,,Tim PatrickT. Patrick DEN,10,25,113,156,137.5,14.8
150,,Trent TaylorT. Taylor SF,4,25,118,164,144.4,11.7
151,,David SillsD. Sills BUF,6,,71,158,116.3,31.2
152,,Marcell AtemanM. Ateman OAK,6,24,104,151,142.3,8.3
153,,Mack HollinsM. Hollins PHI,10,25,119,163,145.8,11.6
154,,Stanley Morgan Jr.S. Morgan CIN,9,,78,185,129.3,42.4
155,,Jaron BrownJ. Brown SEA,11,29,128,175,148.3,14.5
156,,Kevin WhiteK. White ARI,12,26,115,184,142.4,23.1
157,,Dontrelle InmanD. Inman NE,10,30,121,169,143.2,17.2
158,,Auden TateA. Tate CIN,9,22,128,153,144.8,6.7
159,,J.J. NelsonJ. Nelson OAK,6,27,126,173,153.2,16.2
160,,Seth RobertsS. Roberts BAL,8,28,127,155,147.4,7.3
161,,Richie JamesR. James SF,4,23,117,142,127.7,10.5
162,,Cody LatimerC. Latimer NYG,11,26,123,154,141.5,11.5
163,,Chris MooreC. Moore BAL,8,25,135,157,149.8,7.9
164,,Brandon PowellB. Powell DET,5,22,104,155,130.7,20.9
165,,Travis FulghamT. Fulgham DET,5,,100,175,133.0,31.3
166,,Tavon AustinT. Austin DAL,8,28,127,174,146.5,17.1
167,,Ashton DulinA. Dulin IND,6,,93,167,135.0,31.0
168,,Mike WallaceM. Wallace FA,,32,121,162,147.3,16.0
169,,Dillon MitchellD. Mitchell MIN,12,,64,160,112.0,48.0
170,,Antoine WesleyA. Wesley BAL,8,,66,194,139.7,54.0
171,,Anthony JohnsonA. Johnson TB,7,,65,163,114.0,49.0
172,,Jordan LasleyJ. Lasley BAL,8,,136,188,156.6,17.4
173,,Jaleel ScottJ. Scott BAL,8,,134,186,156.6,19.5
174,,Daurice FountainD. Fountain IND,6,23,137,189,157.2,18.5
175,,Torrey SmithT. Smith CAR,7,30,140,195,163.8,15.6
176,,Josh MaloneJ. Malone CIN,9,23,141,191,165.0,16.3
177,,Cedrick WilsonC. Wilson DAL,8,23,88,179,145.0,40.6
178,,Zach PascalZ. Pascal IND,6,24,132,177,154.8,18.0
179,,Greg DortchG. Dortch NYJ,4,,99,161,130.0,31.0
180,,Jazz FergusonJ. Ferguson SEA,11,,122,164,148.3,18.7
181,,Eli RogersE. Rogers PIT,7,26,150,192,167.8,14.5
182,,Jarius WrightJ. Wright CAR,7,29,131,170,150.3,15.9
183,,Brice ButlerB. Butler MIA,5,29,144,164,155.0,8.3
184,,Amara DarbohA. Darboh SEA,11,25,149,172,162.0,8.5
185,,ArDarius StewartA. Stewart FA,,25,142,176,156.7,14.3
186,,Dan ArnoldD. Arnold NO,9,,136,159,147.5,11.5
187,,Deontay BurnettD. Burnett NYJ,4,21,153,177,165.5,8.8
188,,Emmanuel ButlerE. Butler NO,9,,158,197,169.0,16.2
189,,Josh BellamyJ. Bellamy NYJ,4,30,154,180,171.0,9.8
190,,Brandon LaFellB. LaFell FA,,32,151,183,163.3,14.1
191,,Simmie Cobbs Jr.S. Cobbs NO,9,23,158,190,170.3,11.9
192,,Chad HansenC. Hansen FA,,24,160,175,165.3,6.8
193,,Braxton MillerB. Miller PHI,10,26,159,174,166.7,6.1
194,,Terrance WilliamsT. Williams FA,,29,157,172,164.5,7.5
195,,Jehu ChessonJ. Chesson WAS,10,25,165,178,173.0,5.7
196,,Isaiah FordI. Ford MIA,5,23,167,193,180.5,9.2
197,,TJ JonesT. Jones FA,,26,168,196,182.0,14.0
198,,Russell ShepardR. Shepard NYG,11,28,178,181,179.5,1.5
