Rank,WSID,Wide Receivers (Team),Bye,Age,Best,Worst,Avg,Std Dev,Notes
1,,DeAndre HopkinsD. Hopkins HOU,10,27,1,4,1.4,0.7
2,,Odell Beckham Jr.O. Beckham CLE,7,26,1,5,2.3,0.9
3,,Michael ThomasM. Thomas NO,9,26,2,5,3.4,0.8
4,,Davante AdamsD. Adams GB,11,26,1,6,3.5,1.1
5,,JuJu Smith-SchusterJ. Smith-Schuster PIT,7,22,1,9,5.0,1.4
6,,Mike EvansM. Evans TB,7,25,4,8,6.1,0.8
7,,Julio JonesJ. Jones ATL,9,30,3,14,7.8,1.2
8,,Amari CooperA. Cooper DAL,8,25,7,13,8.7,1.7
9,,Keenan AllenK. Allen LAC,12,27,5,14,9.1,1.9
10,,Stefon DiggsS. Diggs MIN,12,25,6,14,10.0,1.4
11,,Antonio BrownA. Brown OAK,6,30,7,13,10.4,1.0
12,,Brandin CooksB. Cooks LAR,9,25,10,24,14.3,2.5
13,,Adam ThielenA. Thielen MIN,12,28,12,23,14.5,2.1
14,,Kenny GolladayK. Golladay DET,5,25,7,20,15.0,3.2
15,,A.J. GreenA. Green CIN,9,30,10,40,15.0,2.2
16,,T.Y. HiltonT. Hilton IND,6,29,9,30,16.0,2.2
17,,D.J. MooreD. Moore CAR,7,22,10,27,18.2,4.1
18,,Robert WoodsR. Woods LAR,9,27,14,42,20.3,4.8
19,,Cooper KuppC. Kupp LAR,9,26,14,36,20.4,2.7
20,,Calvin RidleyC. Ridley ATL,9,24,11,34,21.7,3.9
21,,Corey DavisC. Davis TEN,11,24,14,39,22.0,4.1
22,,Chris GodwinC. Godwin TB,7,23,15,37,22.9,4.1
23,,N'Keal HarryN. Harry NE,10,,7,57,24.3,7.1
24,,Allen RobinsonA. Robinson CHI,6,25,18,44,25.9,4.4
25,,Mike WilliamsM. Williams LAC,12,24,18,44,26.2,4.3
26,,Jarvis LandryJ. Landry CLE,7,26,19,35,27.4,3.3
27,,Sammy WatkinsS. Watkins KC,12,26,18,50,28.8,4.8
28,,Courtland SuttonC. Sutton DEN,10,23,20,45,30.0,4.5
29,,Tyler LockettT. Lockett SEA,11,26,19,53,31.3,7.6
30,,Tyler BoydT. Boyd CIN,9,24,19,47,31.6,4.3
31,,Christian KirkC. Kirk ARI,12,22,22,46,32.9,4.4
32,,Will FullerW. Fuller HOU,10,25,21,50,33.8,4.5
33,,Alshon JefferyA. Jeffery PHI,10,29,18,48,34.1,5.7
34,,Dante PettisD. Pettis SF,4,23,25,49,34.2,4.4
35,,Tyreek HillT. Hill KC,12,25,10,100,36.1,21.8
36,,A.J. BrownA. Brown TEN,11,,20,103,37.8,16.6
37,,D.K. MetcalfD. Metcalf SEA,11,,21,101,38.8,18.8
38,,Robby AndersonR. Anderson NYJ,4,26,27,66,40.5,8.6
39,,Anthony MillerA. Miller CHI,6,23,32,69,42.0,4.6
40,,Sterling ShepardS. Shepard NYG,11,26,28,54,42.4,6.2
41,,Parris CampbellP. Campbell IND,6,,24,70,42.5,12.2
42,,Marvin JonesM. Jones DET,5,29,32,63,43.5,6.7
43,,Marquise BrownM. Brown BAL,8,,24,111,45.4,17.7
44,,James WashingtonJ. Washington PIT,7,23,35,57,46.2,5.0
45,,Dede WestbrookD. Westbrook JAC,10,25,36,82,47.8,5.4
46,,Keke CouteeK. Coutee HOU,10,22,35,80,48.3,7.1
47,,Deebo SamuelD. Samuel SF,4,,22,126,48.4,13.4
48,,Golden TateG. Tate NYG,11,30,32,69,50.4,5.6
49,,Michael GallupM. Gallup DAL,8,23,38,75,50.4,7.7
50,,Curtis SamuelC. Samuel CAR,7,22,38,107,50.9,7.2
"50

                                              googletag.cmd.push(function() { googletag.display('div-gpt-ad-1404326895972-0'); });"
51,,Julian EdelmanJ. Edelman NE,10,33,18,73,51.4,10.4
52,,J.J. Arcega-WhitesideJ. Arcega-Whiteside PHI,10,,35,94,53.6,12.4
53,,Tre'Quan SmithT. Smith NO,9,23,32,76,55.5,6.4
54,,DaeSean HamiltonD. Hamilton DEN,10,24,26,87,56.7,9.8
55,,Marquez Valdes-ScantlingM. Valdes-Scantling GB,11,24,38,68,57.2,3.3
56,,Devin FunchessD. Funchess IND,6,25,49,66,57.2,4.6
57,,John BrownJ. Brown BUF,6,29,44,84,57.5,8.6
58,,Mecole HardmanM. Hardman KC,12,,29,96,51.5,14.4
59,,Hakeem ButlerH. Butler ARI,12,,30,100,60.9,15.1
60,,Emmanuel SandersE. Sanders DEN,10,32,44,98,61.9,10.0
61,,Andy IsabellaA. Isabella ARI,12,,36,98,56.1,16.2
62,,Antonio CallawayA. Callaway CLE,7,22,51,84,64.5,6.3
63,,Robert FosterR. Foster BUF,6,25,34,114,66.0,15.5
64,,Devante ParkerD. Parker MIA,5,26,53,87,66.0,7.9
65,,Donte MoncriefD. Moncrief PIT,7,25,55,89,66.5,8.1
66,,Geronimo AllisonG. Allison GB,11,25,40,149,67.1,10.6
67,,Marquise GoodwinM. Goodwin SF,4,28,43,88,67.7,10.5
68,,Tyrell WilliamsT. Williams OAK,6,27,55,105,69.8,9.3
69,,Jamison CrowderJ. Crowder NYJ,4,26,54,86,70.1,9.3
70,,Kenny StillsK. Stills MIA,5,27,49,119,70.6,11.3
71,,Quincy EnunwaQ. Enunwa NYJ,4,27,60,98,74.6,10.1
72,,John RossJ. Ross CIN,9,24,55,109,75.0,8.7
73,,Larry FitzgeraldL. Fitzgerald ARI,12,35,41,94,75.1,8.5
74,,Nelson AgholorN. Agholor PHI,10,26,62,108,76.5,8.8
75,,Josh ReynoldsJ. Reynolds LAR,9,24,41,130,78.3,12.2
76,,DeSean JacksonD. Jackson PHI,10,32,46,101,79.1,9.9
77,,Marqise LeeM. Lee JAC,10,27,57,98,79.2,7.9
78,,Zay JonesZ. Jones BUF,6,24,49,124,79.6,10.4
79,,D.J. CharkD. Chark JAC,10,22,39,98,81.8,8.6
80,,Adam HumphriesA. Humphries TEN,11,26,56,99,82.3,10.7
81,,Kelvin HarmonK. Harmon WAS,10,,38,131,83.5,17.0
82,,Equanimeous St. BrownE. St. GB,11,22,74,95,85.4,7.1
83,,Randall CobbR. Cobb DAL,8,28,63,120,85.5,9.3
84,,Josh DoctsonJ. Doctson WAS,10,26,63,110,83.0,11.1
85,,Miles BoykinM. Boykin BAL,8,,39,115,78.8,15.0
86,,Albert WilsonA. Wilson MIA,5,26,60,112,85.6,15.1
87,,David MooreD. Moore SEA,11,24,70,104,86.0,10.0
88,,Keelan ColeK. Cole JAC,10,26,67,125,92.3,11.0
89,,Taywan TaylorT. Taylor TEN,11,24,67,122,92.5,11.7
90,,Mohamed SanuM. Sanu ATL,9,29,63,119,92.8,10.8
91,,Terry McLaurinT. McLaurin WAS,10,,57,116,79.4,13.9
92,,Diontae JohnsonD. Johnson PIT,7,,54,116,81.4,18.3
93,,Jalen HurdJ. Hurd SF,4,,57,120,83.0,16.0
94,,Trey QuinnT. Quinn WAS,10,23,51,150,93.7,17.8
95,,Paul RichardsonP. Richardson WAS,10,27,83,109,96.2,7.3
96,,Deon CainD. Cain IND,6,22,81,120,99.1,9.5
97,,Demaryius ThomasD. Thomas NE,10,31,68,118,94.9,13.3
98,,Taylor GabrielT. Gabriel CHI,6,28,70,113,90.1,12.1
99,,Riley RidleyR. Ridley CHI,6,,70,131,97.1,14.6
100,,Willie SneadW. Snead BAL,8,26,74,118,99.6,9.2
101,,Josh GordonJ. Gordon FA,,28,67,132,90.1,15.5
102,,Chris HoganC. Hogan CAR,7,31,81,136,102.7,14.0
103,,Phillip DorsettP. Dorsett NE,10,26,81,154,109.4,14.5
104,,J'Mon MooreJ. Moore GB,11,24,92,129,109.1,9.1
105,,Ted GinnT. Ginn NO,9,34,81,128,105.5,12.2
106,,Keith KirkwoodK. Kirkwood NO,9,25,85,155,110.9,13.8
107,,Demarcus RobinsonD. Robinson KC,12,24,71,112,96.1,12.0
108,,Doug BaldwinD. Baldwin FA,,30,39,172,88.1,37.2
109,,Laquon TreadwellL. Treadwell MIN,12,24,92,142,115.4,13.0
110,,Gary JenningsG. Jennings SEA,11,,62,141,104.8,19.0
111,,Allen HurnsA. Hurns DAL,8,27,90,155,119.9,12.3
112,,Chris ConleyC. Conley JAC,10,26,84,132,105.4,11.5
113,,Corey ColemanC. Coleman NYG,11,24,94,154,119.1,12.9
114,,KeeSean JohnsonK. Johnson ARI,12,,68,145,109.2,18.0
115,,Cole BeasleyC. Beasley BUF,6,30,92,136,117.1,10.5
116,,Cameron MeredithC. Meredith NO,9,26,92,152,112.8,15.6
117,,Michael CrabtreeM. Crabtree FA,,31,79,144,107.1,19.4
118,,Danny AmendolaD. Amendola DET,5,33,89,159,118.6,17.1
119,,Kelvin BenjaminK. Benjamin FA,,28,98,148,118.4,12.6
120,,Pierre GarconP. Garcon FA,,32,86,163,119.3,20.3
121,,Ryan GrantR. Grant OAK,6,28,106,157,126.1,16.5
122,,Dez BryantD. Bryant FA,,30,100,142,121.6,11.6
123,,Rishard MatthewsR. Matthews NO,9,29,112,164,131.1,16.7
124,,Hunter RenfrowH. Renfrow OAK,6,,88,151,114.3,21.0
125,,Breshad PerrimanB. Perriman TB,7,25,89,135,115.4,13.4
126,,Chad WilliamsC. Williams ARI,12,24,105,156,128.7,17.5
127,,Jermaine KearseJ. Kearse DET,5,29,105,168,131.1,18.0
128,,Jordan MatthewsJ. Matthews SF,4,26,102,154,126.8,12.2
129,,Preston WilliamsP. Williams MIA,5,,43,113,94.5,10.6
130,,Rashard HigginsR. Higgins CLE,7,24,102,132,119.6,9.6
131,,Travis BenjaminT. Benjamin LAC,12,29,82,138,120.4,13.5
132,,Martavis BryantM. Bryant FA,,27,96,143,120.7,12.3
133,,Emanuel HallE. Hall CHI,6,,63,133,114.8,10.0
134,,Jake KumerowJ. Kumerow GB,11,27,90,142,115.5,12.4
135,,Tim PatrickT. Patrick DEN,10,25,90,139,125.7,9.8
136,,Tajae SharpeT. Sharpe TEN,11,24,103,160,140.6,15.0
137,,Cordarrelle PattersonC. Patterson CHI,6,28,104,130,119.2,6.7
138,,Jordy NelsonJ. Nelson FA,,34,88,184,121.7,31.9
139,,Ryan SwitzerR. Switzer PIT,7,24,110,176,137.6,17.5
140,,Chester RogersC. Rogers IND,6,25,108,165,135.1,15.3
141,,Justin WatsonJ. Watson TB,7,24,87,149,116.0,22.2
142,,Jakeem GrantJ. Grant MIA,5,26,101,138,128.5,8.0
143,,Terrelle PryorT. Pryor JAC,10,30,119,148,129.5,8.9
144,,DaMarkus LodgeD. Lodge TB,7,,93,152,120.4,20.1
145,,Mack HollinsM. Hollins PHI,10,25,117,166,139.2,18.8
146,,Trent TaylorT. Taylor SF,4,25,111,157,139.7,13.6
147,,Kendrick BourneK. Bourne SF,4,23,114,145,132.8,9.1
148,,Jakobi MeyersJ. Meyers NE,10,,83,118,100.3,14.3
149,,Dontrelle InmanD. Inman NE,10,30,96,150,134.2,12.2
150,,Jaron BrownJ. Brown SEA,11,29,119,157,136.2,13.7
151,,Braxton BerriosB. Berrios NE,10,23,100,175,144.3,23.1
152,,J.J. NelsonJ. Nelson OAK,6,27,125,169,145.8,15.1
153,,Chris MooreC. Moore BAL,8,26,112,155,139.8,17.0
154,,Kevin WhiteK. White ARI,12,27,104,144,130.0,15.8
155,,Lil'Jordan HumphreyL. Humphrey NO,9,,90,153,119.3,25.9
156,,David SillsD. Sills BUF,6,,70,156,119.7,36.4
157,,Bruce EllingtonB. Ellington FA,,27,100,173,146.0,17.5
158,,Torrey SmithT. Smith CAR,7,30,142,170,153.7,9.5
159,,Marcell AtemanM. Ateman OAK,6,24,134,160,150.4,5.8
160,,Seth RobertsS. Roberts BAL,8,28,139,163,152.0,9.5
161,,Byron PringleB. Pringle KC,12,25,91,121,106.0,15.0
162,,Daurice FountainD. Fountain IND,6,23,139,154,146.3,5.4
163,,Jordan LasleyJ. Lasley BAL,8,,150,163,154.0,4.9
164,,Darius SlaytonD. Slayton NYG,11,,110,163,135.0,21.7
165,,Auden TateA. Tate CIN,9,22,144,156,147.8,4.8
166,,Dillon MitchellD. Mitchell MIN,12,,67,157,112.0,45.0
167,,Antoine WesleyA. Wesley BAL,8,,73,155,114.0,41.0
168,,Anthony JohnsonA. Johnson TB,7,,66,167,116.5,50.5
169,,Tavon AustinT. Austin DAL,8,28,123,148,139.3,11.6
170,,Richie JamesR. James SF,4,23,117,162,139.7,18.4
171,,Jaleel ScottJ. Scott BAL,8,,141,174,153.0,12.6
172,,Stanley Morgan Jr.S. Morgan CIN,9,,100,150,125.0,25.0
173,,Cedrick WilsonC. Wilson DAL,8,23,95,182,147.7,37.8
174,,Ashton DulinA. Dulin IND,6,,92,171,131.5,39.5
175,,Greg DortchG. Dortch NYJ,4,,99,166,132.5,33.5
176,,Mike WallaceM. Wallace FA,,32,121,166,150.7,21.0
177,,Zach PascalZ. Pascal IND,6,24,139,162,150.7,9.4
178,,Amara DarbohA. Darboh SEA,11,25,119,175,151.0,23.6
179,,Cody LatimerC. Latimer NYG,11,26,147,161,152.0,6.4
180,,Maurice HarrisM. Harris NE,10,26,130,153,141.5,11.5
181,,ArDarius StewartA. Stewart FA,,25,146,162,156.3,7.3
182,,Josh MaloneJ. Malone CIN,9,23,144,179,163.8,13.3
183,,Jazz FergusonJ. Ferguson SEA,11,,121,168,144.5,23.5
184,,Emmanuel ButlerE. Butler NO,9,,137,154,145.5,8.5
185,,Brice ButlerB. Butler MIA,5,29,156,165,159.7,3.9
186,,Jarius WrightJ. Wright CAR,7,29,139,158,148.5,9.5
187,,Simmie Cobbs Jr.S. Cobbs NO,9,23,156,171,165.3,6.6
188,,Eli RogersE. Rogers PIT,7,26,162,178,170.3,7.3
189,,Andre RobertsA. Roberts BUF,6,31,148,165,156.5,8.5
190,,Braxton MillerB. Miller PHI,10,26,157,177,168.0,8.3
191,,Chad HansenC. Hansen NO,9,24,158,178,168.0,8.2
192,,Justin HardyJ. Hardy ATL,9,27,159,162,160.5,1.5
193,,Josh BellamyJ. Bellamy NYJ,4,30,164,183,174.3,8.0
194,,Deontay BurnettD. Burnett NYJ,4,21,161,180,171.3,7.8
195,,Russell ShepardR. Shepard NYG,11,28,146,184,165.0,19.0
196,,Jehu ChessonJ. Chesson WAS,10,25,163,181,174.3,8.1
197,,Isaiah FordI. Ford MIA,5,23,165,185,177.7,9.0
