Rank,WSID,Wide Receivers (Team),Bye,Best,Worst,Avg,Std Dev,Notes
&nbsp,&nbsp,&nbsp,&nbsp,&nbsp,&nbsp,&nbsp,&nbsp
Tier 1,
1,,Michael ThomasM. Thomas NO,,1,1,1.0,0.0
2,,DeAndre HopkinsD. Hopkins HOU,,2,7,2.9,1.1
3,,Davante AdamsD. Adams GB,,2,7,3.5,1.1
4,,Tyreek HillT. Hill KC,,2,12,4.1,1.5
Tier 2,
5,,Julio JonesJ. Jones ATL,,2,10,4.6,1.3
6,,Chris GodwinC. Godwin TB,,3,9,5.3,1.1
7,,Mike EvansM. Evans TB,,4,10,7.0,0.8
8,,Amari CooperA. Cooper DAL,,7,16,9.4,1.9
Tier 3,
9,,Kenny GolladayK. Golladay DET,,7,17,9.7,2.1
10,,D.J. MooreD. Moore CAR,,7,23,11.0,1.7
11,,Odell Beckham Jr.O. Beckham CLE,,6,16,11.6,2.3
12,,Allen RobinsonA. Robinson CHI,,8,25,12.7,1.9
13,,Keenan AllenK. Allen LAC,,7,22,14.1,3.1
14,,Courtland SuttonC. Sutton DEN,,10,28,15.2,2.9
15,,A.J. BrownA. Brown TEN,,7,23,15.3,2.6
Tier 4,
16,,DeVante ParkerD. Parker MIA,,9,28,16.7,4.1
17,,JuJu Smith-SchusterJ. Smith-Schuster PIT,,7,31,17.0,4.2
18,,Stefon DiggsS. Diggs MIN,,11,35,17.9,3.3
19,,Cooper KuppC. Kupp LAR,,6,35,18.4,4.4
20,,Calvin RidleyC. Ridley ATL,,10,34,21.4,3.9
21,,Robert WoodsR. Woods LAR,,15,35,22.1,2.7
22,,D.J. CharkD. Chark JAC,,16,33,22.7,3.2
23,,Tyler LockettT. Lockett SEA,,12,33,23.8,3.9
24,,Adam ThielenA. Thielen MIN,,16,36,24.5,4.2
25,,Julian EdelmanJ. Edelman NE,,17,34,24.8,4.0
Tier 5,
26,,T.Y. HiltonT. Hilton IND,,17,34,25.8,4.1
27,,D.K. MetcalfD. Metcalf SEA,,19,42,25.9,2.9
28,,Jarvis LandryJ. Landry CLE,,13,46,27.4,4.0
29,,Terry McLaurinT. McLaurin WAS,,15,33,27.6,2.7
30,,A.J. GreenA. Green CIN,,10,44,29.7,6.4
31,,Deebo SamuelD. Samuel SF,,21,44,30.9,2.8
32,,Michael GallupM. Gallup DAL,,23,38,31.2,3.7
33,,John BrownJ. Brown BUF,,24,51,32.6,3.5
34,,Tyler BoydT. Boyd CIN,,24,42,32.8,3.1
35,,Christian KirkC. Kirk ARI,,22,45,33.7,3.8
Tier 6,
36,,Marquise BrownM. Brown BAL,,29,47,37.3,3.3
37,,Sterling ShepardS. Shepard NYG,,34,49,38.8,3.8
38,,Mike WilliamsM. Williams LAC,,35,59,38.9,1.9
39,,Robby AndersonR. Anderson NYJ,,35,50,40.3,3.1
40,,Alshon JefferyA. Jeffery PHI,,36,65,42.5,4.8
41,,Marvin JonesM. Jones DET,,30,58,43.0,4.1
42,,Emmanuel SandersE. Sanders SF,,36,62,43.2,4.0
43,,Will FullerW. Fuller HOU,,30,81,44.5,5.9
44,,Anthony MillerA. Miller CHI,,34,70,44.5,4.3
45,,Darius SlaytonD. Slayton NYG,,36,61,46.0,5.6
46,,Curtis SamuelC. Samuel CAR,,36,54,46.9,3.4
47,,Brandin CooksB. Cooks LAR,,38,60,47.7,5.2
48,,Preston WilliamsP. Williams MIA,,28,62,48.6,4.3
49,,Jamison CrowderJ. Crowder NYJ,,33,60,48.8,4.6
50,,Diontae JohnsonD. Johnson PIT,,41,59,49.4,4.1
51,,Golden TateG. Tate NYG,,34,60,50.1,4.1
Tier 7,
52,,John RossJ. Ross CIN,,41,68,55.5,3.9
53,,Sammy WatkinsS. Watkins KC,,44,69,55.8,4.0
54,,DeSean JacksonD. Jackson PHI,,38,79,56.3,8.4
55,,Tyrell WilliamsT. Williams LV,,44,72,56.4,3.8
56,,Dede WestbrookD. Westbrook JAC,,41,73,56.5,3.9
57,,N'Keal HarryN. Harry NE,,43,73,56.8,5.1
58,,Mecole HardmanM. Hardman KC,,40,75,58.4,5.3
59,,Corey DavisC. Davis TEN,,48,68,60.3,4.4
60,,Breshad PerrimanB. Perriman TB,,43,110,61.2,6.1
61,,Cole BeasleyC. Beasley BUF,,36,91,61.8,7.5
62,,Hunter RenfrowH. Renfrow LV,,45,82,62.3,5.4
63,,James WashingtonJ. Washington PIT,,47,73,62.5,4.0
64,,Larry FitzgeraldL. Fitzgerald ARI,,43,71,62.9,5.0
65,,Parris CampbellP. Campbell IND,,57,77,65.6,4.5
66,,Kenny StillsK. Stills HOU,,50,74,68.5,2.9
67,,Randall CobbR. Cobb DAL,,61,82,68.8,4.0
68,,Andy IsabellaA. Isabella ARI,,48,77,70.3,2.9
69,,Mohamed SanuM. Sanu NE,,59,116,71.5,10.6
Tier 8,
70,,Chris ConleyC. Conley JAC,,57,81,70.6,4.5
71,,Albert WilsonA. Wilson MIA,,64,101,75.4,6.4
72,,Allen LazardA. Lazard GB,,62,85,73.1,5.2
73,,Tre'Quan SmithT. Smith NO,,54,87,75.6,4.6
74,,Danny AmendolaD. Amendola DET,,60,113,76.7,10.6
75,,Taylor GabrielT. Gabriel FA,,63,115,76.3,8.9
76,,Devin FunchessD. Funchess IND,,71,107,80.6,8.0
77,,Nelson AgholorN. Agholor PHI,,69,106,82.1,8.6
78,,Auden TateA. Tate CIN,,66,91,80.4,4.6
79,,Kelvin HarmonK. Harmon WAS,,64,127,85.5,11.3
80,,DaeSean HamiltonD. Hamilton DEN,,70,129,86.4,12.7
81,,David MooreD. Moore SEA,,77,105,87.6,8.1
82,,J.J. Arcega-WhitesideJ. Arcega-Whiteside PHI,,74,108,88.4,8.2
83,,Miles BoykinM. Boykin BAL,,69,104,88.6,8.3
84,,Demarcus RobinsonD. Robinson KC,,78,127,93.1,9.8
85,,Marquez Valdes-ScantlingM. Valdes-Scantling GB,,80,137,89.2,11.2
Tier 9,
86,,Willie SneadW. Snead BAL,,82,141,92.0,12.3
87,,Jalen HurdJ. Hurd SF,,61,109,92.1,6.6
88,,Adam HumphriesA. Humphries TEN,,75,100,89.3,5.3
89,,Jakobi MeyersJ. Meyers NE,,66,96,85.0,4.7
90,,Phillip DorsettP. Dorsett NE,,78,105,89.8,5.2
91,,Zach PascalZ. Pascal IND,,72,99,91.4,6.1
92,,Antonio BrownA. Brown FA,,21,130,68.1,27.9
93,,Keke CouteeK. Coutee HOU,,75,113,90.5,7.4
94,,Steven SimsS. Sims WAS,,68,109,91.2,12.8
95,,Demaryius ThomasD. Thomas NYJ,,82,106,91.3,6.7
96,,Keelan ColeK. Cole JAC,,77,109,97.4,4.2
97,,Josh ReynoldsJ. Reynolds LAR,,83,118,95.7,7.4
98,,Russell GageR. Gage ATL,,75,114,97.8,8.5
99,,Greg WardG. Ward PHI,,71,134,93.9,14.0
100,,Geronimo AllisonG. Allison GB,,85,182,102.3,17.9
101,,Ted GinnT. Ginn NO,,94,131,103.7,9.3
102,,Kendrick BourneK. Bourne SF,,90,130,104.4,7.1
103,,Justin WatsonJ. Watson TB,,81,126,105.2,7.5
104,,Dante PettisD. Pettis SF,,59,133,104.4,8.7
105,,Paul Richardson Jr.P. Richardson FA,,94,141,107.2,11.3
106,,Marquise GoodwinM. Goodwin SF,,90,124,108.6,5.3
107,,Zay JonesZ. Jones LV,,93,148,110.1,11.6
108,,Quincy EnunwaQ. Enunwa NYJ,,71,119,107.8,7.2
109,,KeeSean JohnsonK. Johnson ARI,,77,129,105.7,10.6
110,,Josh GordonJ. Gordon SEA,,65,120,109.1,5.1
Tier 10,
111,,CeeDee LambC. Lamb FA,,33,53,42.4,7.3
112,,Jerry JeudyJ. Jeudy FA,,36,53,43.0,6.0
113,,Damiere ByrdD. Byrd ARI,,81,187,117.1,26.2
114,,Justin JeffersonJ. Jefferson FA,,35,76,55.6,15.2
115,,Tee HigginsT. Higgins FA,,45,80,60.2,11.7
116,,Henry Ruggs IIIH. Ruggs FA,,52,88,60.8,13.7
117,,Allen HurnsA. Hurns MIA,,95,117,105.7,6.9
118,,Jalen ReagorJ. Reagor FA,,56,123,73.2,25.3
119,,Laviska Shenault Jr.L. Shenault FA,,56,111,77.0,19.4
120,,Trey QuinnT. Quinn WAS,,89,139,118.6,13.8
121,,Tajae SharpeT. Sharpe TEN,,89,124,108.5,11.5
122,,Hakeem ButlerH. Butler ARI,,91,122,105.6,12.8
123,,Tim PatrickT. Patrick DEN,,103,121,111.4,5.8
124,,Rashard HigginsR. Higgins CLE,,97,179,125.7,24.1
125,,Riley RidleyR. Ridley CHI,,85,169,113.8,27.8
126,,Robert FosterR. Foster BUF,,101,166,134.2,16.1
127,,Taywan TaylorT. Taylor CLE,,114,133,123.8,6.2
128,,Jakeem GrantJ. Grant MIA,,110,170,125.4,22.6
129,,Jake KumerowJ. Kumerow GB,,109,144,125.8,12.4
130,,Marqise LeeM. Lee JAC,,100,174,127.8,24.2
131,,Cordarrelle PattersonC. Patterson CHI,,108,177,128.6,24.3
132,,Byron PringleB. Pringle KC,,110,150,131.0,13.2
133,,Tyler JohnsonT. Johnson FA,,52,131,93.3,32.4
Tier 11,
134,,Olabisi JohnsonO. Johnson MIN,,99,140,119.5,17.0
135,,Deon CainD. Cain PIT,,111,174,137.4,24.3
136,,Chris HoganC. Hogan CAR,,111,162,139.0,18.9
137,,Scott MillerS. Miller TB,,100,134,112.0,15.6
138,,Denzel MimsD. Mims FA,,78,93,85.5,7.5
139,,Michael Pittman Jr.M. Pittman FA,,85,91,88.0,3.0
140,,Brandon AiyukB. Aiyuk FA,,84,101,92.5,8.5
141,,KJ HamlerK. Hamler FA,,88,119,103.5,15.5
142,,Alex EricksonA. Erickson CIN,,103,104,103.5,0.5
143,,Antonio Gandy-GoldenA. Gandy-Golden FA,,99,112,105.5,6.5
144,,Antonio CallawayA. Callaway FA,,78,135,106.5,28.5
145,,Bryan EdwardsB. Edwards FA,,87,127,107.0,20.0
146,,Chase ClaypoolC. Claypool FA,,90,124,107.0,17.0
147,,Donte MoncriefD. Moncrief FA,,79,149,114.0,35.0
148,,Van JeffersonV. Jefferson FA,,111,118,114.5,3.5
149,,Donovan Peoples-JonesD. Peoples-Jones FA,,91,147,119.0,28.0
150,,Marcus JohnsonM. Johnson IND,,86,153,119.5,33.5
151,,Keelan DossK. Doss LV,,98,143,120.5,22.5
152,,Malik TurnerM. Turner SEA,,125,185,149.3,25.8
153,,Cody LatimerC. Latimer NYG,,111,146,128.5,17.5
154,,Justin HardyJ. Hardy ATL,,135,173,150.7,16.2
155,,Richie JamesR. James SF,,126,171,151.0,18.7
156,,Isaiah FordI. Ford MIA,,116,145,130.5,14.5
157,,Jaron BrownJ. Brown SEA,,109,166,137.5,28.5
158,,Jarius WrightJ. Wright CAR,,138,139,138.5,0.5
159,,Chester RogersC. Rogers IND,,130,152,141.0,11.0
160,,Isaiah McKenzieI. McKenzie BUF,,119,165,142.0,23.0
161,,Dontrelle InmanD. Inman IND,,120,169,144.5,24.5
162,,Javon WimsJ. Wims CHI,,138,151,144.5,6.5
163,,Pharoh CooperP. Cooper ARI,,122,168,145.0,23.0
Tier 12,
164,,Seth RobertsS. Roberts BAL,,117,175,146.0,29.0
165,,Marvin HallM. Hall DET,,112,186,149.0,37.0
166,,Chad BeebeC. Beebe MIN,,141,159,150.0,9.0
167,,Damion RatleyD. Ratley CLE,,146,156,151.0,5.0
168,,Vyncint SmithV. Smith NYJ,,149,157,153.0,4.0
169,,Deonte HarrisD. Harris NO,,136,171,153.5,17.5
170,,Braxton BerriosB. Berrios NYJ,,137,175,156.0,19.0
171,,Kalif RaymondK. Raymond TEN,,134,189,161.5,27.5
172,,Laquon TreadwellL. Treadwell MIN,,132,192,162.0,30.0
173,,Tavon AustinT. Austin DAL,,136,188,162.0,26.0
174,,Mack HollinsM. Hollins MIA,,158,176,167.0,9.0
175,,Christian BlakeC. Blake ATL,,150,191,170.5,20.5
Tier 13,
176,,Trent SherfieldT. Sherfield ARI,,173,183,178.0,5.0
177,,Travis BenjaminT. Benjamin LAC,,167,193,180.0,13.0
178,,Stanley Morgan Jr.S. Morgan CIN,,180,189,184.5,4.5
