Rank,WSID,Running Backs (Team),Bye,Best,Worst,Avg,Std Dev,ADP,vs. ADP,Notes
&nbsp,&nbsp,&nbsp,&nbsp,&nbsp,&nbsp,&nbsp,&nbsp,&nbsp,&nbsp
Tier 1,
1,,Saquon BarkleyS. Barkley NYG,11,1,5,1.7,0.9,1.0,0.0
2,,Ezekiel ElliottE. Elliott DAL,8,1,8,2.6,1.2,3.0,+1.0
3,,Christian McCaffreyC. McCaffrey CAR,7,1,7,2.7,1.1,2.0,-1.0
4,,Alvin KamaraA. Kamara NO,9,1,6,3.5,1.1,4.0,0.0
Tier 2,
5,,David JohnsonD. Johnson ARI,12,3,16,6.0,2.2,5.0,0.0
6,,James ConnerJ. Conner PIT,7,3,20,8.1,2.1,7.0,+1.0
7,,Le'Veon BellL. Bell NYJ,4,5,16,8.2,2.5,6.0,-1.0
8,,Joe MixonJ. Mixon CIN,9,4,26,9.0,2.4,10.0,+2.0
9,,Melvin GordonM. Gordon LAC,12,3,30,9.9,4.5,8.0,-1.0
Tier 3,
10,,Todd GurleyT. Gurley LAR,9,1,22,10.6,4.0,9.0,-1.0
11,,Dalvin CookD. Cook MIN,12,5,33,10.9,2.5,11.0,0.0
12,,Nick ChubbN. Chubb CLE,7,6,30,11.9,3.3,12.0,0.0
13,,Damien WilliamsD. Williams KC,12,4,47,13.8,5.5,14.0,+1.0
14,,Leonard FournetteL. Fournette JAC,10,7,23,15.4,3.0,13.0,-1.0
15,,Aaron JonesA. Jones GB,11,3,29,15.6,3.2,15.0,0.0
16,,Marlon MackM. Mack IND,6,9,40,16.4,3.6,18.0,+2.0
17,,Devonta FreemanD. Freeman ATL,9,8,28,16.7,3.6,16.0,-1.0
18,,Kerryon JohnsonK. Johnson DET,5,8,28,17.3,4.4,17.0,-1.0
Tier 4,
19,,Derrick HenryD. Henry TEN,11,11,39,20.0,3.9,20.0,+1.0
20,,Josh JacobsJ. Jacobs OAK,6,8,38,20.4,5.1,19.0,-1.0
21,,Phillip LindsayP. Lindsay DEN,10,10,36,23.3,3.8,21.0,0.0
22,,David MontgomeryD. Montgomery CHI,6,8,41,24.3,6.4,22.0,0.0
23,,Mark IngramM. Ingram BAL,8,10,41,24.5,3.7,23.0,0.0
24,,Kenyan DrakeK. Drake MIA,5,9,45,24.6,5.4,24.0,0.0
25,,James WhiteJ. White NE,10,9,43,24.7,5.4,26.0,+1.0
26,,Sony MichelS. Michel NE,10,10,40,25.1,4.6,25.0,-1.0
27,,Chris CarsonC. Carson SEA,11,15,38,25.2,4.4,27.0,0.0
28,,Tarik CohenT. Cohen CHI,6,14,43,26.1,4.7,28.0,0.0
Tier 5,
29,,Lamar MillerL. Miller HOU,10,22,55,29.5,3.9,31.0,+2.0
30,,Tevin ColemanT. Coleman SF,4,21,46,30.3,4.3,30.0,0.0
31,,Derrius GuiceD. Guice WAS,10,11,45,32.3,5.7,29.0,-2.0
32,,Rashaad PennyR. Penny SEA,11,21,46,33.8,4.0,32.0,0.0
33,,Latavius MurrayL. Murray NO,9,19,54,34.2,5.7,38.0,+5.0
34,,Royce FreemanR. Freeman DEN,10,23,70,37.4,4.1,41.0,+7.0
35,,Austin EkelerA. Ekeler LAC,12,19,58,38.3,6.6,36.0,+1.0
36,,LeSean McCoyL. McCoy BUF,6,21,55,38.6,6.4,39.0,+3.0
37,,Jordan HowardJ. Howard PHI,10,26,64,39.1,6.6,35.0,-2.0
38,,Miles SandersM. Sanders PHI,10,16,86,36.5,10.0,33.0,-5.0
39,,Darrell HendersonD. Henderson LAR,9,15,103,40.2,12.3,34.0,-5.0
Tier 6,
40,,Ronald Jones IIR. Jones TB,7,27,68,42.1,7.0,40.0,0.0
41,,Dion LewisD. Lewis TEN,11,29,59,42.2,7.1,48.0,+7.0
42,,Jerick McKinnonJ. McKinnon SF,4,24,75,42.7,9.9,42.0,0.0
43,,Nyheim HinesN. Hines IND,6,28,71,43.0,7.0,44.0,+1.0
44,,Matt BreidaM. Breida SF,4,25,63,46.4,7.4,52.0,+8.0
45,,Ito SmithI. Smith ATL,9,31,81,47.6,6.7,50.0,+5.0
46,,D'Onta ForemanD. Foreman HOU,10,25,72,47.8,6.5,45.0,-1.0
47,,Adrian PetersonA. Peterson WAS,10,32,73,49.1,8.9,51.0,+4.0
48,,Peyton BarberP. Barber TB,7,29,73,49.3,9.1,46.0,-2.0
49,,Duke JohnsonD. Johnson CLE,7,35,68,50.8,6.8,57.0,+8.0
50,,Kalen BallageK. Ballage MIA,5,33,82,52.3,8.4,53.0,+3.0
"50

                                              googletag.cmd.push(function() { googletag.display('div-gpt-ad-1404326895972-0'); });"
51,,Carlos HydeC. Hyde KC,12,28,87,51.1,8.8,49.0,-2.0
52,,Jaylen SamuelsJ. Samuels PIT,7,21,78,53.0,9.6,47.0,-5.0
53,,Damien HarrisD. Harris NE,10,20,105,53.3,13.4,43.0,-10.0
54,,Kareem HuntK. Hunt CLE,7,30,88,55.1,8.7,37.0,-17.0
55,,Jamaal WilliamsJ. Williams GB,11,42,78,57.1,7.3,63.0,+8.0
56,,Chris ThompsonC. Thompson WAS,10,39,100,55.0,8.5,58.0,+2.0
Tier 7,
57,,C.J. AndersonC. Anderson DET,5,44,76,58.6,7.1,61.0,+4.0
58,,Giovani BernardG. Bernard CIN,9,41,84,59.7,7.7,60.0,+2.0
59,,Devin SingletaryD. Singletary BUF,6,27,86,58.1,10.2,54.0,-5.0
60,,Justice HillJ. Hill BAL,8,14,104,59.1,14.4,55.0,-5.0
61,,Jalen RichardJ. Richard OAK,6,41,76,60.5,8.3,64.0,+3.0
62,,Mike DavisM. Davis CHI,6,44,106,63.1,8.8,74.0,+12.0
63,,Justin JacksonJ. Jackson LAC,12,38,83,65.1,10.7,59.0,-4.0
64,,Rex BurkheadR. Burkhead NE,10,42,86,62.3,9.0,70.0,+6.0
65,,Chase EdmondsC. Edmonds ARI,12,44,88,66.6,7.3,72.0,+7.0
66,,Gus EdwardsG. Edwards BAL,8,35,99,67.1,9.6,67.0,+1.0
67,,Elijah McGuireE. McGuire NYJ,4,36,104,65.1,10.7,77.0,+10.0
68,,Frank GoreF. Gore BUF,6,44,88,69.0,7.2,75.0,+7.0
69,,T.J. YeldonT. Yeldon BUF,6,41,91,66.6,9.2,65.0,-4.0
70,,Alexander MattisonA. Mattison MIN,12,45,99,65.7,11.3,56.0,-14.0
71,,Kenneth DixonK. Dixon BAL,8,37,113,66.9,11.9,88.0,+17.0
72,,Doug MartinD. Martin OAK,6,31,95,73.3,8.4,84.0,+12.0
73,,Theo RiddickT. Riddick FA,,45,115,71.2,12.5,73.0,0.0
74,,Malcolm BrownM. Brown LAR,9,47,105,72.5,8.3,79.0,+5.0
75,,Ryquell ArmsteadR. Armstead JAC,10,45,108,71.2,11.9,69.0,-6.0
76,,Spencer WareS. Ware IND,6,46,109,76.2,8.8,87.0,+11.0
Tier 8,
77,,Corey ClementC. Clement PHI,10,60,90,77.7,6.0,104.0,+27.0
78,,Benny Snell Jr.B. Snell PIT,7,31,113,77.9,11.5,66.0,-12.0
79,,Devontae BookerD. Booker DEN,10,55,101,80.2,8.1,94.0,+15.0
80,,Jordan WilkinsJ. Wilkins IND,6,64,105,81.9,8.5,99.0,+19.0
81,,Alfred BlueA. Blue JAC,10,48,102,82.7,8.9,82.0,+1.0
82,,Josh AdamsJ. Adams PHI,10,38,153,79.0,15.3,118.0,+36.0
83,,Ty MontgomeryT. Montgomery NYJ,4,61,109,85.7,8.4,78.0,-5.0
84,,Wendell SmallwoodW. Smallwood PHI,10,71,155,83.9,11.2,106.0,+22.0
85,,Wayne GallmanW. Gallman NYG,11,70,113,86.6,7.7,92.0,+7.0
86,,John KellyJ. Kelly LAR,9,74,123,90.3,10.6,239.0,+153.0
87,,Darwin ThompsonD. Thompson KC,12,26,132,80.5,17.3,62.0,-25.0
88,,Cameron Artis-PayneC. Artis-Payne CAR,7,72,118,93.8,9.1,97.0,+9.0
89,,Dexter WilliamsD. Williams GB,11,56,114,83.4,13.9,85.0,-4.0
90,,Tony PollardT. Pollard DAL,8,47,110,75.8,13.7,68.0,-22.0
91,,Rod SmithR. Smith NYG,11,68,126,91.8,8.8,133.0,+42.0
92,,Mike WeberM. Weber DAL,8,61,128,91.6,13.4,86.0,-6.0
93,,Ameer AbdullahA. Abdullah MIN,12,82,131,95.4,11.4,250.0,+157.0
94,,Zach ZennerZ. Zenner DET,5,71,135,98.4,10.1,122.0,+28.0
95,,Bilal PowellB. Powell NYJ,4,66,130,93.1,13.6,95.0,0.0
96,,Myles GaskinM. Gaskin MIA,5,46,112,90.1,11.3,93.0,-3.0
Tier 9,
97,,Trenton CannonT. Cannon NYJ,4,70,129,96.9,10.9,135.0,+38.0
98,,Jeff WilsonJ. Wilson SF,4,81,146,97.1,13.9,144.0,+46.0
99,,Trayveon WilliamsT. Williams CIN,9,44,119,92.8,11.1,80.0,-19.0
100,,Jay AjayiJ. Ajayi FA,,36,135,86.0,17.0,71.0,-29.0
101,,Bruce AndersonB. Anderson TB,7,48,114,81.0,16.0,83.0,-18.0
102,,Marcus MurphyM. Murphy BUF,6,77,144,103.8,12.9,187.0,+85.0
103,,Bryce LoveB. Love WAS,10,57,142,93.5,17.9,76.0,-27.0
104,,Mark WaltonM. Walton MIA,5,82,132,101.3,11.5,257.0,+153.0
105,,Qadree OllisonQ. Ollison ATL,9,55,115,88.7,14.0,89.0,-16.0
106,,Rodney AndersonR. Anderson CIN,9,69,113,95.0,12.3,81.0,-25.0
107,,Jordan ScarlettJ. Scarlett CAR,7,57,132,95.7,16.8,100.0,-7.0
108,,Javorius AllenJ. Allen NO,9,62,148,97.9,17.6,124.0,+16.0
109,,Travis HomerT. Homer SEA,11,62,131,97.8,16.4,131.0,+22.0
110,,Andre EllingtonA. Ellington TB,7,64,112,92.5,13.1,254.0,+144.0
111,,Boston ScottB. Scott PHI,10,75,139,107.5,14.3,258.0,+147.0
112,,Darrel WilliamsD. Williams KC,12,76,124,105.3,12.5,252.0,+140.0
113,,LeGarrette BlountL. Blount FA,,87,137,103.9,15.0,113.0,0.0
114,,Mike BooneM. Boone MIN,12,80,126,101.9,11.3,253.0,+139.0
115,,Darren SprolesD. Sproles PHI,10,67,135,99.6,17.6,91.0,-24.0
116,,Brian HillB. Hill ATL,9,70,145,104.2,18.9,127.0,+11.0
Tier 10,
117,,Kyle JuszczykK. Juszczyk SF,4,71,120,99.9,11.3,98.0,-19.0
118,,Karan HigdonK. Higdon HOU,10,51,136,108.9,11.8,136.0,+18.0
119,,Chris Warren IIIC. Warren FA,,82,122,102.5,13.7,245.0,+126.0
120,,Alex CollinsA. Collins FA,,64,162,103.4,24.2,103.0,-17.0
121,,Elijah HolyfieldE. Holyfield CAR,7,41,136,105.7,21.9,90.0,-31.0
122,,DeAndre WashingtonD. Washington OAK,6,94,133,111.2,11.0,181.0,+59.0
123,,Cordarrelle PattersonC. Patterson CHI,6,67,85,79.4,3.8,,
124,,J.D. McKissicJ. McKissic SEA,11,67,140,108.6,18.9,256.0,+132.0
125,,Raheem MostertR. Mostert SF,4,91,128,109.6,13.2,202.0,+77.0
126,,Alex BarnesA. Barnes TEN,11,80,137,109.9,17.3,126.0,0.0
127,,Devine OzigboD. Ozigbo NO,9,94,139,111.8,13.8,96.0,-31.0
128,,T.J. LoganT. Logan ARI,12,86,133,116.2,11.1,237.0,+109.0
129,,Corey GrantC. Grant GB,11,91,141,117.7,16.2,209.0,+80.0
130,,Tavon AustinT. Austin DAL,8,76,150,103.2,23.7,,
131,,Chris IvoryC. Ivory FA,,91,136,110.4,17.3,141.0,+10.0
132,,Benny CunninghamB. Cunningham JAC,10,76,145,115.9,14.9,255.0,+123.0
133,,Darius JacksonD. Jackson DAL,8,74,115,99.8,15.5,108.0,-25.0
134,,Dwayne WashingtonD. Washington NO,9,102,126,115.9,8.1,153.0,+19.0
135,,James DevelinJ. Develin NE,10,90,113,104.6,7.8,102.0,-33.0
136,,C.J. ProsiseC. Prosise SEA,11,87,148,118.4,15.9,215.0,+79.0
137,,Samaje PerineS. Perine WAS,10,79,138,113.8,17.3,242.0,+105.0
138,,Elijhaa PennyE. Penny NYG,11,91,142,116.2,17.9,241.0,+103.0
139,,Jeremy HillJ. Hill FA,,95,140,116.3,18.1,129.0,-10.0
140,,Jacquizz RodgersJ. Rodgers FA,,73,141,117.8,18.6,234.0,+94.0
141,,Alfred MorrisA. Morris FA,,69,151,124.0,19.5,230.0,+89.0
142,,Kenneth FarrowK. Farrow MIA,5,90,139,113.2,16.6,224.0,+82.0
143,,Dontrell HilliardD. Hilliard CLE,7,99,140,121.7,14.0,117.0,-26.0
144,,Ty JohnsonT. Johnson DET,5,85,136,107.0,20.1,111.0,-33.0
145,,Roc ThomasR. Thomas FA,,115,133,122.2,5.8,189.0,+44.0
146,,Andy JanovichA. Janovich DEN,10,94,124,110.8,12.0,120.0,-26.0
147,,James WilliamsJ. Williams FA,,82,140,119.0,20.2,130.0,-17.0
148,,Paul PerkinsP. Perkins NYG,11,65,157,125.7,18.9,249.0,+101.0
149,,Kenjon BarnerK. Barner ATL,9,96,149,121.4,18.6,243.0,+94.0
150,,David FluellenD. Fluellen TEN,11,100,131,114.5,11.3,246.0,+96.0
151,,CJ HamC. Ham MIN,12,85,114,102.7,12.7,203.0,+52.0
152,,Zach LineZ. Line NO,9,98,108,103.3,4.1,183.0,+31.0
Tier 11,
153,,Anthony ShermanA. Sherman KC,12,101,115,109.7,6.2,116.0,-37.0
154,,Damarea CrockettD. Crockett HOU,10,100,144,122.8,16.1,,
155,,Shaun WilsonS. Wilson WAS,10,120,130,123.3,4.0,219.0,+64.0
156,,Patrick DiMarcoP. DiMarco BUF,6,104,132,117.7,11.4,251.0,+95.0
157,,Detrez NewsomeD. Newsome LAC,12,112,145,126.3,12.0,166.0,+9.0
158,,Jamize OlawaleJ. Olawale DAL,8,116,122,118.7,2.5,199.0,+41.0
159,,Taquan MizzellT. Mizzell CHI,6,121,154,133.0,11.7,,
160,,Alex ArmahA. Armah CAR,7,117,143,128.3,10.1,247.0,+87.0
161,,Ricky OrtizR. Ortiz ATL,9,96,120,108.0,12.0,197.0,+36.0
162,,Kapri BibbsK. Bibbs FA,,78,141,109.5,31.5,139.0,-23.0
163,,Keith SmithK. Smith OAK,6,113,113,113.0,0.0,244.0,+81.0
164,,Jonathan WilliamsJ. Williams IND,6,121,136,129.0,6.2,204.0,+40.0
165,,Charcandrick WestC. West FA,,105,143,129.3,17.2,138.0,-27.0
166,,Jeremy McNicholsJ. McNichols TEN,11,117,124,120.5,3.5,217.0,+51.0
167,,Thomas RawlsT. Rawls JAC,10,117,134,125.5,8.5,164.0,-3.0
168,,Kerrith WhyteK. Whyte CHI,6,120,131,125.5,5.5,,
169,,Justin DavisJ. Davis LAR,9,127,143,134.3,6.6,228.0,+59.0
170,,Roosevelt NixR. Nix PIT,7,111,144,127.5,16.5,248.0,+78.0
171,,Elijah HoodE. Hood CAR,7,121,139,130.0,9.0,146.0,-25.0
172,,Brandon BoldenB. Bolden NE,10,126,156,141.3,12.3,156.0,-16.0
173,,De'Angelo HendersonD. Henderson MIN,12,130,141,135.5,5.5,182.0,+9.0
174,,Trey EdmundsT. Edmunds PIT,7,122,152,137.0,15.0,227.0,+53.0
175,,Derek WattD. Watt LAC,12,127,147,137.0,10.0,238.0,+63.0
176,,De'Lance TurnerD. Turner BAL,8,127,150,138.5,11.5,212.0,+36.0
177,,Byron MarshallB. Marshall WAS,10,129,151,140.0,11.0,240.0,+63.0
178,,Troymaine PopeT. Pope LAC,12,141,143,142.0,1.0,223.0,+45.0
179,,Quinton FlowersQ. Flowers CIN,9,134,158,146.0,12.0,226.0,+47.0
