Rank,WSID,Overall (Team),Pos,Bye,Best,Worst,Avg,Std Dev,ADP,vs. ADP,Notes
&nbsp,&nbsp,&nbsp,&nbsp,&nbsp,&nbsp,&nbsp,&nbsp,&nbsp,&nbsp,&nbsp
Tier 1,
1,,Saquon BarkleyS. Barkley NYG,RB1,11,1,4,1.4,0.6,1.0,0.0
2,,Ezekiel ElliottE. Elliott DAL,RB2,8,1,8,2.3,1.1,4.0,+2.0
3,,Christian McCaffreyC. McCaffrey CAR,RB3,7,1,6,3.1,0.8,2.0,-1.0
4,,Alvin KamaraA. Kamara NO,RB4,9,1,14,3.7,1.3,3.0,-1.0
5,,DeAndre HopkinsD. Hopkins HOU,WR1,10,5,16,6.1,1.7,5.0,0.0
Tier 2,
6,,Davante AdamsD. Adams GB,WR2,11,5,16,8.1,2.8,7.0,+1.0
7,,Melvin GordonM. Gordon LAC,RB5,12,4,19,8.2,2.9,6.0,-1.0
8,,Julio JonesJ. Jones ATL,WR3,9,5,27,9.4,2.7,16.0,+8.0
9,,David JohnsonD. Johnson ARI,RB6,12,3,42,9.9,4.7,8.0,-1.0
10,,Michael ThomasM. Thomas NO,WR4,9,7,28,11.2,3.7,10.0,0.0
11,,Travis KelceT. Kelce KC,TE1,12,12,17,12.3,0.9,17.0,+6.0
12,,Odell Beckham Jr.O. Beckham CLE,WR5,7,5,30,13.5,4.9,15.0,+3.0
13,,Le'Veon BellL. Bell NYJ,RB7,4,4,40,13.8,4.0,9.0,-4.0
14,,James ConnerJ. Conner PIT,RB8,7,5,40,14.5,4.7,11.0,-3.0
15,,JuJu Smith-SchusterJ. Smith-Schuster PIT,WR6,7,5,30,14.8,4.7,14.0,-1.0
16,,Joe MixonJ. Mixon CIN,RB9,9,8,76,16.5,6.5,12.0,-4.0
Tier 3,
17,,Todd GurleyT. Gurley LAR,RB10,9,1,60,18.8,10.7,13.0,-4.0
18,,Dalvin CookD. Cook MIN,RB11,12,8,46,19.5,5.6,19.0,+1.0
19,,George KittleG. Kittle SF,TE2,4,15,53,20.3,5.8,26.0,+7.0
20,,Antonio BrownA. Brown OAK,WR7,6,13,32,20.5,4.4,20.0,0.0
21,,Zach ErtzZ. Ertz PHI,TE3,10,15,63,20.7,8.7,23.0,+2.0
22,,Nick ChubbN. Chubb CLE,RB12,7,11,66,23.7,9.7,21.0,-1.0
23,,Mike EvansM. Evans TB,WR8,7,15,62,24.3,4.3,18.0,-5.0
24,,Keenan AllenK. Allen LAC,WR9,12,16,36,26.8,3.5,24.0,0.0
25,,T.Y. HiltonT. Hilton IND,WR10,6,10,64,28.0,3.8,27.0,+2.0
26,,A.J. GreenA. Green CIN,WR11,9,16,58,28.7,3.8,32.0,+6.0
27,,Amari CooperA. Cooper DAL,WR12,8,21,41,29.7,3.2,29.0,+2.0
28,,Leonard FournetteL. Fournette JAC,RB13,10,18,59,30.6,9.7,30.0,+2.0
29,,Adam ThielenA. Thielen MIN,WR13,12,20,39,31.0,3.4,22.0,-7.0
30,,Stefon DiggsS. Diggs MIN,WR14,12,25,37,32.4,2.4,31.0,+1.0
31,,Damien WilliamsD. Williams KC,RB14,12,11,163,33.6,15.9,28.0,-3.0
32,,Patrick MahomesP. Mahomes KC,QB1,12,24,87,34.9,14.0,25.0,-7.0
33,,Robert WoodsR. Woods LAR,WR15,9,28,65,36.0,3.9,43.0,+10.0
34,,Julian EdelmanJ. Edelman NE,WR16,10,23,65,36.2,7.1,42.0,+8.0
35,,Brandin CooksB. Cooks LAR,WR17,9,29,55,36.7,3.7,39.0,+4.0
36,,Marlon MackM. Mack IND,RB15,6,18,84,37.1,12.0,34.0,-2.0
37,,Kenny GolladayK. Golladay DET,WR18,5,20,90,38.1,4.8,40.0,+3.0
38,,Aaron JonesA. Jones GB,RB16,11,4,80,38.8,12.9,37.0,-1.0
Tier 4,
39,,Devonta FreemanD. Freeman ATL,RB17,9,18,66,41.8,10.7,35.0,-4.0
40,,Cooper KuppC. Kupp LAR,WR19,9,33,79,42.4,6.6,47.0,+7.0
41,,Chris GodwinC. Godwin TB,WR20,7,28,96,44.0,9.9,51.0,+10.0
42,,Alshon JefferyA. Jeffery PHI,WR21,10,34,71,46.0,7.4,71.0,+29.0
43,,Derrick HenryD. Henry TEN,RB18,11,23,76,46.5,9.5,38.0,-5.0
44,,Tyler LockettT. Lockett SEA,WR22,11,32,75,47.7,9.8,54.0,+10.0
45,,Andrew LuckA. Luck IND,QB2,6,24,80,47.9,10.9,44.0,-1.0
46,,Kerryon JohnsonK. Johnson DET,RB19,5,23,112,48.3,11.7,36.0,-10.0
47,,Deshaun WatsonD. Watson HOU,QB3,10,24,77,49.8,9.8,56.0,+9.0
48,,Aaron RodgersA. Rodgers GB,QB4,11,24,74,50.6,7.0,52.0,+4.0
49,,Sammy WatkinsS. Watkins KC,WR23,12,16,101,51.1,12.6,55.0,+6.0
50,,D.J. MooreD. Moore CAR,WR24,7,37,90,51.6,9.7,58.0,+8.0
"50

                                              googletag.cmd.push(function() { googletag.display('div-gpt-ad-1404326895972-0'); });"
51,,Phillip LindsayP. Lindsay DEN,RB20,10,21,83,52.3,10.8,45.0,-6.0
52,,Allen RobinsonA. Robinson CHI,WR25,6,34,96,53.2,14.5,74.0,+22.0
Tier 5,
53,,Calvin RidleyC. Ridley ATL,WR26,9,32,102,55.6,9.8,49.0,-4.0
54,,Sony MichelS. Michel NE,RB21,10,19,112,57.4,14.6,41.0,-13.0
55,,Kenyan DrakeK. Drake MIA,RB22,5,18,132,57.6,19.8,53.0,-2.0
56,,O.J. HowardO. Howard TB,TE4,7,15,136,58.2,10.8,57.0,+1.0
57,,Jarvis LandryJ. Landry CLE,WR27,7,32,113,58.9,15.2,63.0,+6.0
58,,Josh JacobsJ. Jacobs OAK,RB23,6,23,243,60.0,39.9,33.0,-25.0
59,,Mark IngramM. Ingram BAL,RB24,8,19,93,61.9,12.6,48.0,-11.0
60,,Tyler BoydT. Boyd CIN,WR28,9,35,101,61.9,14.2,64.0,+4.0
61,,Tarik CohenT. Cohen CHI,RB25,6,31,100,62.4,11.1,50.0,-11.0
62,,Chris CarsonC. Carson SEA,RB26,11,27,119,63.3,16.4,61.0,-1.0
63,,Hunter HenryH. Henry LAC,TE5,12,15,94,63.6,10.5,67.0,+4.0
64,,James WhiteJ. White NE,RB27,10,23,123,64.6,18.8,60.0,-4.0
65,,Robby AndersonR. Anderson NYJ,WR29,4,38,111,65.4,14.1,76.0,+11.0
66,,Corey DavisC. Davis TEN,WR30,11,36,129,65.9,14.8,81.0,+15.0
67,,Baker MayfieldB. Mayfield CLE,QB5,7,24,131,67.6,15.3,68.0,+1.0
68,,Evan EngramE. Engram NYG,TE6,11,45,108,68.0,11.1,62.0,-6.0
69,,Mike WilliamsM. Williams LAC,WR31,12,39,90,68.6,9.2,66.0,-3.0
Tier 6,
70,,Marvin JonesM. Jones DET,WR32,5,58,102,75.1,8.8,100.0,+30.0
71,,Lamar MillerL. Miller HOU,RB28,10,57,161,75.2,12.3,75.0,+4.0
72,,Will FullerW. Fuller HOU,WR33,10,41,102,77.1,11.3,80.0,+8.0
73,,Russell WilsonR. Wilson SEA,QB6,11,24,169,77.3,22.1,77.0,+4.0
74,,David MontgomeryD. Montgomery CHI,RB29,6,18,272,77.9,44.8,46.0,-28.0
75,,Eric EbronE. Ebron IND,TE7,6,63,127,79.9,13.6,69.0,-6.0
76,,Matt RyanM. Ryan ATL,QB7,9,53,122,80.2,17.4,73.0,-3.0
77,,Dante PettisD. Pettis SF,WR34,4,55,184,82.2,15.1,83.0,+6.0
78,,Sterling ShepardS. Shepard NYG,WR35,11,48,157,82.4,15.8,89.0,+11.0
79,,Golden TateG. Tate NYG,WR36,11,47,129,82.5,14.3,97.0,+18.0
80,,Derrius GuiceD. Guice WAS,RB30,10,19,143,82.6,18.1,59.0,-21.0
81,,Jared CookJ. Cook NO,TE8,9,22,136,83.6,18.5,79.0,-2.0
82,,Tevin ColemanT. Coleman SF,RB31,4,56,188,84.5,16.6,72.0,-10.0
83,,Cam NewtonC. Newton CAR,QB8,7,47,131,86.3,17.3,93.0,+10.0
84,,Christian KirkC. Kirk ARI,WR37,12,57,223,86.8,14.2,86.0,+2.0
85,,Drew BreesD. Brees NO,QB9,9,54,162,88.2,19.8,87.0,+2.0
86,,Dede WestbrookD. Westbrook JAC,WR38,10,36,190,89.6,21.3,111.0,+25.0
87,,Courtland SuttonC. Sutton DEN,WR39,10,62,137,90.1,11.4,94.0,+7.0
88,,David NjokuD. Njoku CLE,TE9,7,53,139,91.3,17.4,82.0,-6.0
89,,Carson WentzC. Wentz PHI,QB10,10,56,125,93.9,16.4,88.0,-1.0
90,,Larry FitzgeraldL. Fitzgerald ARI,WR40,12,43,215,95.1,24.9,102.0,+12.0
91,,Latavius MurrayL. Murray NO,RB32,9,39,177,95.5,19.0,96.0,+5.0
92,,Jameis WinstonJ. Winston TB,QB11,7,50,125,97.3,14.1,105.0,+13.0
93,,Rashaad PennyR. Penny SEA,RB33,11,52,143,97.6,17.3,78.0,-15.0
94,,Keke CouteeK. Coutee HOU,WR41,10,65,196,97.7,18.8,114.0,+20.0
95,,LeSean McCoyL. McCoy BUF,RB34,6,76,143,99.8,14.9,104.0,+9.0
96,,Curtis SamuelC. Samuel CAR,WR42,7,55,198,101.8,19.0,122.0,+26.0
97,,Jared GoffJ. Goff LAR,QB12,9,68,155,102.8,16.9,91.0,-6.0
98,,Jerick McKinnonJ. McKinnon SF,RB35,4,59,190,102.8,24.9,101.0,+3.0
Tier 7,
99,,Vance McDonaldV. McDonald PIT,TE10,7,64,161,109.4,22.0,95.0,-4.0
100,,Delanie WalkerD. Walker TEN,TE11,11,69,246,110.8,28.9,136.0,+36.0
101,,Geronimo AllisonG. Allison GB,WR43,11,58,243,112.2,28.9,112.0,+11.0
102,,Royce FreemanR. Freeman DEN,RB36,10,66,149,112.4,12.9,92.0,-10.0
103,,Anthony MillerA. Miller CHI,WR44,6,75,220,112.4,29.5,138.0,+35.0
104,,Ben RoethlisbergerB. Roethlisberger PIT,QB13,7,77,161,113.9,17.9,109.0,+5.0
105,,Jordan HowardJ. Howard PHI,RB37,10,66,193,114.3,25.1,84.0,-21.0
106,,Dion LewisD. Lewis TEN,RB38,11,66,181,115.0,24.1,124.0,+18.0
107,,Dak PrescottD. Prescott DAL,QB14,8,77,156,115.8,15.7,123.0,+16.0
108,,Austin HooperA. Hooper ATL,TE12,9,69,159,116.4,19.5,107.0,-1.0
109,,Trey BurtonT. Burton CHI,TE13,6,82,175,119.6,16.0,135.0,+26.0
110,,Philip RiversP. Rivers LAC,QB15,12,91,168,119.6,15.7,115.0,+5.0
111,,Ronald Jones IIR. Jones TB,RB39,7,71,235,120.8,29.0,98.0,-13.0
112,,Lamar JacksonL. Jackson BAL,QB16,8,68,186,121.3,24.0,132.0,+20.0
113,,Nyheim HinesN. Hines IND,RB40,6,60,245,121.7,28.2,119.0,+6.0
114,,Michael GallupM. Gallup DAL,WR45,8,86,210,122.7,28.5,184.0,+70.0
115,,Kyler MurrayK. Murray ARI,QB17,12,56,202,119.3,32.7,99.0,-16.0
116,,Chris Herndon IVC. Herndon NYJ,TE14,4,69,153,124.7,16.7,137.0,+21.0
117,,N'Keal HarryN. Harry NE,WR46,10,33,270,119.5,45.6,90.0,-27.0
118,,DeSean JacksonD. Jackson PHI,WR47,10,88,242,126.0,23.7,142.0,+24.0
119,,Austin EkelerA. Ekeler LAC,RB41,12,80,185,126.8,22.8,110.0,-9.0
120,,Miles SandersM. Sanders PHI,RB42,10,60,289,106.0,45.8,70.0,-50.0
121,,Mitch TrubiskyM. Trubisky CHI,QB18,6,68,184,128.6,17.7,128.0,+7.0
122,,Jack DoyleJ. Doyle IND,TE15,6,72,236,129.8,30.8,160.0,+38.0
123,,Matt BreidaM. Breida SF,RB43,4,66,217,131.0,26.4,147.0,+24.0
124,,DaeSean HamiltonD. Hamilton DEN,WR48,10,58,242,131.2,33.9,156.0,+32.0
125,,Josh AllenJ. Allen BUF,QB19,6,68,167,135.4,21.7,134.0,+9.0
126,,John BrownJ. Brown BUF,WR49,6,45,220,135.6,26.8,194.0,+68.0
127,,Emmanuel SandersE. Sanders DEN,WR50,10,67,214,131.6,38.7,113.0,-14.0
128,,Devin FunchessD. Funchess IND,WR51,6,81,229,137.3,31.1,143.0,+15.0
129,,Kenny StillsK. Stills MIA,WR52,5,65,261,137.4,32.7,175.0,+46.0
130,,Ito SmithI. Smith ATL,RB44,9,80,261,137.8,29.3,118.0,-12.0
131,,Jordan ReedJ. Reed WAS,TE16,10,94,236,138.1,20.6,183.0,+52.0
Tier 8,
132,,James WashingtonJ. Washington PIT,WR53,7,62,267,140.1,47.3,106.0,-26.0
133,,Tom BradyT. Brady NE,QB20,10,103,177,141.9,17.3,127.0,-6.0
134,,Robert FosterR. Foster BUF,WR54,6,55,261,142.7,40.0,168.0,+34.0
135,,Greg OlsenG. Olsen CAR,TE17,7,94,257,144.2,23.9,157.0,+22.0
136,,Duke JohnsonD. Johnson CLE,RB45,7,80,199,141.6,23.6,186.0,+50.0
137,,Darrell HendersonD. Henderson LAR,RB46,9,46,309,132.3,51.4,139.0,+2.0
138,,D'Onta ForemanD. Foreman HOU,RB47,10,98,238,147.4,28.3,120.0,-18.0
139,,Kyle RudolphK. Rudolph MIN,TE18,12,106,258,147.5,23.4,133.0,-6.0
140,,Jimmy GaroppoloJ. Garoppolo SF,QB21,4,94,197,148.1,19.4,130.0,-10.0
141,,Carlos HydeC. Hyde KC,RB48,12,83,245,149.4,37.7,125.0,-16.0
142,,Kirk CousinsK. Cousins MIN,QB22,12,103,200,144.6,18.9,116.0,-26.0
143,,Jimmy GrahamJ. Graham GB,TE19,11,104,255,150.8,28.8,150.0,+7.0
144,,Marquez Valdes-ScantlingM. Valdes-Scantling GB,WR55,11,65,270,155.6,40.9,149.0,+5.0
145,,Tyrell WilliamsT. Williams OAK,WR56,6,49,240,155.8,37.7,148.0,+3.0
146,,Jamison CrowderJ. Crowder NYJ,WR57,4,97,258,147.4,31.4,201.0,+55.0
147,,Peyton BarberP. Barber TB,RB49,7,76,329,159.0,48.8,129.0,-18.0
148,,Adrian PetersonA. Peterson WAS,RB50,10,85,256,156.4,35.7,146.0,-2.0
149,,Kareem HuntK. Hunt CLE,RB51,7,85,235,154.8,32.4,85.0,-64.0
150,,Marquise GoodwinM. Goodwin SF,WR58,4,107,268,161.3,41.8,196.0,+46.0
151,,Donte MoncriefD. Moncrief PIT,WR59,7,58,262,167.2,35.6,171.0,+20.0
152,,Chris ThompsonC. Thompson WAS,RB52,10,92,257,158.3,24.1,173.0,+21.0
153,,Adam HumphriesA. Humphries TEN,WR60,11,82,319,163.8,47.2,208.0,+55.0
154,,Jamaal WilliamsJ. Williams GB,RB53,11,110,241,166.7,25.8,170.0,+16.0
155,,D.K. MetcalfD. Metcalf SEA,WR61,11,64,325,162.8,49.4,108.0,-47.0
156,,Kalen BallageK. Ballage MIA,RB54,5,108,264,174.7,29.3,152.0,-4.0
157,,Mohamed SanuM. Sanu ATL,WR62,9,107,270,171.0,30.8,215.0,+58.0
158,,Matthew StaffordM. Stafford DET,QB23,5,116,202,167.2,16.8,151.0,-7.0
159,,Derek CarrD. Carr OAK,QB24,6,118,241,172.4,14.7,162.0,+3.0
160,,Sam DarnoldS. Darnold NYJ,QB25,4,116,241,168.0,15.3,154.0,-6.0
161,,Quincy EnunwaQ. Enunwa NYJ,WR63,4,109,247,175.6,28.0,242.0,+81.0
162,,Marqise LeeM. Lee JAC,WR64,10,86,262,176.8,32.9,226.0,+64.0
163,,Devante ParkerD. Parker MIA,WR65,5,102,228,176.9,26.2,169.0,+6.0
164,,Andy DaltonA. Dalton CIN,QB26,9,125,241,178.8,20.5,188.0,+24.0
165,,Mark AndrewsM. Andrews BAL,TE20,8,92,267,178.9,34.8,199.0,+34.0
166,,Chicago (CHI)CHI DST,DST1,6,140,248,145.0,22.0,159.0,-7.0
Tier 9,
167,,Parris CampbellP. Campbell IND,WR66,6,58,262,167.4,39.7,126.0,-41.0
168,,Dallas GoedertD. Goedert PHI,TE21,10,121,255,172.6,34.6,178.0,+10.0
169,,C.J. AndersonC. Anderson DET,RB55,5,126,257,177.6,27.8,181.0,+12.0
170,,Albert WilsonA. Wilson MIA,WR67,5,74,285,179.5,41.4,213.0,+43.0
171,,Mecole HardmanM. Hardman KC,WR68,12,58,313,167.0,47.6,103.0,-68.0
172,,Mike GesickiM. Gesicki MIA,TE22,5,121,335,184.6,44.4,212.0,+40.0
173,,Tre'Quan SmithT. Smith NO,WR69,9,109,261,188.7,27.4,165.0,-8.0
174,,Mike DavisM. Davis CHI,RB56,6,119,283,190.4,32.2,187.0,+13.0
175,,Jacksonville (JAC)JAC DST,DST2,10,145,249,155.2,18.9,177.0,+2.0
176,,T.J. HockensonT. Hockenson DET,TE23,5,92,319,170.6,44.0,121.0,-55.0
177,,Marcus MariotaM. Mariota TEN,QB27,11,125,254,191.5,21.6,197.0,+20.0
178,,Noah FantN. Fant DEN,TE24,10,78,299,180.1,46.9,140.0,-38.0
179,,Los Angeles (LAR)LAR DST,DST3,9,145,257,161.6,19.8,176.0,-3.0
180,,Jalen RichardJ. Richard OAK,RB57,6,89,283,185.9,45.3,204.0,+24.0
181,,Taylor GabrielT. Gabriel CHI,WR70,6,147,285,194.9,24.5,263.0,+82.0
182,,Damien HarrisD. Harris NE,RB58,10,80,317,182.8,55.5,141.0,-41.0
183,,David MooreD. Moore SEA,WR71,11,124,263,201.9,26.3,255.0,+72.0
184,,Baltimore (BAL)BAL DST,DST4,8,140,251,166.8,27.7,182.0,-2.0
185,,Elijah McGuireE. McGuire NYJ,RB59,4,98,289,192.3,41.3,249.0,+64.0
186,,Minnesota (MIN)MIN DST,DST5,12,152,256,169.1,20.4,189.0,+3.0
187,,Antonio CallawayA. Callaway CLE,WR72,7,128,290,200.9,30.8,221.0,+34.0
188,,Los Angeles (LAC)LAC DST,DST6,12,145,259,170.0,20.2,180.0,-8.0
189,,A.J. BrownA. Brown TEN,WR73,11,64,270,190.3,37.8,205.0,+16.0
190,,Zay JonesZ. Jones BUF,WR74,6,99,295,202.8,41.9,190.0,0.0
191,,Kenneth DixonK. Dixon BAL,RB60,8,93,347,190.7,53.2,273.0,+82.0
192,,Giovani BernardG. Bernard CIN,RB61,9,132,310,191.0,36.3,235.0,+43.0
193,,Jaylen SamuelsJ. Samuels PIT,RB62,7,85,272,184.2,40.3,117.0,-76.0
194,,Greg ZuerleinG. Zuerlein LAR,K1,9,171,249,175.0,14.6,144.0,-50.0
195,,Houston (HOU)HOU DST,DST7,10,152,279,175.2,24.7,192.0,-3.0
196,,Deebo SamuelD. Samuel SF,WR75,4,111,302,185.1,40.2,164.0,-32.0
197,,Rex BurkheadR. Burkhead NE,RB63,10,115,321,180.5,43.0,262.0,+65.0
198,,Nick FolesN. Foles JAC,QB28,10,160,313,207.1,27.1,203.0,+5.0
199,,Marquise BrownM. Brown BAL,WR76,8,64,290,187.7,48.3,153.0,-46.0
200,,Tyreek HillT. Hill KC,WR77,12,20,322,158.4,91.8,65.0,-135.0
201,,Gerald EverettG. Everett LAR,TE25,9,153,282,202.9,32.4,247.0,+46.0
202,,Theo RiddickT. Riddick DET,RB64,5,126,334,202.9,42.9,243.0,+41.0
203,,Tyler EifertT. Eifert CIN,TE26,9,133,299,208.3,39.4,200.0,-3.0
204,,Cleveland (CLE)CLE DST,DST8,7,164,260,187.3,22.2,195.0,-9.0
205,,Devin SingletaryD. Singletary BUF,RB65,6,76,356,196.6,54.5,131.0,-74.0
206,,Randall CobbR. Cobb DAL,WR78,8,148,298,214.1,24.1,241.0,+35.0
207,,Justin TuckerJ. Tucker BAL,K2,8,171,252,186.5,17.1,158.0,-49.0
208,,Harrison ButkerH. Butker KC,K3,12,179,264,188.0,13.9,161.0,-47.0
209,,New Orleans (NO)NO DST,DST9,9,152,261,193.0,18.8,209.0,0.0
210,,Stephen GostkowskiS. Gostkowski NE,K4,10,171,263,193.6,14.8,172.0,-38.0
211,,Justice HillJ. Hill BAL,RB66,8,91,393,216.4,64.3,145.0,-66.0
212,,John RossJ. Ross CIN,WR79,9,124,346,213.1,39.7,252.0,+40.0
Tier 10,
213,,Gus EdwardsG. Edwards BAL,RB67,8,112,316,211.5,46.8,224.0,+11.0
214,,Nelson AgholorN. Agholor PHI,WR80,10,156,304,224.0,22.8,231.0,+17.0
215,,Denver (DEN)DEN DST,DST10,10,165,262,204.3,17.1,207.0,-8.0
216,,Ted GinnT. Ginn NO,WR81,9,113,350,228.9,34.2,257.0,+41.0
217,,Andy IsabellaA. Isabella ARI,WR82,12,99,301,210.8,43.4,163.0,-54.0
218,,Josh DoctsonJ. Doctson WAS,WR83,10,124,304,223.8,28.4,271.0,+53.0
219,,Wil LutzW. Lutz NO,K5,9,183,265,204.1,14.5,167.0,-52.0
220,,D.J. CharkD. Chark JAC,WR84,10,73,271,228.0,25.9,239.0,+19.0
221,,Frank GoreF. Gore BUF,RB68,6,143,331,228.8,40.3,304.0,+83.0
222,,Chase EdmondsC. Edmonds ARI,RB69,12,156,280,225.3,29.6,238.0,+16.0
223,,New England (NE)NE DST,DST11,10,164,234,211.2,13.7,214.0,-9.0
224,,Paul RichardsonP. Richardson WAS,WR85,10,141,339,229.6,38.5,298.0,+74.0
225,,Buffalo (BUF)BUF DST,DST12,6,164,314,216.1,27.2,233.0,+8.0
226,,Cameron BrateC. Brate TB,TE27,7,163,349,235.7,39.7,268.0,+42.0
227,,Dallas (DAL)DAL DST,DST13,8,159,307,217.5,21.4,211.0,-16.0
228,,T.J. YeldonT. Yeldon BUF,RB70,6,134,310,218.2,36.5,210.0,-18.0
229,,Hayden HurstH. Hurst BAL,TE28,8,163,373,236.0,41.5,279.0,+50.0
230,,Willie SneadW. Snead BAL,WR86,8,137,301,236.4,26.4,325.0,+95.0
231,,Mason CrosbyM. Crosby GB,K6,11,212,266,223.0,11.9,193.0,-38.0
232,,Joe FlaccoJ. Flacco DEN,QB29,10,178,333,248.6,27.4,218.0,-14.0
233,,Pittsburgh (PIT)PIT DST,DST14,7,140,279,232.6,24.0,292.0,+59.0
234,,Equanimeous St. BrownE. St. GB,WR87,11,148,311,233.7,34.4,272.0,+38.0
235,,Jake ElliottJ. Elliott PHI,K7,10,204,268,226.8,8.4,185.0,-50.0
236,,Seattle (SEA)SEA DST,DST15,11,176,318,227.2,20.9,267.0,+31.0
237,,Philadelphia (PHI)PHI DST,DST16,10,164,266,228.0,15.1,220.0,-17.0
238,,Eli ManningE. Manning NYG,QB30,11,183,284,250.1,23.4,234.0,-4.0
239,,Ricky Seals-JonesR. Seals-Jones ARI,TE29,12,139,343,238.1,32.9,276.0,+37.0
240,,Brett MaherB. Maher DAL,K8,8,215,281,232.0,14.1,236.0,-4.0
241,,Ka'imi FairbairnK. Fairbairn HOU,K9,10,183,327,221.9,26.4,166.0,-75.0
242,,Robbie GouldR. Gould SF,K10,4,214,288,234.6,14.2,179.0,-63.0
243,,Demaryius ThomasD. Thomas NE,WR88,10,155,375,242.3,44.6,230.0,-13.0
244,,Matt PraterM. Prater DET,K11,5,204,309,235.4,21.8,244.0,0.0
245,,Tennessee (TEN)TEN DST,DST17,11,207,278,227.9,15.0,283.0,+38.0
246,,Alexander MattisonA. Mattison MIN,RB71,12,120,316,225.8,57.4,155.0,-91.0
247,,Malcolm BrownM. Brown LAR,RB72,9,143,388,242.4,47.1,246.0,-1.0
248,,Danny AmendolaD. Amendola DET,WR89,5,155,350,250.1,36.9,356.0,+108.0
249,,Trey QuinnT. Quinn WAS,WR90,10,107,379,225.1,52.5,253.0,+4.0
250,,Michael BadgleyM. Badgley LAC,K12,12,215,288,237.8,14.4,237.0,-13.0
251,,Josh ReynoldsJ. Reynolds LAR,WR91,9,196,384,251.7,43.5,331.0,+80.0
252,,Josh RosenJ. Rosen MIA,QB31,5,172,334,258.8,37.0,219.0,-33.0
253,,Adam VinatieriA. Vinatieri IND,K13,6,204,253,239.3,13.2,191.0,-62.0
254,,Indianapolis (IND)IND DST,DST18,6,159,307,244.4,28.1,223.0,-31.0
255,,Kansas City (KC)KC DST,DST19,12,159,326,250.6,35.4,251.0,-4.0
256,,Cole BeasleyC. Beasley BUF,WR92,6,147,301,254.6,35.3,260.0,+4.0
257,,Hakeem ButlerH. Butler ARI,WR93,12,73,349,242.8,48.2,216.0,-41.0
258,,Ian ThomasI. Thomas CAR,TE30,7,166,356,256.6,33.1,240.0,-18.0
259,,Dwayne HaskinsD. Haskins WAS,QB32,10,158,385,265.7,44.4,198.0,-61.0
260,,Justin JacksonJ. Jackson LAC,RB73,12,174,357,256.8,33.3,256.0,-4.0
261,,Keelan ColeK. Cole JAC,WR94,10,110,377,255.2,37.4,277.0,+16.0
262,,Ryquell ArmsteadR. Armstead JAC,RB74,10,115,358,244.8,55.0,174.0,-88.0
263,,Jason MyersJ. Myers SEA,K14,11,195,300,256.6,17.0,254.0,-9.0
264,,Carolina (CAR)CAR DST,DST20,7,185,345,259.5,25.2,305.0,+41.0
265,,Phillip DorsettP. Dorsett NE,WR95,10,151,333,265.8,32.0,265.0,0.0
266,,Aldrick RosasA. Rosas NYG,K15,11,194,330,259.7,23.7,317.0,+51.0
267,,Taywan TaylorT. Taylor TEN,WR96,11,203,369,259.8,43.5,397.0,+130.0
268,,Doug MartinD. Martin OAK,RB75,6,170,364,254.5,37.1,288.0,+20.0
Tier 11,
269,,Josh AdamsJ. Adams PHI,RB76,10,119,361,249.0,48.8,352.0,+83.0
270,,Nick VannettN. Vannett SEA,TE31,11,191,360,267.2,32.1,357.0,+87.0
271,,Graham GanoG. Gano CAR,K16,7,218,292,254.4,15.7,,
272,,Austin Seferian-JenkinsA. Seferian-Jenkins FA,TE32,,133,352,236.4,44.6,258.0,-14.0
273,,Chris HoganC. Hogan CAR,WR97,7,162,361,274.2,32.1,335.0,+62.0
274,,Green Bay (GB)GB DST,DST21,11,159,307,270.5,35.3,334.0,+60.0
275,,Jason WittenJ. Witten DAL,TE33,8,92,305,244.6,42.8,225.0,-50.0
276,,Chris BoswellC. Boswell PIT,K17,7,188,300,275.5,20.3,,
277,,Atlanta (ATL)ATL DST,DST22,9,189,355,267.0,27.3,300.0,+23.0
278,,Dan BaileyD. Bailey MIN,K18,12,233,301,270.3,15.7,245.0,-33.0
279,,Corey ClementC. Clement PHI,RB77,10,186,322,270.4,30.9,336.0,+57.0
280,,J.J. Arcega-WhitesideJ. Arcega-Whiteside PHI,WR98,10,160,345,260.8,43.4,222.0,-58.0
281,,Spencer WareS. Ware IND,RB78,6,134,386,257.3,34.5,319.0,+38.0
282,,Ryan SuccopR. Succop TEN,K19,11,190,302,277.0,17.7,287.0,+5.0
283,,Devontae BookerD. Booker DEN,RB79,10,170,362,270.8,41.6,340.0,+57.0
284,,Chris ConleyC. Conley JAC,WR99,10,212,375,278.5,35.2,377.0,+93.0
285,,Jordan WilkinsJ. Wilkins IND,RB80,6,193,374,272.5,36.8,363.0,+78.0
286,,Arizona (ARI)ARI DST,DST23,12,165,323,284.6,28.8,354.0,+68.0
287,,Breshad PerrimanB. Perriman TB,WR100,7,191,343,287.8,31.0,348.0,+61.0
288,,Jay AjayiJ. Ajayi FA,RB81,,100,321,237.4,58.6,282.0,-6.0
289,,Josh LamboJ. Lambo JAC,K20,10,181,344,288.8,25.6,,
290,,Charles ClayC. Clay ARI,TE34,12,221,381,283.9,32.8,330.0,+40.0
291,,Benny Snell Jr.B. Snell PIT,RB82,7,89,331,274.1,51.0,229.0,-62.0
292,,Washington (WAS)WAS DST,DST24,10,145,337,290.5,40.8,353.0,+61.0
293,,Brandon McManusB. McManus DEN,K21,10,192,339,288.0,16.1,,
294,,Ryan FitzpatrickR. Fitzpatrick MIA,QB33,5,158,397,291.0,40.7,232.0,-62.0
295,,Rashard HigginsR. Higgins CLE,WR101,7,225,379,288.4,23.5,379.0,+84.0
296,,Demarcus RobinsonD. Robinson KC,WR102,12,141,328,240.6,53.3,217.0,-79.0
297,,Ryan GrantR. Grant OAK,WR103,6,192,378,289.0,29.1,,
298,,Case KeenumC. Keenum WAS,QB34,10,241,335,303.8,26.7,309.0,+11.0
299,,Greg JosephG. Joseph CLE,K22,7,171,342,291.2,30.7,,
300,,Steven HauschkaS. Hauschka BUF,K23,6,183,331,300.6,20.2,,
301,,Detroit (DET)DET DST,DST25,5,164,342,303.7,25.8,347.0,+46.0
302,,Cameron MeredithC. Meredith NO,WR104,9,214,379,296.9,27.5,418.0,+116.0
303,,Alfred BlueA. Blue JAC,RB83,10,181,363,295.5,42.2,329.0,+26.0
304,,Cordarrelle PattersonC. Patterson CHI,WR105,6,196,380,296.4,36.8,,
305,,Jake ButtJ. Butt DEN,TE35,10,236,381,293.7,38.0,,
306,,New York (NYG)NYG DST,DST26,11,152,347,313.3,28.4,,
307,,Wendell SmallwoodW. Smallwood PHI,RB84,10,238,363,303.5,27.4,296.0,-11.0
308,,Ty MontgomeryT. Montgomery NYJ,RB85,4,182,382,303.8,36.3,327.0,+19.0
309,,Daniel CarlsonD. Carlson OAK,K24,6,179,332,309.9,23.4,,
310,,Wayne GallmanW. Gallman NYG,RB86,11,227,368,302.8,27.2,316.0,+6.0
311,,New York (NYJ)NYJ DST,DST27,4,175,318,289.1,30.3,280.0,-31.0
312,,Giorgio TavecchioG. Tavecchio ATL,K25,9,215,353,289.5,31.8,227.0,-85.0
313,,Cairo SantosC. Santos TB,K26,7,183,332,308.0,24.1,,
314,,Michael CrabtreeM. Crabtree FA,WR106,,208,325,287.9,25.4,,
315,,Jake KumerowJ. Kumerow GB,WR107,11,214,395,303.6,31.9,307.0,-8.0
316,,Jonnu SmithJ. Smith TEN,TE36,11,227,388,288.7,42.3,291.0,-25.0
317,,Keith KirkwoodK. Kirkwood NO,WR108,9,214,378,315.6,33.3,351.0,+34.0
318,,Matt BryantM. Bryant FA,K27,,215,309,269.6,31.0,,
319,,Deon CainD. Cain IND,WR109,6,167,378,307.8,33.4,281.0,-38.0
320,,J'Mon MooreJ. Moore GB,WR110,11,246,379,305.3,27.0,,
Tier 12,
321,,John KellyJ. Kelly LAR,RB87,9,217,393,307.7,27.7,404.0,+83.0
322,,Ryan TannehillR. Tannehill TEN,QB35,11,241,385,326.4,31.6,339.0,+17.0
323,,Miles BoykinM. Boykin BAL,WR111,8,148,385,277.6,66.0,294.0,-29.0
324,,Darwin ThompsonD. Thompson KC,RB88,12,118,368,258.6,76.4,206.0,-118.0
325,,Irv Smith Jr.I. Smith MIN,TE37,12,180,342,280.2,35.9,202.0,-123.0
326,,Diontae JohnsonD. Johnson PIT,WR112,7,169,387,281.6,56.2,259.0,-67.0
327,,Will DisslyW. Dissly SEA,TE38,11,180,354,274.0,57.5,295.0,-32.0
328,,Cameron Artis-PayneC. Artis-Payne CAR,RB89,7,237,382,321.9,30.9,360.0,+32.0
329,,San Francisco (SF)SF DST,DST28,4,201,347,309.0,26.4,293.0,-36.0
330,,Geoff SwaimG. Swaim JAC,TE39,10,153,373,273.5,66.4,346.0,+16.0
331,,Travis BenjaminT. Benjamin LAC,WR113,12,205,370,282.4,55.7,342.0,+11.0
332,,Luke WillsonL. Willson OAK,TE40,6,170,389,299.2,49.2,,
333,,Kendrick BourneK. Bourne SF,WR114,4,230,386,312.8,28.3,,
334,,Terry McLaurinT. McLaurin WAS,WR115,10,81,383,292.7,56.4,297.0,-37.0
335,,Bruce AndersonB. Anderson TB,RB90,7,126,374,244.8,71.0,278.0,-57.0
336,,Miami (MIA)MIA DST,DST29,5,140,355,316.3,41.8,312.0,-24.0
337,,C.J. UzomahC. Uzomah CIN,TE41,9,153,389,291.6,67.4,261.0,-76.0
338,,Mike WeberM. Weber DAL,RB91,8,190,382,315.6,32.3,337.0,-1.0
339,,Dustin HopkinsD. Hopkins WAS,K28,10,251,353,323.3,11.9,,
340,,Blake JarwinB. Jarwin DAL,TE42,8,232,356,290.2,33.9,306.0,-34.0
341,,Rod SmithR. Smith NYG,RB92,11,199,362,318.9,19.6,,
342,,Ameer AbdullahA. Abdullah MIN,RB93,12,277,393,325.4,21.9,,
343,,Jace SternbergerJ. Sternberger GB,TE43,11,184,345,271.0,39.5,264.0,-79.0
344,,Myles GaskinM. Gaskin MIA,RB94,5,123,339,301.6,43.5,324.0,-20.0
345,,Chester RogersC. Rogers IND,WR116,6,240,395,323.3,33.6,364.0,+19.0
346,,Dexter WilliamsD. Williams GB,RB95,11,217,392,303.0,54.4,266.0,-80.0
347,,Tampa Bay (TB)TB DST,DST30,7,145,347,324.3,15.2,371.0,+24.0
348,,Justin WatsonJ. Watson TB,WR117,7,197,384,278.6,58.8,359.0,+11.0
349,,Zach ZennerZ. Zenner DET,RB96,5,259,376,337.7,17.0,,
350,,Laquon TreadwellL. Treadwell MIN,WR118,12,234,365,320.1,25.2,384.0,+34.0
351,,Jeff WilsonJ. Wilson SF,RB97,4,281,364,323.8,16.5,,
352,,Trenton CannonT. Cannon NYJ,RB98,4,257,383,335.5,24.7,,
353,,Chandler CatanzaroC. Catanzaro NYJ,K29,4,233,339,313.8,19.4,,
354,,Jordan ThomasJ. Thomas HOU,TE44,10,191,371,297.5,52.4,343.0,-11.0
355,,Tony PollardT. Pollard DAL,RB99,8,188,386,285.2,64.0,269.0,-86.0
356,,Benjamin WatsonB. Watson NE,TE45,10,209,379,279.1,48.7,299.0,-57.0
357,,Vernon DavisV. Davis WAS,TE46,10,232,360,310.9,36.9,400.0,+43.0
358,,Trent TaylorT. Taylor SF,WR119,4,248,381,325.6,26.8,,
359,,Alex CollinsA. Collins FA,RB100,,195,340,305.6,29.8,373.0,+14.0
360,,Bilal PowellB. Powell NYJ,RB101,4,217,383,326.2,24.0,344.0,-16.0
361,,Darren WallerD. Waller OAK,TE47,6,161,394,283.1,59.7,248.0,-113.0
362,,Jalen HurdJ. Hurd SF,WR120,4,216,372,314.3,39.3,311.0,-51.0
363,,Trayveon WilliamsT. Williams CIN,RB102,9,224,357,318.3,34.4,326.0,-37.0
364,,Mark WaltonM. Walton MIA,RB103,5,287,387,335.3,22.1,,
365,,Rodney AndersonR. Anderson CIN,RB104,9,193,356,300.1,45.5,310.0,-55.0
366,,Tim PatrickT. Patrick DEN,WR121,10,223,395,319.7,34.8,383.0,+17.0
367,,Cody ParkeyC. Parkey FA,K30,,191,322,292.9,31.6,,
368,,Jesse JamesJ. James DET,TE48,5,161,366,331.5,35.9,284.0,-84.0
369,,Marcus MurphyM. Murphy BUF,RB105,6,283,380,336.4,14.4,,
370,,Allen HurnsA. Hurns DAL,WR122,8,242,385,324.4,40.5,,
371,,Bryce LoveB. Love WAS,RB106,10,104,380,307.8,43.9,274.0,-97.0
372,,Jordan MatthewsJ. Matthews SF,WR123,4,198,369,323.6,32.6,,
373,,Hunter RenfrowH. Renfrow OAK,WR124,6,153,378,268.9,85.2,285.0,-88.0
374,,Jakeem GrantJ. Grant MIA,WR125,5,226,377,311.8,44.9,,
375,,Tyler HigbeeT. Higbee LAR,TE49,9,244,383,329.1,25.6,341.0,-34.0
376,,Josh OliverJ. Oliver JAC,TE50,10,141,380,301.5,67.3,250.0,-126.0
377,,Jaron BrownJ. Brown SEA,WR126,11,214,384,333.9,48.9,388.0,+11.0
378,,Jermaine KearseJ. Kearse DET,WR127,5,231,373,318.7,30.3,,
379,,Blake BortlesB. Bortles LAR,QB36,9,252,376,340.2,21.2,409.0,+30.0
380,,LeGarrette BlountL. Blount FA,RB107,,304,384,338.1,14.3,,
