"page","page_pos","scrape_date","fantasypros_id","player_name","pos","team","rank","ecr","sd","best","worst","player_positions","player_short_name","player_eligibility","player_page_url","player_filename","player_bye_week","player_owned_avg","player_opponent","player_opponent_id","player_ecr_delta","note","tag","recommendation","pos_rank","start_sit_grade","r2p_pts"
"ppr-wr","WR",2024-09-20,"19252","Brandon Aiyuk","WR","SF",13,13.29,4,5,22,"WR","B. Aiyuk","WR","https://www.fantasypros.com/nfl/players/brandon-aiyuk.php","brandon-aiyuk.php","9",98.9,"at LAR","LAR",3,"This could be a monster George Kittle game, but this could also be the eruption game for Aiyuk. He has only drawn a 13.8% target share, a 17.4% air-yard share, and a 16.7% first-read share with 1.09 YPRR. That doesn't mean that he has been bad on a per-route basis. This season, Aiyuk ranks 13th in separation and fifth in route win rate among 92 qualifying wide receivers. Aiyuk hasn't been drawing massive target shares, but the previous coverage matchups have leaned in the direction of Deebo Samuel and George Kittle. Not this week. Aiyuk should go off this week. The Rams have the ninth-highest single-high rate (59.6%). Last year against single-high, Aiyuk dominated with a 26.2% target share, a 42.2% air-yard share, 3.71 YPRR, and a 29% first-read share. Aiyuk will run about 82% of his routes against Quentin Lake (60% catch rate and 99.6 passer rating) and Tre'Davious White (71.4% catch rate and 153.3 passer rating).",NA,NA,"WR13","A","15.8"
"ppr-wr","WR",2024-09-20,"15802","Tyreek Hill","WR","MIA",14,13.9,2.04,8,19,"WR","T. Hill","WR","https://www.fantasypros.com/nfl/players/tyreek-hill.php","tyreek-hill.php","6",100,"at SEA","SEA",NA,NA,NA,NA,"WR14","A","15.4"
"ppr-wr","WR",2024-09-20,"25409","Malik Nabers","WR","NYG",15,15.31,1.87,11,20,"WR","M. Nabers","WR","https://www.fantasypros.com/nfl/players/malik-nabers.php","malik-nabers.php","11",96.6,"at CLE","CLE",NA,"After his monster Week 2 performance, Nabers is the WR4 in fantasy with a 35.7% target share, a 56.2% air-yard share, 2.61 YPRR, and a 50% first-read share. Yep, Daniel Jones knows where his bread must be buttered. He should be looking for Nabers at all times because he is awesome. Among 69 qualifying wide receivers, Nabers ranks 17th in separation and 28th in route win rate. Nabers will still be fed volume this week, but expect his Week 3 results to resemble his Week 1 stat line more closely. The Browns' secondary is nasty. Nabers will run about 86% of his routes against Martin Emerson Jr. (58.3% catch rate and 104.5 passer rating) and Cam Mitchell (40% catch rate and 47.9 passer rating). The Browns have allowed the 13th-lowest PPR points per target to opposing perimeter wide receivers.",NA,NA,"WR15","A","15.1"
"ppr-wr","WR",2024-09-20,"12119","Mike Evans","WR","TB",16,15.55,2.32,8,20,"WR","M. Evans","WR","https://www.fantasypros.com/nfl/players/mike-evans.php","mike-evans.php","11",99.8,"vs. DEN","DEN",-6,NA,NA,NA,"WR16","A","15.0"
"ppr-wr","WR",2024-09-20,"22916","Zay Flowers","WR","BAL",17,16.93,1.78,12,21,"WR","Z. Flowers","WR","https://www.fantasypros.com/nfl/players/zay-flowers.php","zay-flowers.php","14",96.4,"at DAL","DAL",NA,"Flowers is the WR16 in fantasy points per game, leading Baltimore with a 26.7% target share, a 29.8% air-yard share, and a 33.3% first-read share. He has produced 1.56 YPRR while ranking 77th in separation and 78th in route win rate (among 92 qualifying receivers). Flowers saw his aDOT increase from Week 1 to last week, jumping from 6.1 to 10.7. Flowers is tied for the team lead with two end-zone targets. His startling inefficiency per route is worrisome, but it's only been two games, so I'm preaching patience. Dallas has utilized Cover 3 or Cover 4 on 52.7% of their defensive snaps this season. Last year, Flowers led the team with a 22.9% target share against these coverages while posting 2.08 YPRR. Flowers will run about 68% of his routes against Trevon Diggs (70% catch rate and 46.7 passer rating) and Caelen Carson (63.6% catch rate and 115.7 passer rating).",NA,NA,"WR17","A-","14.4"
"ppr-wr","WR",2024-09-20,"18219","DK Metcalf","WR","SEA",18,17.76,2.15,14,22,"WR","DK Metcalf","WR","https://www.fantasypros.com/nfl/players/dk-metcalf.php","dk-metcalf.php","10",98.7,"vs. MIA","MIA",NA,"Metcalf blew up last week, raising himself to WR15 in fantasy. He has commanded a 26.1% target share, a 40.9% air-yard share, and a 34.8% first-read share with 2.32 YPRR. Miami has utilized single-high on 57.8% of their defensive snaps. Metcalf has led the way again this year against single-high with a 29.7% target share, a 48.7% air-yard share, and a 37% first-read share. Metcalf should have no issues this week while running 90% of his routes against Kendall Fuller (25% catch rate and 45.8 passer rating) and Jalen Ramsey (100% catch rate and 118.8 passer rating).",NA,NA,"WR18","A-","14.4"
"ppr-wr","WR",2024-09-20,"17265","DJ Moore","WR","CHI",19,19.6,3.02,14,25,"WR","DJ Moore","WR","https://www.fantasypros.com/nfl/players/dj-moore-wr.php","dj-moore-wr.php","7",98,"at IND","IND",NA,"Moore has been earning volume at his usual clips, but it hasn't translated to wondrous fantasy production. Moore is the WR37, commanding a 27.3% target share, a 36.3% air-yard share, and a 31% first-read share, but hit has only amounted to 1.17 YPRR and 0.28 fantasy points per route run. If Williams can deliver catchable targets this week, Moore should crush. Indy has the fifth-highest single-high rate (65.5%). Last year, among 57 qualifying receivers, Moore ranked sixth in YPRR and 10th in fantasy points per route run against single high. Moore will run about 75% of his routes against Jaylon Jones (70% catch rate and 112.1 passer rating), Dallis Flowers (career: 59.3% catch rate and 107.0 passer rating), and Samuel Womack lll (career: 77.8% catch rate and 115.0 passer rating). Indy has allowed the fifth-most PPR points per target to perimeter wide receivers.",NA,NA,"WR19","A-","14.3"
"ppr-wr","WR",2024-09-20,"23163","Drake London","WR","ATL",20,19.86,1.95,14,24,"WR","D. London","WR","https://www.fantasypros.com/nfl/players/drake-london.php","drake-london.php","12",98.7,"vs. KC","KC",NA,"Last week, London bounced back with a WR19 finish, a 24.1% target share, 1.86 YPRR, and a 46.7% first-read share. While Darnell Mooney finished with a strout stat line, London is the undisputed WR1 of this offense. Last week, among 69 qualifying wide receivers, London ranked third in separation and fifth in route win rate. We'll see if London can build upon his bounce-back game in Week 3. Kansas City has allowed the 10th-highest PPR points per target to perimeter wide receivers. London will run about 72% of his routes against Trent McDuffie (42.9% catch rate and 53.3 passer rating) and Jaylen Watson (63.6% catch rate and 135.4 passer rating).",NA,NA,"WR20","A-","13.3"
"ppr-wr","WR",2024-09-20,"13981","Stefon Diggs","WR","HOU",21,22.24,1.6,17,24,"WR","S. Diggs","WR","https://www.fantasypros.com/nfl/players/stefon-diggs.php","stefon-diggs.php","14",98.1,"at MIN","MIN",NA,"Diggs is the WR23 in fantasy, with his two touchdowns in Week 1 doing the heavy lifting there. He has secured a 17.6% target share, a 12.3% air-yard share (5.2 aDOT), and a 20.5% first-read share as the team's starting slot. Diggs will face a Minnesota secondary that has deployed two high at the highest rate in the NFL (78.5%). Against two-high, Diggs has been third in the target pecking order with a 12.5% target share and a 16.7% first-read share, each of which fall behind Nico Collins and Tank Dell. Diggs does draw a favorable corner matchup, though, as he will match up with Byron Murphy (78.6% catch rate and 105.4 passer rating) all day.","start",NA,"WR21","B+","13.2"
"ppr-wr","WR",2024-09-20,"23677","Jameson Williams","WR","DET",22,22.48,2.84,16,28,"WR","J. Williams","WR","https://www.fantasypros.com/nfl/players/jameson-williams.php","jameson-williams.php","5",77.9,"at ARI","ARI",NA,"Good lawd, it's so fun to watch Williams tear it up so far in 2024 as the WR8 in fantasy. This is the player that I loved as a prospect. Watching him harness his talent and rip secondaries apart has been a blessing. Williams has a 23.8% target share, a 47.2% air-yard share, 2.63 YPRR, and a 34.5% first-read share. Among 92 qualifying wide receivers, Williams is sixth in separation and ninth in route win rate. Oh, baby, those numbers all jump off the page. Williams will run about 71% of his routes against Sean Murphy-Bunting (71.4% catch rate and 89.6 passer rating) and Starling Thomas (42.9% catch rate and 69.9 passer rating).","start",NA,"WR22","B+","13.2"
"ppr-wr","WR",2024-09-20,"23070","Jaxon Smith-Njigba","WR","SEA",23,22.88,2.74,16,31,"WR","J. Smith-Njigba","WR","https://www.fantasypros.com/nfl/players/jaxon-smith-njigba.php","jaxon-smith-njigba.php","10",86.3,"vs. MIA","MIA",4,"Well, we finally got to see it. Smith-Njigba was utilized, and he looked like an absolute stud. He had a 36.4% target share, a 47.1% air-yard share, 3.08 YPRR, and a 39.3% first-read share. He was the WR8 for the week in fantasy. Moving forward, Smith-Njigba and Metcalf should lead this passing attack. Miami has utilized single-high on 57.8% of their defensive snaps. Against single-high, Smith-Njigba has a 27% target share, 2.14 YPRR, and a 29.6% first-read share. Smith-Njigba should pick on Kader Kohou (75% catch rate and 109.9 passer rating) all game in Week 3. Miami has allowed the eighth-highest PPR points per target to slot receivers this season.","start",NA,"WR23","B","13.2"
"ppr-wr","WR",2024-09-20,"19278","Michael Pittman","WR","IND",24,22.9,4.44,16,36,"WR","M. Pittman Jr.","WR","https://www.fantasypros.com/nfl/players/michael-pittman.php","michael-pittman.php","14",97.1,"vs. CHI","CHI",-4,"Pittman has had a quiet start to the season as the WR66 in fantasy, while Alec Pierce has been filling up box scores. Pittman is still the clear leader of this receiver room. He has a 28.3% target share and a 31.4% first-read share that he has sadly only turned into 1.0 YPRR and 6.1 fantasy points per game. This week is not cakewalk either. The Bears have allowed the 12th-fewest PPR points per target to perimeter wide receivers this season. That won't stop Indy from feeding Pittman more volume this week. Chicago has utilized Cover 3 or Cover 4 on 61.1% of their defensive snaps this season. Last year, against Cover 3 & Cover 4, Pittman had a 28.4% target share, 1.96 YPRR, and a 37.5% first-read share. Richardson should be looking for him early and often. Pittman will run about 80% of his routes against Jaylon Johnson (37.5% catch rate and 9.4 passer rating) and Tyrique Stevenson (52.6% catch rate and 71.8 passer rating).","sit",NA,"WR24","B+","12.9"
"ppr-wr","WR",2024-09-20,"24687","Rashid Shaheed","WR","NO",25,25.95,2.66,20,33,"WR","R. Shaheed","WR","https://www.fantasypros.com/nfl/players/rashid-shaheed.php","rashid-shaheed.php","12",63.6,"vs. PHI","PHI",3,"Shaheed is the WR10 in fantasy points per game, commanding a 22.5% target share, a 43.9% air-yard share, and a 26.7% first-read share with 5.28 YPRR (wow, just wow). Last week, he did step back and assume the role of the 1B behind Olave with a 25% target share, a 45.9% air-yard share, and a 33.3% first-read share (tied with Olave). Overall, among 92 qualifying receivers, Shaheed ranks seventh in separation and 28th in route win rate. The Eagles have the sixth-highest rate of single high this season (63.2%). Among 77 qualifying wide receivers against single high, Shaheed is fourth in separation and 37th in route win rate. Shaheed and Olave should cook this week. Shaheed will run about 70% of his routes against Darius Slay (100% catch rate and 146.5 passer rating) and Quinyon Mitchell (58.3% catch rate and 91.3 passer rating).","start",NA,"WR25","B","12.8"
"ppr-wr","WR",2024-09-20,"25361","Tank Dell","WR","HOU",26,26.26,1.88,21,31,"WR","T. Dell","WR","https://www.fantasypros.com/nfl/players/nathaniel-dell.php","nathaniel-dell.php","14",94,"at MIN","MIN",NA,"Dell has had a quiet start to the season as the WR73 with a 16.2% target share, a 30.6% air-yard share, 0.60 YPRR, and a 15.4% first-read share. Among 84 qualifying receivers, he ranks 45th in separation and 52nd in route win rate. Dell was too good last year not to find his stride as the season progresses, so stay the course with this talent. He will tangle with a Minny secondary that has utilized two high at the highest rate in the NFL (78.5%). Against two high, Dell has a 15.6% target share, a 31.9% air-yard share, and a 22.2% first read share. He should be number two in line for targets this week after Collins. Dell will run about 72% of his routes against Stephon Gilmore (76.9% catch rate and 98.2 passer rating) and Shaquill Griffin (66.7% catch rate and 77.1 passer rating).","start",NA,"WR26","B-","12.8"
"ppr-wr","WR",2024-09-20,"13894","Amari Cooper","WR","CLE",27,26.33,2.37,20,32,"WR","A. Cooper","WR","https://www.fantasypros.com/nfl/players/amari-cooper.php","amari-cooper.php","10",93.7,"vs. NYG","NYG",NA,"Cooper has had a rough opening two games to the season. His volume market share has been solid but the results haven't been there. Cooper has a 21.5% target share, a 43.2% air-yard share, and a 25.9% first-read share. That all sounds great, right? Well, only 58.8% of that volume has been catchable, and Cooper has turned his catchable volume into 0.31 YPRR and 0.09 fantasy points per route run. The secondary matchup is juicy for Cooper, but the coverage scheme for the Giants could lead to another down week. The Giants have utilized two-high at the fifth-highest rate (53.1%) this season. Against two high, Cooper has only managed an 8.6% target share and an 8.3% first-read share. Unless we see Cleveland change their approach here, Cooper is destined for a third quiet game. Cooper will run about 75% of his routes against Andru Phillips (77.8% catch rate and 79.6 passer rating) and Deonte Banks (63.6% catch rate and 127.1 passer rating).",NA,NA,"WR27","B-","12.6"
"ppr-wr","WR",2024-09-20,"22963","George Pickens","WR","PIT",28,29.4,3.09,25,41,"WR","G. Pickens","WR","https://www.fantasypros.com/nfl/players/george-pickens.php","george-pickens.php","9",94.4,"vs. LAC","LAC",NA,"Pickens will cook in Week 3. There, I said it. He is WR43 but a target hog. Pickens has a 25.6% target share, a 53.4% air-yard share, 2.78 YPRR, and a 32.3% first-read share. Among 92 qualifying wide receivers, he ranks second in separation and third in route win rate. The Bolts have the fourth-highest rate of two high this season (65.2%). Pickens ranks second in separation and eighth in route win rate against two high. Pickens will run about 67% of his routes against Asante Samuel Jr. (75% catch rate and 93.1 passer rating) and Kristian Fulton (40% catch rate and 47.9 passer rating).",NA,NA,"WR28","C+","11.9"
"ppr-wr","WR",2024-09-20,"19790","Jaylen Waddle","WR","MIA",29,29.69,3.36,23,39,"WR","J. Waddle","WR","https://www.fantasypros.com/nfl/players/jaylen-waddle.php","jaylen-waddle.php","6",97.2,"at SEA","SEA",-5,"Waddle is the WR29 in fantasy points per game, drawing an 11.8% target share, a 19.3% air-yard share, and a 15.3% first-read share. These are all-around disappointing numbers, but his 2.78 YPRR loudly states that Waddle remains a talented receiver. Thompson starting for the foreseeable future really caps Waddle's upside unless he earns a higher market share in this offense. Waddle is a volatile WR3/flex moving forward until Tua Tagovailoa is possibly back under center. Waddle will run about 82% of his routes against Tariq Woolen (44.4% catch rate and 13.9 passer rating) and Tre Brown (50% catch rate and 68.1 passer rating). Seattle has allowed the lowest PPR points per target to perimeter wide receivers this season.",NA,NA,"WR29","B-","11.7"
"ppr-wr","WR",2024-09-20,"23019","Xavier Worthy","WR","KC",30,30.33,2.12,23,34,"WR","X. Worthy","WR","https://www.fantasypros.com/nfl/players/xavier-worthy.php","xavier-worthy.php","6",89.2,"at ATL","ATL",NA,"Worthy has a 68% route share with a 13.2% target share, a 27.1% air-yard share, 1.52 YPRR, and a 17.5% first-read share. Last week, his route share dropped to 61% while he was still second on the team with a 16% target share and a 21.1% first-read share. Atlanta has the 12th-highest single-high rate this season (58.5%). Against single-high this season, it has been all Rashee Rice, as Worthy has only a 10.7% target share and a 14.3% first-read share. We'll see if that changes this week. Worthy could also get shadow coverage from A.J. Terrell, but that might not be a bad thing. Terrell followed George Pickens and DeVonta Smith on 58-80% of their routes this season, allowing them to secure nine of their 11 targets with 141 receiving yards. Worthy carries a wide range of outcomes this week.",NA,NA,"WR30","C+","11.7"
"ppr-wr","WR",2024-09-20,"17258","Calvin Ridley","WR","TEN",31,31,3.12,24,37,"WR","C. Ridley","WR","https://www.fantasypros.com/nfl/players/calvin-ridley.php","calvin-ridley.php","5",93.2,"vs. GB","GB",NA,"After two games, Ridley is the WR16 with a rushing touchdown in Week 2, helping to pad his fantasy production. He has earned a 21.7% target share, a 60% air-yard share, and a 28.3% first-read share with 2.12 YPRR. Ridley hasn't seen a red zone or end zone target yet. Green Bay has utilized single high on 56.6% of their defensive snaps this year. Among 77 qualifying wide receivers, Ridley ranks 73rd in separation and 51st in route win rate against single high. Ridley could see shadow coverage from Jaire Alexander this week after he followed A.J. Brown on 69% of his routes in Week 1. Brown roasted Alexander with 108 receiving yards and a score. Green Bay didn't have him shadow Michael Pittman in Week 2, so it's up in the air if he does so this week. If Alexander doesn't follow Ridley, he'll run about 83% of his routes against Alexander (55.6% catch rate and 97.9 passer rating) and Eric Stokes (66.7% catch rate and 86.8 passer rating). Green Bay has allowed the sixth-highest PPR points per target to perimeter wide receivers this season.","start",NA,"WR31","C+","11.6"
"ppr-wr","WR",2024-09-20,"23000","Brian Thomas","WR","JAC",32,31.86,2.45,26,37,"WR","B. Thomas Jr.","WR","https://www.fantasypros.com/nfl/players/brian-thomas-jr.php","brian-thomas-jr.php","12",79.8,"at BUF","BUF",NA,"Thomas Jr. has been a big play specialist so far this season with his 16.3 aDOT. He has a 15.7% target share, a 23.6% air-yard share, 3.07 YPRR, and a 20.5% first-read share. He is tied for second on the team with one end-zone target. Buffalo has the third-highest rate of two high coverage (69.5%). This year against two-high, Thomas Jr. has a 19% target share, 3.47 YPRR, and a 25% first-read share. Buffalo has been tough on perimeter wide receivers, allowing the second-lowest PPR points per target. If you're flexing Thomas Jr., it's a bet on talent and just maybe one splash play making his fantasy day. He'll run about 73% of his routes against Christian Benford (40% catch rate and 8.3 passer rating) and Rasul Douglas (71.4% catch rate and 90.8 passer rating).","start",NA,"WR32","C+","11.6"
"ppr-wr","WR",2024-09-20,"18466","Terry McLaurin","WR","WAS",33,32.98,2.44,27,39,"WR","T. McLaurin","WR","https://www.fantasypros.com/nfl/players/terry-mclaurin.php","terry-mclaurin.php","14",90.7,"at CIN","CIN",NA,"McLaurin is the only receiver that's currently fantasy viable in the Commanders passing attack. He is the only wide receiver that logged at least a 60% route share last week (McLaurin 79%). Last week, his usage bumped up with a 27.6% target share, a 22.9% air-yard share, and a 31.8% first-read share. The problem for McLaurin and this offense is that it is in dink and dunk mode. McLaurin's 0.73 YPRR can be traced to his 3.8 aDOT. It's tough for any wide receiver to produce with basically elongated handoffs every play. I'm not trying to wedge McLaurin into fantasy lineups this week against a secondary that has allowed the 11th-fewest receiving yards to perimeter wide receivers. McLaurin will run about 81% of his routes against Cam Taylor-Britt (50% catch rate and 80.6 passer rating) and Dax Hill (62.5% catch rate and 75 passer rating).","start",NA,"WR33","C+","11.5"
"ppr-wr","WR",2024-09-20,"18615","Diontae Johnson","WR","CAR",34,34.45,2.61,28,38,"WR","D. Johnson","WR","https://www.fantasypros.com/nfl/players/diontae-johnson.php","diontae-johnson.php","11",83.8,"at LV","LV",NA,"Johnson has a 21.1% target share, a 21.6% air-yard share, 0.68 YPRR, and a 26.8% first-read share. I expect Dalton to hone in on Johnson this week and feed him. The rest of his numbers outside of his first-read share I'll take with a grain of salt because the level of quarterback play in Carolina through the first two weeks was dreadful. Johnson is back on the WR3/flex radar for this week. Johnson will run about 67% of his routes against Jack Jones (55.6% catch rate and 64.6 passer rating) and Jakorian Bennett (37.5% catch rate and 54.2 passer rating).",NA,NA,"WR34","C+","11.5"
"ppr-wr","WR",2024-09-20,"17268","Christian Kirk","WR","JAC",35,36.02,2.91,30,47,"WR","C. Kirk","WR","https://www.fantasypros.com/nfl/players/christian-kirk.php","christian-kirk.php","12",84.9,"at BUF","BUF",NA,"Kirk has been simply dreadful this season. There's no way anyone can feel good about putting him into a lineup right now. He has only a 13.7% target share, a 22.2% air-yard share, 0.59 YPRR, and a 17.9% first-read share as the WR98 in fantasy. It has been wild how far he's fallen from last year's stats. If you are desperate for a flex play this week, the coverage matchup dictates that he should be utilized this week. Buffalo has the third-highest rate of two high coverage (69.5%). This year against two-high, Kirk has a 19% target share, a 40.9% air-yard share, and a 25% first-read share.",NA,NA,"WR35","C+","11.5"
"ppr-wr","WR",2024-09-20,"23748","Khalil Shakir","WR","BUF",36,36.45,2.8,26,42,"WR","K. Shakir","WR","https://www.fantasypros.com/nfl/players/khalil-shakir.php","khalil-shakir.php","12",55.7,"vs. JAC","JAC",NA,"This is a good matchup for Shakir in the slot. He has a 19% target share, 2.74 YPRR, and a 16.7% first-read share this season. His per-route efficiency has never been in question, just his target drawing ability, but we are seeing that expand some this season. Although the Bills have been so run-centric, it has limited all of their passing weapons. If Allen throws more this week, Shakir should have a solid day. Shakir will run about 77% of his routes against Jarrian Jones (75% catch rate and 108.9 passer rating). The Jaguars are 15th in receiving yards allowed to the slot.",NA,NA,"WR36","C+","11.2"
"ppr-wr","WR",2024-09-20,"15665","Demarcus Robinson","WR","LAR",37,36.9,3.94,30,50,"WR","D. Robinson","WR","https://www.fantasypros.com/nfl/players/demarcus-robinson.php","demarcus-robinson.php","6",32,"vs. SF","SF",NA,"Robinson has a 14.5% target share, a 31.1% air-yard share, 1.33 YPRR, and a 14.6% first-read share. With Puka Nacua and Cooper Kupp sidelined, those numbers should increase dramatically. Robinson has the talent to earn targets at a higher clip. Among 92 qualifying receivers, he is 36th in separation and 16th in route win rate. Robinson is tied for the team lead in end zone targets (two), so Stafford should be looking in his direction in high-leverage situations. The 49ers have allowed the third-most fantasy points per game to wide receivers. Robinson will run about 61% of his routes against Charvarius Ward (42.9% catch rate and 91.7 passer rating) and Isaac Yiadom (62.5% catch rate and 130.7 passer rating).",NA,NA,"WR37","C","11.0"
"ppr-wr","WR",2024-09-20,"26122","Ladd McConkey","WR","LAC",38,39.64,3.29,31,52,"WR","L. McConkey","WR","https://www.fantasypros.com/nfl/players/ladd-mcconkey.php","ladd-mcconkey.php","5",74.9,"at PIT","PIT",NA,"McConkey is the WR42 in fantasy, drawing a 23.9% target share, a 29% air-yard share, and a 19.2% first-read share with 1.86 YPRR. He's tied for second on the team with one end-zone target. Among 92 qualifying receivers, he ranks 62nd in separation and 47th in route win rate. McConkey does have a good corner matchup this week, as he'll run about 65% of his routes against Beanie Bishop Jr. (87.5% catch rate and 143.2 passer rating). Joshua Palmer or Quentin Johnston will draw shadow coverage from Joey Porter Jr., which should push more target volume to McConkey this week.",NA,NA,"WR38","C","10.6"
"ppr-wr","WR",2024-09-20,"19201","Jerry Jeudy","WR","CLE",39,40.19,3.93,31,52,"WR","J. Jeudy","WR","https://www.fantasypros.com/nfl/players/jerry-jeudy.php","jerry-jeudy.php","10",60.9,"vs. NYG","NYG",6,"Jeudy should lead the way for the Browns aerial attack this week. Jeudy has a 17.7% target share, a 32.1% air-yard share, 1.29 YPRR, and a 19% first-read share as the WR30 in fantasy. On paper, this looks like a ""Jerry Jeudy week."" The Giants have utilized two-high at the fifth-highest rate (53.1%) this season. Against two-high, Jeudy has been the go-to receiver through two games with a 20% target share, a 52.3% air-yard share, and a 25% first-read share. Among 54 qualifying receivers against two high, Jeudy ranks 23rd in route win rate and 24th in separation. Jeudy will run about 60% of his routes against Andru Phillips (77.8% catch rate and 79.6 passer rating) and Deonte Banks (63.6% catch rate and 127.1 passer rating). New York has allowed the sixth-highest PPR points per target to perimeter wide receivers.","start",NA,"WR39","C","10.5"
