"page","page_pos","scrape_date","fantasypros_id","player_name","pos","team","rank","ecr","sd","best","worst","sportradar_id","yahoo_id","cbs_id","player_positions","player_short_name","player_eligibility","player_yahoo_positions","player_page_url","player_filename","player_square_image_url","player_image_url","player_bye_week","player_owned_avg","player_owned_espn","player_owned_yahoo","player_opponent","player_opponent_id","player_ecr_delta","note","tag","recommendation","pos_rank","start_sit_grade","r2p_pts"
"ppr-rb","RB",2022-10-29,"23264","Spencer Brown","RB","CAR",118,97.5,4.5,93,102,"0fe5d2c8-9cf4-4983-b160-468362c1a23c","33724","2867517","RB","S. Brown","RB","RB","https://www.fantasypros.com/nfl/players/spencer-brown-rb.php","spencer-brown-rb.php","https://images.fantasypros.com/images/players/nfl/23264/headshot/210x210.png","https://images.fantasypros.com/images/players/nfl/23264/headshot/210x210.png","13",0,0,0,"at ATL","ATL",NA,NA,NA,NA,"RB118","F","0.0"
"ppr-rb","RB",2022-10-29,"22969","Jordan Mason","RB","SF",119,110.5,6.1,101,118,"af9f7390-ca80-11ec-97ae-e1573849d1a6","34320","2967536","RB","J. Mason","RB","RB","https://www.fantasypros.com/nfl/players/jordan-mason.php","jordan-mason.php","","","9",0.6,0.1,1,"at LAR","LAR",NA,NA,NA,NA,"RB119","F","0.0"
"ppr-rb","RB",2022-10-29,"19438","JJ Taylor","RB","NE",120,104,1,103,105,"879325b1-c961-4c9a-a3a4-679d77a28293","33028","2252786","RB","J.J. Taylor","RB","RB","https://www.fantasypros.com/nfl/players/jj-taylor.php","jj-taylor.php","https://images.fantasypros.com/images/players/nfl/19438/headshot/210x210.png","https://images.fantasypros.com/images/players/nfl/19438/headshot/210x210.png","10",0.1,0.1,0,"at NYJ","NYJ",NA,NA,NA,NA,"RB120","F","0.0"
"ppr-rb","RB",2022-10-29,"23327","Tory Carter","RB","TEN",121,114.33,2.62,112,118,"1e8324fc-540c-4a95-855a-8c0afcb4957e","33835","2804550","RB","T. Carter","RB","RB","https://www.fantasypros.com/nfl/players/tory-carter.php","tory-carter.php","https://images.fantasypros.com/images/players/nfl/23327/headshot/210x210.png","https://images.fantasypros.com/images/players/nfl/23327/headshot/210x210.png","6",0,0,0,"at HOU","HOU",NA,NA,NA,NA,"RB121","F","0.0"
"ppr-rb","RB",2022-10-29,"18607","Trayveon Williams","RB","CIN",122,112,3,109,115,"478fcd24-2617-41d5-a900-b272aa6ef515","32014","2222046","RB","T. Williams","RB","RB","https://www.fantasypros.com/nfl/players/trayveon-williams.php","trayveon-williams.php","https://images.fantasypros.com/images/players/nfl/18607/headshot/210x210.png","https://images.fantasypros.com/images/players/nfl/18607/headshot/210x210.png","10",0,0,0,"at CLE","CLE",NA,NA,NA,NA,"RB122","F",NA
"ppr-rb","RB",2022-10-29,"24572","Brittain Brown","RB","LV",123,114,0,114,114,"387c8819-5892-4528-ac33-0ec72b24cc2f","34206","2249805","RB","B. Brown","RB","RB","https://www.fantasypros.com/nfl/players/brittain-brown.php","brittain-brown.php","https://images.fantasypros.com/images/players/nfl/24572/headshot/210x210.png","https://images.fantasypros.com/images/players/nfl/24572/headshot/210x210.png","6",0,0,0,"at NO","NO",NA,NA,NA,NA,"RB123","F",NA
"ppr-wr","WR",2022-10-29,"16433","Cooper Kupp","WR","LAR",1,1.39,0.85,1,5,"2806e915-c46f-492f-8a29-71d3a85e5620","30182","2006951","WR","C. Kupp","WR","WR","https://www.fantasypros.com/nfl/players/cooper-kupp.php","cooper-kupp.php","https://images.fantasypros.com/images/players/nfl/16433/headshot/210x210.png","https://images.fantasypros.com/images/players/nfl/16433/headshot/210x210.png","7",100,99.9,100,"vs. SF","SF",NA,"Kupp is the WR2 in fantasy. Kupp has a 32.6% target share (first) and 36.6% air yard share (12th). He's 16th in red zone targets, first in YAC, and fifth in receiving yards. In their last meeting, he destroyed the 49ers with 19 targets, 14 receptions, and 122 receiving yards. You're never sitting, Kupp. Ever.",NA,NA,"WR1","A+","20.9"
"ppr-wr","WR",2022-10-29,"19236","Justin Jefferson","WR","MIN",2,2.43,0.74,1,4,"4131d4ee-0318-4bb5-832a-4dec80668a4f","32692","2871343","WR","J. Jefferson","WR","WR","https://www.fantasypros.com/nfl/players/justin-jefferson.php","justin-jefferson.php","https://images.fantasypros.com/images/players/nfl/19236/headshot/210x210.png","https://images.fantasypros.com/images/players/nfl/19236/headshot/210x210.png","7",100,99.9,100,"vs. ARI","ARI",NA,"Jefferson remains a matchup-proof fantasy monster. He's the WR3 in fantasy after a slow start. He's seventh in target share, 17th in target per route run rate, 12th in PFF receiving grade, and third in yards per route run (minimum 15 targets). Since Week 4, the Cardinals have utilized zone on 60% of their coverage snaps. This will be their undoing if Cousins can manage to deliver accurate balls to Jefferson. Jefferson has seen 58.3% of his target volume against zone, ranking first in PFF receiving grade and yards per route run against the coverage type (minimum ten targets). Jefferson is an elite WR1.",NA,NA,"WR2","A+","20.8"
"ppr-wr","WR",2022-10-29,"15802","Tyreek Hill","WR","MIA",3,3.17,0.82,1,4,"01d8aee3-e1c4-4988-970a-8c0c2d08bd83","29399","2131163","WR","T. Hill","WR","WR","https://www.fantasypros.com/nfl/players/tyreek-hill.php","tyreek-hill.php","https://images.fantasypros.com/images/players/nfl/15802/headshot/210x210.png","https://images.fantasypros.com/images/players/nfl/15802/headshot/210x210.png","11",100,99.9,100,"at DET","DET",NA,"Hill has been incredible this year. He's a weekly must-start as the WR4 in fantasy. He's second in target share, seventh in air yard share, and leads the NFL in receiving yards. He's first in PFF receiving grade and yards per route run (minimum 15 targets). Hill is second in deep targets and first in deep receiving yards. If Tagovailoa cuts the Lions' secondary to shreds with the deep ball, Hill will have a monster day. Hill will run about 58% of his routes against Jeffery Okudah (71% catch rate, 97.6 passer rating) and Amani Oruwariye (73.3% catch rate, 130.1 passer rating). Hill is a top-five receiver.",NA,NA,"WR3","A+","20.7"
"ppr-wr","WR",2022-10-29,"13981","Stefon Diggs","WR","BUF",4,3.28,1.12,2,5,"a1c40664-b265-4083-aad2-54b4c734f2c5","28534","2000038","WR","S. Diggs","WR","WR","https://www.fantasypros.com/nfl/players/stefon-diggs.php","stefon-diggs.php","https://images.fantasypros.com/images/players/nfl/13981/headshot/210x210.png","https://images.fantasypros.com/images/players/nfl/13981/headshot/210x210.png","7",100,99.9,100,"vs. GB","GB",NA,"Diggs is a dominant wide receiver. He's the WR1 in fantasy, ranking second in PFF receiving grade and yards per route run (minimum 15 targets). Diggs has finished no lower than WR37 in any game and has been in the top eight among fantasy wide receivers four times. Diggs has a 28.3% target share (tenth) and 33.4% air yard share (19th). He's third in the NFL with 12 red zone targets and 23rd in deep targets (eight). Diggs could be shadowed by Jaire Alexander, who followed Terry McLaurin on 69% of his routes in Week 7 (six targets, four receptions, 67 receiving yards, and one touchdown). If Alexander (66.7% catch rate, 91.6 passer rating) doesn't follow him, he'll run about 62% of his routes against Alexander and Eric Stokes (87% catch rate, 129.7 passer rating).",NA,NA,"WR4","A+","19.8"
"ppr-wr","WR",2022-10-29,"12123","Davante Adams","WR","LV",5,5.07,0.64,3,7,"e7d6ae25-bf15-4660-8b37-c37716551de3","27581","1893167","WR","D. Adams","WR","WR","https://www.fantasypros.com/nfl/players/davante-adams.php","davante-adams.php","https://images.fantasypros.com/images/players/nfl/12123/headshot/210x210.png","https://images.fantasypros.com/images/players/nfl/12123/headshot/210x210.png","6",100,99.9,100,"at NO","NO",NA,"Adams remains a weekly WR1. He's the WR6 in fantasy points per game with a 32.0% target share (fourth) and 28.4% target per route run rate (15th). Adams is 13th in deep targets and second in red zone targets. He ranks seventh in PFF receiving grade and 13th in yards per route run (minimum 15 targets). The Saints remain zone-based in the coverage, with at least 55% of their corner snaps last week coming in zone coverage. Adams has seen 63.8% of his target volume against zone, ranking eighth in PFF receiving grade and 11th in yards per route run against zone (minimum five targets). With Marshon Lattimore ruled out, Adams will run about 70% of his routes against rookie Alontae Taylor (16.7% catch rate, 39.6 passer rating, six targets) and possibly backup safety Bryce Thompson (zero targets, five coverage snaps). Watch the Saturday and Sunday news for Adams who is dealing with a rough bout of the flu. He was DNP all week before a limited session on Friday and a questionable tag.",NA,NA,"WR5","A+","19.7"
"ppr-wr","WR",2022-10-29,"11606","DeAndre Hopkins","WR","ARI",6,6.8,1.6,4,12,"5c48ade7-4b9a-4757-9643-87a6e3839e2b","26650","1737078","WR","D. Hopkins","WR","WR","https://www.fantasypros.com/nfl/players/deandre-hopkins.php","deandre-hopkins.php","https://images.fantasypros.com/images/players/nfl/11606/headshot/210x210.png","https://images.fantasypros.com/images/players/nfl/11606/headshot/210x210.png","13",96.5,95.9,97,"at MIN","MIN",NA,"In his first game back Hopkins saw the best usage of his tenure in Arizona. He went nuclear absorbing a 46.7% target share and 60.6% air yard share which is great, but my biggest takeaway was his 42.4% slot rate. This is by far the highest slot rate he's seen during his time with Kliff Kingsbury. Hopkins responded with 3.55 yards per route run. We'll see how much slot time he gets this week with Rondale Moore likely to move back inside if Robbie Anderson is up to speed, but I have to tip my cap to Kingsbury for a moment. When on the outside Hopkins will matchup with Patrick Peterson (50% catch rate, 55.7 passer rating) and Cameron Dantzler (75% catch rate, 112.6 paser rating). Kingsbury would be wise to move Hopkins inside again some this week to take advantage of Chandon Sullivan (82.8% catch rate, 128.0 passer rating). Hopkins is a WR1.",NA,NA,"WR6","A","18.7"
"ppr-wr","WR",2022-10-29,"19202","CeeDee Lamb","WR","DAL",7,7.85,1.79,6,13,"a72ea15b-5199-4101-a300-846e1c655add","32687","2865251","WR","C. Lamb","WR","WR","https://www.fantasypros.com/nfl/players/ceedee-lamb.php","ceedee-lamb.php","https://images.fantasypros.com/images/players/nfl/19202/headshot/210x210.png","https://images.fantasypros.com/images/players/nfl/19202/headshot/210x210.png","9",99.8,99.6,100,"vs. CHI","CHI",NA,"Lamb is the WR22 in fantasy, drawing a 32.2% target share (third) and 32.4% target per route run rate (fourth). He's fifth in air yard share (39.0%) while leading the team with ten deep targets (13th). Lamb is 22nd in PFF receiving grade and 14th in yards per route run (minimum 15 targets). He'll run about 59% of his routes in the slot against Kyler Gordon (79.5% catch rate, 112.9 passer rating). Gordon's play has improved, but since Week 3, he's still 23rd in yards per snap allowed (minimum 25 slot coverage snaps). If Prescott takes advantage of the Bears' deep passing issues, Lamb will be the beneficiary. He's a WR1.",NA,NA,"WR7","A","17.2"
"ppr-wr","WR",2022-10-29,"19790","Jaylen Waddle","WR","MIA",8,9.13,1.8,6,13,"0ff9a975-669d-4851-a95d-ab28d9fc29c4","33394","2962110","WR","J. Waddle","WR","WR","https://www.fantasypros.com/nfl/players/jaylen-waddle.php","jaylen-waddle.php","https://images.fantasypros.com/images/players/nfl/19790/headshot/210x210.png","https://images.fantasypros.com/images/players/nfl/19790/headshot/210x210.png","11",99.1,99.1,99,"at DET","DET",NA,"Waddle hasn't been a slouch either as he tries to keep pace with his teammate as the WR9 in fantasy. Waddle has a 22% target share with a 27% air yard share. The specialty that has carried him to 621 receiving yards (fourth-most) is YAC. Waddle is third in YAC and fourth in YAC per reception. He's 13th in PFF receiving grade and fourth in yards per route run. While Waddle can still walk away with a good fantasy week, this game sets up as a Hill game. Detroit has allowed the sixth-lowest YAC this season and is 20th in missed tackles. Waddle is a borderline WR1/high-end WR2.",NA,NA,"WR8","A","16.8"
"ppr-wr","WR",2022-10-29,"18218","AJ Brown","WR","PHI",9,9.35,1.66,7,13,"a9e580f2-1fbe-46fb-887c-c84089b507e4","31883","2258303","WR","A.J. Brown","WR","WR","https://www.fantasypros.com/nfl/players/aj-brown.php","aj-brown.php","https://images.fantasypros.com/images/players/nfl/18218/headshot/210x210.png","https://images.fantasypros.com/images/players/nfl/18218/headshot/210x210.png","7",99.8,99.5,100,"vs. PIT","PIT",NA,"A.J. Brown is your favorite alpha receivers' favorite receiver. He's the WR13 in fantasy points per game (WR8 in expected fantasy points per game). Brown has commanded a 30.6% target share (sixth) and a 31.7% target per route run rate (fifth). Brown is third among receivers in air-yard share. He is fourth in PFF receiving grade and eighth in yards per route run (minimum 15 targets). He's finished as a top-24 receiver in four of six games. Brown is seventh among receivers in red zone targets, but he's only scored two touchdowns. Regression is coming for Brown. Yes, I know I keep preaching this, but his volume and high-value usage are too good for him to keep up this touchdown drought. Brown is a WR1. He'll run about 76% of his routes against Akhello Witherspoon (73.7% catch rate, 117.2 passer rating) and James Pierre (53.8% catch rate, 64.3 passer rating).",NA,NA,"WR9","A","16.7"
"ppr-wr","WR",2022-10-29,"19799","Amon-Ra St Brown","WR","DET",10,10.37,1.77,6,13,"26ef0447-29b8-4dd1-9831-dcbf8132bb74","33500","2967690","WR","A. St. Brown","WR","WR","https://www.fantasypros.com/nfl/players/amonra-stbrown.php","amonra-stbrown.php","https://images.fantasypros.com/images/players/nfl/19799/headshot/210x210.png","https://images.fantasypros.com/images/players/nfl/19799/headshot/210x210.png","6",98,98,98,"vs. MIA","MIA",NA,"St. Brown should be good to go this week. Head coach Dan Campbell stated St. Brown didn't have a concussion but was ruled out due to ataxia. In Weeks 1-3 before the injury, St. Brown was 16th in PFF receiving grade, tenth in yards per route run, and 13th in YAC per reception (minimum ten targets). St. Brown will remind people this week that he's a WR1. In the first three games of the season, St. Brown commanded a 30.8% target share (sixth-best), seeing 11 targets per game (seventh-best). St. Brown will run about 66% of his routes from the slot against Justin Bethel (career: 58.1% catch rate, 94.8 passer rating).",NA,NA,"WR10","A","16.6"
"ppr-wr","WR",2022-10-29,"19211","Tee Higgins","WR","CIN",11,10.52,3.32,5,19,"7963b029-5de4-4541-b00a-44eefe4349af","32703","2809208","WR","T. Higgins","WR","WR","https://www.fantasypros.com/nfl/players/tee-higgins.php","tee-higgins.php","https://images.fantasypros.com/images/players/nfl/19211/headshot/210x210.png","https://images.fantasypros.com/images/players/nfl/19211/headshot/210x210.png","10",99.6,99.2,100,"at CLE","CLE",NA,"In the five games Higgins has been a full-time player, he has a 22.7% target share and 30.4% air yard share. In his five healthy games, he has a 77.0 PFF receiving grade and 2.24 yards per route run mark. This season, among all wide receivers with 15 or more targets, those numbers would rank 17th in PFF receiving grade and 14th in yards per route run. Higgins is a WR2 that will run about 77% of his routes against Emerson and Williams.",NA,NA,"WR11","A","16.4"
"ppr-wr","WR",2022-10-29,"12119","Mike Evans","WR","TB",12,11.22,1.94,8,16,"c48c21d9-0ae5-478c-ad34-30a660cfa9b8","27535","1824909","WR","M. Evans","WR","WR","https://www.fantasypros.com/nfl/players/mike-evans.php","mike-evans.php","https://images.fantasypros.com/images/players/nfl/12119/headshot/210x210.png","https://images.fantasypros.com/images/players/nfl/12119/headshot/210x210.png","11",99.7,99.3,100,"vs. BAL","BAL",NA,"Evans is the WR11 in fantasy points per game. He has garnered a 19% target share with 33.2% of the team's air yards. Evans is 19th in PFF receiving grade and 23rd in yards per route run (minimum 15 targets). He leads Tampa Bay with a 41.7% end zone target share. Evans is a low-end WR1/high-end WR2 who will run about 72% of his routes against Marlon Humphrey (71% catch rate, 57.5 passer rating) and Marcus Peters (64.5% catch rate, 92.5 passer rating). The matchup this week against the Ravens' outside corners is no joke, but it's impossible to bench Evans with his downfield role (leads the team in deep targets) and touchdown equity in the Bucs offense.",NA,NA,"WR12","A","16.4"
"ppr-wr","WR",2022-10-29,"16406","Chris Godwin","WR","TB",13,13.48,2.59,8,23,"baa61bb5-f8d0-4f90-bbe2-028576b8d33d","30197","2818150","WR","C. Godwin","WR","WR","https://www.fantasypros.com/nfl/players/chris-godwin.php","chris-godwin.php","https://images.fantasypros.com/images/players/nfl/16406/headshot/210x210.png","https://images.fantasypros.com/images/players/nfl/16406/headshot/210x210.png","11",94.4,94.7,94,"vs. BAL","BAL",NA,"In the three games Godwin has played at least 80% of the snaps this season, he has seen a 26.1% target share with 29.1% of the team's air yards. In those three games, he has logged at least ten targets and seven receptions in each outing. Godwin is 26th in PFF receiving grade and 35th in yards per route run (minimum 25 targets). Godwin will run about 73% of his routes in the slot against Damarion Williams (74.1% catch rate, 135.3 passer rating). Williams is the weak link in the Baltimore secondary. Expect Brady to zero in on it and pepper Godwin with another ten-plus target game. Godwin is a top-ten wide receiver.",NA,NA,"WR13","A","15.8"
"ppr-wr","WR",2022-10-29,"20111","Chris Olave","WR","NO",14,15.09,2.27,9,21,"2375d572-a36c-4365-bb3f-87e156526e2f","33966","2963666","WR","C. Olave","WR","WR","https://www.fantasypros.com/nfl/players/chris-olave.php","chris-olave.php","https://images.fantasypros.com/images/players/nfl/20111/headshot/210x210.png","https://images.fantasypros.com/images/players/nfl/20111/headshot/210x210.png","14",92.5,91,94,"vs. LV","LV",NA,"Olave has been a mega-producer and arguably the best rookie wide receiver in the NFL when he's been active. In his full games played, he's seen a 27.4% target share with 42.6% of the team's air yards. He has stacked a 77.9 PFF receiving grade and 2.38 yards per route run in those weeks. This season, those would rank 15th and 11th-best among wide receivers (minimum 15 targets). Olave leads the NFL in deep targets, and now he faces a pass defense ranked 26th in DVOA against deep passing. Olave is a WR2 that will run about 74% of his routes against Rock Ya-Sin (47.8% catch rate, 66.4 passer rating) and Anthony Averett (80% catch rate, 158.3 passer rating).","start",NA,"WR14","A","15.8"
"ppr-wr","WR",2022-10-29,"13971","Tyler Lockett","WR","SEA",15,15.5,3.09,12,33,"dffa69ad-331e-4f09-ae38-40a5a4406be6","28457","1860834","WR","T. Lockett","WR","WR","https://www.fantasypros.com/nfl/players/tyler-lockett.php","tyler-lockett.php","https://images.fantasypros.com/images/players/nfl/13971/headshot/210x210.png","https://images.fantasypros.com/images/players/nfl/13971/headshot/210x210.png","11",92.1,92.2,92,"vs. NYG","NYG",NA,"Lockett is a low-end WR2 this week. Lockett is the WR24 in fantasy points per game, seeing a 25.4% target share (18th) and 35.5% air-yard share (13th). His best asset is his usage as a downfield weapon (11 deep targets, eighth), as he has only seen four red zone targets. He'll run about 54% of his routes on the perimeter. He could be shadowed by Adoree Jackson (52.9% catch rate, 85.5 passer rating). Jackson has shadowed three times this season following Robert Woods, Robbie Anderson, and CeeDee Lamb on 65-91% of their routes. Jackson only gave up eight targets, six receptions, and 57 receiving yards (one touchdown). Jackson has been the LCB predominantly, and Lockett will run about 46% of his routes against Jackson if they don't move him around more. Jackson has 32 snaps this season in the slot, so he could follow Lockett inside some if they try to hide him in the slot. Lockett has been deemed a game-time call after being limited twice this week in practice (hamstring/ribs).",NA,NA,"WR15","A","15.8"
"ppr-wr","WR",2022-10-29,"13894","Amari Cooper","WR","CLE",16,16.8,1.44,14,21,"00f88be8-45f9-4237-b2b8-3271ec790d07","28392","1984220","WR","A. Cooper","WR","WR","https://www.fantasypros.com/nfl/players/amari-cooper.php","amari-cooper.php","https://images.fantasypros.com/images/players/nfl/13894/headshot/210x210.png","https://images.fantasypros.com/images/players/nfl/13894/headshot/210x210.png","9",95.6,95.1,96,"vs. CIN","CIN",NA,"Cooper is the WR20 in fantasy points per game with a 26.6% target share (16th) and 38% air-yard share (ninth). He has nine deep targets (17th) and eight red zone targets (16th) This game doesn't set up well for him, though. Since Week 4, the Bengals have deployed their corners in zone on 56-60% of their snaps. Cooper has seen most of his target volume against man coverage. Cooper only has 33.3% of his target volume against zone with 1.45 yards per route run (51st, minimum five zone targets). Cooper is a WR3 that will run about 76% of his routes against Chidobe Awuzie (43.9% catch rate, 60.9 passer rating) and Eli Apple (65.5% catch rate, 108.1 passer rating).","start",NA,"WR16","A","14.9"
"ppr-wr","WR",2022-10-29,"19278","Michael Pittman","WR","IND",17,18.02,3.88,12,27,"1aefd5e2-1f85-471a-91a5-4aad4cf6fe6d","32704","2240188","WR","M. Pittman Jr.","WR","WR","https://www.fantasypros.com/nfl/players/michael-pittman.php","michael-pittman.php","https://images.fantasypros.com/images/players/nfl/19278/headshot/210x210.png","https://images.fantasypros.com/images/players/nfl/19278/headshot/210x210.png","14",98.9,98.7,99,"vs. WAS","WAS",NA,"Pittman is the WR12 in fantasy points per game with a 24.0% target share (23rd) and 26.6% air yard share (36th). He's only drawn five red zone targets (33rd) this season with none since Week 4. With Ryan he's 31st in PFF receiving grade and 45th in yards per route run (minimum 15 targets). Pittman will run about 76% of his routes on the perimeter seeing Kendall Fuller (65.7% catch rate, 135.1 passer rating) and Benjamin St.-Juste (48.6% catch rate, 77.4 passer rating) in coverage. Pittman runs more routes as the LWR which means he'll see slightly more Fuller in this matchup as Fuller plays on one side of the field (RCB). If the Colts wish to pick on Fuller with Pittman it should be easy to do. Pittman is a WR2.","start",NA,"WR17","A-","14.8"
"ppr-wr","WR",2022-10-29,"19398","Gabe Davis","WR","BUF",18,20.07,2.94,13,30,"dc397432-7157-4ce4-976d-b9662cc6f551","32798","2804813","WR","G. Davis","WR","WR","https://www.fantasypros.com/nfl/players/gabriel-davis.php","gabriel-davis.php","https://images.fantasypros.com/images/players/nfl/19398/headshot/210x210.png","https://images.fantasypros.com/images/players/nfl/19398/headshot/210x210.png","7",95.7,94.3,97,"vs. GB","GB",NA,"A healthy Gabriel Davis is a bad, bad man. In Weeks 1, 5, and 6, when he has been healthy, he has a 74.8 PFF receiving grade and 2.92 yards per route run averaging 111 receiving yards per game. That would place Davis 28th in PFF receiving grade and second in yards per route run (minimum 15 targets) this season. Davis saw a 16.2% target share in those three weeks and 36% of the team's air yards. He'll run 90% of his routes against Alexander and Stokes. If Alexander follows Diggs, Davis will eat Stokes alive. Davis is a high-end WR2.",NA,NA,"WR18","A-","14.3"
"ppr-wr","WR",2022-10-29,"17268","Christian Kirk","WR","JAC",19,21.35,2.64,17,26,"ebcd87ce-218c-4144-810b-921c2f59d6e8","31017","2180820","WR","C. Kirk","WR","WR","https://www.fantasypros.com/nfl/players/christian-kirk.php","christian-kirk.php","https://images.fantasypros.com/images/players/nfl/17268/headshot/210x210.png","https://images.fantasypros.com/images/players/nfl/17268/headshot/210x210.png","11",92.7,92.3,93,"vs. DEN","DEN",NA,"Kirk is a low-end WR2/WR3. He's the WR18 in fantasy points per game, seeing a 22.7% target share (27th) with increased red zone involvement (nine red zone targets, seventh-best). Lawrence's game manager role and a touch matchup trickle down to Kirk. Kirk is still 29th in yard per route run (minimum 15 targets), but his catchable target rate has dipped to 74.1% (59th). He'll run about 73% of his routes against K'Wauan Williams inside (75% catch rate, 88.8 passer rating).","start",NA,"WR19","A-","14.1"
"ppr-wr","WR",2022-10-29,"17265","DJ Moore","WR","CAR",20,21.37,4.3,13,29,"d8202e6d-d03b-4cd1-a793-ff8fd39d9755","30994","2179328","WR","DJ Moore","WR","WR","https://www.fantasypros.com/nfl/players/dj-moore-wr.php","dj-moore-wr.php","https://images.fantasypros.com/images/players/nfl/17265/headshot/210x210.png","https://images.fantasypros.com/images/players/nfl/17265/headshot/210x210.png","13",94.7,95.3,94,"at ATL","ATL",NA,"Moore showed signs of life last week. He absorbed a 45% target share (nine targets), finishing with seven grabs, 69 receiving yards, and one score as the WR9. Moore has suffered through wretched quarterback play all year. Walker has at least the distinction of a 79.1% on-target rate, which is worlds away from Baker Mayfield's 64.1%. Moore has a 27.8% target share (11th) this season with a 39.4% air yard share (fourth). With A.J. Terrell on the shelf with a shoulder injury and Casey Hayward on the IR, Moore will run about 73% of his routes against Cornell Armstrong (62.5% catch rate, 137.0 passer rating) and Darren Hall (76.9% catch rate, 120.4 passer rating). Moore is a WR2.","start",NA,"WR20","A-","13.5"
