"page","page_pos","scrape_date","fantasypros_id","player_name","pos","team","rank","ecr","sd","best","worst","sportradar_id","yahoo_id","cbs_id","player_positions","player_short_name","player_eligibility","player_yahoo_positions","player_page_url","player_filename","player_square_image_url","player_image_url","player_bye_week","player_owned_avg","player_owned_espn","player_owned_yahoo","player_opponent","player_opponent_id","player_ecr_delta","note","tag","recommendation","pos_rank","start_sit_grade","r2p_pts"
"ppr-wr","WR",2021-12-24,"18244","Deebo Samuel","WR","SF",4,4.94,0.67,4,6,"628a6a0a-4fde-4024-8d7c-28674953d5af","31868","2139735","WR","D. Samuel","WR","WR","https://www.fantasypros.com/nfl/players/deebo-samuel.php","deebo-samuel.php","https://images.fantasypros.com/images/players/nfl/18244/headshot/210x210.png","https://images.fantasypros.com/images/players/nfl/18244/headshot/210x210.png","6",98.6,99.2,98,"at TEN","TEN",1,"Over his previous three games leading up to Week 15, Samuel had reeled in three total receptions. While he was seeing increased usage as an RB, it was concerning how little work Samuel was getting in the receiving game. That changed in Week 15 though as Samuel saw five targets and he reeled in four receptions for 60 yards. On top of his six carries - one of which went for a touchdown - Samuel's back in the top-5 territory in the WR rankings. Against the Titans, Samuel can be locked into your starting lineup.",NA,NA,"WR4","A+","18.5"
"ppr-wr","WR",2021-12-24,"18615","Diontae Johnson","WR","PIT",5,5.6,1.4,4,9,"244c00c7-fe9a-4f4f-adff-1d5b9c8877e7","31898","2194164","WR","D. Johnson","WR","WR","https://www.fantasypros.com/nfl/players/diontae-johnson.php","diontae-johnson.php","https://images.fantasypros.com/images/players/nfl/18615/headshot/210x210.png","https://images.fantasypros.com/images/players/nfl/18615/headshot/210x210.png","7",98.2,98.4,98,"at KC","KC",2,"Consistent target volume is Johnson's calling card, but he saw only five targets against the Titans last week and finished with 5-38-0 in a 19-13 Steelers victory. Consider it a bump in the road for an alpha receiver who's averaged 10.4 targets, 6.6 catches, and 79.1 receiving yards a game in 2021. Johnson is a low-end WR1 this week vs. the Chiefs.",NA,NA,"WR5","A+","18.2"
"ppr-wr","WR",2021-12-24,"11616","Keenan Allen","WR","LAC",6,5.8,1.21,3,8,"5f424505-f29f-433c-b3f2-1a143a04a010","26699","1737096","WR","K. Allen","WR","WR","https://www.fantasypros.com/nfl/players/keenan-allen.php","keenan-allen.php","https://images.fantasypros.com/images/players/nfl/11616/headshot/210x210.png","https://images.fantasypros.com/images/players/nfl/11616/headshot/210x210.png","7",99.2,99.4,99,"at HOU","HOU",NA,"Allen offers one of the safest weekly floors in fantasy football. He's averaging 10.3 targets, 7.1 receptions, and 77.5 receiving yards a game, and he's had only two games this season in which he finished with fewer than 50 receiving yards. Obviously, you're starting Allen in your playoff matchups this week and feeling great about it. He's the WR7.",NA,NA,"WR6","A+","17.4"
"ppr-wr","WR",2021-12-24,"19202","CeeDee Lamb","WR","DAL",7,8.11,1.35,6,12,"a72ea15b-5199-4101-a300-846e1c655add","32687","2865251","WR","C. Lamb","WR","WR","https://www.fantasypros.com/nfl/players/ceedee-lamb.php","ceedee-lamb.php","https://images.fantasypros.com/images/players/nfl/19202/headshot/210x210.png","https://images.fantasypros.com/images/players/nfl/19202/headshot/210x210.png","7",99.7,99.4,100,"vs. WAS","WAS",NA,"Lamb is consistently getting target and reception volume, but the touchdowns gave dried up lately, and it's been a while since we've gotten a 100-yard game out of him. He's averaging 8.4 targets a game, and he's had six or more catches in four of his last five outings. But Lamb has gone four games without a touchdown, and his last 100-yard day was on Halloween. This week, Lamb gets a rematch against Washington, which held him to 7-61-0 in Week 14. Lamb checks in at WR8 in this week's rankings.",NA,NA,"WR7","A","17.0"
"ppr-wr","WR",2021-12-24,"19788","JaMarr Chase","WR","CIN",8,9.17,0.91,7,11,"fa99e984-d63b-4ef4-a164-407f68a7eeaf","33393","2966320","WR","J. Chase","WR","WR","https://www.fantasypros.com/nfl/players/jamarr-chase.php","jamarr-chase.php","https://images.fantasypros.com/images/players/nfl/19788/headshot/210x210.png","https://images.fantasypros.com/images/players/nfl/19788/headshot/210x210.png","10",98.6,99.1,98,"vs. BAL","BAL",NA,"Chase's catastrophic Week 15 stat line - four targets, one catch for three yards - no doubt doomed a lot of fantasy managers to playoff elimination. Chase has scored 10 touchdowns this season, but his weekly yardage totals have been erratic. He's had a 201-yard game and a 159-yard game, and he churned out 101 receiving yards in his Week 1 debut. But Chase has produced 52 or fewer receiving yards in six of his last seven games, so his value has become increasingly TD dependent. The good news is that Chase gets a smash matchup this week against an injury-depleted Ravens secondary that he's already destroyed once. That 201-yard game? It came against Baltimore in Week 7, with Chase racking up eight catches and scoring on an 82-yard touchdown. This is a get-right spot for Chase, so if you survived his Week 15 dud, there's a good chance he'll make it up to you this week. Chase lands at WR9 in this week's rankings.",NA,NA,"WR8","A","16.3"
"ppr-wr","WR",2021-12-24,"13981","Stefon Diggs","WR","BUF",9,9.69,1.24,8,13,"a1c40664-b265-4083-aad2-54b4c734f2c5","28534","2000038","WR","S. Diggs","WR","WR","https://www.fantasypros.com/nfl/players/stefon-diggs.php","stefon-diggs.php","https://images.fantasypros.com/images/players/nfl/13981/headshot/210x210.png","https://images.fantasypros.com/images/players/nfl/13981/headshot/210x210.png","7",100,99.9,100,"at NE","NE",NA,"Diggs didn't do much this past week from a yardage perspective - just 35 yards on 4 receptions - but he was able to save his fantasy day by finding the end zone. Lately, Diggs has needed that touchdown to be able to vault him up the fantasy rankings, which is concerning as heads into this matchup. JC Jackson should cover Diggs for the majority of the game, which is an extremely difficult matchup for opposing WRs. He'll bring a safe floor due to the projected target volume, but the upside to be a top-5 option this week probably isn't there. He can be viewed as a low-end WR1.",NA,NA,"WR9","A","16.1"
"ppr-wr","WR",2021-12-24,"19211","Tee Higgins","WR","CIN",10,12,1.64,9,16,"7963b029-5de4-4541-b00a-44eefe4349af","32703","2809208","WR","T. Higgins","WR","WR","https://www.fantasypros.com/nfl/players/tee-higgins.php","tee-higgins.php","https://images.fantasypros.com/images/players/nfl/19211/headshot/210x210.png","https://images.fantasypros.com/images/players/nfl/19211/headshot/210x210.png","10",94.5,93.9,95,"vs. BAL","BAL",NA,"Higgins' streak of three consecutive 100-yard games was snapped with a 2-23-0 performance against the Broncos in Week 15. A tough matchup against a good group of Denver cornerbacks might have had something to do with Higgins' slow day, but the Bengals attempted only 22 passes, and Higgins only saw three targets, so there weren't many opportunities. A Week 16 date with the Ravens could get Higgins back on track. With Marlon Humphrey out for the season with a pectoral injury, the Ravens are hurting at cornerback. Higgins saw a season-high 15 targets against the Ravens back in Week 7 but finished with 7-62-0 in an inefficient performance. If Higgins gets double-digit targets in Week 16, he'll likely put up big numbers. He's a high-end WR2 for Week 16.",NA,NA,"WR10","A","16.1"
"ppr-wr","WR",2021-12-24,"13971","Tyler Lockett","WR","SEA",11,12.29,1.78,9,16,"dffa69ad-331e-4f09-ae38-40a5a4406be6","28457","1860834","WR","T. Lockett","WR","WR","https://www.fantasypros.com/nfl/players/tyler-lockett.php","tyler-lockett.php","https://images.fantasypros.com/images/players/nfl/13971/headshot/210x210.png","https://images.fantasypros.com/images/players/nfl/13971/headshot/210x210.png","9",96.8,96.6,97,"vs. CHI","CHI",NA,"Lockett missed the Seahawks' Tuesday-night loss to the Rams because he was on the COVID-19 list. He's expected back this week, and he gets a favorable draw against a leaky Chicago secondary that's given up 26 TD passes and is yielding 24.3 fantasy points per game (0.5) to wide receivers. Lockett has a boom-or-bust production profile, but it's easy to see the potential boom in this matchup. He's a high-end WR2.",NA,NA,"WR11","A","15.8"
"ppr-wr","WR",2021-12-24,"18345","Hunter Renfrow","WR","LV",12,12.69,1.89,9,17,"34c523c7-bc58-49f0-a9cc-f9edd91fe00f","31981","2144726","WR","H. Renfrow","WR","WR","https://www.fantasypros.com/nfl/players/hunter-renfrow.php","hunter-renfrow.php","https://images.fantasypros.com/images/players/nfl/18345/headshot/210x210.png","https://images.fantasypros.com/images/players/nfl/18345/headshot/210x210.png","8",90,91.9,88,"vs. DEN","DEN",NA,"After turning in three straight 100-yard games, Renfrow fell back down to Earth with a 3-32-0 game against the Browns on Monday. Renfrow draws a tricky individual matchup against Broncos slot corner Bryce Callahan in Week 16, but Derek Carr's bread-and-butter receiver is still a must-start in your fantasy playoff matchups. He's a mid-range WR2 this week.",NA,NA,"WR12","A","15.7"
"ppr-wr","WR",2021-12-24,"9808","Antonio Brown","WR","TB",13,13.83,3.28,8,23,"16e33176-b73e-49b7-b0aa-c405b47a706e","24171","1272852","WR","A. Brown","WR","WR","https://www.fantasypros.com/nfl/players/antonio-brown.php","antonio-brown.php","https://images.fantasypros.com/images/players/nfl/9808/headshot/210x210.png","https://images.fantasypros.com/images/players/nfl/9808/headshot/210x210.png","9",86.4,81.8,91,"at CAR","CAR",NA,"An ankle injury and a three-game suspension for using a fake vaccination card have kept Brown out of action since Week 6. His return is most welcome for the Buccaneers, who lost Chris Godwin to a torn ACL and probably won't have Mike Evans or Leonard Fournette for a few weeks because of hamstring injuries. In five games this season, Brown has racked up 29-418-4 receiving. Before the ankle injury, he was the WR7 in fantasy points per game (0.5 PPR), averaging 16.2. Even with target competition from Godwin and Evans, Brown was averaging 8.4 targets per game. He has a good chance to see double-digit targets this week with Godwin and Evans out of the picture. Brown checks in at WR11.",NA,NA,"WR13","A","15.7"
"ppr-wr","WR",2021-12-24,"19790","Jaylen Waddle","WR","MIA",14,16.2,1.94,14,21,"0ff9a975-669d-4851-a95d-ab28d9fc29c4","33394","2962110","WR","J. Waddle","WR","WR","https://www.fantasypros.com/nfl/players/jaylen-waddle.php","jaylen-waddle.php","https://images.fantasypros.com/images/players/nfl/19790/headshot/210x210.png","https://images.fantasypros.com/images/players/nfl/19790/headshot/210x210.png","14",93.1,93.1,93,"at NO","NO",NA,"Waddle spent Week 15 on the COVID-19 list but is expected to return for a Week 16 matchup against a Saints defense that's had trouble covering slot receivers. Saints slot corner C.J. Gardner-Johnson has yielded a 69% catch rate and is giving up 1.4 yards per route into his coverage. Over his last three games, Waddle has 26-292-1 on 30 targets. Regard him as a mid-range WR2.",NA,NA,"WR14","A","15.2"
"ppr-wr","WR",2021-12-24,"18219","DK Metcalf","WR","SEA",15,17,3.37,11,24,"754faf0f-40f7-45f0-b23b-6ce990ecaf26","31896","2260185","WR","D.K. Metcalf","WR","WR","https://www.fantasypros.com/nfl/players/dk-metcalf.php","dk-metcalf.php","https://images.fantasypros.com/images/players/nfl/18219/headshot/210x210.png","https://images.fantasypros.com/images/players/nfl/18219/headshot/210x210.png","9",99.1,99.1,99,"vs. CHI","CHI",2,"Metcalf's struggles continue. Even with teammate Tyler Lockett on the COVID-19 list for Week 15, Metcalf was only able to turn 12 targets into 6-52-0 in a Tuesday-night loss to the Rams. Metcalf has gone six straight games without a touchdown and hasn't exceeded 60 receiving yards in any game during that stretch. He gets a juicy matchup against a shaky Chicago pass defense this week, but Metcalf and QB Russell Wilson have demonstrated so little chemistry ever since Wilson returned from a finger injury that it's hard to feel confident about plugging Metcalf into your lineup. He's the WR19 for Week 16.",NA,NA,"WR15","A","15.0"
"ppr-wr","WR",2021-12-24,"18226","Marquise Brown","WR","BAL",16,18.89,3.79,14,28,"feeee40a-dd63-41a7-89cd-6c95b5456833","31857","2804128","WR","M. Brown","WR","WR","https://www.fantasypros.com/nfl/players/marquise-brown.php","marquise-brown.php","https://images.fantasypros.com/images/players/nfl/18226/headshot/210x210.png","https://images.fantasypros.com/images/players/nfl/18226/headshot/210x210.png","8",94.1,95.1,93,"at CIN","CIN",5,"Brown's unexpected transition from a deep-ball artist to a short-area receiver continued in Week 15 with a truly unusual performance. Brown was targeted 14 times and had a season-high 10 catches, but he produced only 43 receiving yards. Most of Brown's catches came late in the game with the Ravens trying to come back from a deficit. Backup QB Tyler Huntley kept peppering Brown with quick passes within a yard or two of the line of scrimmage, and Packers CB Eric Stokes would quickly close in on Brown and make the tackle after a short gain. Brown hasn't topped 55 yards since Week 9 and hasn't scored a touchdown since Week 7. He's a high-end WR3 this week.","start",NA,"WR16","A-","14.9"
"ppr-wr","WR",2021-12-24,"13429","Adam Thielen","WR","MIN",17,20.06,3,15,26,"2fa2b2da-4aa9-44b5-b27e-56876dfe2ad4","27277","2059362","WR","A. Thielen","WR","WR","https://www.fantasypros.com/nfl/players/adam-thielen.php","adam-thielen.php","https://images.fantasypros.com/images/players/nfl/13429/headshot/210x210.png","https://images.fantasypros.com/images/players/nfl/13429/headshot/210x210.png","7",97.3,97.5,97,"vs. LAR","LAR",NA,"At the time of writing, it's unclear if Thielen is going to be able to make it back for this matchup. We'll need to continue to monitor the situation as the week progresses, but if Thielen does return in Week 16, he's worth rolling out there as a mid-range WR3 due to his involvement in the red zone.",NA,NA,"WR17","A-","14.8"
"ppr-wr","WR",2021-12-24,"19278","Michael Pittman","WR","IND",18,20.26,2.35,16,27,"1aefd5e2-1f85-471a-91a5-4aad4cf6fe6d","32704","2240188","WR","M. Pittman Jr.","WR","WR","https://www.fantasypros.com/nfl/players/michael-pittman.php","michael-pittman.php","https://images.fantasypros.com/images/players/nfl/19278/headshot/210x210.png","https://images.fantasypros.com/images/players/nfl/19278/headshot/210x210.png","14",92.5,92,93,"at ARI","ARI",NA,"Pittman had a chance for a big play last week before getting ejected, but Wentz wasn't able to connect with him deep downfield. His fantasy managers were disappointed last week due to the fact that he only put up seven receiving yards before exiting the game, but he should be put right back into starting lineups this week against Arizona. The Colts are most likely going to have to throw more this week and Pittman's still a key focal point for them on offense. He should bring a safe floor and that's invaluable right now in fantasy football. He can be viewed as a low-end WR2 for Week 16.",NA,NA,"WR18","A-","14.7"
"ppr-wr","WR",2021-12-24,"18218","AJ Brown","WR","TEN",19,21.8,4.83,12,40,"a9e580f2-1fbe-46fb-887c-c84089b507e4","31883","2258303","WR","A.J. Brown","WR","WR","https://www.fantasypros.com/nfl/players/aj-brown.php","aj-brown.php","https://images.fantasypros.com/images/players/nfl/18218/headshot/210x210.png","https://images.fantasypros.com/images/players/nfl/18218/headshot/210x210.png","13",92.8,91.5,94,"vs. SF","SF",7,"Brown has been designated to return off of IR now and there's the possibility that he's back in the lineup as early as this week. While fantasy managers are going to be excited to have Brown back, it's worth remembering that Brown really hasn't done much this season to warrant consideration as a locked-in starter for Week 16. There were two games in the middle of the season where he put up 133 and 155 receiving yards back-to-back, but he followed those up with three dud performances before getting injured. With Julio Jones likely done for the season after re-aggravating his hamstring injury, Brown should see plenty of volume. However, this offense isn't as high-powered as it once was and Brown producing top-15 numbers at the WR position can't be viewed as a guarantee. He's a low-end WR2/high-end WR3 if he suits up this week.",NA,NA,"WR19","A-","14.5"
"ppr-wr","WR",2021-12-24,"15802","Tyreek Hill","WR","KC",20,17.06,23.17,3,112,"01d8aee3-e1c4-4988-970a-8c0c2d08bd83","29399","2131163","WR","T. Hill","WR","WR","https://www.fantasypros.com/nfl/players/tyreek-hill.php","tyreek-hill.php","https://images.fantasypros.com/images/players/nfl/15802/headshot/210x210.png","https://images.fantasypros.com/images/players/nfl/15802/headshot/210x210.png","12",100,99.9,100,"vs. PIT","PIT",-15,NA,NA,NA,"WR20","A","14.4"
"ppr-wr","WR",2021-12-24,"19799","Amon-Ra St Brown","WR","DET",21,21.91,3.83,18,33,"26ef0447-29b8-4dd1-9831-dcbf8132bb74","33500","2967690","WR","A. St. Brown","WR","WR","https://www.fantasypros.com/nfl/players/amonra-stbrown.php","amonra-stbrown.php","https://images.fantasypros.com/images/players/nfl/19799/headshot/210x210.png","https://images.fantasypros.com/images/players/nfl/19799/headshot/210x210.png","9",57.3,47.6,67,"at ATL","ATL",NA,"St. Brown has always had the talent and ability to make an impact for fantasy football this season, but the Lions have only just recently unleashed him and it's working. He now has 35 targets over the past three weeks and he's hauled in 26 of them for 249 yards and two touchdowns over that time frame. He's been a dominant fantasy asset and he now gets to take on the Atlanta Falcons secondary that cannot stop anyone. They're allowing the 5th most fantasy points to opposing WRs this year and St. Brown should continue to see plenty of volume to return low-end WR2 value.",NA,NA,"WR21","A-","14.3"
"ppr-wr","WR",2021-12-24,"16377","Mike Williams","WR","LAC",22,22.03,3.82,14,30,"12f27311-7cd6-4ca5-ba7d-571e9de5e1eb","30120","2082516","WR","M. Williams","WR","WR","https://www.fantasypros.com/nfl/players/mike-williams-wr.php","mike-williams-wr.php","https://images.fantasypros.com/images/players/nfl/16377/headshot/210x210.png","https://images.fantasypros.com/images/players/nfl/16377/headshot/210x210.png","7",94.8,94.5,95,"at HOU","HOU",NA,"Williams stakeholders were delighted with their investment over the first five weeks of the season but have mostly been disappointed ever since. In Week 15, Williams turned in another frustrating performance, with 3-49-0 on nine targets against the Chiefs. Things could have been so much better. On the Chargers' first drive, Justin Herbert targeted Williams on three straight throws into the end zone from the Chiefs' 5-yard line, but Williams dropped one of the throws and the other two were also incomplete. There's tremendous splash-play potential here - as we saw when Williams racked up six touchdowns in his first five games of the season - but Williams is just a mid-range WR3 this week vs. the Texans.","start",NA,"WR22","B+","14.3"
"ppr-wr","WR",2021-12-24,"17268","Christian Kirk","WR","ARI",23,23.29,3.03,16,28,"ebcd87ce-218c-4144-810b-921c2f59d6e8","31017","2180820","WR","C. Kirk","WR","WR","https://www.fantasypros.com/nfl/players/christian-kirk.php","christian-kirk.php","https://images.fantasypros.com/images/players/nfl/17268/headshot/210x210.png","https://images.fantasypros.com/images/players/nfl/17268/headshot/210x210.png","12",73,67,79,"vs. IND","IND",NA,"With no Deandre Hopkins in the lineup, Kirk was able to come through for fantasy managers with a 9-94-1 stat line. While the majority of his production came late in the game, Kirk was the clear WR1 in Hopkins' absence and that should give us confidence in playing him again here in Week 16 against the Colts. Indianapolis is middle of the pack when it comes to defending opposing WRs this season, so we shouldn't be scared off of playing Kirk in this matchup. With the guaranteed targets, plus his talent and ability, Kirk's a solid low-end WR2/high-end WR3 for Week 16.",NA,NA,"WR23","B+","14.2"
"ppr-wr","WR",2021-12-24,"18466","Terry McLaurin","WR","WAS",24,24.09,3.04,19,32,"7e8c4641-2beb-4213-ba22-69fe0307005f","31908","2139279","WR","T. McLaurin","WR","WR","https://www.fantasypros.com/nfl/players/terry-mclaurin.php","terry-mclaurin.php","https://images.fantasypros.com/images/players/nfl/18466/headshot/210x210.png","https://images.fantasypros.com/images/players/nfl/18466/headshot/210x210.png","9",98,98,98,"at DAL","DAL",-4,"Another week, another frustrating result for McLaurin investors. With a COVID-19 outbreak among the Washington quarterbacks forcing the Football Team to start third-stringer Garrett Gilbert against the Eagles in Week 15, McLaurin had 2-51-0 on four targets. McLaurin has produced 60 or fewer receiving yards in six of his last seven games, and he's scored just one touchdown over that stretch. McLaurin's immense talent keeps tempting us to use him even when the numbers say we should probably stay away. McLaurin is a low-end WR2 this week in a matchup against the Cowboys and CB Trevon Diggs.",NA,NA,"WR24","B","14.1"
"ppr-wr","WR",2021-12-24,"17606","Russell Gage","WR","ATL",25,24.49,3.27,18,31,"4501e6f4-4683-4357-b241-8b4a0b6aae81","31164","2131694","WR","R. Gage","WR","WR","https://www.fantasypros.com/nfl/players/russell-gage.php","russell-gage.php","https://images.fantasypros.com/images/players/nfl/17606/headshot/210x210.png","https://images.fantasypros.com/images/players/nfl/17606/headshot/210x210.png","6",63.7,58.4,69,"vs. DET","DET",NA,"Did you all see Gage ""Moss"" a defender last week for a touchdown?! After being considered simply a slot receiver that doesn't bring a ton of dynamic ability to the table, Gage has really rounded into a solid receiver here this season and he's stepping up for the Falcons offense in a big way. Over the course of the last four games, Gage has three top-12 fantasy finishes and he's now locked into starting lineups moving forward. Against the Lions' secondary this week, Gage can be viewed as a high-end WR3.","start",NA,"WR25","B","13.8"
"ppr-wr","WR",2021-12-24,"17265","DJ Moore","WR","CAR",26,26.49,4.78,18,37,"d8202e6d-d03b-4cd1-a793-ff8fd39d9755","30994","2179328","WR","D.J. Moore","WR","WR","https://www.fantasypros.com/nfl/players/dj-moore-wr.php","dj-moore-wr.php","https://images.fantasypros.com/images/players/nfl/17265/headshot/210x210.png","https://images.fantasypros.com/images/players/nfl/17265/headshot/210x210.png","13",96.3,96.6,96,"vs. TB","TB",6,"Moore has 78-986-4 for the season and is the WR17 in fantasy scoring. But Cam Newton has completed 54.9% of his passes and averaged 5.5 yards per pass attempt since rejoining the Panthers, so any bet on a Carolina receiver carries some degree of risk. The talented Moore has seen double-digit targets in three straight games and has 16-235-0 over that span. Consider him a mid-range WR3 this week.","start",NA,"WR26","B","13.3"
"ppr-wr","WR",2021-12-24,"13894","Amari Cooper","WR","DAL",27,26.69,3,19,32,"00f88be8-45f9-4237-b2b8-3271ec790d07","28392","1984220","WR","A. Cooper","WR","WR","https://www.fantasypros.com/nfl/players/amari-cooper.php","amari-cooper.php","https://images.fantasypros.com/images/players/nfl/13894/headshot/210x210.png","https://images.fantasypros.com/images/players/nfl/13894/headshot/210x210.png","7",97.8,97.5,98,"vs. WAS","WAS",NA,"Cooper is coming off his worst game of the season, a 2-8-0 performance against the Giants. While the Cowboys' passing game has fallen into a funk, Cooper finds himself mired in a slump. Over his last five games, he's averaging 4.6 targets, 3.0 catches, and 37.6 yards per game, with one touchdown over that span. Cooper's talent demands that he at least be kept in consideration for a lineup spot in your Week 16 fantasy matchup, but at WR32 this week, he'll be a tough start/sit call for a lot of fantasy managers.",NA,NA,"WR27","B-","12.9"
"ppr-wr","WR",2021-12-24,"12127","Odell Beckham","WR","LAR",28,30.29,4.13,16,39,"354dec38-b88b-4ba0-8974-859123f27c45","27540","1824823","WR","O. Beckham Jr.","WR","WR","https://www.fantasypros.com/nfl/players/odell-beckham.php","odell-beckham.php","https://images.fantasypros.com/images/players/nfl/12127/headshot/210x210.png","https://images.fantasypros.com/images/players/nfl/12127/headshot/210x210.png","11",90,90,90,"at MIN","MIN",NA,"OBJ wasn't able to make much of an impact in Week 15 as he saw just three total targets and reeled in one of them for just seven yards. This wasn't abnormal for this past week though with so many other star fantasy assets disappointing, but it still crushed your lineup if you started him. Looking ahead to Week 16, we can't be as optimistic about OBJ as we would have been previously, but he should still be in your starting lineup due to the upside he provides. Against the Vikings secondary that's allowing the most fantasy points to opposing WRs this season, OBJ can be viewed as a mid-range WR3 that could put up a monstrous performance.","start",NA,"WR28","B-","12.6"
