"page","page_pos","scrape_date","fantasypros_id","player_name","pos","team","rank","ecr","sd","best","worst","sportradar_id","yahoo_id","cbs_id","player_positions","player_short_name","player_eligibility","player_yahoo_positions","player_page_url","player_filename","player_square_image_url","player_image_url","player_bye_week","player_owned_avg","player_owned_espn","player_owned_yahoo","player_opponent","player_opponent_id","player_ecr_delta","note","tag","recommendation","pos_rank","start_sit_grade","r2p_pts"
"qb","QB",2023-11-14,"17298","Josh Allen","QB","BUF",1,1,0,1,1,"3069db07-aa43-4503-ab11-2ae5c0002721","30977","2181054","QB","J. Allen","QB","QB","https://www.fantasypros.com/nfl/players/josh-allen-qb.php","josh-allen-qb.php","https://images.fantasypros.com/images/players/nfl/17298/headshot/210x210.png","https://images.fantasypros.com/images/players/nfl/17298/headshot/210x210.png","13",100,99.9,100,"vs. DEN","DEN",NA,"Allen remains a fantasy behemoth as the QB1 overall this season. Allen is still performing at a ridiculously high level, ranking second in passing grade, seventh in yards per attempt, second in passing touchdowns, and fifth in adjusted completion rate. Denver has been a reformed pass defense since Week 5. The Broncos in that timeframe have allowed the 13th-lowest yards per attempt, the 11th-lowest passer rating, and second-fewest passing touchdowns. Allen has the talent and the weapons to overcome a bad matchup. Week 10 Positional Value: QB1",NA,NA,"QB1","A+","23.6"
"qb","QB",2023-11-14,"19196","Joe Burrow","QB","CIN",2,2.67,1.09,2,6,"3023ac10-4e7f-425f-9fc5-2b8e6332c92e","32671","2179798","QB","J. Burrow","QB","QB","https://www.fantasypros.com/nfl/players/joe-burrow.php","joe-burrow.php","https://images.fantasypros.com/images/players/nfl/19196/headshot/210x210.png","https://images.fantasypros.com/images/players/nfl/19196/headshot/210x210.png","7",99.4,98.7,100,"vs. HOU","HOU",NA,"A fully healthy Burrow has been a beautiful thing to watch. Since Week 5, he has been on a tear as the QB4 in fantasy. In his last four games, he has been fourth in passing grade, first in passing touchdowns, and third in adjusted completion rate. The Texans' pass defense has been evaporating. Since Week 5, they have allowed the second-highest passing yards per game and yards per attempt while giving up the eighth-highest adjusted completion rate. The reason for their struggle has been tied to woes with defending the deep ball. They have allowed the ninth-highest yards per attempt, the eighth-highest adjusted completion rate, and the seventh-highest deep passing yards per game. Week 10 Positional Value: QB1",NA,NA,"QB2","A","20.8"
"qb","QB",2023-11-14,"15600","Dak Prescott","QB","DAL",3,3.54,1.12,2,6,"86197778-8d4b-4eba-affe-08ef7be7c70b","29369","1824864","QB","D. Prescott","QB","QB","https://www.fantasypros.com/nfl/players/dak-prescott.php","dak-prescott.php","https://images.fantasypros.com/images/players/nfl/15600/headshot/210x210.png","https://images.fantasypros.com/images/players/nfl/15600/headshot/210x210.png","7",94.7,92.3,97,"vs. NYG","NYG",1,"Since Week 6, Prescott has been playing some of the best football of his career. Over his last three games, he ranks first in passing grade, yards per attempt, and big-time throw rate with QB1, QB3, and QB2 finishes. The Giants will be a tougher test through the air than many realize. While they have been destroyed on the ground all season, their pass defense has started to take shape. Since Week 6, they have the highest man coverage rate (51.7%) in the NFL. In this stretch, they have held passers to the ninth-lowest yards per attempt, the seventh-lowest passer rating, and the second-lowest adjusted completion rate. Against man coverage this season, Prescott has feasted with the sixth-highest yards per attempt and passer rating while also ranking eighth in fantasy points per dropback. Prescott will also have to deal with the blitz this week as the Giants have the second-highest blitz rate (43.1%) despite ranking 15th in pressure rate. Against the blitz, Prescott is sixth in passing grade, eighth in yards per attempt, and sixth in adjusted completion rate. Week 10 Positional Value: QB1",NA,NA,"QB3","A","19.9"
"qb","QB",2023-11-14,"17233","Lamar Jackson","QB","BAL",4,4.1,1.31,2,8,"e06a9c07-453a-4bb0-a7e9-2c3a64166dad","31002","2181169","QB","L. Jackson","QB","QB","https://www.fantasypros.com/nfl/players/lamar-jackson.php","lamar-jackson.php","https://images.fantasypros.com/images/players/nfl/17233/headshot/210x210.png","https://images.fantasypros.com/images/players/nfl/17233/headshot/210x210.png","13",99.8,99.6,100,"vs. CLE","CLE",-1,"Jackson is the QB7 in fantasy after two subpar fantasy performances where Baltimore just ran the ball down their opponent's throats, and the touchdowns flowed to Gus Edwards. Jackson has been playing at an extremely high level as a passer, ranking fourth in yards per attempt, fifth in adjusted completion rate, and fourth in hero throw rate. Add in his rushing upside (first in rushing yards and third in rushing touchdowns), and you have a fantasy quarterback that can go nuclear any week. Since Week 6, the Browns have utilized the third-highest rate of man coverage (42.0%) and the highest rate of single-high (73.3%). Against man coverage and single-high looks, Jackson's fantasy points per dropback has dropped from 0.57 (overall) to 0.43. That ranks 25th against man coverage and 13th against single-high. Anyway, you slice it, this is a tough draw for Jackson as he faces a Browns' secondary that, over the last four weeks, has given up the fourth-lowest passer rating, the lowest adjusted completion rate, and the 13th-fewest fantasy points via passing. Week 10 Positional Value: QB1",NA,NA,"QB4","A","18.7"
"qb","QB",2023-11-14,"18635","Justin Herbert","QB","LAC",5,4.6,1.32,2,7,"f0a8f8e3-b9e9-46ed-85e4-eec6452a8a44","32676","2221960","QB","J. Herbert","QB","QB","https://www.fantasypros.com/nfl/players/justin-herbert.php","justin-herbert.php","https://images.fantasypros.com/images/players/nfl/18635/headshot/210x210.png","https://images.fantasypros.com/images/players/nfl/18635/headshot/210x210.png","5",98.8,98.6,99,"vs. DET","DET",NA,"Herbert roasted the Bears' secondary in Week 8, but sandwiched around that game have been QB22 and QB26 weeks where Herbert has looked like a shell of himself. Since Week 7, he has been 16th in passing grade, 19th in yards per attempt, and tenth in turnover-worthy play rate. Since Week 5, the Lions have allowed the 11th-highest yards per attempt, but they have kept passers in check in every other area. They have the 14th-lowest CPOE, the sixth-lowest adjusted completion rate, and the 11th-lowest fantasy points allowed via passing. Over their last four games, Detroit has ranked tenth in pressure rate. Since Week 7, Herbert has not dealt with pressure well, with the 14th-lowest passing grade, the 12th-lowest yards per attempt, and the 11th-highest turnover-worthy play rate. In a high total game, Herbert can likely squeeze out fantasy numbers that will put him around the QB1 status, but don't expect a banner performance in Week 10. Week 10 Positional Value: Low-end QB1",NA,NA,"QB5","A","18.2"
"qb","QB",2023-11-14,"15501","Jared Goff","QB","DET",6,5.92,1.37,3,10,"aba8f925-ffbf-4654-bfa7-a25d3d237494","29235","2061053","QB","J. Goff","QB","QB","https://www.fantasypros.com/nfl/players/jared-goff.php","jared-goff.php","https://images.fantasypros.com/images/players/nfl/15501/headshot/210x210.png","https://images.fantasypros.com/images/players/nfl/15501/headshot/210x210.png","9",85.4,76.7,94,"at LAC","LAC",NA,"Goff is the QB13 in fantasy points per game with three top-ten weekly finishes this season. Goff has been playing exceptional football all season. He is fourth in passing grade, ninth in yards per attempt, and first in adjusted completion rate. Digging even deeper, he is sixth in highly accurate throw rate and 12th in hero throw rate. This is arguably the best football of his career. The Chargers pass defense continues to struggle. Since Week 5, they have allowed the sixth-highest yards per attempt, the fourth-highest adjusted completion rate, and the third-highest CPOE. Overall, they have given up the fourth-most fantasy points per game to quarterbacks. Goff should carve them up with a surgical performance in Week 10. Week 10 Positional Value: QB1","start",NA,"QB6","A","17.8"
"qb","QB",2023-11-14,"23071","CJ Stroud","QB","HOU",7,8.23,1.45,5,11,"7e91086f-9ca4-4bd9-a099-b88b2f37e6c6","40030","3163079","QB","C.J. Stroud","QB","QB","https://www.fantasypros.com/nfl/players/cj-stroud.php","cj-stroud.php","https://images.fantasypros.com/images/players/nfl/23071/headshot/210x210.png","https://images.fantasypros.com/images/players/nfl/23071/headshot/210x210.png","7",91.3,92.5,90,"at CIN","CIN",NA,"After last week's historic performance, Stroud is the QB5 in fantasy. Stroud has been a stone-cold baller since Week 3, ranking seventh in passing grade, second in yards per attempt, and eighth in hero throw rate. He faces a stout Cincy pass defense that, since Week 5, has allowed the tenth-lowest fantasy points per game passing and the ninth-lowest passer rating, but the Bengals are not without their warts. During this stretch, they have also given up the fourth-highest yards per attempt, which can be attributed to their problems defending the deep ball. Over their last four games, they have allowed the fifth-highest passer rating, the eighth-most deep passing yards per game, and the eighth-highest deep completion rate. I can't wait to see Stroud go toe to toe with Joe Cool this week. Week 10 Positional Value: QB1","start",NA,"QB7","B+","17.4"
"qb","QB",2023-11-14,"11687","Geno Smith","QB","SEA",8,8.56,2.29,5,15,"cfc93f5e-105e-4a5e-88d3-f4279893cfa8","26662","1700358","QB","G. Smith","QB","QB","https://www.fantasypros.com/nfl/players/geno-smith.php","geno-smith.php","https://images.fantasypros.com/images/players/nfl/11687/headshot/210x210.png","https://images.fantasypros.com/images/players/nfl/11687/headshot/210x210.png","5",69,61.9,76,"vs. WAS","WAS",3,"Smith has gotten a bad rap this season for his play. He only has one QB1 performance on his resume this season, but his deeper passing metrics all scream that he is playing better than that. Smith is 13th in passing grade, big-time throw rate, and adjusted completion rate. Smith is fifth in hero throw rate. Smith should post his second QB1 game of the season against Washington this week. Since Week 4, the Commanders have given up the sixth-highest yards per attempt, the second-highest passing yards per game, and the fifth-highest passer rating. Week 10 Positional Value: QB1","start",NA,"QB8","B+","17.1"
"qb","QB",2023-11-14,"19797","Brock Purdy","QB","SF",9,8.56,1.59,5,13,"d5aef708-ad61-4ab8-a637-62ff96e92040","34218","2961306","QB","B. Purdy","QB","QB","https://www.fantasypros.com/nfl/players/brock-purdy.php","brock-purdy.php","https://images.fantasypros.com/images/players/nfl/19797/headshot/210x210.png","https://images.fantasypros.com/images/players/nfl/19797/headshot/210x210.png","9",81.5,77,86,"at JAC","JAC",NA,"Purdy is the QB14 in fantasy. After two down games, he rebounded in fantasy with a QB12 outing in Week 8. Purdy has four weeks with QB1 fantasy output this season. Looking at his full-season resume, Purdy has still been quite good for fantasy while we can poke some holes in his real-life quarterback play. Purdy is first in yards per attempt, second in passer rating, and third in fantasy points per dropback, but he is also 25th in highly accurate throw rate and 20th in hero throw rate. This speaks to Purdy being a serviceable real-life quarterback, but he's not among the league's elites. Since Week 6, Jacksonville has had the third-highest rate of zone coverage (82.2%). Against zone, Purdy has been ninth in first-read rate, so expect him to zero in on San Francisco's zone-beater this week. Jacksonville has been a pass funnel, but not one that we should be heavily targeting. Since Week 5, they have allowed the third-most passing yards per game, but they also are tied for the most interceptions, the tenth-lowest passing touchdowns, and the seventh-lowest adjusted completion rate allowed. Purdy should be able to rack up the yardage this week, but touchdowns and efficiency will be the question marks. Week 10 Positional Value: QB1 ","start",NA,"QB9","B","16.9"
"qb","QB",2023-11-14,"23045","Sam Howell","QB","WAS",10,9.83,1.69,7,14,"7d85e9c2-f464-4654-9200-acfcffd7dfaf","34100","3123797","QB","S. Howell","QB","QB","https://www.fantasypros.com/nfl/players/sam-howell.php","sam-howell.php","https://images.fantasypros.com/images/players/nfl/23045/headshot/210x210.png","https://images.fantasypros.com/images/players/nfl/23045/headshot/210x210.png","14",72.8,72.6,73,"at SEA","SEA",NA,"Howell is the QB10 in fantasy. He has been a passing volume monster, ranking first in passing attempts, second in passing yards, and first in air yards. He is the QB20 in fantasy points per dropback, but the volume has helped prop him up as the QB3 in expected fantasy points per game. Howell has been an adventure, ranking 26th in passing grade, 19th in yards per attempt, fifth in big-time throw rate, and 11th-highest in turnover-worthy play rate. The volume will remain on his side, but this week's matchup is gruesome. Since Week 4, Seattle has allowed the third-lowest yards per attempt, the seventh-lowest passer rating, and the third-lowest fantasy points via passing. Week 10 Positional Value: Borderline QB1","start",NA,"QB10","B","16.6"
"qb","QB",2023-11-14,"19780","Trevor Lawrence","QB","JAC",11,10.19,1.24,6,13,"aaa8b42c-4d87-45f6-bfd2-e31cfed9a736","33389","2967185","QB","T. Lawrence","QB","QB","https://www.fantasypros.com/nfl/players/trevor-lawrence.php","trevor-lawrence.php","https://images.fantasypros.com/images/players/nfl/19780/headshot/210x210.png","https://images.fantasypros.com/images/players/nfl/19780/headshot/210x210.png","9",91.5,88,95,"vs. SF","SF",-2,"Lawrence has been underwhelming in fantasy this season as the QB19 in fantasy. He has only three QB1 weeks this season, and two of those performances came against the Colts. Lawrence is 15th in yards per attempt, 13th in passer rating, and 20th in fantasy points per dropback. Since Week 5, the 49ers have allowed the ninth-highest yards per attempt and the 12th-highest adjusted completion rate as their pass defense has hit a lull. Defending deep passing has been their biggest issue, as they have given up the fifth-highest deep yards per attempt and the tenth-highest deep passer rating and depth-adjusted completion rate. If Lawrence can navigate the 49ers' pressure (tenth-best pressure rate), he should be able to carve them up deep. Week 10 Positional Value: QB2","start",NA,"QB11","B","16.4"
"qb","QB",2023-11-14,"18600","Kyler Murray","QB","ARI",12,12.06,1.64,8,16,"dd5a6b6e-ffae-45a5-b8e6-718a9251f374","31833","2180829","QB","K. Murray","QB","QB","https://www.fantasypros.com/nfl/players/kyler-murray.php","kyler-murray.php","https://images.fantasypros.com/images/players/nfl/18600/headshot/210x210.png","https://images.fantasypros.com/images/players/nfl/18600/headshot/210x210.png","14",63.4,53.7,73,"vs. ATL","ATL",NA,"What version of Murray will we get in his first game back? Will he run? Will he look rusty and be firing poorly-timed passes all day? We shall see, but the matchup is glorious for Murray to have a big outing in his return if he's right. Atlanta's pass defense has declined recently. Since Week 5, they have given up the second-most passing touchdowns and fifth-highest passer rating. If you need upside at the quarterback position this week, Murray can absolutely smash in his return against this defense. Week 10 Positional Value: QB1","start",NA,"QB12","B-","16.2"
"qb","QB",2023-11-14,"17237","Baker Mayfield","QB","TB",13,13.48,1.4,11,16,"30198d30-9769-4e10-ac86-b4c91d940802","30971","2080032","QB","B. Mayfield","QB","QB","https://www.fantasypros.com/nfl/players/baker-mayfield.php","baker-mayfield.php","https://images.fantasypros.com/images/players/nfl/17237/headshot/210x210.png","https://images.fantasypros.com/images/players/nfl/17237/headshot/210x210.png","5",55,57.9,52,"vs. TEN","TEN",NA,"Mayfield is the QB18 in fantasy, ranking 15th in passing grade, 24th in adjusted completion rate, and 21st in yards per attempt. Since Week 5, Tennessee has allowed the 12th-highest yards per attempt while ranking 15th in passer rating and 14th in adjusted completion rate. With Tennessee's penchant for slowing games down, they have faced the fourth-fewest passing attempts over their last four games while also giving up the second-fewest passing touchdowns. Mayfield should post a healthy QB2 stat line this week. Week 10 Positional Value: QB2","sit",NA,"QB13","C+","15.9"
"qb","QB",2023-11-14,"11180","Russell Wilson","QB","DEN",14,14.17,1.62,10,17,"409d4cac-ee90-4470-9710-ebe671678339","25785","1272242","QB","R. Wilson","QB","QB","https://www.fantasypros.com/nfl/players/russell-wilson.php","russell-wilson.php","https://images.fantasypros.com/images/players/nfl/11180/headshot/210x210.png","https://images.fantasypros.com/images/players/nfl/11180/headshot/210x210.png","9",51.7,57.4,46,"at BUF","BUF",NA,"Wilson is the QB16 in fantasy points per game with only two QB1 weeks this season. He could make those three in Week 10. Wilson has shown flashes of his former glory this season, ranking seventh in big-time throw rate and adjusted completion rate, but he has also been 20th in passing grade and yards per attempt. Since Week 5, the Buffalo Bills' pass defense has looked like a shell of itself, giving up the seventh-highest passer rating, the eighth-highest passing yards per game, and the seventh-highest adjusted completion rate. Wilson could flirt with QB1 numbers this week. Week 10 Positional Value: Borderline QB1",NA,NA,"QB14","C+","15.7"
"qb","QB",2023-11-14,"16417","Joshua Dobbs","QB","MIN",15,14.81,1.81,11,20,"15bedebc-839e-450a-86f6-1f5ad1f4f820","30248","2071844","QB","J. Dobbs","QB","QB","https://www.fantasypros.com/nfl/players/joshua-dobbs.php","joshua-dobbs.php","https://images.fantasypros.com/images/players/nfl/16417/headshot/210x210.png","https://images.fantasypros.com/images/players/nfl/16417/headshot/210x210.png","13",45.8,38.5,53,"vs. NO","NO",NA,"Last week, with zero practice time with the team, Dobbs came off the bench to rank 17th in passing grade, 21st in yards per attempt, and 23rd in adjusted completion rate among 28 qualifying quarterbacks. I will not take anything away from Dobbs because what he accomplished last week was not only improbable, but it was incredible despite his deeper metrics lagging. The 66 rushing yards and one score he rolled up on the ground definitely helped save his fantasy day, though. The Saints won't be nearly as giving as the Falcons were, though. Since Week 5, New Orleans has allowed the fourth-lowest passer rating and yards per attempt while also boasting the lowest adjusted completion rate given up. Week 10 Positional Value: QB2 ",NA,NA,"QB15","C","15.4"
"qb","QB",2023-11-14,"12092","Derek Carr","QB","NO",16,16.56,1.48,13,19,"9f026fc0-4449-4dc5-a226-2e2830619381","27564","1664819","QB","D. Carr","QB","QB","https://www.fantasypros.com/nfl/players/derek-carr.php","derek-carr.php","https://images.fantasypros.com/images/players/nfl/12092/headshot/210x210.png","https://images.fantasypros.com/images/players/nfl/12092/headshot/210x210.png","11",45.2,29.3,61,"at MIN","MIN",NA,"Carr has begun to find his footing in this offense with three QB1 outings in his last four games (QB9, QB10, QB11). Since Week 6, Carr has been 11th in passing grade, 12th in yards per attempt, and tenth in adjusted completion rate. He faces a Minnesota pass defense that has been impressive the last few weeks. Since Week 5, they have operated with the seventh-highest rate of zone coverage (76.9%), allowing the 11th-lowest fantasy points per dropback. They have also given up the 12th-lowest yards per attempt and tenth-lowest passer rating. During this stretch, they have been only 22nd in pressure rate. They continue to lead the NFL in blitz rate (51.3%). Against the blitz, Carr ranks 20th in passing grade and 24th in adjusted completion rate with the sixth-highest turnover-worthy play rate. Week 10 Positional Value: QB2 ",NA,NA,"QB16","C","15.1"
"qb","QB",2023-11-14,"13932","Taylor Heinicke","QB","ATL",17,17.04,1.72,14,21,"2c259733-ec2c-4e3c-bb7b-34dc0d37dc34","28839","2174914","QB","T. Heinicke","QB","QB","https://www.fantasypros.com/nfl/players/taylor-heinicke.php","taylor-heinicke.php","https://images.fantasypros.com/images/players/nfl/13932/headshot/210x210.png","https://images.fantasypros.com/images/players/nfl/13932/headshot/210x210.png","11",16.3,13.6,19,"at ARI","ARI",NA,"Heinicke was the QB14 in fantasy last week. His quarterback play is a rollercoaster as he was 14th in yards per attempt and 12th in big-time throw rate last week while also sitting at 23rd in passing grade and fifth-worst in turnover-worthy play rate. The good thing for Heinicke is that this week's matchup could allow the rollercoaster ride to be a joyous event instead of ending in vomit and nausea. Since Week 5, the Cardinals have allowed the seventh-highest yards per attempt, the sixth-highest passer rating, and the fourth-highest adjusted completion rate. Heinicke could flirt with QB1 numbers this week. Week 10 Positional Value: QB2 with QB1 upside",NA,NA,"QB17","C-","14.9"
"qb","QB",2023-11-14,"22987","Will Levis","QB","TEN",18,17.52,2.52,12,24,"4c8a2f7e-f982-4eca-9d52-cf53df6985a4","40068","2964377","QB","W. Levis","QB","QB","https://www.fantasypros.com/nfl/players/will-levis.php","will-levis.php","https://images.fantasypros.com/images/players/nfl/22987/headshot/210x210.png","https://images.fantasypros.com/images/players/nfl/22987/headshot/210x210.png","7",44.7,36.3,53,"at TB","TB",NA,"Levis has been an adventure during his brief NFL action. Among 38 qualifying quarterbacks, he ranks ninth in yards per attempt and first in big-time throw rate, but he also has the seventh-highest turnover-worthy-play rate while sitting at 36th in adjusted completion rate. Levis is 37th in catchable throw rate. Levis should post another solid stat line and continue to build the hope and hype this week against a Bucs secondary that has been burned repeatedly. They have allowed the third-highest yards per attempt, the eighth-most passing touchdowns, and the second-highest passing yards per game. Week 10 Positional Value: QB2","sit",NA,"QB18","C-","14.7"
"qb","QB",2023-11-14,"18562","Gardner Minshew","QB","IND",19,18.73,1.19,16,22,"dabb52c0-455b-48fe-996b-abf758120623","32010","2183083","QB","G. Minshew II","QB","QB","https://www.fantasypros.com/nfl/players/gardner-minshew.php","gardner-minshew.php","https://images.fantasypros.com/images/players/nfl/18562/headshot/210x210.png","https://images.fantasypros.com/images/players/nfl/18562/headshot/210x210.png","11",13.5,9,18,"at NE","NE",NA,"Since assuming the starting role in Week 6, Minshew has only one top 12 fantasy finish (QB3 in Week 7). Among 35 qualifying quarterbacks, Minshew is 23rd in yards per attempt, 22nd in passer rating, and 29th in highly accurate throw rate. All of these QB2-worthy metrics line up with his 22nd ranking in fantasy points per dropback. Since Week 6, the Patriots have been a below-average pass defense. In this timeframe, they have allowed the 11th-highest yards per attempt, the sixth-most passing touchdowns (tied), and the fourth-most passing yards per game. Over the last four weeks, the Patriots have allowed the fifth-most fantasy points via passing. Minshew is a solid QB2 who could flirt with top-12 numbers this week. Week 10 Positional Value: QB2","sit",NA,"QB19","D+","14.5"
"qb","QB",2023-11-14,"20156","Mac Jones","QB","NE",20,21.19,2.1,16,26,"1fd00ec3-b758-46d2-a2c1-cca521ea8a54","33403","2741202","QB","M. Jones","QB","QB","https://www.fantasypros.com/nfl/players/mac-jones.php","mac-jones.php","https://images.fantasypros.com/images/players/nfl/20156/headshot/210x210.png","https://images.fantasypros.com/images/players/nfl/20156/headshot/210x210.png","11",8.1,5.2,11,"vs. IND","IND",NA,"Jones is the QB30 in fantasy with only two QB1 weeks on his resume this season. Among 35 qualifying quarterbacks, he ranks 27th in passing grade, 30th in yards per attempt, and 29th in adjusted completion rate. Jones is no more than another low-end QB2 this week in a bad matchup. Since Week 6, Indy has been a tough pass defense to lock horns with. Over the last four weeks, they have allowed the 11th-lowest yards per attempt, sixth-lowest passer rating, and the 13th-lowest adjusted completion rate. Week 10 Positional Value: QB2",NA,NA,"QB20","D","14.4"
