"page","page_pos","scrape_date","fantasypros_id","player_name","pos","team","rank","ecr","sd","best","worst","sportradar_id","yahoo_id","cbs_id","player_positions","player_short_name","player_eligibility","player_yahoo_positions","player_page_url","player_filename","player_square_image_url","player_image_url","player_bye_week","player_owned_avg","player_owned_espn","player_owned_yahoo","player_opponent","player_opponent_id","player_ecr_delta","note","tag","recommendation","pos_rank","start_sit_grade","r2p_pts"
"ppr-wr","WR",2023-10-29,"18218","AJ Brown","WR","PHI",3,3.81,1.76,1,7,"a9e580f2-1fbe-46fb-887c-c84089b507e4","31883","2258303","WR","A.J. Brown","WR","WR","https://www.fantasypros.com/nfl/players/aj-brown.php","aj-brown.php","https://images.fantasypros.com/images/players/nfl/18218/headshot/210x210.png","https://images.fantasypros.com/images/players/nfl/18218/headshot/210x210.png","10",100,99.9,100,"at WAS","WAS",NA,"To say Brown has been on a tear since Week 3 is an understatement. Over his last five games, he has not finished with less than six grabs and 127 receiving yards in any game (averaging 8.2 receptions and 140.2 receiving yards). Brown is a dominant alpha and one of the best wide receivers in the NFL, hands down. Brown is the WR5 in fantasy, ranking third in deep targets. Among 145 qualifying wide receivers, he is sixth in target share (29.9%), first in air-yard share (50.3%), third in YPRR (3.38), and second in first-read share (42.3%). While this isn't the smash matchup on paper that many will project because Washington has changed up their starting corners, there's no shutting down Brown at this point. Since Week 6, Washington has allowed the seventh-lowest PPR points per target to perimeter wide receivers. Brown will run about 78% of his routes against Benjamin St. Juste (68.3% catch rate and 95.0 passer rating) and Kendall Fuller (68.3% catch rate and 82.9 passer rating). Week 8 Positional Value: WR1",NA,NA,"WR3","A+","19.1"
"ppr-wr","WR",2023-10-29,"11616","Keenan Allen","WR","LAC",4,4.48,0.66,4,6,"5f424505-f29f-433c-b3f2-1a143a04a010","26699","1737096","WR","K. Allen","WR","WR","https://www.fantasypros.com/nfl/players/keenan-allen.php","keenan-allen.php","https://images.fantasypros.com/images/players/nfl/11616/headshot/210x210.png","https://images.fantasypros.com/images/players/nfl/11616/headshot/210x210.png","5",99.4,99.7,99,"vs. CHI","CHI",NA,"Allen hasn't shown any signs of slowing down this season as the WR3 in fantasy. Without Mike Williams, he has seen a 26.4% target share, 32.5% air-yard share, and a 37.3% first read share while producing 1.64 YPRR. Allen is 27th in deep targets and eighth in red zone looks among wideouts. Allen will run about 64% of his routes against Kyler Gordon (80% catch rate and 96.7 passer rating). Week 8 Positional Value: WR1",NA,NA,"WR4","A+","18.7"
"ppr-wr","WR",2023-10-29,"19788","JaMarr Chase","WR","CIN",5,5.05,1.7,2,7,"fa99e984-d63b-4ef4-a164-407f68a7eeaf","33393","2966320","WR","J. Chase","WR","WR","https://www.fantasypros.com/nfl/players/jamarr-chase.php","jamarr-chase.php","https://images.fantasypros.com/images/players/nfl/19788/headshot/210x210.png","https://images.fantasypros.com/images/players/nfl/19788/headshot/210x210.png","7",100,99.9,100,"at SF","SF",NA,"Chase has rebounded as the WR8 in fantasy. Among 105 qualifying wide receivers, he ranks second in target share (30.9%), eighth in air-yard share (43.1%), 23rd in YPRR (2.29), and fifth in first-read share (39.8%). The 49ers utilize zone coverage on 75.3% of their defensive snaps (11th-highest rate). Against zone, Chase's target share balloons to 32.0%, his air-yard share bumps to 47.5%, his YPRR increases to 2.55, and his first-read share climbs to 42.1%. Chase also leads Cincinnati with seven deep targets, so if Burrow launches it this week, he'll be targeting Chase. Chase will run about 74% of his routes against Charvarius Ward (61.9% catch rate and 73.5 passer rating) and Deommodore Lenoir (66% catch rate and 71.5 passer rating). Week 8 Positional Value: WR1",NA,NA,"WR5","A+","18.4"
"ppr-wr","WR",2023-10-29,"16433","Cooper Kupp","WR","LAR",6,5.48,1.33,3,7,"2806e915-c46f-492f-8a29-71d3a85e5620","30182","2006951","WR","C. Kupp","WR","WR","https://www.fantasypros.com/nfl/players/cooper-kupp.php","cooper-kupp.php","https://images.fantasypros.com/images/players/nfl/16433/headshot/210x210.png","https://images.fantasypros.com/images/players/nfl/16433/headshot/210x210.png","10",100,99.9,100,"at DAL","DAL",NA,"Since his return, Kupp has had a 30% target share, a 41.5% air-yard share, 3.31 YPRR, and a 37.5% first-read share. He's been vintage Kupp besides last week's bump in the road. Dallas has the second-highest rate of man coverage in the NFL (40.2%). Against man, Kupp has a 34.4% target share, a 39.4% air-yard share, 2.24 YPRR and a 41.7% first-read share. He is tied for the team lead with Nacua in target share and first-read share against man since Week 5. Kupp will run about half of his routes against Jourdan Lewis (66.7% catch rate and 136.9 passer rating) in the slot. Dallas has allowed the fourth-highest PPR points per target against slot receivers. Kupp has led the team in deep targets since his return with seven (Nacua four). Week 8 Positional Value: WR1",NA,NA,"WR6","A+","18.3"
"ppr-wr","WR",2023-10-29,"19799","Amon-Ra St Brown","WR","DET",7,5.57,0.9,4,7,"26ef0447-29b8-4dd1-9831-dcbf8132bb74","33500","2967690","WR","A. St. Brown","WR","WR","https://www.fantasypros.com/nfl/players/amonra-stbrown.php","amonra-stbrown.php","https://images.fantasypros.com/images/players/nfl/19799/headshot/210x210.png","https://images.fantasypros.com/images/players/nfl/19799/headshot/210x210.png","9",100,99.9,100,"vs. LV","LV",NA,"St. Brown is the WR9 in fantasy. He has been on another level since returning from injury. Over the last two games, he has averaged 17 targets, 12.5 receptions, and 113 receiving yards. St. Brown has at least one red zone target in five of six games played this season. St. Brown has a 29.4% target share, a 31.1% air-yard share, 2.59 YPRR, and a 38.2% first-read share. The Raiders have been tough against slot receivers, giving up the fourth-fewest receiving yards and 14th-lowest PPR points per target. St. Brown will run about 52% of his routes against Amik Robertson (68.4% catch rate and 94.6 passer rating). Week 8 Positional Value: WR1",NA,NA,"WR7","A+","18.1"
"ppr-wr","WR",2023-10-29,"12123","Davante Adams","WR","LV",8,8.71,0.98,7,12,"e7d6ae25-bf15-4660-8b37-c37716551de3","27581","1893167","WR","D. Adams","WR","WR","https://www.fantasypros.com/nfl/players/davante-adams.php","davante-adams.php","https://images.fantasypros.com/images/players/nfl/12123/headshot/210x210.png","https://images.fantasypros.com/images/players/nfl/12123/headshot/210x210.png","13",100,99.9,100,"at DET","DET",NA,"Adams has dipped to the WR16 in fantasy with three stinker weeks in a row. Since Week 5, he has finished as the WR45, WR69, and the WR24 in fantasy. Last week, he saw 12 targets, but with the lackluster quarterback play of Brian Hoyer, he could only muster 57 scoreless receiving yards. Adams has a 29.5% target share, a 39.8% air-yard share, 2.31 YPRR, and a 40.9% first-read share. Adams leads all wide receivers in red zone targets. He will run about 82% of his routes against Cameron Sutton (62.9% catch rate and 97.3 passer rating) and Will Harris (81.3% catch rate and 83.1 passer rating). Week 8 Positional Value: Borderline WR1",NA,NA,"WR8","A","16.9"
"ppr-wr","WR",2023-10-29,"19202","CeeDee Lamb","WR","DAL",9,9.76,1.19,8,12,"a72ea15b-5199-4101-a300-846e1c655add","32687","2865251","WR","C. Lamb","WR","WR","https://www.fantasypros.com/nfl/players/ceedee-lamb.php","ceedee-lamb.php","https://images.fantasypros.com/images/players/nfl/19202/headshot/210x210.png","https://images.fantasypros.com/images/players/nfl/19202/headshot/210x210.png","7",100,99.9,100,"vs. LAR","LAR",NA,"Lamb is the WR21 in fantasy ranking 14th in open score immediately behind Ja'Marr Chase. Lamb has five red zone targets, but they have all come in the last four games. Lamb has a 21.5% target share, a 28.3% air-yard share, 2.54 YPRR, and a 24.4% first-read share. The way to defeat the Rams' secondary is via the slot which Lamb can do this week. Los Angeles has given up the second-most receiving yards and the seventh-most receptions to slot receivers. Lamb will run about 68% of his routes against Cobie Durant (65.5% catch rate and 95.5 passer rating). Among 36 qualifying slot corners, Durant has allowed the 13th-highest yards per snap. Week 8 Positional Value: WR1",NA,NA,"WR9","A","16.6"
"ppr-wr","WR",2023-10-29,"23180","Puka Nacua","WR","LAR",10,9.9,1.57,8,14,"111be44d-7bc2-4cad-934d-c9e946293b2f","40168","3121687","WR","P. Nacua","WR","WR","https://www.fantasypros.com/nfl/players/puka-nacua.php","puka-nacua.php","https://images.fantasypros.com/images/players/nfl/23180/headshot/210x210.png","https://images.fantasypros.com/images/players/nfl/23180/headshot/210x210.png","10",96.6,98.1,95,"at DAL","DAL",NA,"Since Kupp's return, Nacua has led the team with a 33.3% target share and ranks second in air yard share (37.7%), YPRR (2.70), and first-read share (35.9%). In the same span, against man coverage, Nacua is tied with Kupp for the team lead with a 34.4% target share and 41.7% first-read share. He leads the team in that stretch with 4.46 YPRR against man. Nacua leads the team during these three games with two end zone targets against man coverage. He ranks second on the team in deep targets since Kupp's return with four. Nacua will run about 60% of his routes on the perimeter against Stephon Gilmore (46.7% catch rate and 71.1 passer rating) and DaRon Bland (48.1% catch rate and 22.7 passer rating). Since losing Trevon Diggs, Dallas has surrendered the fewest PPR points per target to perimeter wide receivers and only one receiving touchdown. Week 8 Positional Value: WR1/2",NA,NA,"WR10","A","16.4"
"ppr-wr","WR",2023-10-29,"19252","Brandon Aiyuk","WR","SF",11,10.71,1.42,8,13,"c90471cc-fa60-4416-9388-5aebb5d877eb","32695","2967489","WR","B. Aiyuk","WR","WR","https://www.fantasypros.com/nfl/players/brandon-aiyuk.php","brandon-aiyuk.php","https://images.fantasypros.com/images/players/nfl/19252/headshot/210x210.png","https://images.fantasypros.com/images/players/nfl/19252/headshot/210x210.png","9",97.3,96.5,98,"vs. CIN","CIN",NA,"Aiyuk is the WR17 in fantasy, commanding a 27.4% target share, a 46.9% air-yard share, 3.62 YPRR, and a 31.9% air-yard share. Aiyuk is 19th in deep targets among wideouts while also leading the NFL in open score. The Bengals have been incredibly tough on perimeter wide receivers, giving up the eighth-lowest PPR points per target and zero receiving touchdowns. Aiyuk will run about 80% of his routes against Cam Taylor-Britt (53.1% catch rate and 69.8 passer rating) and D.J. Turner (33.3% catch rate and 42.4 passer rating). Week 8 Positional Value: Volume-based WR2/3",NA,NA,"WR11","A","15.7"
"ppr-wr","WR",2023-10-29,"13429","Adam Thielen","WR","CAR",12,11.62,1.29,10,15,"2fa2b2da-4aa9-44b5-b27e-56876dfe2ad4","27277","2059362","WR","A. Thielen","WR","WR","https://www.fantasypros.com/nfl/players/adam-thielen.php","adam-thielen.php","https://images.fantasypros.com/images/players/nfl/13429/headshot/210x210.png","https://images.fantasypros.com/images/players/nfl/13429/headshot/210x210.png","7",94.3,94.5,94,"vs. HOU","HOU",NA,"Thielen is the only fantasy-viable receiver for Carolina. Bryce Young's struggles have kept him from supporting more than Thielen in this offense. Thielen is the WR6 in fantasy, rocking a 24.5% target share, a 30.8% air-yard share, 2.22 YPRR, and a 34.8% first-read share. Thielen hasn't finished lower than WR20 in any week since Week 2. That is absolute insanity. Thielen ranks 20th in red zone targets among wide receivers. Houston has done a great job at limiting slot receivers this season, allowing the eighth-lowest PPR points per target and receiving yards (Thielen 72% slot). Thielen will tangle with Tavierre Thomas (2022: 51.9% catch rate and 59.0 passer rating) all day. Week 8 Positional Value: WR2","start",NA,"WR12","A","15.6"
"ppr-wr","WR",2023-10-29,"12119","Mike Evans","WR","TB",13,14.86,2.1,12,19,"c48c21d9-0ae5-478c-ad34-30a660cfa9b8","27535","1824909","WR","M. Evans","WR","WR","https://www.fantasypros.com/nfl/players/mike-evans.php","mike-evans.php","https://images.fantasypros.com/images/players/nfl/12119/headshot/210x210.png","https://images.fantasypros.com/images/players/nfl/12119/headshot/210x210.png","5",96.5,97,96,"at BUF","BUF",NA,"Evans continues to crush. I faded him in draft season and now regret doing so immensely. Among 104 qualifying wide receivers, he ranks 23rd in target share (22.9%), 16th in air-yard share (37.8%), and tenth in yards per route run (2.80). He is also 24th in first-read share (28.4%). Evans is second on the Bucs in red zone targets. He should lead the passing attack against the Bills zone coverage. Against zone, his target share has increased to 23.9% as his air-yard share has bumped to 41%, and his yards per route run (YPRR) balloons to an insane 3.22. Evans will run about 72% of his routes against Christian Benford (72.7% catch rate and 100.9 passer rating) and Dane Jackson (80% catch rate and 118.9 passer rating). Week 8 Positional Value: Borderline WR1",NA,NA,"WR13","A","15.5"
"ppr-wr","WR",2023-10-29,"19790","Jaylen Waddle","WR","MIA",14,16.29,3.76,11,26,"0ff9a975-669d-4851-a95d-ab28d9fc29c4","33394","2962110","WR","J. Waddle","WR","WR","https://www.fantasypros.com/nfl/players/jaylen-waddle.php","jaylen-waddle.php","https://images.fantasypros.com/images/players/nfl/19790/headshot/210x210.png","https://images.fantasypros.com/images/players/nfl/19790/headshot/210x210.png","10",99.7,99.3,100,"vs. NE","NE",NA," Waddle has had a disappointing season to date as the WR28 in fantasy. He has garnered a 20.1% target share, a 22.3% air-yard share, and a 23.2% first-read share while still producing a stellar 2.55 YPRR. The Patriots have utilized man coverage at the third-highest rate (39.5%). Against man, Waddle's target share has plummeted to 12.2% with a 13.8% first-read share despite his YPRR remaining strong at 1.97. In their last meeting, Waddle finished with four receptions for 86 scoreless yards. Week 8 Positional Value: WR2/3",NA,NA,"WR14","A","15.1"
"ppr-wr","WR",2023-10-29,"20111","Chris Olave","WR","NO",15,16.48,1.99,13,20,"2375d572-a36c-4365-bb3f-87e156526e2f","33966","2963666","WR","C. Olave","WR","WR","https://www.fantasypros.com/nfl/players/chris-olave.php","chris-olave.php","https://images.fantasypros.com/images/players/nfl/20111/headshot/210x210.png","https://images.fantasypros.com/images/players/nfl/20111/headshot/210x210.png","11",98.6,98.1,99,"at IND","IND",NA,"Olave has been massively underperforming as he and Carr are trying to get on the same page. Among 105 qualifying wide receivers, he is 21st in target share (24.4%), 14th in air-yard share (39.5%), and 17th in first-read share (32.0%), but he is only 44th in YPRR (1.75) and the WR25 in fantasy with the most unrealized air yards in the NFL. Better days are ahead for Olave. He leads all wide receivers in deep targets. Indy has the second-highest rate of zone coverage (83.0%). Against zone, Olave's air-yard share has increased to 41.7%, and he leads the team with four end-zone targets. Olave will run about 58% of his routes against Jaylon Jones (44.4% catch rate and 95.1 passer rating) and Darrell Baker Jr. (61.5% catch rate and 121.0 passer rating). The Colts have toughened up against perimeter wide receivers recently. Since Week 4, they have allowed the tenth-lowest PPR points per target to perimeter wideouts. Week 8 Positional Value: WR2",NA,NA,"WR15","A","15.1"
"ppr-wr","WR",2023-10-29,"18598","Jakobi Meyers","WR","LV",16,17.38,2.94,13,22,"73e194d1-a4b7-4de4-b1c2-3c24ef502918","32231","2183835","WR","J. Meyers","WR","WR","https://www.fantasypros.com/nfl/players/jakobi-meyers.php","jakobi-meyers.php","https://images.fantasypros.com/images/players/nfl/18598/headshot/210x210.png","https://images.fantasypros.com/images/players/nfl/18598/headshot/210x210.png","13",89.4,90.8,88,"at DET","DET",NA,"Meyers has a 25.8% target share, a 36.2% air-yard share, 1.92 YPRR, and a 31.8% first-read share as the WR12 in fantasy. Meyers ranks fourth among wide receivers in red zone targets. Across his last three games, he has five targets inside the 20-yard line. Meyers will run about 75% of his routes against Cameron Sutton (62.9% catch rate and 97.3 passer rating) and Will Harris (81.3% catch rate and 83.1 passer rating). Week 8 Positional Value: WR2/3","start",NA,"WR16","A-","15.0"
"ppr-wr","WR",2023-10-29,"22916","Zay Flowers","WR","BAL",17,17.62,3.21,13,25,"2b6d74b7-10fb-4f17-99c8-9bb557fb475b","40039","3127049","WR","Z. Flowers","WR","WR","https://www.fantasypros.com/nfl/players/zay-flowers.php","zay-flowers.php","https://images.fantasypros.com/images/players/nfl/22916/headshot/210x210.png","https://images.fantasypros.com/images/players/nfl/22916/headshot/210x210.png","13",90.2,90.3,90,"at ARI","ARI",NA,"What Flowers has done as a rookie has been impressive. The kid deserves major kudos. He is the WR30 in fantasy and is on pace for 95 receptions and 1,073 receiving yards. Flowers has a 26.9% target share, a 28.5% air-yard share, 1.95 YPRR, and a 30.4% first-read share. He has been incredibly consistent, but he has yet to enjoy a blowup game. He has at least 50 receiving yards in every game except for one, but he hasn't eclipsed 78 receiving yards in any game. Flowers will go off this week. Arizona has allowed the most receiving yards to wide receivers. Flowers has the high cholesterol usage that we crave as he's tenth in deep targets (leads the team in deep targets) and 17th in red zone targets. The Cardinals have the 12th-highest zone coverage rate. Flowers' air-yard share increases to 34.1% against zone, his YPRR jumps to 2.21, and his first-read share is 33.3%. Flowers will run about 70% of his routes against Starling Thomas (87.5% catch rate and 140.1 passer rating) and Marco Wilson (79.6% catch rate and 132.3 passer rating). Week 8 Positional Value: WR1/2",NA,NA,"WR17","A-","15.0"
"ppr-wr","WR",2023-10-29,"17268","Christian Kirk","WR","JAC",18,18.14,3.52,13,27,"ebcd87ce-218c-4144-810b-921c2f59d6e8","31017","2180820","WR","C. Kirk","WR","WR","https://www.fantasypros.com/nfl/players/christian-kirk.php","christian-kirk.php","https://images.fantasypros.com/images/players/nfl/17268/headshot/210x210.png","https://images.fantasypros.com/images/players/nfl/17268/headshot/210x210.png","9",92.4,90.7,94,"at PIT","PIT",NA,"Kirk has been the mainstay for the Jacksonville passing attack as the WR21 in fantasy. Kirk should be the focal point for Lawrence this week against a Steelers secondary that has the fifth-highest rate of man coverage (37.5%) in the NFL. Against man, Kirk's target share has inflated to 30.8% and his first-read share has been a whopping 32.4%. Kirk will run about 71% of his routes against the Steelers new slot corner Patrick Peterson (59.4% catch rate and 116.5 passer rating). Kirk should have no problems burning the former All-Pro. Week 8 Positional Value: WR2 with WR1 upside",NA,NA,"WR18","A-","14.8"
"ppr-wr","WR",2023-10-29,"23107","Jordan Addison","WR","MIN",19,18.86,2.62,15,27,"63fdd64e-1a23-4b77-9536-b1609f3a708c","40042","3162290","WR","J. Addison","WR","WR","https://www.fantasypros.com/nfl/players/jordan-addison.php","jordan-addison.php","https://images.fantasypros.com/images/players/nfl/23107/headshot/210x210.png","https://images.fantasypros.com/images/players/nfl/23107/headshot/210x210.png","13",92.7,91.3,94,"at GB","GB",NA,"Over the last two weeks without Justin Jefferson, Addison has seen a 19.7% target share, a 29.2% air-yard share, and a 27.1% first-read share (leads the team) while churning out 2.60 YPRR. Addison has also seen three of Cousin's four deep targets. He has finished as the WR32 and WR1 in weekly scoring while seeing four red zone targets. Addison will run about 75% of his routes against Rasul Douglas (64.3% catch rate and 104.9 passer rating) and Jaire Alexander (77.8% catch rate and 155.8 passer rating). Week 8 Positional Value: WR2",NA,NA,"WR19","A-","14.0"
"ppr-wr","WR",2023-10-29,"19222","DeVonta Smith","WR","PHI",20,21.19,4.51,15,30,"3555d07e-57ae-43de-97d5-b1b5bf055f17","33398","2866975","WR","D. Smith","WR","WR","https://www.fantasypros.com/nfl/players/devonta-smith.php","devonta-smith.php","https://images.fantasypros.com/images/players/nfl/19222/headshot/210x210.png","https://images.fantasypros.com/images/players/nfl/19222/headshot/210x210.png","10",98.7,98.4,99,"at WAS","WAS",NA,"Smith faded into the background with Brown going ham since Week 3. Since that time, he has had a 17.6% target share, a 25.3% air-yard share, 1.07 YPRR, and a 19.6% first-read share (third on the team). He is the WR38 in fantasy, ranking ninth in deep targets. Smith has also been on the end of some misfortune as he is eighth in unrealized air yards, so all hope is not lost for him to turn around his season. He only has two red zone targets this season, so if he scores, it will have to be on a downfield toss. Smith will run about 69% of his routes against Benjamin St. Juste (68.3% catch rate and 95.0 passer rating) and Kendall Fuller (68.3% catch rate and 82.9 passer rating). Week 8 Positional Value: WR3","start",NA,"WR20","A-","13.9"
"ppr-wr","WR",2023-10-29,"20130","Nico Collins","WR","HOU",21,21.24,3.31,14,26,"bd56a50c-5fae-4ee2-8363-f74ae07b6887","33477","2878193","WR","N. Collins","WR","WR","https://www.fantasypros.com/nfl/players/nico-collins.php","nico-collins.php","https://images.fantasypros.com/images/players/nfl/20130/headshot/210x210.png","https://images.fantasypros.com/images/players/nfl/20130/headshot/210x210.png","7",89.8,88.6,91,"at CAR","CAR",NA,"Collins is the WR13 in fantasy points per game. He has a 19.6% target share, a 29.9% air-yard share, 3.36 YPRR, and a team-leading 26.1% first-read share. In the three games Tank Dell has been a full-time player, Colins ranks second to Dell in deep targets (four vs. two). If Stroud attacks this secondary deep, Collins will be involved, but he might not be leading the charge. The good thing for Collins is that Carolina has the third-highest rate of zone coverage (82.6%). Against zone, Collins has a 20.9% target share, a 31.3% air-yard share, and a 27.0% first-read share. All of his metrics have slightly increased against zone. Collins will run about 81% of his routes against Donte Jackson (68.4% catch rate and 146.3 passer rating) and C.J. Henderson (81.5% catch rate and 128.1 passer rating). Week 8 Positional Value: WR2","start",NA,"WR21","A-","13.9"
"ppr-wr","WR",2023-10-29,"17265","DJ Moore","WR","CHI",22,22.71,3.95,11,27,"d8202e6d-d03b-4cd1-a793-ff8fd39d9755","30994","2179328","WR","DJ Moore","WR","WR","https://www.fantasypros.com/nfl/players/dj-moore-wr.php","dj-moore-wr.php","https://images.fantasypros.com/images/players/nfl/17265/headshot/210x210.png","https://images.fantasypros.com/images/players/nfl/17265/headshot/210x210.png","13",97.7,97.3,98,"at LAC","LAC",NA,"Last week with Bagent under center, Moore still saw a 31.0% target share, a 58.7% air-yard share, and a 42.1% first-read share as he churned out 2.00 YPRR. He finished as the WR21 for the week. Moore should continue to get fed with Bagent. Moore ranks fifth in deep targets and 29th in red zone targets among wide receivers. He is the WR10 in fantasy. Moore will run about 84% of his routes against Asante Samuel Jr. (70% catch rate and 93.8 passer rating) and Michael Davis (68.1% catch rate and 126.6 passer rating). The Chargers have allowed the fifth-highest PPR points per target to perimeter wide receivers. Week 8 Positional Value: WR2",NA,NA,"WR22","B+","13.7"
"ppr-wr","WR",2023-10-29,"23072","Garrett Wilson","WR","NYJ",23,23.14,3.48,13,28,"68d72fe0-79b2-4fdb-afd5-6c79676e77f3","33965","3123864","WR","G. Wilson","WR","WR","https://www.fantasypros.com/nfl/players/garrett-wilson.php","garrett-wilson.php","https://images.fantasypros.com/images/players/nfl/23072/headshot/210x210.png","https://images.fantasypros.com/images/players/nfl/23072/headshot/210x210.png","7",98.6,98.1,99,"at NYG","NYG",NA,"Wilson is the WR23 in fantasy, which is a true testament to his talent to produce as a WR2 despite the quarterback play of Zach Wilson. He has been the only startable receiver in this offense and a fountain of high-leverage usage. He ranks ninth in deep targets and second in red zone targets among wideouts. Among 105 qualifying wide receivers, he ranks tenth in target share (28.4%), sixth in air-yard share (45.9%), 40th in YPRR (1.86), and first in first-read share (45.3%). The Giants utilize man coverage at the fourth-highest rate in the NFL (39.5%). Against man, Wilson's YPRR has increased to 2.27. Wilson will run about 72% of his routes against Adoree' Jackson (75% catch rate and 119.9 passer rating) and Deonte Banks (55.6% catch rate and 80.3 passer rating). Week 8 Positional Value: WR2/3",NA,NA,"WR23","B+","13.6"
