"page","page_pos","scrape_date","fantasypros_id","player_name","pos","team","rank","ecr","sd","best","worst","sportradar_id","yahoo_id","cbs_id","player_positions","player_short_name","player_eligibility","player_yahoo_positions","player_page_url","player_filename","player_square_image_url","player_image_url","player_bye_week","player_owned_avg","player_owned_espn","player_owned_yahoo","player_opponent","player_opponent_id","player_ecr_delta","note","tag","recommendation","pos_rank","start_sit_grade","r2p_pts"
"ppr-te","TE",2022-10-29,"18290","TJ Hockenson","TE","DET",5,5.04,0.89,3,7,"bd1120b6-38b3-4225-a4b0-20660a149d0d","31840","2251097","TE","T.J. Hockenson","TE","TE","https://www.fantasypros.com/nfl/players/tj-hockenson.php","tj-hockenson.php","https://images.fantasypros.com/images/players/nfl/18290/headshot/210x210.png","https://images.fantasypros.com/images/players/nfl/18290/headshot/210x210.png","6",96.1,96.1,96,"vs. MIA","MIA",NA,"Hockenson is the TE3 in fantasy scoring, but his Week 4 legend performance against Seattle is masking his shortcomings. Outside of that game, he has only one top-12 finish this season. If we take Week 4 out of the equation, Hockenson is 25th in PFF receiving grade, 34th in yards per route run, and has a 16% target share (four red zone targets). No, I'm not a proponent of ""well, if we exclude all of the big plays then,"" but this game against Seattle looks like a massive outlier stacked against the rest of his 2022 resume. With all of that being said, Miami is a good matchup for Hockenson. The Dolphins are 23rd in DVOA against tight ends giving up the eighth-most receiving yards and highest catch rate, but they have also yielded the third-lowest yards per reception. Hockenson is a low-end TE1.","start",NA,"TE5","A-","11.7"
"ppr-te","TE",2022-10-29,"15623","Tyler Higbee","TE","LAR",6,5.96,1.37,4,12,"0df7912d-9e81-47ea-b4f7-d04986df4ee8","29344","1853103","TE","T. Higbee","TE","TE","https://www.fantasypros.com/nfl/players/tyler-higbee.php","tyler-higbee.php","https://images.fantasypros.com/images/players/nfl/15623/headshot/210x210.png","https://images.fantasypros.com/images/players/nfl/15623/headshot/210x210.png","7",89.8,90.6,89,"vs. SF","SF",NA,"Higbee has taken over the role as the WR2 in this offense. He is fourth in targets and target share (22.6%) among tight ends. He is sixth in route participation, tenth in red zone targets, and 14th in yards per route run. In their last meeting, he saw 14 targets with ten grabs and 73 receiving yards as the TE4 for the week. San Francisco is still 13th in DVOA against the position with the second-lowest yards per reception and seventh-fewest receiving yards allowed. The 49ers deployed zone coverage on 53-61% of their snaps last week. Higbee has seen 68.8% of his target volume against zone as he ranks ninth in yards per route run against zone (minimum five zone targets).","start",NA,"TE6","B+","10.6"
"ppr-te","TE",2022-10-29,"20163","Pat Freiermuth","TE","PIT",7,7.04,0.99,5,9,"04f0fefe-9d9d-44f5-94ea-6df2a42df3c6","33443","2961270","TE","P. Freiermuth","TE","TE","https://www.fantasypros.com/nfl/players/pat-freiermuth.php","pat-freiermuth.php","https://images.fantasypros.com/images/players/nfl/20163/headshot/210x210.png","https://images.fantasypros.com/images/players/nfl/20163/headshot/210x210.png","9",87,89,85,"at PHI","PHI",NA,"Freiermuth has drawn an 18.7% target share (tenth) and sits at seventh in target rate per route run among tight ends. He lacks red zone targets (four, 16th), but he leads the position in deep targets (seven). Freiermuth is sixth in PFF receiving grade and fifth in yards per route run (minimum 15 targets). Philly has been rough on opposing tight ends ranking 11th in DVOA, holding them to the seventh-lowest catch rate and tenth-lowest yards per reception. Freiermuth is a TE1 and one of the Steelers' best hopes to move the ball this week.","start",NA,"TE7","B+","9.9"
"ppr-te","TE",2022-10-29,"20164","Kyle Pitts","TE","ATL",8,9.71,2.99,6,18,"1f3deb24-9ff8-4769-8f42-825eff7742f6","33392","2964514","TE","K. Pitts","TE","TE","https://www.fantasypros.com/nfl/players/kyle-pitts.php","kyle-pitts.php","https://images.fantasypros.com/images/players/nfl/20164/headshot/210x210.png","https://images.fantasypros.com/images/players/nfl/20164/headshot/210x210.png","14",92.8,93.6,92,"vs. CAR","CAR",NA,"Pitts suffers from the same Smith-itis. Among tight ends with 15 or more targets, he's 12th in PFF receiving grade and 11th in yards per route run. Pitts has run 19.2 routes per game. He's the only tight end with a route rate above 60% (76.7%), below 22.9 routes per game. Pitts has only seen more than five targets twice this season and surpassed 30 receiving yards once. Again, this is not a Pitts problem but a result of the offensive system he is tied to. Pitts is a TE2 until (if) this offensive design changes. Carolina is 26th in DVOA against tight ends allowing the third-highest catch rate.",NA,NA,"TE8","B-","9.3"
"ppr-te","TE",2022-10-29,"17115","Taysom Hill","TE","NO",9,10.27,3,4,20,"3c8a55dd-20a8-4375-b711-49eb5e6e1d0e","30614","2818935","TE","T. Hill","QB,TE","QB,TE","https://www.fantasypros.com/nfl/players/taysom-hill.php","taysom-hill.php","https://images.fantasypros.com/images/players/nfl/17115/headshot/210x210.png","https://images.fantasypros.com/images/players/nfl/17115/headshot/210x210.png","14",66.3,56.6,76,"vs. LV","LV",NA,NA,"sit",NA,"TE9","B-","9.2"
"ppr-te","TE",2022-10-29,"17283","Hayden Hurst","TE","CIN",10,10.87,2.33,8,17,"1b125fc4-5dd9-4eb9-a42f-048e61ca42b7","30995","2185053","TE","H. Hurst","TE","TE","https://www.fantasypros.com/nfl/players/hayden-hurst.php","hayden-hurst.php","https://images.fantasypros.com/images/players/nfl/17283/headshot/210x210.png","https://images.fantasypros.com/images/players/nfl/17283/headshot/210x210.png","10",61,57,65,"at CLE","CLE",NA,"Hurst is a low-end TE1. He's the TE12 in fantasy points per game with a 14.6% target share (16th), seven red zone targets (sixth), and the third-most routes run. He's the poster child for volume is king. He's been terribly inefficient, ranking 22nd in PFF receiving grade and 41st in yards per route run (minimum ten targets). The Browns are 12th in DVOA against tight ends with the lowest catch rate allowed while also ranking first in yards per reception.","start",NA,"TE10","C+","9.1"
"ppr-te","TE",2022-10-29,"16502","Robert Tonyan","TE","GB",11,11.16,2.47,8,20,"7c9c7800-69d0-459b-812b-a07ac48e9f2a","30777","2820026","TE","R. Tonyan","TE","TE","https://www.fantasypros.com/nfl/players/robert-tonyan.php","robert-tonyan.php","https://images.fantasypros.com/images/players/nfl/16502/headshot/210x210.png","https://images.fantasypros.com/images/players/nfl/16502/headshot/210x210.png","14",51,49.9,52,"at BUF","BUF",NA,"It took only one game for Tonyan to turn back into a pumpkin. Since Week 4, he has had a 15% target share but a 56.2% route run rate. Week 6 is the only game this season in which Tonyan has more than 40 receiving yards. Tonyan is a TE2 in a terrible matchup. Buffalo is second in DVOA against tight ends, limiting them to the seventh-lowest yards per reception and zero touchdowns.","sit",NA,"TE11","C+","9.0"
"ppr-te","TE",2022-10-29,"18610","Irv Smith","TE","MIN",12,13.07,2.1,9,19,"ed0e6a30-83d5-4f4b-bf49-f7ff80e21304","31882","2257888","TE","I. Smith Jr.","TE","TE","https://www.fantasypros.com/nfl/players/irv-smith-jr.php","irv-smith-jr.php","https://images.fantasypros.com/images/players/nfl/18610/headshot/210x210.png","https://images.fantasypros.com/images/players/nfl/18610/headshot/210x210.png","7",48.7,38.4,59,"vs. ARI","ARI",NA,"Smith Jr. is the matchup-based streaming option of the week. Smith's numbers aren't pretty, but the matchup is wondrous. Over his last three games, Smith has a 12.5% target share with a 55.8% route run rate. These aren't exactly numbers that we chase in fantasy. Add on to that his 29th-ranked PFF receiving grade and 30th standing in yards per route run, and you'll be scratching your head as to why I'm so enamored with Smith outside of being a long-standing truther. The matchup. The matchup. The matchup. Arizona is 28th in DVOA against the tight end position giving up the fourth-highest catch rate, the most receiving yards per game, the most receptions per game, and the second-most fantasy points per game. Smith is tenth in red zone targets. He's a TE1 this week.","start",NA,"TE12","C","8.9"
"ppr-te","TE",2022-10-29,"17349","Dalton Schultz","TE","DAL",13,13.18,2.69,8,20,"8caec1b4-e0b6-4a84-b8c8-617d6e91ef6a","31107","2136748","TE","D. Schultz","TE","TE","https://www.fantasypros.com/nfl/players/dalton-schultz.php","dalton-schultz.php","https://images.fantasypros.com/images/players/nfl/17349/headshot/210x210.png","https://images.fantasypros.com/images/players/nfl/17349/headshot/210x210.png","9",79.4,78.7,80,"vs. CHI","CHI",NA,"In Prescott's first game back, Schultz saw a 20% target share which is encouraging, but as a reflection of his overall health, he only ran a route on 57% of dropbacks. I don't buy the Cowboys' reports of him being at full health. This has been reflected this week in his limited practices and now his questionable tag. Schultz is 31st in PFF receiving grade and 23rd in yards per route run (minimum 15 targets). Schultz is a TE2 in a rough matchup. The Bears are seventh in DVOA against the position holding tight ends to the fifth-lowest receiving yards and eighth-lowest yards per reception (one touchdown).","sit",NA,"TE13","C","8.8"
"ppr-te","TE",2022-10-29,"16411","Evan Engram","TE","JAC",14,14.42,2.07,9,20,"e21365af-8d66-416e-b0a5-8816d18fcfd9","30136","2079887","TE","E. Engram","TE","TE","https://www.fantasypros.com/nfl/players/evan-engram.php","evan-engram.php","https://images.fantasypros.com/images/players/nfl/16411/headshot/210x210.png","https://images.fantasypros.com/images/players/nfl/16411/headshot/210x210.png","11",37.8,32.6,43,"vs. DEN","DEN",NA,"Engram is a TE2 this week. He remains the lackluster volume factory. Engram is 11th in target share, seventh in routes run, and eighth in raw target volume at the position. He's only the TE14 in fantasy points per game, as he's 24th in PFF receiving grade, 16th in yards per route run, and 25th in fantasy points per target. The Broncos have been tough on tight ends, ranking fifth in DVOA, giving up the fifth-lowest yards per reception and 13th-fewest fantasy points per game.","sit",NA,"TE14","C-","8.5"
"ppr-te","TE",2022-10-29,"18631","Dawson Knox","TE","BUF",15,15.22,2.92,12,22,"5fb525c5-4e70-4ede-8c49-94ad0cf66b7d","31928","2186345","TE","D. Knox","TE","TE","https://www.fantasypros.com/nfl/players/dawson-knox.php","dawson-knox.php","https://images.fantasypros.com/images/players/nfl/18631/headshot/210x210.png","https://images.fantasypros.com/images/players/nfl/18631/headshot/210x210.png","7",66.1,62.2,70,"vs. GB","GB",NA,"Knox only had a 7.9% target share in Week 6, but the positive is this is probably the healthiest we've seen him all season. We can surmise this from his season-high 75% route run rate. Coming off a bye, as long as Knox is practicing in full this week or we hear positive reports, we could see his route rate climb even higher. Knox has two of his three red zone targets in his last two games played. Green Bay is 18th in DVOA against tight ends. Knox is a TE2 with quiet upside.","sit",NA,"TE15","C-","8.4"
"ppr-te","TE",2022-10-29,"23153","Greg Dulcich","TE","DEN",16,16.13,2.73,9,24,"b9e4a022-d15c-4cef-9879-170277f17207","34036","2964274","TE","G. Dulcich","TE","TE","https://www.fantasypros.com/nfl/players/greg-dulcich.php","greg-dulcich.php","https://images.fantasypros.com/images/players/nfl/23153/headshot/210x210.png","https://images.fantasypros.com/images/players/nfl/23153/headshot/210x210.png","9",37.1,32.1,42,"at JAC","JAC",NA,"Dulcich has been worked into the offense quickly. Since Week 6, he's drawn a 17.1% target share with a 74.4% route run rate. Over the last two games, he's been the TE11 and TE7 in weekly scoring. He's garnered three deep targets, and a red zone look in this short stretch. Dulcich is a low-end TE1/high-end TE2 this week. The Jaguars are 21st in DVOA against tight ends with the fifth-highest yards per reception allowed.","start",NA,"TE16","D+","8.3"
"ppr-te","TE",2022-10-29,"17272","Mike Gesicki","TE","MIA",17,16.38,2.88,10,23,"1012cbe0-7eba-4169-bfca-183a0204e1a7","31012","2139298","TE","M. Gesicki","TE","TE","https://www.fantasypros.com/nfl/players/mike-gesicki.php","mike-gesicki.php","https://images.fantasypros.com/images/players/nfl/17272/headshot/210x210.png","https://images.fantasypros.com/images/players/nfl/17272/headshot/210x210.png","11",61.8,69.6,54,"at DET","DET",NA,"Since being reintegrated into this offense in Week 5, Gesicki is the TE6 with a 15% target share and a 66.2% route run rate. Over that small three-game span, he's 13th in PFF receiving grade and 13th in yards per route run with five red zone targets. Gesicki has run about 60% of his routes from the slot, so he'll see plenty of A.J. Parker (100% catch rate, 118.8 passer rating). Detroit is also 31st in DVOA against tight ends if we're viewing Gesicki from the traditional tight-end lens. They have allowed the seventh-highest catch rate and yards per reception. Gesicki is a top-12 tight end.","start",NA,"TE17","D+","7.9"
"ppr-te","TE",2022-10-29,"23181","Cade Otton","TE","TB",18,17.22,2.52,10,23,"f23517bd-ae85-484a-8ecb-1f7a2d851e48","34062","2815179","TE","C. Otton","TE","TE","https://www.fantasypros.com/nfl/players/cade-otton.php","cade-otton.php","https://images.fantasypros.com/images/players/nfl/23181/headshot/210x210.png","https://images.fantasypros.com/images/players/nfl/23181/headshot/210x210.png","11",10.8,7.6,14,"vs. BAL","BAL",NA,"If Cameron Brate remains sidelined, Otton will be the full-time tight end in Week 7. In the two games, he's been in the starter's chair, he's played at least 81% of the snaps with a 12.2% target share and 83.5% route run rate. He averaged six targets, five receptions, and 53.5 receiving yards as the TE10 and TE12 in fantasy scoring. Baltimore is 24th in DVOA against tight ends allowing the highest catch rate and fourth-most receiving touchdowns to the position. If Otton draws the start, he's a TE1.","start",NA,"TE18","D+","7.8"
"ppr-te","TE",2022-10-29,"19562","Juwan Johnson","TE","NO",19,19.4,2.07,14,24,"0226b03b-f91d-4223-9813-9fcd2e9c3acc","33113","2186637","TE","J. Johnson","TE","TE","https://www.fantasypros.com/nfl/players/juwan-johnson.php","juwan-johnson.php","https://images.fantasypros.com/images/players/nfl/19562/headshot/210x210.png","https://images.fantasypros.com/images/players/nfl/19562/headshot/210x210.png","14",7.6,7.1,8,"vs. LV","LV",NA,"Juwan Johnson, my king. Last week he turned his five targets into 32 receiving yards and two scores. Since Week 6, he's played at least 76% of the snaps with an 11.1% target share and 76.5% route run rate. He ranks 11th in deep targets and tenth in red zone targets among tight ends. Johnson is a decent TE2 and streaming option this week against a Raiders defense that ranks 16th in DVOA against tight ends with the 14th-most receiving yards per game allowed. Johnson has been listed as questionable with a hamstring issue. He logged limited practices on Thursday and Friday putting him in line to play.","sit",NA,"TE19","D","7.7"
"ppr-te","TE",2022-10-29,"17527","Noah Fant","TE","SEA",20,21.02,2.08,16,26,"cdc98acc-9eb6-4b44-81bb-61d7b8a3b55f","31852","2251095","TE","N. Fant","TE","TE","https://www.fantasypros.com/nfl/players/noah-fant.php","noah-fant.php","https://images.fantasypros.com/images/players/nfl/17527/headshot/210x210.png","https://images.fantasypros.com/images/players/nfl/17527/headshot/210x210.png","11",23.2,36.4,10,"vs. NYG","NYG",NA,"The SEA tight end situation is a weekly coinflip. Fant is the lean this week if you're looking this way for a streamer. Fant leads Dissly with a 12.3% target share (Dissly 9.5%) and 48.5% route run rate (Dissly 41.5%). Fant also has the slight lead in weighted opportunity (0.24 vs. 0.17). The Giants have been giving to tight ends ranking 27th in DVOA with the fourth-most receiving yards and ninth-highest yards per reception allowed.","sit",NA,"TE20","D-","7.6"
"ppr-te","TE",2022-10-29,"15561","Hunter Henry","TE","NE",21,21.24,2.14,17,25,"705899da-3c20-4bc3-b5d0-2e6e40655131","29269","2079848","TE","H. Henry","TE","TE","https://www.fantasypros.com/nfl/players/hunter-henry.php","hunter-henry.php","https://images.fantasypros.com/images/players/nfl/15561/headshot/210x210.png","https://images.fantasypros.com/images/players/nfl/15561/headshot/210x210.png","10",36.2,33.3,39,"at NYJ","NYJ",NA,"Since Week 4, Henry has had an 18% target share (4.5 targets per game) with an 82.6% route run rate as the TE17 in fantasy. Over the last four games, he has had four red zone targets. Henry is a mid-TE2 and a decent matchup streamer. The Jets have allowed the fifth-most receiving yards per game to tight ends while ranking 13th in yards per reception.","sit",NA,"TE21","D-","7.5"
"ppr-te","TE",2022-10-29,"19389","Harrison Bryant","TE","CLE",22,21.51,3.02,13,28,"f58a5899-8b78-46e8-a29a-ba6273b7d872","32785","2241240","TE","H. Bryant","TE","TE","https://www.fantasypros.com/nfl/players/harrison-bryant.php","harrison-bryant.php","https://images.fantasypros.com/images/players/nfl/19389/headshot/210x210.png","https://images.fantasypros.com/images/players/nfl/19389/headshot/210x210.png","9",5.8,4.6,7,"vs. CIN","CIN",NA,"With Njoku on the shelf, Bryant likely takes the mantle as the leading tight end for the Browns. Bryant is one of the best streaming tight-end options for the week. This week, Bryant could be the Browns' best weapon against the Bengals' zone coverage. In 2021, Bryant saw 64.3% of his target volume against zone. He was one of the best tight ends in the NFL against the coverage, ranking 16th in PFF receiving grade and 11th in yards per route run (minimum five zone targets). Bryant is a TE2 with sneaky TE1 upside in Week 8.","sit",NA,"TE22","D-","7.5"
"ppr-te","TE",2022-10-29,"18049","Will Dissly","TE","SEA",23,23.53,1.53,20,28,"383f4814-6836-4766-a297-fc063e8509cc","31090","2139628","TE","W. Dissly","TE","TE","https://www.fantasypros.com/nfl/players/will-dissly.php","will-dissly.php","https://images.fantasypros.com/images/players/nfl/18049/headshot/210x210.png","https://images.fantasypros.com/images/players/nfl/18049/headshot/210x210.png","11",10,6.9,13,"vs. NYG","NYG",NA,NA,NA,NA,"TE23","F","6.7"
"ppr-te","TE",2022-10-29,"19229","Cole Kmet","TE","CHI",24,23.78,2.06,21,29,"036feeb6-9a22-43c5-a8e3-7ac611d8ff49","32713","2868619","TE","C. Kmet","TE","TE","https://www.fantasypros.com/nfl/players/cole-kmet.php","cole-kmet.php","https://images.fantasypros.com/images/players/nfl/19229/headshot/210x210.png","https://images.fantasypros.com/images/players/nfl/19229/headshot/210x210.png","14",26,28.9,23,"at DAL","DAL",NA,"It's time. I've blown that last remaining hope candle for Kmet out. He's the TE37 in fantasy points per game. He's only managed a 13.6% target share (19th) with one red zone target. He hasn't surpassed 50 receiving yards in any game this season. Don't play Kmet. The Cowboys have allowed the lowest yards per reception to tight ends while giving up the 12th-fewest receiving yards.","sit",NA,"TE24","F","6.6"
"ppr-te","TE",2022-10-29,"17598","Tyler Conklin","TE","NYJ",25,25.27,1.74,20,29,"f0d17dfa-ebf3-416c-a8d2-c6bc30675103","31127","2165249","TE","T. Conklin","TE","TE","https://www.fantasypros.com/nfl/players/tyler-conklin.php","tyler-conklin.php","https://images.fantasypros.com/images/players/nfl/17598/headshot/210x210.png","https://images.fantasypros.com/images/players/nfl/17598/headshot/210x210.png","10",14.3,16.6,12,"vs. NE","NE",NA,"Since Week 4, no Jets tight ends are playable in fantasy. None have seen more than 3.5 targets per game or a route run rate higher than 53.4%. New England is sixth in DVOA against tight ends.","sit",NA,"TE25","F","6.3"
"ppr-te","TE",2022-10-29,"18397","Foster Moreau","TE","LV",26,27.62,3.52,24,40,"9c3a67fd-5c6e-4689-9e08-9ff6d4db6c9a","31969","2180634","TE","F. Moreau","TE","TE","https://www.fantasypros.com/nfl/players/foster-moreau.php","foster-moreau.php","https://images.fantasypros.com/images/players/nfl/18397/headshot/210x210.png","https://images.fantasypros.com/images/players/nfl/18397/headshot/210x210.png","6",2.2,1.3,3,"at NO","NO",NA,"Check back Friday to see if Moreau reprises the every down tight end role for the Raiders or if Waller sends him back to part-time usage.","sit",NA,"TE26","F","6.3"
"ppr-te","TE",2022-10-29,"23781","Isaiah Likely","TE","BAL",27,29.43,4.72,20,44,"f9279edb-cfa7-4f7d-91df-b81cbf3e133e","34095","2961906","TE","I. Likely","TE","TE","https://www.fantasypros.com/nfl/players/isaiah-likely.php","isaiah-likely.php","https://images.fantasypros.com/images/players/nfl/23781/headshot/210x210.png","https://images.fantasypros.com/images/players/nfl/23781/headshot/210x210.png","10",3.4,1.7,5,"at TB","TB",NA,NA,NA,NA,"TE27","F","6.1"
"ppr-te","TE",2022-10-29,"22841","Kylen Granson","TE","IND",28,31.95,3.25,28,40,"bcc0167c-05fd-4b23-981e-60b8784ceb33","33515","2247146","TE","K. Granson","TE","TE","https://www.fantasypros.com/nfl/players/kylen-granson.php","kylen-granson.php","https://images.fantasypros.com/images/players/nfl/22841/headshot/210x210.png","https://images.fantasypros.com/images/players/nfl/22841/headshot/210x210.png","14",0.3,0.3,0,"vs. WAS","WAS",NA,NA,NA,NA,"TE28","F","5.6"
"ppr-te","TE",2022-10-29,"15581","Austin Hooper","TE","TEN",29,30.19,2.85,25,40,"90c2a93f-d837-4e1b-b57c-56648903a8db","29315","2067004","TE","A. Hooper","TE","TE","https://www.fantasypros.com/nfl/players/austin-hooper.php","austin-hooper.php","https://images.fantasypros.com/images/players/nfl/15581/headshot/210x210.png","https://images.fantasypros.com/images/players/nfl/15581/headshot/210x210.png","6",9.8,5.6,14,"at HOU","HOU",NA,NA,NA,NA,"TE29","F","5.4"
"ppr-te","TE",2022-10-29,"23829","Jelani Woods","TE","IND",30,34.41,5.49,29,53,"321af8f8-b4de-4ed2-a86f-7f97a85a13d4","34029","2787078","TE","J. Woods","TE","TE","https://www.fantasypros.com/nfl/players/jelani-woods.php","jelani-woods.php","https://images.fantasypros.com/images/players/nfl/23829/headshot/210x210.png","https://images.fantasypros.com/images/players/nfl/23829/headshot/210x210.png","14",0.7,0.4,1,"vs. WAS","WAS",NA,NA,NA,NA,"TE30","F","4.9"
"ppr-te","TE",2022-10-29,"14104","Darren Waller","TE","LV",31,27.7,17.29,6,95,"14c97c9f-26e8-4944-9299-f90de6aeada3","28592","1850793","TE","D. Waller","TE","TE","https://www.fantasypros.com/nfl/players/darren-waller.php","darren-waller.php","https://images.fantasypros.com/images/players/nfl/14104/headshot/210x210.png","https://images.fantasypros.com/images/players/nfl/14104/headshot/210x210.png","6",94,94,94,"at NO","NO",NA,NA,NA,NA,"TE31","F","4.8"
"ppr-te","TE",2022-10-29,"16579","Mo Alie-Cox","TE","IND",32,33.7,6.42,27,48,"8809c0dd-786b-4255-a7d0-333c9498c19a","30112","2815925","TE","Mo Alie-Cox","TE","TE","https://www.fantasypros.com/nfl/players/mo-alie-cox.php","mo-alie-cox.php","https://images.fantasypros.com/images/players/nfl/16579/headshot/210x210.png","https://images.fantasypros.com/images/players/nfl/16579/headshot/210x210.png","14",3.4,1.8,5,"vs. WAS","WAS",-3,"The Colts' tight-end roulette wheel isn't worth spinning against Washington. The Commanders are a brick wall against tight ends, ranking fourth in DVOA, yielding the fourth-lowest catch rate, and receiving yards.",NA,NA,"TE32","F","4.3"
"ppr-te","TE",2022-10-29,"17387","Ian Thomas","TE","CAR",33,33.4,2.01,31,39,"ed8a8fd2-df67-45e7-a34f-984afb82f6ea","31071","2253359","TE","I. Thomas","TE","TE","https://www.fantasypros.com/nfl/players/ian-thomas.php","ian-thomas.php","https://images.fantasypros.com/images/players/nfl/17387/headshot/210x210.png","https://images.fantasypros.com/images/players/nfl/17387/headshot/210x210.png","13",0.1,0.1,0,"at ATL","ATL",NA,NA,NA,NA,"TE33","F","4.3"
"ppr-te","TE",2022-10-29,"22795","Tommy Tremble","TE","CAR",34,34.2,2.83,29,44,"cbee2fd3-e5f2-4316-bffd-531f1873f032","33471","2969027","TE","T. Tremble","TE","TE","https://www.fantasypros.com/nfl/players/tommy-tremble.php","tommy-tremble.php","https://images.fantasypros.com/images/players/nfl/22795/headshot/210x210.png","https://images.fantasypros.com/images/players/nfl/22795/headshot/210x210.png","13",0.4,0.4,0,"at ATL","ATL",NA,NA,NA,NA,"TE34","F","4.3"
"ppr-te","TE",2022-10-29,"16380","OJ Howard","TE","HOU",35,38.24,6.03,32,64,"93ed8c6f-b676-46d3-bf82-6155e89b4a68","30132","2061190","TE","O.J. Howard","TE","TE","https://www.fantasypros.com/nfl/players/oj-howard.php","oj-howard.php","https://images.fantasypros.com/images/players/nfl/16380/headshot/210x210.png","https://images.fantasypros.com/images/players/nfl/16380/headshot/210x210.png","6",0.8,0.5,1,"vs. TEN","TEN",NA,NA,NA,NA,"TE35","F","4.1"
"ppr-te","TE",2022-10-29,"20162","Brevin Jordan","TE","HOU",36,34.74,5.42,26,47,"8ffb5c07-4aa1-4796-b1ab-30c1ab0ccc4c","33535","2964787","TE","B. Jordan","TE","TE","https://www.fantasypros.com/nfl/players/brevin-jordan.php","brevin-jordan.php","https://images.fantasypros.com/images/players/nfl/20162/headshot/210x210.png","https://images.fantasypros.com/images/players/nfl/20162/headshot/210x210.png","6",0.9,0.7,1,"vs. TEN","TEN",NA,NA,NA,NA,"TE36","F","4.0"
"ppr-te","TE",2022-10-29,"17415","Jordan Akins","TE","HOU",37,31.92,6.24,24,48,"0cb5a32a-a340-4671-ba2a-93f5fa6aee8d","31068","2142712","TE","J. Akins","TE","TE","https://www.fantasypros.com/nfl/players/jordan-akins.php","jordan-akins.php","https://images.fantasypros.com/images/players/nfl/17415/headshot/210x210.png","https://images.fantasypros.com/images/players/nfl/17415/headshot/210x210.png","6",0.2,0.2,0,"vs. TEN","TEN",NA,NA,NA,NA,"TE37","F","4.0"
