"page","page_pos","scrape_date","fantasypros_id","player_name","pos","team","rank","ecr","sd","best","worst","sportradar_id","yahoo_id","cbs_id","player_positions","player_short_name","player_eligibility","player_yahoo_positions","player_page_url","player_filename","player_square_image_url","player_image_url","player_bye_week","player_owned_avg","player_owned_espn","player_owned_yahoo","player_opponent","player_opponent_id","player_ecr_delta","note","tag","recommendation","pos_rank","start_sit_grade","r2p_pts"
"qb","QB",2023-09-29,"17298","Josh Allen","QB","BUF",1,1.26,0.59,1,3,"3069db07-aa43-4503-ab11-2ae5c0002721","30977","2181054","QB","J. Allen","QB","QB","https://www.fantasypros.com/nfl/players/josh-allen-qb.php","josh-allen-qb.php","https://images.fantasypros.com/images/players/nfl/17298/headshot/210x210.png","https://images.fantasypros.com/images/players/nfl/17298/headshot/210x210.png","13",100,99.9,100,"vs. MIA","MIA",NA,"Allen has been on point after his debacle in Week 1. Over the last two weeks, he ranks third in passing grade, sixth in big-time throw rate, and first in adjusted completion rate. Since Week 2, Allen has been fifth in fantasy points per dropback. Miami has been a run-of-the-mill pass defense, ranking 15th in yards per attempt and passer rating allowed. They have struggled to defend play-action passing, which could lead to another massive Allen outing. Miami has permitted the 13th-highest play-action adjusted completion rate, the sixth-most play-action passing touchdowns (tied), and the eighth-highest play-action passer rating. Allen is 14th in play-action dropback rate with the fifth-highest play-action yards per attempt and the highest passer rating when utilizing play-action. Week 4 Positional Value: High-end QB1",NA,NA,"QB1","A+","22.6"
"qb","QB",2023-09-29,"19275","Jalen Hurts","QB","PHI",2,1.98,0.46,1,3,"64bd0f02-6a5d-407e-98f1-fd02048ea21d","32723","2240246","QB","J. Hurts","QB","QB","https://www.fantasypros.com/nfl/players/jalen-hurts.php","jalen-hurts.php","https://images.fantasypros.com/images/players/nfl/19275/headshot/210x210.png","https://images.fantasypros.com/images/players/nfl/19275/headshot/210x210.png","10",100,99.9,100,"vs. WAS","WAS",NA,"Hurts isn't playing at last year's MVP level, but he is definitely not struggling either. Hurts is the QB7 in fantasy ranking 15th in passing grade, sixth in adjusted completion rate, and 13th in big-time throw rate. He has destroyed zone coverage this season (WAS 68-76% zone). Hurts has the tenth-best yards per attempt, the tenth-highest passer rating, and the seventh-highest fantasy points per dropback against zone. Washington has allowed the 14th-highest yards per attempt while holding passers to the 13th-lowest adjusted completion rate. The Commanders biggest issue is their inability to stop downfield passing. Washington has permitted the fourth-most deep passing yards and the ninth-highest deep ball adjusted completion rate. Hurts is tenth in deep ball rate. Week 4 Positional Value: Top-three QB",NA,NA,"QB2","A","22.1"
"qb","QB",2023-09-29,"16413","Patrick Mahomes","QB","KC",3,3.32,0.82,1,5,"11cad59d-90dd-449c-a839-dddaba4fe16c","30123","2142052","QB","P. Mahomes II","QB","QB","https://www.fantasypros.com/nfl/players/patrick-mahomes.php","patrick-mahomes.php","https://images.fantasypros.com/images/players/nfl/16413/headshot/210x210.png","https://images.fantasypros.com/images/players/nfl/16413/headshot/210x210.png","10",100,99.9,100,"at NYJ","NYJ",NA,"Mahomes is the QB4 in fantasy with he third-highest passing grade, 12th-best big-time throw rate, and the third-most passing touchdowns. He faces a tough test against the Jets' talented pass defense. They have held quarterbacks to the 12th-lowest yard per attempt while also ranking 17th in passer rating and adjusted completion rate. New York has given up the 11th-fewest fantasy points per game to quarterbacks. Mahomes is matchup-proof as he chews up and spits out even superb defense. Week 4 Positional Value: High-end QB1",NA,NA,"QB3","A","21.4"
"qb","QB",2023-09-29,"18635","Justin Herbert","QB","LAC",4,3.91,1,1,7,"f0a8f8e3-b9e9-46ed-85e4-eec6452a8a44","32676","2221960","QB","J. Herbert","QB","QB","https://www.fantasypros.com/nfl/players/justin-herbert.php","justin-herbert.php","https://images.fantasypros.com/images/players/nfl/18635/headshot/210x210.png","https://images.fantasypros.com/images/players/nfl/18635/headshot/210x210.png","5",98.9,98.7,99,"vs. LV","LV",NA,"Herbert has been hosting a master class in quarterback play. He is 12th in passing grade, eighth-best in adjusted completion rate, fourth-highest in yards per attempt, and ninth-best in big-time throw rate. The Raiders don't have a chance to slow him down. Las Vegas has allowed the third-most passing touchdowns, second-highest passer rating, and the fourth-highest adjusted completion rate. The Raiders are tied for the 13th-most dropbacks defended in man coverage. Against man, Herbert has the fifth-best yards per attempt and second-highest passer rating. Week 4 Positional Value: Top-five QB",NA,NA,"QB4","A-","20.8"
"qb","QB",2023-09-29,"19198","Tua Tagovailoa","QB","MIA",5,6.09,2.49,3,16,"26ad9c27-de38-495e-913c-6fb2428e76d3","32675","2741209","QB","T. Tagovailoa","QB","QB","https://www.fantasypros.com/nfl/players/tua-tagovailoa.php","tua-tagovailoa.php","https://images.fantasypros.com/images/players/nfl/19198/headshot/210x210.png","https://images.fantasypros.com/images/players/nfl/19198/headshot/210x210.png","10",96.7,95.4,98,"at BUF","BUF",NA,"How quickly all those offseason concerns for Tagovailoa have disappeared. That's what happens when you continually prove the doubters wrong. Tagovailoa continues to do just that. He is the QB4 in fantasy, ranking first in passing grade, tenth-best in adjusted completion rate, and first in big-time throw rate. The Bills are a formidable pass defense, but Tagovailoa can still carve them up. Buffalo has held the opposition to 20th in yards per attempt, but they have surrendered the tenth-highest adjusted completion rate. Buffalo has also had issues defending the deep ball. Last year, Buffalo defended the 13th-fewest deep ball attempts in the NFL, but they gave up the 12th-highest adjusted completion rate and ninth-highest passer rating on throw 20 or more yards. This season, Tagovailoa has the eighth-most deep attempts (tied) and the ninth-highest deep-adjusted completion rate. Buffalo is sixth in pressure rate, but Miami has allowed Tagovailoa to face the league's lowest pressure rate. The Tua train continues to roll this week. Week 4 Positional Value: QB1",NA,NA,"QB5","B+","20.2"
"qb","QB",2023-09-29,"24347","Anthony Richardson","QB","IND",6,6.49,1.74,4,11,"5fc5b4a6-a583-4345-a810-4f982204ea5e","40040","3163263","QB","A. Richardson","QB","QB","https://www.fantasypros.com/nfl/players/anthony-richardson.php","anthony-richardson.php","https://images.fantasypros.com/images/players/nfl/24347/headshot/210x210.png","https://images.fantasypros.com/images/players/nfl/24347/headshot/210x210.png","11",83.1,82.2,84,"vs. LAR","LAR",NA,"Richardson remains a work in progress as a passer ranking 28th in passing grade and 16th in adjusted completion rate. In fantasy he remains a must-start QB1. He ranks first in fantasy points per dropback with his legs doing the heavy lifting. He is fifth in carries per game, first in red zone carries, and fourth in rushing yards per game. The Rams have been a spunky pass defense. They are also outplaying preseason expectations. Los Angeles has held passers to the seventh-lowets yards per attempt, the sixth-lowest passer rating, and the fourth-lowest adjusted completion rate. Richardson will be forced to compensate with rushing yards to aid his fantasy day which shouldn't be a problem. Week 4 Positional Value: QB1","start",NA,"QB6","B+","19.7"
"qb","QB",2023-09-29,"11177","Kirk Cousins","QB","MIN",7,6.96,1.54,4,13,"bbd0942c-6f77-4f83-a6d0-66ec6548019e","25812","1272574","QB","K. Cousins","QB","QB","https://www.fantasypros.com/nfl/players/kirk-cousins.php","kirk-cousins.php","https://images.fantasypros.com/images/players/nfl/11177/headshot/210x210.png","https://images.fantasypros.com/images/players/nfl/11177/headshot/210x210.png","13",94.4,93.7,95,"at CAR","CAR",NA,"The sim must be broken. Cousins remains THE QB1 in fantasy. He is seventh in passing grade, fourth in yards per attempt (tied with Justin Herbert), and seventh in adjusted completion rate. Cousins should eat up Carolina's zone coverage (65-69% zone). Cousins has the 11th-highest yards per attempt and third-highest fantasy points per dropback against zone. Carolina has allowed the 12th-highest yards per attempt while ranking 15th in passer rating. Week 4 Positional Value: QB1","start",NA,"QB7","B+","19.3"
"qb","QB",2023-09-29,"17233","Lamar Jackson","QB","BAL",8,8.21,1.42,5,12,"e06a9c07-453a-4bb0-a7e9-2c3a64166dad","31002","2181169","QB","L. Jackson","QB","QB","https://www.fantasypros.com/nfl/players/lamar-jackson.php","lamar-jackson.php","https://images.fantasypros.com/images/players/nfl/17233/headshot/210x210.png","https://images.fantasypros.com/images/players/nfl/17233/headshot/210x210.png","13",99.7,99.4,100,"at CLE","CLE",NA,"Jackson's passing hasn't been very impressive. Yes, he has the fourth-best adjusted completion rate, but he is also 16th in passing grade and has the fourth-lowest aDOT. His rushing continues to bring him the Fantasy flowers as he's third in carries per game and second in rushing yards. This has led to QB9 and QB3 weekly finishes in the last two weeks. This week's matchup is brutal, so Jackson will have to run to finish with a decent fantasy day. Cleveland has allowed the lowest yards per attempt, the third-lowest passer rating, and the second-lowest adjusted completion rate. The Browns will send the house this week as they rank tenth in blitz rate and first in pressure rate. Jackson has the eighth-lowest passer grade and the ninth-lowest yards per attempt against the blitz this season. Week 4 Positional Value: low-end QB1",NA,NA,"QB8","B","19.2"
"qb","QB",2023-09-29,"19781","Justin Fields","QB","CHI",9,10.55,2.67,7,20,"cf15be8f-9117-4531-a517-2b9c7cb3e9e1","33399","1273205","QB","J. Fields","QB","QB","https://www.fantasypros.com/nfl/players/justin-fields.php","justin-fields.php","https://images.fantasypros.com/images/players/nfl/19781/headshot/210x210.png","https://images.fantasypros.com/images/players/nfl/19781/headshot/210x210.png","13",91,91,91,"vs. DEN","DEN",2,"Fields has been tough to watch. There's no way around it. The Bears offense looks broken. He has the fifth-lowest passing grade, the fourth-lowest adjusted completion rate, and the highest time to throw. The baffling thing is that Fields still only has three designed runs this season. Three! I still can't wrap my head around this. Last year, Fields had six games in which he had at least three designed runs. It's like Luke Getsy decided to take away his quarterback's best weapon this season. It's head-scratching. Fields still ranks fifth in carries per game and eighth in rushing yards per game, so his rushing equity isn't totally lifeless. If Fields can't produce in this matchup, it's time to consider cutting him to the waiver wire. The Broncos have a Swiss cheese run defense, as we saw last week, but their secondary has also been riding the struggle bus this season. Denver has allowed the highest yards per attempt, the most passing touchdowns, and the highest adjusted completion rate. Week 4 Positional Value: Dice roll QB with top-12 upside","sit",NA,"QB9","B-","19.0"
"qb","QB",2023-09-29,"18232","Daniel Jones","QB","NYG",10,10.74,3.04,6,19,"0042266b-cb28-4012-bfd2-06650badad97","31838","2179245","QB","D. Jones","QB","QB","https://www.fantasypros.com/nfl/players/daniel-jones.php","daniel-jones.php","https://images.fantasypros.com/images/players/nfl/18232/headshot/210x210.png","https://images.fantasypros.com/images/players/nfl/18232/headshot/210x210.png","13",67.2,66.3,68,"vs. SEA","SEA",2,"Jones has one spectacular game this season sandwiched in between to disgusting ones. Jones has the 11th-lowest passing grade and fifth-lowest yards per attempt while also ranking 20th in adjusted completion rate. The rushing equity remains as Jones is third in carries per game, fifth in red zone carries per game, and fourth in rushing yards per game. Seattle has allowed the sixth-highest yards per attempt, the ninth-highest passer rating, and the eighth-most fantasy points per game to quarterbacks. Week 4 Positional Value: QB1","start",NA,"QB10","B-","18.8"
"qb","QB",2023-09-29,"19196","Joe Burrow","QB","CIN",11,10.89,2.98,7,21,"3023ac10-4e7f-425f-9fc5-2b8e6332c92e","32671","2179798","QB","J. Burrow","QB","QB","https://www.fantasypros.com/nfl/players/joe-burrow.php","joe-burrow.php","https://images.fantasypros.com/images/players/nfl/19196/headshot/210x210.png","https://images.fantasypros.com/images/players/nfl/19196/headshot/210x210.png","7",98.5,98,99,"at TEN","TEN",-2,"Excluding his rough Week 1 outing, we find that Burrow has been playing commendably, with all things considered. He is 11th in passing grade, but the focus because of his health has been to get the ball out quickly on short area routes. He has the third-lowest time to throw, the second-lowest aDOT, and the third-lowest yards per attempt. The Titans' secondary has not been playing good football, but they could keep Burrow in check this week. Tennessee has given up the fourth-highest yards per attempt, the fifth-highest passer rating, and the sixth-highest adjusted completion rate. The problem for Burrow is that they are not allowing much after the catch. The Titans have permitted the tenth-lowest YAC per reception and missed tackles. They have the fifth-lowest percentage of passing yards after catch allowed. Burrow will have to dink and dunk all day to move the Bengals' offense against this pass-funnel defense. Week 4 Positional Value: low-end QB1","start",NA,"QB11","B-","18.6"
"qb","QB",2023-09-29,"19780","Trevor Lawrence","QB","JAC",12,10.91,1.67,8,15,"aaa8b42c-4d87-45f6-bfd2-e31cfed9a736","33389","2967185","QB","T. Lawrence","QB","QB","https://www.fantasypros.com/nfl/players/trevor-lawrence.php","trevor-lawrence.php","https://images.fantasypros.com/images/players/nfl/19780/headshot/210x210.png","https://images.fantasypros.com/images/players/nfl/19780/headshot/210x210.png","9",93.8,91.6,96,"vs. ATL","ATL",-2,"Lawrence has been struggling in the early going. He is the QB22 in fantasy points per game with the 15th-best adjusted completion rate while running 23rd in yards per attempt. This isn't the type of production you hoped for this season after his scorching end to the 2022 season. This week's matchup is no cakewalk, so we'll all collectively hold our breath to see if Lawrence can start to turn things around here. Atlanta has allowed the fifth-lowest yards per attempt, the eighth-lowest passer rating, and the 12th-fewest fantasy points per game to quarterbacks. Week 4 Positional Value: low-end QB1","start",NA,"QB12","B-","18.3"
"qb","QB",2023-09-29,"11180","Russell Wilson","QB","DEN",13,13.51,2.19,8,21,"409d4cac-ee90-4470-9710-ebe671678339","25785","1272242","QB","R. Wilson","QB","QB","https://www.fantasypros.com/nfl/players/russell-wilson.php","russell-wilson.php","https://images.fantasypros.com/images/players/nfl/11180/headshot/210x210.png","https://images.fantasypros.com/images/players/nfl/11180/headshot/210x210.png","9",60.9,66.8,55,"at CHI","CHI",2,"Wilson looks like a player with a second life, with Sean Payton. He is tenth in passing grade, sixth in yards per attempt, and 13th in adjusted completion rate as the QB10 in fantasy. Wilson should post another solid stat line against the Bears' zone defense (55-67% zone for CHI's corners). Wilson is 13th in passer rating and fifth in fantasy points per dropback against zone this season. Chicago's pass defense has been a turnstile, allowing the third-highest yards per attempt, the fourth-highest passer rating, and the fifth-most fantasy points to quarterbacks. Week 4 Positional Value: QB1",NA,NA,"QB13","C+","18.1"
"qb","QB",2023-09-29,"19797","Brock Purdy","QB","SF",14,13.6,1.42,11,17,"d5aef708-ad61-4ab8-a637-62ff96e92040","34218","2961306","QB","B. Purdy","QB","QB","https://www.fantasypros.com/nfl/players/brock-purdy.php","brock-purdy.php","https://images.fantasypros.com/images/players/nfl/19797/headshot/210x210.png","https://images.fantasypros.com/images/players/nfl/19797/headshot/210x210.png","9",74.2,71.4,77,"vs. ARI","ARI",NA,"Purdy is still trying to shake off the rust. He's 21st in passing grade with the 11th-highest turnover-worthy play rate. It's not all doom and gloom, though. He's also second in yards per attempt and 12th-best in adjusted completion rate as the QB15 in fantasy. Arizona has allowed the 11th-highest yards per attempt and the 13th-highest adjusted completion rate. Week 4 Positional Value: Rock solid QB2","sit",NA,"QB14","C+","17.8"
"qb","QB",2023-09-29,"11687","Geno Smith","QB","SEA",15,13.87,1.86,10,20,"cfc93f5e-105e-4a5e-88d3-f4279893cfa8","26662","1700358","QB","G. Smith","QB","QB","https://www.fantasypros.com/nfl/players/geno-smith.php","geno-smith.php","https://images.fantasypros.com/images/players/nfl/11687/headshot/210x210.png","https://images.fantasypros.com/images/players/nfl/11687/headshot/210x210.png","5",74.7,73.3,76,"at NYG","NYG",NA,"Chef Geno never leaves the kitchen. The cooking of NFL defenses is a 24/7/365 affair. He has remained stellar ranking ninth-best in passing grade, 11th-best in yards per attempt, and first in adjusted completion rate. New York will blitz Smith incessantly. Good think the Chef is adept at handling the blitz. He has the seventh-highest passing grade against the blitz with the tenth highest yards per attempt. New York has utilized man coverage on 44-46% of their corner's snaps. Smith has the fourth-lowest yards per attempt but eighth-highest passer rating against man. Week 4 Positional Value: QB1",NA,NA,"QB15","C+","17.5"
"qb","QB",2023-09-29,"16398","Deshaun Watson","QB","CLE",16,16.04,1.49,11,19,"eec5265c-7731-4bb6-8af2-4f98a67f9ab7","30125","2133482","QB","D. Watson","QB","QB","https://www.fantasypros.com/nfl/players/deshaun-watson.php","deshaun-watson.php","https://images.fantasypros.com/images/players/nfl/16398/headshot/210x210.png","https://images.fantasypros.com/images/players/nfl/16398/headshot/210x210.png","5",88.3,87.5,89,"vs. BAL","BAL",NA,"Watson looked better against Tennessee's pass funnel defense last week, but we need to see if he can continue that level of play. His numbers have not been impressive, ranking 17th in passing grade, 19th in yards per attempt, and 19th in adjusted completion rate. Baltimore has a tough pass defense, allowing the third-fewest yards per attempt and 12th-lowest passer rating. The Ravens have surrendered the ninth-fewest fantasy points per game to quarterbacks. Baltimore's 24th-ranked pressure rate is painful, but they have been blitzing at the eighth-highest rate. If the blitz can get home, Watson is in trouble. He has the 19th-best adjusted completion rate and the second-lowest yards per attempt this season against the blitz. Week 4 Positional Value: QB2","sit",NA,"QB16","C","17.1"
"qb","QB",2023-09-29,"19246","Jordan Love","QB","GB",17,16.81,1.82,11,21,"e5094779-e94f-4052-8597-bdbee3719f6b","32696","2239997","QB","J. Love","QB","QB","https://www.fantasypros.com/nfl/players/jordan-love.php","jordan-love.php","https://images.fantasypros.com/images/players/nfl/19246/headshot/210x210.png","https://images.fantasypros.com/images/players/nfl/19246/headshot/210x210.png","6",68.6,60.2,77,"vs. DET","DET",NA,"Love hasn't been impressive outside of running hot with touchdowns in the first two games. Among 34 qualifying quarterbacks, he ranks 22nd in passing grade, dead last in adjusted completion rate, and has the 13th-highest turnover-worthy play rate. Detroit has been a much-improved defense this season. They have held quarterbacks to the 12th-lowest yards per attempt and seventh-lowest adjusted completion rate. Detroit has permitted the 17th-lowest fantasy points per game to quarterbacks. Love will have to turn it up to another level that we have yet to see to walk away with a standout day in Week 4. Detroit has utilized zone coverage on 62-66% of their corners snaps. Against zone, Love is 19th in passer rating with the highest turnover-worthy throw rate. Week 4 Positional Value: QB2","sit",NA,"QB17","C","16.7"
"qb","QB",2023-09-29,"15501","Jared Goff","QB","DET",18,18.25,1.7,14,22,"aba8f925-ffbf-4654-bfa7-a25d3d237494","29235","2061053","QB","J. Goff","QB","QB","https://www.fantasypros.com/nfl/players/jared-goff.php","jared-goff.php","https://images.fantasypros.com/images/players/nfl/15501/headshot/210x210.png","https://images.fantasypros.com/images/players/nfl/15501/headshot/210x210.png","9",69.1,57.2,81,"at GB","GB",NA,"Goff continues to play, hands down, fantastic football. He ranks fourth in passing grade, third in yards per attempt, and fourth in adjusted completion rate. He's also ninth in fantasy points per dropback. The Packers have held opposing passers to the 11th-lowest yards per attempt, but they are allowing the seventh-highest adjusted completion rate. Goff should have no problems shredding the Packers' zone coverage (70-83% of their starting corners snaps). Goff has the eighth-highest yards per attempt and second-highest fantasy points per dropback this season against zone. I would worry about the Packers' pass rush (11th-best in pressure rate and blitz rate), but Detroit has done a fine job keeping Goff clean (ninth-lowest pressure rate faced). Week 4 Positional Value: Borderline QB1",NA,NA,"QB18","C-","16.3"
"qb","QB",2023-09-29,"9451","Matthew Stafford","QB","LAR",19,18.51,2.2,13,23,"ade43b1a-0601-4672-83b6-d246bc066a19","9265","1114942","QB","M. Stafford","QB","QB","https://www.fantasypros.com/nfl/players/matthew-stafford.php","matthew-stafford.php","https://images.fantasypros.com/images/players/nfl/9451/headshot/210x210.png","https://images.fantasypros.com/images/players/nfl/9451/headshot/210x210.png","10",41.1,34.1,48,"at IND","IND",NA,"Stafford continues to look like a quarterback that is still in his prime. He ranks sixth in passing grade, ninth in yards per attempt, and first in big-time throw rate. The Colts are an advantageous matchup for the strong armed veteran. Indy has allowed the eighth-highest yards per attempt and passer rating. The Colts have given up the fourth-most fantasy points per game to quarterbacks. Week 4 Positional Value: QB1","start",NA,"QB19","D+","16.0"
"qb","QB",2023-09-29,"15600","Dak Prescott","QB","DAL",20,19.36,1.52,15,23,"86197778-8d4b-4eba-affe-08ef7be7c70b","29369","1824864","QB","D. Prescott","QB","QB","https://www.fantasypros.com/nfl/players/dak-prescott.php","dak-prescott.php","https://images.fantasypros.com/images/players/nfl/15600/headshot/210x210.png","https://images.fantasypros.com/images/players/nfl/15600/headshot/210x210.png","7",87.2,82.4,92,"vs. NE","NE",NA,"Prescott is the QB26 in fantasy. The best weekly finish he has through three weeks is QB17. Prescott is 27th in passing grade with the tenth-lowest yards per attempt and 13th-lowest big-time throw rate. The Patriots have allowed the fifth-fewest fantasy points per game to quarterbacks. New England has held passers to the eighth-lowest yards per attempt and the ninth-lowest passer rating. The Patriots have deployed man coverage on 40-51% of their corner's snaps this season. Prescott has actually been pretty good against man this year. He has the sixth-highest yards per attempt, the 12th-best passer rating, and the fourth-best adjusted completion rate against man coverage. Week 4 Positional Value: QB2","sit",NA,"QB20","D","15.8"
"qb","QB",2023-09-29,"23071","CJ Stroud","QB","HOU",21,20.77,1.47,14,23,"7e91086f-9ca4-4bd9-a099-b88b2f37e6c6","40030","3163079","QB","C.J. Stroud","QB","QB","https://www.fantasypros.com/nfl/players/cj-stroud.php","cj-stroud.php","https://images.fantasypros.com/images/players/nfl/23071/headshot/210x210.png","https://images.fantasypros.com/images/players/nfl/23071/headshot/210x210.png","7",34.9,26.8,43,"vs. PIT","PIT",NA,"Stroud has been the most impressive rookie passer this season. Over the last two weeks, he is 12th in passing grade, third in yards per attempt, and 19th in adjusted completion rate. This week's opponent is a huge test for him. The Steelers have held passers to 17th in yards per attempt, the third-lowest adjusted completion rate, and the 13th-lowest fantasy points per game. Stroud's biggest hurdle will be facing the Steel Curtain pass rush. Pittsburgh is 13th in blitz rate and third in pressure rate. Stroud has been pressured at the seventh-highest rate this season. Stroud has the fourth-lowest passing grade and seventh-lowest yards per attempt when pressured. This week will be a good litmus test for the rookie. Week 4 Positional Value: QB2","sit",NA,"QB21","D","15.5"
