"page","page_pos","scrape_date","fantasypros_id","player_name","pos","team","rank","ecr","sd","best","worst","sportradar_id","yahoo_id","cbs_id","player_positions","player_short_name","player_eligibility","player_yahoo_positions","player_page_url","player_filename","player_square_image_url","player_image_url","player_bye_week","player_owned_avg","player_owned_espn","player_owned_yahoo","player_opponent","player_opponent_id","player_ecr_delta","note","tag","recommendation","pos_rank","start_sit_grade","r2p_pts"
"qb","QB",2021-10-16,"17298","Josh Allen","QB","BUF",1,1.03,0.16,1,2,"3069db07-aa43-4503-ab11-2ae5c0002721","30977","2181054","QB","J. Allen","QB","QB","https://www.fantasypros.com/nfl/players/josh-allen-qb.php","josh-allen-qb.php","https://images.fantasypros.com/images/players/nfl/17298/headshot/210x210.png","https://images.fantasypros.com/images/players/nfl/17298/headshot/210x210.png","7",100,99.9,100,"at TEN","TEN",NA,"After a couple of duds to start the season, Allen has finished as a top-4 QB in two of his last three games. He should make it three out of four in a tasty matchup with Tennessee's lackluster defense in Week 6.","start",NA,"QB1","A+","26.1"
"qb","QB",2021-10-16,"16413","Patrick Mahomes","QB","KC",2,2.08,0.35,1,3,"11cad59d-90dd-449c-a839-dddaba4fe16c","30123","2142052","QB","P. Mahomes II","QB","QB","https://www.fantasypros.com/nfl/players/patrick-mahomes.php","patrick-mahomes.php","https://images.fantasypros.com/images/players/nfl/16413/headshot/210x210.png","https://images.fantasypros.com/images/players/nfl/16413/headshot/210x210.png","12",100,99.9,100,"at WAS","WAS",NA,"Well, it hasn't exactly been smooth sailing for Mahomes and the Chiefs offense this season. Kansas City is now 2-3 on the year, the Chiefs are sitting in 4th place in the AFC West, and Mahomes has struggled to come through in a couple of key matchups. Last week against the stout Bills secondary, Mahomes finished outside the top-12 QBs on the week as the Chiefs lost by a significant amount and the offense looked out of sync. With all that being said, Mahomes is still the QB1 in fantasy football through five weeks. While the offense might not be steamrolling every single defense it comes up against this year, we know that Mahomes has week-winning upside in plus matchups and that's exactly what we have in front of us this year. Coming into the season, Washington appeared like it was going to be a top-5 defense on paper and that they were going to be able to keep nearly any offense in check. However, they have crumbled so far this season and they're allowing a shocking 32.4 fantasy points per game to opposing QBs, which is the highest mark in the NFL. Washington isn't going to stand a chance against the Chiefs passing game and we could see another five-touchdown performance from Mahomes in this one. Fire him up with full confidence this week against the Football Team.","start",NA,"QB2","A","25.4"
"qb","QB",2021-10-16,"17233","Lamar Jackson","QB","BAL",3,3.29,0.72,2,6,"e06a9c07-453a-4bb0-a7e9-2c3a64166dad","31002","2181169","QB","L. Jackson","QB","QB","https://www.fantasypros.com/nfl/players/lamar-jackson.php","lamar-jackson.php","https://images.fantasypros.com/images/players/nfl/17233/headshot/210x210.png","https://images.fantasypros.com/images/players/nfl/17233/headshot/210x210.png","8",99.7,99.3,100,"vs. LAC","LAC",2,"Fantasy managers that had Jackson as their starting QB in week five most likely walked away with a victory. Did you know that Jackson's 41.88 fantasy points in week five against the Colts ranked as a top-20 fantasy football performance all-time at the QB position? Jackson ended the Ravens' Monday Night Football comeback with 442 passing yards, four touchdowns, zero interceptions, and 14 rush attempts for 62 yards. While it wasn't looking pretty in the first half, Jackson rebounded and found chemistry with his receivers, and willed his team back to a victory. We've been waiting for the massive performance from Jackson so far this season and we got it this past week. Now, Jackson enters back into another matchup that should force the Ravens to throw the ball quite a bit to stay in it against the Chargers. This game has all the makings of a shootout and points are going to be flying up on the board. Jackson needs to be back in starting lineups this week as a top-3 option.",NA,NA,"QB3","A","24.3"
"qb","QB",2021-10-16,"18600","Kyler Murray","QB","ARI",4,4.26,1.09,2,7,"dd5a6b6e-ffae-45a5-b8e6-718a9251f374","31833","2180829","QB","K. Murray","QB","QB","https://www.fantasypros.com/nfl/players/kyler-murray.php","kyler-murray.php","https://images.fantasypros.com/images/players/nfl/18600/headshot/210x210.png","https://images.fantasypros.com/images/players/nfl/18600/headshot/210x210.png","12",100,99.9,100,"at CLE","CLE",-1,"From weeks 1-3, Murray was the overall QB1 in fantasy football. He was absolutely lighting up opposing defenses and there didn't seem to be any team that could slow him down. However, from weeks 4-5, Murray is just the QB17 and he's only averaging 18.14 fantasy points per contest. The 49ers kept him in check this past week as he only accounted for 240 total yards (passing + rushing) and one touchdown, but he has the chance to blow those numbers out of the water this week against the Browns. Cleveland is coming off of a loss to the Los Angeles Chargers where they saw Justin Herbert throw for nearly 400 yards, four touchdowns, and also add another touchdown on the ground. While we can't expect Murray to hit those types of numbers, this should be a good spot to expect a bounce-back performance from Murray from a fantasy perspective. He can be viewed as a mid-range QB1 this week.","start",NA,"QB4","A","23.5"
"qb","QB",2021-10-16,"19275","Jalen Hurts","QB","PHI",5,5.16,0.93,4,7,"64bd0f02-6a5d-407e-98f1-fd02048ea21d","32723","2240246","QB","J. Hurts","QB","QB","https://www.fantasypros.com/nfl/players/jalen-hurts.php","jalen-hurts.php","https://images.fantasypros.com/images/players/nfl/19275/headshot/210x210.png","https://images.fantasypros.com/images/players/nfl/19275/headshot/210x210.png","14",95,94,96,"vs. TB","TB",NA,"Make no mistake about it, Jalen Hurts was not good as a passer last week. He finished with under 200 yards passing, 5.4 Yards Per Attempt, and zero touchdowns to one interception. However, it doesn't matter for fantasy football because Hurts tacked on 30 yards rushing for two touchdowns on the ground. This reminds me of Blake Bortles from several years ago where he's a viable fantasy option, but you simply cannot watch the games for your mental health because of the quality of the play. The final stats end up looking alright, but it's not the prettiest thing to watch while it's happening. Hurts continues to get the job done for fantasy football though and he's worth starting every single week because of the potential for what he can do on the ground with his legs. This matchup against the Bucs is a good one on paper for opposing passing attacks, so Hurts should see better numbers through the air than what he posted in week five. On top of what he can do as a runner, Hurts is a mid-range/low-end QB1 yet again.",NA,NA,"QB5","A","22.7"
"qb","QB",2021-10-16,"9603","Tom Brady","QB","TB",6,5.53,0.85,3,7,"41c44740-d0f6-44ab-8347-3b5d515e5ecf","5228","187741","QB","T. Brady","QB","QB","https://www.fantasypros.com/nfl/players/tom-brady.php","tom-brady.php","https://images.fantasypros.com/images/players/nfl/9603/headshot/210x210.png","https://images.fantasypros.com/images/players/nfl/9603/headshot/210x210.png","9",98.8,98.6,99,"at PHI","PHI",-2,"In last week's version of The Game Plan, I wrote about how Tom Brady had been a bit of a disappointment over the two previous weeks due to only throwing for one total touchdown. Apparently, Brady reads this article though, and took it personally because he came out on fire in week five and threw for over 400 yards and five passing touchdowns. Did you know that this past performance from Brady is the first time in his entire storied NFL career that he has thrown for over 400 yards and five touchdowns in the same game? In his entire NFL career - including playoffs - he has never accomplished this feat, but he was able to do it against a solid Miami secondary last week. With the receiving weapons that Brady has around him, the upside for big performances is always going to be there and he consistently belongs in the QB1 conversation every single week. He might not bring you the safe floor that other QBs in this range do with their rushing ability, so we could have some dud performances from time to time, but he's going to be one of the steadiest fantasy options out there. For week six against the Eagles, Brady should continue to dominate despite the short week. The Eagles just clamped down on Sam Darnold and the Carolina Panthers, but this is the same secondary that allowed Patrick Mahomes to throw for five touchdowns just two weeks ago. This should be a big victory for the Bucs and Brady's a solid mid-range QB1 because of it.",NA,NA,"QB6","A","21.9"
"qb","QB",2021-10-16,"18635","Justin Herbert","QB","LAC",7,6.76,0.78,4,8,"f0a8f8e3-b9e9-46ed-85e4-eec6452a8a44","32676","2221960","QB","J. Herbert","QB","QB","https://www.fantasypros.com/nfl/players/justin-herbert.php","justin-herbert.php","https://images.fantasypros.com/images/players/nfl/18635/headshot/210x210.png","https://images.fantasypros.com/images/players/nfl/18635/headshot/210x210.png","7",98.2,97.3,99,"at BAL","BAL",NA,"Lamar Jackson put up the fantasy performance of a lifetime in week five with 41.88 fantasy points and it was dominant enough to rank inside the top-20 fantasy performances at the QB position all-time. And somehow, he didn't even finish as the QB1 on the week. That title belongs to Herbert thanks to his massive outing against the Cleveland Browns defense in week five. Herbert ended last week's shootout with 398 passing yards, four passing touchdowns, zero interceptions, and an additional 29 yards on the ground with another score just for good measure. His 42.88 fantasy points ranks as the 14th-most by a QB in the entire history of the NFL and it's insane to think that he's only in his second year in the league. The ceiling is through the roof for this young QB and he now remains locked into starting lineups every single week moving forward. In this matchup against Baltimore that could quickly turn into another battle all the way until the end, Herbert can be viewed as a mid-range QB2.",NA,NA,"QB7","B+","21.3"
"qb","QB",2021-10-16,"15600","Dak Prescott","QB","DAL",8,8.47,0.72,7,10,"86197778-8d4b-4eba-affe-08ef7be7c70b","29369","1824864","QB","D. Prescott","QB","QB","https://www.fantasypros.com/nfl/players/dak-prescott.php","dak-prescott.php","https://images.fantasypros.com/images/players/nfl/15600/headshot/210x210.png","https://images.fantasypros.com/images/players/nfl/15600/headshot/210x210.png","7",98.8,98.5,99,"at NE","NE",NA,"Through the first five weeks of the 2021 NFL season, it's clear that Prescott has taken his game to another level. He's confident and commanding at the line of scrimmage and he's continuously making the right reads. Up to this point of the season, Prescott only has been credited with five Turnover Worthy Plays, which is a stat measured by Pro Football Focus. For comparison, Josh Allen has been credited with nine. Prescott is making big-time play after big-time play and the offense is thriving as a result. While he's only averaging 33 pass attempts per game - which is limiting his overall upside for fantasy football - he's still producing in a big way with his touchdown production. He now has 13 passing touchdowns on the season, which is tied with Justin Herbert for the third-most in the entire league. With all that being taken into account, he now gets to take on the Patriots pass defense that just allowed Davis Mills to throw for over 300 yards and three touchdowns. We could see the Cowboys lean into their run game yet again here, but the upside is certainly there. He can be viewed as a low-end QB1 yet again.",NA,NA,"QB8","B","20.7"
"qb","QB",2021-10-16,"9451","Matthew Stafford","QB","LAR",9,8.63,0.58,8,10,"ade43b1a-0601-4672-83b6-d246bc066a19","9265","1114942","QB","M. Stafford","QB","QB","https://www.fantasypros.com/nfl/players/matthew-stafford.php","matthew-stafford.php","https://images.fantasypros.com/images/players/nfl/9451/headshot/210x210.png","https://images.fantasypros.com/images/players/nfl/9451/headshot/210x210.png","11",95.4,93.7,97,"at NYG","NYG",NA,"Stafford has been handed a solid dose of reality here over the past couple of weeks after starting out the season on fire, but he's still getting the job done for fantasy football. Through the first three weeks of the season, Stafford amassed 942 passing yards, nine touchdowns, and just one interception. Over the last two weeks though, Stafford has thrown for a solid 645 passing yards, but he has just three touchdowns to two interceptions over that period. While Stafford's production has taken a dip here recently, he's still captaining a top offense in the NFL and the scoring opportunities are plentiful. Now, he gets to take on the Giants defense that just got torched by Dak Prescott and the Cowboys for 9.43 Yards Per Attempt. Stafford belongs in your lineup every single week as a l0w-end QB1.","start",NA,"QB9","B","20.1"
"qb","QB",2021-10-16,"9001","Aaron Rodgers","QB","GB",10,10.47,0.72,9,12,"0ce48193-e2fa-466e-a986-33f751add206","7200","419780","QB","A. Rodgers","QB","QB","https://www.fantasypros.com/nfl/players/aaron-rodgers.php","aaron-rodgers.php","https://images.fantasypros.com/images/players/nfl/9001/headshot/210x210.png","https://images.fantasypros.com/images/players/nfl/9001/headshot/210x210.png","13",97.8,97.6,98,"at CHI","CHI",NA,"Sunday's Packers-Bears game is a showdown for first place in the NFC North, and Rodgers comes in as the QB18 in fantasy scoring (though in fairness, he's only 6.6 points out of QB1 range). The Bears' pass defense has exceeded expectations so far, ranking fourth in Football Outsiders' DVOA metric. Chicago has allowed 16 fantasy points per game to opposing quarterbacks, the fifth-lowest total in the league. Rodgers' fantasy finishes by week: QB34, QB5, QB17, QB8, QB14. The Packers and Bears have been two of the slower-paced teams in the league this season, both ranking in the bottom seven in seconds per play. It would be silly to say Rodgers has a low ceiling this week, because the future Hall-of-Famer is talented enough to blast through his perceived ceiling in any given week. But his matchup isn't ideal, nor is the likely pace of this game. I have Rodgers ranked QB10, which might even be slightly optimistic, and I'm not touching him in DFS.","sit",NA,"QB10","B","19.5"
"qb","QB",2021-10-16,"19196","Joe Burrow","QB","CIN",11,11.18,0.76,9,12,"3023ac10-4e7f-425f-9fc5-2b8e6332c92e","32671","2179798","QB","J. Burrow","QB","QB","https://www.fantasypros.com/nfl/players/joe-burrow.php","joe-burrow.php","https://images.fantasypros.com/images/players/nfl/19196/headshot/210x210.png","https://images.fantasypros.com/images/players/nfl/19196/headshot/210x210.png","10",78.9,71.8,86,"at DET","DET",NA,"When the Lions lost CB Jeff Okudah and edge rusher Romeo Okwara to season-ending Achilles injuries, it seemed as if the Detroit pass defense would be one to target in fantasy. Opponents have indeed been very efficient through the air against Detroit: The Lions' opponent passer rating of 110.9 is third-worst in the league. Yet Detroit is allowing 17.7 fantasy points per game to opposing quarterbacks, a below-average total. How can that be? Well, Detroit is the only team in the league to have faced more rushing attempts than passing attempts this season, 147 to 143. The Lions have trailed so often that opponents have been trying to chew clock against them in the second halves of games. Burrow investors could potentially be thwarted by that type of a game script this Sunday, but it's still exciting to think about Burrow throwing to loosely covered WRs Ja'Marr Chase, Tee Higgins, and Tyler Boyd. In a way, Burrow's season has mirrored that of the defense he's about to face. His efficiency numbers are impressive - a 71.7% rate, a 7.6% TD rate, and an average of 8.8 yards per pass attempt - but Burrow is tied for 26th in pass attempts with 145. The subdued passing volume has him sitting at QB17 in fantasy scoring. He checks in as the QB11 in this week's rankings. His $6,300 price tag on DraftKings seems a bit too expensive considering the lack of rushing potential.",NA,NA,"QB11","B-","19.2"
"qb","QB",2021-10-16,"13932","Taylor Heinicke","QB","WAS",12,11.24,0.98,9,13,"2c259733-ec2c-4e3c-bb7b-34dc0d37dc34","28839","2174914","QB","T. Heinicke","QB","QB","https://www.fantasypros.com/nfl/players/taylor-heinicke.php","taylor-heinicke.php","https://images.fantasypros.com/images/players/nfl/13932/headshot/210x210.png","https://images.fantasypros.com/images/players/nfl/13932/headshot/210x210.png","9",29.3,33.6,25,"vs. KC","KC",NA,"Heinicke falls into the bucket that so many other QBs do in fantasy football and that's simply a streaming option. In tougher matchups, he's not worth considering, but in games against weaker defenses, he has the potential to finish as a top-12 option. That's exactly what we have in front of us this week with Heinicke up against the Kansas City Chiefs defense. The Chiefs were expected to be a stout unit coming into the year, but they have been absolutely gashed by opposing passing games so far this season. Through five weeks, the Chiefs are allowing the second-most fantasy points to opposing QBs and they're only in front of Washington in that category. This game is going to be an offensive fireworks show and it could easily hit the over on a 55.5 line. Kansas City is allowing 308.6 passing yards per game and 30.8 fantasy points. If you have Heinicke, make sure to plug him into your starting lineup as a low-end QB1/high-end QB2. If he's available on your waiver wire still, he's absolutely worth adding and playing here.","start",NA,"QB12","B-","18.9"
"qb","QB",2021-10-16,"17236","Sam Darnold","QB","CAR",13,13.47,1.04,13,18,"13d826c5-9b22-4e0a-a877-02d8c84c546b","30973","2180320","QB","S. Darnold","QB","QB","https://www.fantasypros.com/nfl/players/sam-darnold.php","sam-darnold.php","https://images.fantasypros.com/images/players/nfl/17236/headshot/210x210.png","https://images.fantasypros.com/images/players/nfl/17236/headshot/210x210.png","13",50.7,44.3,57,"vs. MIN","MIN",NA,"After stringing together three consecutive 300-yard passing games, Darnold threw for a season-low 177 yards against the Eagles in Week 5. He had one TD pass against Philadelphia and threw three interceptions. Darnold's matchup against the Vikings this week is no cakewalk. Minnesota's pass defense ranks fifth in Football Outsiders' DVOA metric, and PFF grades the Vikings ninth in both pass rush and pass coverage. Darnold is QB9 in fantasy scoring, but his five TD runs artificially inflate that number. Consider him more of a high-end QB2 for this week and steer clear in DFS.",NA,NA,"QB13","C+","18.6"
"qb","QB",2021-10-16,"11177","Kirk Cousins","QB","MIN",14,14.39,1.16,13,18,"bbd0942c-6f77-4f83-a6d0-66ec6548019e","25812","1272574","QB","K. Cousins","QB","QB","https://www.fantasypros.com/nfl/players/kirk-cousins.php","kirk-cousins.php","https://images.fantasypros.com/images/players/nfl/11177/headshot/210x210.png","https://images.fantasypros.com/images/players/nfl/11177/headshot/210x210.png","7",62,49,75,"at CAR","CAR",NA,"Cousins visits Charlotte this weekend to face a Panthers defense that hasn't allowed 200 passing yards to an opposing quarterback since Jets rookie Zach Wilson threw for 258 yards in Week 1. Carolina's pass defense ranks No. 2 in Football Outsiders' DVOA metric behind only Buffalo, and the Panthers are allowing only 6.3 yards per pass attempt. Cousins got off to a torrid start, throwing for 918 yards and eight touchdowns in his first three games, but he's cooled off in the last two weeks. He had 203 yards against the Browns in Week 4 with one touchdown and one interception, averaging 5.3 yards per attempt. Against an injury-plagued Lions defense in Week 5, Cousins threw for 275 yards with one touchdown and one interception. I have Cousins ranked QB14 this week, and that feels too high even in a week with four teams on bye. I'd start Taylor Heinicke over Cousins without hesitation, and I want no part of Cousins in DFS.","sit",NA,"QB14","C","18.4"
"qb","QB",2021-10-16,"19780","Trevor Lawrence","QB","JAC",15,15.45,1.09,14,18,"aaa8b42c-4d87-45f6-bfd2-e31cfed9a736","33389","2967185","QB","T. Lawrence","QB","QB","https://www.fantasypros.com/nfl/players/trevor-lawrence.php","trevor-lawrence.php","https://images.fantasypros.com/images/players/nfl/19780/headshot/210x210.png","https://images.fantasypros.com/images/players/nfl/19780/headshot/210x210.png","7",48.2,45.4,51,"vs. MIA","MIA",NA,"Over the first few weeks of the season, it was looking pretty rough for Lawrence as he transitioned into the NFL from Clemson, but he's started to settle in and he's becoming a weekly viable fantasy option at the QB position. While he certainly isn't posting up gaudy numbers - he's only averaging 203.5 passing yards over the last four weeks - he's starting to see his rushing workload increase and that's what has fantasy managers excited. Over the first two games, Lawrence only had three rush attempts. For anyone who watched Lawrence's college tape, this was the most baffling thing to witness because he absolutely dominated on the ground with his movability at his size, but Urban Meyer just wasn't using him in this fashion. Since that point though, Lawrence has 21 rush attempts for 91 rushing yards and two touchdowns. If Lawrence isn't able to capitalize as a passer in any given matchup, he's at least bringing a high floor with his workload on the ground. Looking ahead to week six, Lawrence now has a matchup against the Miami Dolphins defense that just got absolutely eviscerated by Tom Brady and the Buccaneers passing attack. After five weeks, the Dolphins are now allowing the 4th-most fantasy points to opposing QBs and Lawrence should be able to do enough in this one to be viewed as a low-end streaming option.","start",NA,"QB15","C","18.0"
"qb","QB",2021-10-16,"11174","Ryan Tannehill","QB","TEN",16,16.05,1.54,14,21,"5812204c-6dae-4450-8011-99e0f72864ac","25718","1273654","QB","R. Tannehill","QB","QB","https://www.fantasypros.com/nfl/players/ryan-tannehill.php","ryan-tannehill.php","https://images.fantasypros.com/images/players/nfl/11174/headshot/210x210.png","https://images.fantasypros.com/images/players/nfl/11174/headshot/210x210.png","13",72.9,66.7,79,"vs. BUF","BUF",NA,NA,NA,NA,"QB16","C","17.7"
"qb","QB",2021-10-16,"15520","Carson Wentz","QB","IND",17,18.34,1.64,14,22,"e9a5c16b-4472-4be9-8030-3f77be7890cb","29236","1907522","QB","C. Wentz","QB","QB","https://www.fantasypros.com/nfl/players/carson-wentz.php","carson-wentz.php","https://images.fantasypros.com/images/players/nfl/15520/headshot/210x210.png","https://images.fantasypros.com/images/players/nfl/15520/headshot/210x210.png","14",23.9,14.7,33,"vs. HOU","HOU",NA,"Wentz played his best game of the young season in Week 5, throwing for 402 yards and two touchdowns against the Ravens on Monday night and staking the Colts to a big lead that they would eventually blow. Wentz completed better than 70% of his throws for a second straight game and averaged 11.5 yards per attempt. I had my doubts about Wentz coming into the season. He looked awful last year, and though the Eagles' injury-riddled offensive line had something to do with that, Wentz played poorly by any measure. So far with the Colts, he's dealt with injuries to teammates and himself, toughing out the last couple of games on two sprained ankles, and has acquitted himself quite well. Wentz is on the verge of getting WR T.Y. Hilton back from IR, and all-pro guard Quenton Nelson is expected back soon as well, so things are looking up. Wentz checks in at QB21 in this week's rankings and is a plausible streaming option in a decent matchup against the Texans.",NA,NA,"QB17","C-","17.4"
"qb","QB",2021-10-16,"12088","Teddy Bridgewater","QB","DEN",18,18.5,1.82,16,24,"d4cb52a9-f6b4-42ed-b40b-27bff5f1eea7","27560","1825122","QB","T. Bridgewater","QB","QB","https://www.fantasypros.com/nfl/players/teddy-bridgewater.php","teddy-bridgewater.php","https://images.fantasypros.com/images/players/nfl/12088/headshot/210x210.png","https://images.fantasypros.com/images/players/nfl/12088/headshot/210x210.png","11",18.7,17.3,20,"vs. LV","LV",5,"Bridgewater is more game manager than gunslinger, and it's hard to imagine him posting big numbers this week against a Raiders defense that's far exceeded expectations. PFF gives the Las Vegas defense its best pass rush grade and its second-best pass coverage grade. The Raiders are giving up only 6.1 yards per pass attempt. Bridgewater ranks QB25 in fantasy scoring and lands at QB24 in this week's rankings.",NA,NA,"QB18","D+","17.1"
