"page","page_pos","scrape_date","fantasypros_id","player_name","pos","team","rank","ecr","sd","best","worst","player_positions","player_short_name","player_eligibility","player_page_url","player_filename","player_bye_week","player_owned_avg","player_opponent","player_opponent_id","player_ecr_delta","note","tag","recommendation","pos_rank","start_sit_grade","r2p_pts"
"ppr-wr","WR",2025-11-15,"23062","Emeka Egbuka","WR","TB",9,9.05,1.28,5,12,"WR","E. Egbuka","WR","https://www.fantasypros.com/nfl/players/emeka-egbuka.php","emeka-egbuka.php","9",97.7,"at BUF","BUF",NA,NA,"start",NA,"WR9","A","16.2"
"ppr-wr","WR",2025-11-15,"19790","Jaylen Waddle","WR","MIA",10,10.16,1.2,7,13,"WR","J. Waddle","WR","https://www.fantasypros.com/nfl/players/jaylen-waddle.php","jaylen-waddle.php","12",96.1,"vs. WAS","WAS",NA,NA,"start",NA,"WR10","A","15.7"
"ppr-wr","WR",2025-11-15,"20130","Nico Collins","WR","HOU",11,10.63,1.24,8,15,"WR","N. Collins","WR","https://www.fantasypros.com/nfl/players/nico-collins.php","nico-collins.php","6",99.2,"at TEN","TEN",NA,NA,"start",NA,"WR11","A","15.6"
"ppr-wr","WR",2025-11-15,"12123","Davante Adams","WR","LAR",12,12.37,1.2,10,15,"WR","D. Adams","WR","https://www.fantasypros.com/nfl/players/davante-adams.php","davante-adams.php","8",98.5,"vs. SEA","SEA",NA,NA,"start",NA,"WR12","A","15.5"
"ppr-wr","WR",2025-11-15,"26122","Ladd McConkey","WR","LAC",13,13.61,1.39,11,17,"WR","L. McConkey","WR","https://www.fantasypros.com/nfl/players/ladd-mcconkey.php","ladd-mcconkey.php","12",98.3,"at JAC","JAC",NA,"Since Week 5, Ladd McConkey has been the WR9 in fantasy points per game with a 24.4% target share, 76.2 receiving yards per game, 2.23 yards per route run, and a 23.1% first-read share. During these six games, he has had ten red zone targets and six deep targets. Jacksonville has utilized two high with 50-70.8% of their defensive snaps in six of their nine games. Since Week 5, McConkey has led the team with 25% while posting 1.60 yards per route run against two high. The matchup is tough for McConkey this week, but he has the talent to overcome it. Since Week 6, Jacksonville has allowed the second-fewest PPR points per target and the tenth-fewest receiving yards per game to slot receivers. Also helping McConkey this week is the fact that Jourdan Lewis will be out. He's been one of the best nickels in the game this season. Jarrian Jones (career: 69.4% catch rate and 84.5 passer rating allowed) will take his place this week.","start",NA,"WR13","A","15.4"
"ppr-wr","WR",2025-11-15,"22963","George Pickens","WR","DAL",14,14.34,1.47,11,17,"WR","G. Pickens","WR","https://www.fantasypros.com/nfl/players/george-pickens.php","george-pickens.php","10",97.2,"at LV","LV",NA,NA,"start",NA,"WR14","A","15.1"
"ppr-wr","WR",2025-11-15,"19222","DeVonta Smith","WR","PHI",15,16.16,1.77,13,20,"WR","D. Smith","WR","https://www.fantasypros.com/nfl/players/devonta-smith.php","devonta-smith.php","9",96.3,"vs. DET","DET",NA,"DeVonta Smith has been so incredibly good this season as the WR13 in fantasy points per game. He has a 26.1% target share, a 37.9% air-yard share, 73 receiving yards per game, 2.38 yards per route run, and a 32.5% first-read share. Smith has six red zone targets and leads the team with 13 deep targets. The Lions have the seventh-highest single high rate this season (57.1%). Against single high, Smith is second on the team with a 22% target per route run rate and 2.18 yards per route run. Smith could lead the way for Philly this week as Detroit has struggled to defend the slot. Since Week 6, the Lions have allowed the sixth-most receiving yards per game and the 12th-most PPR points per target to slot receivers.","start",NA,"WR15","A","14.3"
"ppr-wr","WR",2025-11-15,"13981","Stefon Diggs","WR","NE",16,16.89,2.27,13,21,"WR","S. Diggs","WR","https://www.fantasypros.com/nfl/players/stefon-diggs.php","stefon-diggs.php","14",92.4,"vs. NYJ","NYJ",3,"Since Week 4, Stefon Diggs has been the WR20 in fantasy points per game with a 68.1% route share, a 24.7% target share, 63.1 receiving yards per game, 2.76 yards per route run, and a 25.4% first-read share. In those seven games, Diggs has ten red zone targets and five deep targets. This week, he faces a Jets' pass defense that, since Week 8, has utilized two high at the fifth-highest rate (62%). Since Week 4, against two high, Diggs has led the team with a 31% target per route run rate and logged 2.31 yards per route run (second-best). Diggs should have no issues in Week 11 running against Brandon Stephens (2025: 64.1% catch rate and 117.1 passer rating allowed) and Jarvis Brownlee Jr. (2025: 75% catch rate and 105.4 passer rating allowed) all game.","start",NA,"WR16","A-","14.2"
"ppr-wr","WR",2025-11-15,"19211","Tee Higgins","WR","CIN",17,17.66,2.99,13,26,"WR","T. Higgins","WR","https://www.fantasypros.com/nfl/players/tee-higgins.php","tee-higgins.php","10",97.9,"at PIT","PIT",-2,"Since Week 6, with Joe Flacco, Tee Higgins has been the WR5 in fantasy points per game with a 15.6% target share, a 31% air-yard share, 80.8 receiving yards per game, 2.20 yards per route run, and a 22.4% first-read share. In those four games, Higgins has four red zone targets and six deep targets. This week, Higgins faces a Pittsburgh pass defense with the third-highest single high rate (62.3%). Since Week 6, against single high, has had a 30% target per route run rate and 2.64 yards per route run. Higgins should tee off this week against a Pittsburgh secondary that, since Week 6, has allowed the third-most fantasy points per game and the most receiving yards per game to perimeter wide receivers.","start",NA,"WR17","A-","13.9"
"ppr-wr","WR",2025-11-15,"18218","AJ Brown","WR","PHI",18,17.95,1.81,13,22,"WR","A.J. Brown","WR","https://www.fantasypros.com/nfl/players/aj-brown.php","aj-brown.php","9",98.6,"vs. DET","DET",NA,"A.J. Brown has had a rollercoaster season as the WR30 in fantasy points per game, with three weeks as a top-20 wide receiver in weekly scoring and five games with less than ten fantasy points. Brown has a 24% target share with 51 receiving yards per game, 1.72 yards per route run, and a 30.7% first-read share. Brown has five red zone targets and 11 deep targets this season. This week's matchup could swing the pendulum back in his direction after a down game against Green Bay. The Lions have the seventh-highest single high rate this season (57.1%). Brown's splits against two high and single have been massive. Against single high, he leads the team with a 26% target per route run rate and 2.24 yards per route run. Against two high, those numbers drop off the map to 19% and 1.32. Brown will have to contend with a Detroit secondary that, since Week 6, has allowed the tenth-fewest receiving yards per game to perimeter wide receivers while ranking 15th in PPR points per target. Given his track record this season, Brown is a dice roll, but one that I feel pretty good about this week.",NA,NA,"WR18","A-","13.8"
"ppr-wr","WR",2025-11-15,"25411","Rome Odunze","WR","CHI",19,19.66,2.84,15,27,"WR","R. Odunze","WR","https://www.fantasypros.com/nfl/players/rome-odunze.php","rome-odunze.php","5",94.6,"at MIN","MIN",NA,"After last week's strong game, Odunze is the WR15 in fantasy points per game, ranking first among wide receivers in deep targets and 17th in red zone targets. Odunze has a 22.4% target share with 62.1 receiving yards per game, 1.96 yards per route run, and a 26.6.% first-read share. This week, he faces a Minnesota pass defense that leads the NFL in two high rate (69.4%). Against two high, Odunze is third (tied) on the team with a 22% target per route run rate and 1.83 yards per route run. Against two high, he does lead the team with a 25.7% first-read share. Odunze should have another nice game this week against a secondary that, since Week 6, has allowed the most PPR points per target and the third-most receiving yards to perimeter wide receivers.","start",NA,"WR19","A-","13.8"
"ppr-wr","WR",2025-11-15,"22916","Zay Flowers","WR","BAL",20,19.95,2.75,15,30,"WR","Z. Flowers","WR","https://www.fantasypros.com/nfl/players/zay-flowers.php","zay-flowers.php","7",96.6,"at CLE","CLE",NA,"Zay Flowers is the WR21 in fantasy points per game, with ten deep targets and only five red zone targets. Flowers has all five of his red zone targets in the last five games as the team is using him more often inside the 20-yard line. This week, he faces a Browns' secondary that has utilized single high at the second-highest rate (65%). Against single high, Flowers has eaten with a 30.5% target share, 2.98 yards per route run, and a 35.6% first-read share. Flowers should have a strong game this week. Since Week 6, Cleveland has allowed the 14th-most PPR points per target to perimeter wide receivers.","start",NA,"WR20","A-","13.6"
"ppr-wr","WR",2025-11-15,"22985","WanDale Robinson","WR","NYG",21,20.05,4.91,12,32,"WR","W. Robinson","WR","https://www.fantasypros.com/nfl/players/wandale-robinson.php","wandale-robinson.php","14",62.8,"vs. GB","GB",NA,"Wan'Dale Robinson is the WR26 in fantasy points per game with a 23.5% target share, 60.2 receiving yards per game, 1.73 yards per route run, and a 28.3% first-read share. Robinson is second on the team with six red zone targets and leads the team with 11 deep targets. This week's matchup with Green Bay isn't a great one. Since Week 6, Green Bay has limited slot receivers to the 14th-fewest PPR points per target and the second-fewest receiving yards per game. Robinson's underneath role also doesn't play well against a defense that has allowed the fifth-fewest yards after the catch. Robinson is a PPR flex only this week as he's still a solid volume bet while the ceiling isn't high.",NA,NA,"WR21","A-","13.6"
"ppr-wr","WR",2025-11-15,"18219","DK Metcalf","WR","PIT",22,21.79,1.42,19,25,"WR","DK Metcalf","WR","https://www.fantasypros.com/nfl/players/dk-metcalf.php","dk-metcalf.php","5",97.5,"vs. CIN","CIN",NA,"The last time these two teams met, D.J. Turner (2025: 47.4% catch rate and 78.4 passer rating allowed) shadowed D.K. Metcalf on 78.1% of his routes, holding him to four targets, two receptions, and 45 scoreless receiving yards in his coverage. I expect Turner to be in Metcalf's back pocket again this week. Metcalf is the WR29 in fantasy points per game with a 19.9% target share, a 38.6% air-yard share, 1.95 yards per route run, 55.8 receiving yards per game, and a 25.5% first-read share. He has nine red zone targets and ten deep targets this season. Metcalf was the WR42 in weekly scoring his last time out against Cincy. I wouldn't expect a big game from him this week.","sit",NA,"WR22","B+","13.1"
"ppr-wr","WR",2025-11-15,"23794","Romeo Doubs","WR","GB",23,24.05,2.13,20,32,"WR","R. Doubs","WR","https://www.fantasypros.com/nfl/players/romeo-doubs.php","romeo-doubs.php","5",58.1,"at NYG","NYG",NA,"Romeo Doubs left last week's game with a chest injury. He practiced in full all week and doesn't carry an injury designation into Week 11. Doubs is the WR34 in fantasy points per game, ranking second on the team with ten red zone targets while leading the way with ten deep targets. Doubs has a 19.6% target share with 49.6 receiving yards per game, 1.85 yards per route run, and a 24.9% first-read share. Since Week 8, the Giants have had the second-highest single high rate (69.8%). Against single high, Doubs has seen his numbers improve across the board with a 20.3% target share, 1.91 yards per route run, and a 27.5% first-read share. Since Week 6, New York has allowed the seventh-most PPR points per target and receiving yards per game to perimeter wide receivers. Doubs is a strong play this week.",NA,NA,"WR23","B+","13.0"
"ppr-wr","WR",2025-11-15,"19590","Jauan Jennings","WR","SF",24,24.79,3.5,20,34,"WR","J. Jennings","WR","https://www.fantasypros.com/nfl/players/jauan-jennings.php","jauan-jennings.php","14",83.2,"at ARI","ARI",NA,"Since Week 7, Jauan Jennings has been the WR34 in fantasy points per game, soaking up a 23.1% target share with a 33.5% air-yard share and a 33.3% first-read share. He has churned out 47 receiving yards per game in that span with 1.77 yards per route run. In those four games, he has had five red zone targets and four deep targets. Arizona has the fifth-highest two-high rate in the NFL (58.2%). Since Week 7, against two high, Jennings has had a team-leading 27% target per route run rate with 1.73 yards per route run. Jennings is a strong flex play this week. Since Week 6, Arizona has allowed the 11th-most PPR points per target to perimeter wide receivers while ranking 15th in receiving yards per game.","start",NA,"WR24","B","12.9"
"ppr-wr","WR",2025-11-15,"23748","Khalil Shakir","WR","BUF",25,26.08,3.59,19,33,"WR","K. Shakir","WR","https://www.fantasypros.com/nfl/players/khalil-shakir.php","khalil-shakir.php","7",82.7,"vs. TB","TB",NA,"Khalil Shakir is the WR30 in fantasy points per game, commanding a 20.8% target share and 24% first-read share while churning out 50.8 receiving yards per game with 1.98 yards per route run. Shakir leads the team with eight red zone targets while chipping in with four deep targets. Shakir is a mid-range flex play again this week with a rough matchup. Since Week 6, Tampa Bay has allowed the fifth-fewest PPR points per target to slot receivers while ranking 17th in receiving yards per game allowed.",NA,NA,"WR25","B","12.5"
"ppr-wr","WR",2025-11-15,"25417","Tetairoa McMillan","WR","CAR",26,27,1.82,24,32,"WR","T. McMillan","WR","https://www.fantasypros.com/nfl/players/tetairoa-mcmillan.php","tetairoa-mcmillan.php","14",94,"at ATL","ATL",NA,"Tetairoa McMillan is the WR34 in fantasy points per game, ranking 11th in red zone targets and 26th in deep targets among wide receivers. McMillan has a 24.5% target share, a 43.6% air-yard share, 61.8 receiving yards per game, 1.99 yards per route run, and a 30.1% first-read share. The volume constraints this offense has placed upon him have been capping his weekly upside. Across his last five games, he has surpassed 65 receiving yards only once. The matchup is good for McMillan, but it's fair like I said to question his weekly upside at this point because of the offense that he is stuck in. Atlanta has the highest single high rate in the NFL (71.3%). Against single high, McMillan has seen his target per route run rate increase to 26% with 2.05 yards per route run. It's a marginal increase, so don't hit a backflip out of your seat. Atlanta's issues covering perimeter wide receivers could help him this week, though. Since Week 6, they have allowed the eighth-most PPR points per target to perimeter wide receivers.",NA,NA,"WR26","B","12.4"
"ppr-wr","WR",2025-11-15,"23107","Jordan Addison","WR","MIN",27,27.53,2.94,23,37,"WR","J. Addison","WR","https://www.fantasypros.com/nfl/players/jordan-addison.php","jordan-addison.php","6",87.6,"vs. CHI","CHI",NA,"Since Week 9, with J.J. McCarthy under center, Addison has had a 19.4% target share, a 26.1% air-yard share, 41.5 receiving yards per game, 1.20 yards per route run, and a 22.2% first-read share. In those two games, Addison has had one red zone target and three deep targets. This week, he faces a Chicago pass defense that, since Week 6, has utilized single high at the ninth-highest rate (55.3%). Overall, against single high, Addison has seen his target per route run rate dip to 15% with 1.44 yards per route run. This coverage matchup isn't ideal for Addison, but Chicago's secondary has been hapless and could help him boost his stat line this week. Since Week 6, Chicago has allowed the 12th-most receiving yards per game and the tenth-most PPR points per target to perimeter wide receivers. Addison is a decent flex.",NA,NA,"WR27","B","12.2"
"ppr-wr","WR",2025-11-15,"18244","Deebo Samuel","WR","WAS",28,27.87,2.7,22,33,"WR","D. Samuel Sr.","WR","https://www.fantasypros.com/nfl/players/deebo-samuel.php","deebo-samuel.php","12",92.1,"at MIA","MIA",NA,"Deebo Samuel is the WR20 in fantasy points per game with a 24.4% target share, 44 receiving yards per game, 1.65 yards per route run, and a 29.7% first-read share. He has ten red zone targets this season and six deep targets as he is leading the team in both categories. Last week's 12.9 PPR point outing was the first time that Samuel had posted double-digit PPR points since Week 5. This week, he could easily do it again. Since Week 6, Miami has allowed the 11th-most PPR points per target and the 12th-most receiving yards per game to slot receivers.","start",NA,"WR28","B","12.1"
"ppr-wr","WR",2025-11-15,"23123","Quentin Johnston","WR","LAC",29,28.84,2.84,22,36,"WR","Q. Johnston","WR","https://www.fantasypros.com/nfl/players/quentin-johnston.php","quentin-johnston.php","12",62.6,"at JAC","JAC",NA,"Quentin Johnston's usage has bounced back over the last two games despite not having monster fantasy days. Since Week 9, he has had a 21% target share, a 22.9% air-yard share, 47.5 receiving yards per game, 1.42 yards per route run, and a 27.3% first-read share. This week isn't the matchup to continue to ride with Johnston, though, if the Jaguars deploy two high. Jacksonville has utilized two high with 50-70.8% of their defensive snaps in six of their nine games. They do have three single high heavy games as well, so if they go single high heavy, then Johnston would lead the team in the passing game. It's a risk to fade Johnston this week, but if Jacksonville does lean on two high, he won't be heavily involved. Against two high, Johnston has a 15% target per route run rate (fifth on the team) and only 1.14 yards per route run (fifth on the team). Since Week 6, Jacksonville has allowed the fourth-most PPR points per target and the ninth-most receiving yards per game to perimeter wide receivers. Jacksonville's outside corners have struggled, which could also help Johnston. He's a volatile player this week who could be feast or famine. Johnston has been listed as questionable this week (shin). He was limited in practice all week before logging a full session on Friday.","sit",NA,"WR29","B-","11.9"
"ppr-wr","WR",2025-11-15,"23677","Jameson Williams","WR","DET",30,28.97,2.98,23,37,"WR","J. Williams","WR","https://www.fantasypros.com/nfl/players/jameson-williams.php","jameson-williams.php","8",90.3,"at PHI","PHI",NA,"Jameson Williams has raised his season-long ranking to WR37 in fantasy points per game with WR19 and WR2 weekly finishes in his last two games. Over the last two weeks, he has had an 18.1% target share with a 30% air-yard share, 92.5 receiving yards per game, 2.89 yards per route run, and a 20.4% first-read share. Since Week 9, only two of his 13 targets have been downfield, which is a departure from the rest of the season when he's been just a field stretcher for the offense. We'll see if Williams can keep the hot streak going in Week 11, but it won't be easy. Since Week 6, Philly has allowed the second-fewest PPR points per target and the 12th-fewest receiving yards per game to perimeter wide receivers.",NA,NA,"WR30","B-","11.7"
"ppr-wr","WR",2025-11-15,"23106","Parker Washington","WR","JAC",31,31.03,5.38,18,44,"WR","P. Washington","WR","https://www.fantasypros.com/nfl/players/parker-washington.php","parker-washington.php","8",24.6,"vs. LAC","LAC",NA,"Since Week 7, Parker Washington has been the WR18 in fantasy points per game with a 21.9% target share, a 34.2% air-yard share, 58.3 receiving yards per game, 1.68 yards per route run, and a 25% first-read share. In those three games, Washington has had four red zone targets and five deep targets. Last week, he ran 55.2% of his routes from the slot. I expect him to continue to be the team's slot receiver until Travis Hunter returns. Washington remains a strong volume-based flex option. Since Week 6, the Chargers have faced the eighth-fewest slot targets, but they have allowed the 14th-most PPR points per target to the position. ",NA,NA,"WR31","B","11.6"
"ppr-wr","WR",2025-11-15,"17253","Courtland Sutton","WR","DEN",32,31.34,3.33,25,37,"WR","C. Sutton","WR","https://www.fantasypros.com/nfl/players/courtland-sutton.php","courtland-sutton.php","12",94.4,"vs. KC","KC",NA,"Courtland Sutton is the WR25 in fantasy points per game with an 18.6% target share, 59 receiving yards per game, 1.93 yards per route run, and a 23.2% first-read share. Sutton is second on the team in red zone targets (six) and third in deep targets (ten). This week, he faces a Kansas City pass defense that, since Week 5, has had the ninth-highest single-high rate (56%). Sutton leads the team against single high with a 23.2% target share, 2.29 yards per route run, and a 27.7% first-read share. Sutton has a nice matchup this week as the Chiefs, since Week 6, have allowed the fifth-most PPR points per target and the fourth-highest passer rating when targeted to perimeter wide receivers.","start",NA,"WR32","C+","11.5"
"ppr-wr","WR",2025-11-15,"27147","Tez Johnson","WR","TB",33,32.68,2.9,24,43,"WR","T. Johnson","WR","https://www.fantasypros.com/nfl/players/tez-johnson.php","tez-johnson.php","9",45.5,"at BUF","BUF",NA,"Since assuming a starting spot in Week 6, Tez Johnson has been the WR21 in fantasy points per game. During that stretch, he has had a 15% target share with 47 receiving yards per game, 1.55 yards per route run, and a 14.8% first-read share. None of those metrics are eye popping. What has carried Johnson's fantasy value has been touchdowns, with four in his last four games. Johnson has been getting plenty of high-leverage usage to suggest he can continue to ride the lightning with four red zone targets and three deep targets in his last four games. Buffalo has the ninth-highest two-high rate in the NFL (54.7%). Since Week 6, against two high, Johnson has had a 20% target per route run rate and 1.98 yards per route run. Johnson is a solid flex play again this week against a Buffalo secondary that, since Week 6, has ranked 15th in PPR points per target allowed to perimeter wide receivers.","start",NA,"WR33","C+","11.4"
"ppr-wr","WR",2025-11-15,"25337","Tre Tucker","WR","LV",34,33.42,3.32,25,41,"WR","T. Tucker","WR","https://www.fantasypros.com/nfl/players/tre-tucker.php","tre-tucker.php","8",53.1,"vs. DAL","DAL",NA,"Last week, with Tyler Lockett becoming a full-time player, Tre Tucker took a step back. He still led the team with a 94.3% route share, but he had only an 11.1% target share, 28 receiving yards, 0.85 yards per route run, and a 15.8% first-read share. Excluding his monster Week 3 game, Tucker has had a 15.4% target share, 38.8 receiving yards per game, 1.25 yards per route run, and a 20.1% first-read share. In those eight games, he has had only three red zone targets and six deep targets. Tucker is a low-end flex play this week and only viable because the matchup with Dallas is that good. Since Week 6, Dallas has allowed the sixth-most PPR points per target and the fourth-most receiving yards per game to perimeter wide receivers.",NA,NA,"WR34","C+","10.9"
"ppr-wr","WR",2025-11-15,"23092","Troy Franklin","WR","DEN",35,34.84,1.66,32,38,"WR","T. Franklin","WR","https://www.fantasypros.com/nfl/players/troy-franklin.php","troy-franklin.php","12",62.1,"vs. KC","KC",NA,"Troy Franklin is in the midst of a breakout season. Franklin is the WR32 in fantasy points per game with top-26 weekly finishes in three of his last four games. Franklin has been giving Courtland Sutton a run for his money, leading the team with a 20.3% target share while averaging 42.5 receiving yards per game with 1.50 yards per route run and a 23.2% first-read share (tied for the team lead). Franklin leads the team in red zone targets (14) and deep targets (16). Franklin is tied for fifth in the NFL in red zone targets. This week, he faces a Kansas City pass defense that, since Week 5, has had the ninth-highest single-high rate (56%). Against single high, Franklin is second on the team with a 22.1% target share with 1.80 yards per route run and a 24.1% first-read share (second on the team). Franklin should have another strong week. Since Week 6, Kansas City has allowed the fifth-most PPR points per target and the fourth-highest passer rating when targeted to perimeter wide receivers.","start",NA,"WR35","C+","10.6"
"ppr-wr","WR",2025-11-15,"11616","Keenan Allen","WR","LAC",36,36.68,2.48,31,46,"WR","K. Allen","WR","https://www.fantasypros.com/nfl/players/keenan-allen.php","keenan-allen.php","12",86.1,"at JAC","JAC",NA,"Keenan Allen has seen his usage dip since Week 8 with a 54.9% route share, a 16.1% target share, 34.7 receiving yards per game, 1.68 yards per route run, and a 15.8% first-read share. In those three games, he has had one red zone target and two deep targets. Since Week 8, he has been the WR74 in fantasy points per game. It has been a tough run out for Keenan Allen during crunch time in the fantasy season. Jacksonville has utilized two high with 50-70.8% of their defensive snaps in six of their nine games. Allen has led the team with a 24% target per route run rate against two high while ranking second in yards per route run (1.88). This is a good bounce-back spot for him if the Chargers increase his playing time this week, but there's an equal possibility that they keep him in this new part-time role and it caps his ceiling in Week 11. Since Week 6, Jacksonville has allowed the fourth-most PPR points per target and the ninth-most receiving yards per game to perimeter wide receivers.","sit",NA,"WR36","C+","10.6"
