"page","page_pos","scrape_date","fantasypros_id","player_name","pos","team","rank","ecr","sd","best","worst","sportradar_id","yahoo_id","cbs_id","player_positions","player_short_name","player_eligibility","player_yahoo_positions","player_page_url","player_filename","player_square_image_url","player_image_url","player_bye_week","player_owned_avg","player_owned_espn","player_owned_yahoo","player_opponent","player_opponent_id","player_ecr_delta","note","tag","recommendation","pos_rank","start_sit_grade","r2p_pts"
"qb","QB",2022-10-29,"17298","Josh Allen","QB","BUF",1,1,0,1,1,"3069db07-aa43-4503-ab11-2ae5c0002721","30977","2181054","QB","J. Allen","QB","QB","https://www.fantasypros.com/nfl/players/josh-allen-qb.php","josh-allen-qb.php","https://images.fantasypros.com/images/players/nfl/17298/headshot/210x210.png","https://images.fantasypros.com/images/players/nfl/17298/headshot/210x210.png","7",100,99.9,100,"vs. GB","GB",NA,"Allen is unstoppable. He is the QB1 in fantasy points per game and hasn't finished lower than QB5 in any game this season. That's absolutely unreal. He's third in PFF passing grade, seventh in true completion rate, fifth in passing yards, and fourth in accuracy rating. Green Bay has been an average pass defense, ranking 19th in passing yards per game, 22nd in EPA per drop back, and 18th in explosive pass rate. Allen will dominate again as the QB1 every week.",NA,NA,"QB1","A+","25.6"
"qb","QB",2022-10-29,"19275","Jalen Hurts","QB","PHI",2,2.02,0.14,2,3,"64bd0f02-6a5d-407e-98f1-fd02048ea21d","32723","2240246","QB","J. Hurts","QB","QB","https://www.fantasypros.com/nfl/players/jalen-hurts.php","jalen-hurts.php","https://images.fantasypros.com/images/players/nfl/19275/headshot/210x210.png","https://images.fantasypros.com/images/players/nfl/19275/headshot/210x210.png","7",99.6,99.2,100,"vs. PIT","PIT",NA,"The Pittsburgh Steelers' pass defense has looked like a shell of its former self since Week 4. They are 21st in pass defense DVOA, ranking 29th in passing yards per game, 30th in EPA per drop back, and 32nd in explosive pass rate allowed. Now enters Hurts, who should continue the Pittsburgh beatdown. Hurts is the QB3 in fantasy. He's fifth in PFF passing grade, second in adjusted completion rate, and fifth in yards per attempt. The Steelers are 30th in pressure rate, which is bad news. Hurts is top three in completion rate and accuracy rating from a clean pocket. Hurts is the QB2 behind only Josh Allen.",NA,NA,"QB2","A","23.4"
"qb","QB",2022-10-29,"17233","Lamar Jackson","QB","BAL",3,3.69,0.96,3,6,"e06a9c07-453a-4bb0-a7e9-2c3a64166dad","31002","2181169","QB","L. Jackson","QB","QB","https://www.fantasypros.com/nfl/players/lamar-jackson.php","lamar-jackson.php","https://images.fantasypros.com/images/players/nfl/17233/headshot/210x210.png","https://images.fantasypros.com/images/players/nfl/17233/headshot/210x210.png","10",99.9,99.7,100,"at TB","TB",1,NA,NA,NA,"QB3","A","22.0"
"qb","QB",2022-10-29,"19196","Joe Burrow","QB","CIN",4,4.25,1.3,2,8,"3023ac10-4e7f-425f-9fc5-2b8e6332c92e","32671","2179798","QB","J. Burrow","QB","QB","https://www.fantasypros.com/nfl/players/joe-burrow.php","joe-burrow.php","https://images.fantasypros.com/images/players/nfl/19196/headshot/210x210.png","https://images.fantasypros.com/images/players/nfl/19196/headshot/210x210.png","10",99.1,98.2,100,"at CLE","CLE",-1,"Burrow is in his bag. He's finished as the QB1 overall in each of the last two weeks. He's been a QB1 in six of seven games this season. Since Week 6, he's first in PFF passing grade, first in passing touchdowns, second in adjusted completion rate and fourth in big-time throws (minimum 25 dropbacks). The Browns can't slow him down, as they are 15th in passing yards per game, 25th in EPA per drop back, and 17th in explosive pass rate. Burrow is a top-five fantasy QB option.",NA,NA,"QB4","A","20.8"
"qb","QB",2022-10-29,"18600","Kyler Murray","QB","ARI",5,4.77,0.74,3,7,"dd5a6b6e-ffae-45a5-b8e6-718a9251f374","31833","2180829","QB","K. Murray","QB","QB","https://www.fantasypros.com/nfl/players/kyler-murray.php","kyler-murray.php","https://images.fantasypros.com/images/players/nfl/18600/headshot/210x210.png","https://images.fantasypros.com/images/players/nfl/18600/headshot/210x210.png","13",98.5,97.9,99,"at MIN","MIN",NA,"Last week against the Saints, Murray finished as the QB10 despite pedestrian numbers, but there are positive takeaways. Murray finished with his highest PFF passing grade (73.1) since Week 2. This was the first game that he had eclipsed 7.0 yards per attempt all season. The Vikings offer a wonderful spot for Murray to build on Week 7 and step into the limelight. Minnesota is 12th in success rate per dropback. The Vikings have been gashed through the air all year. They are 32nd in explosive pass rate, 28th in passing yards per game, and 32nd in DVOA against short passing. Murray can pepper the short areas of the field against a defense that has given up the 12th-most YAC.",NA,NA,"QB5","A","19.9"
"qb","QB",2022-10-29,"19198","Tua Tagovailoa","QB","MIA",6,5.65,1.05,3,8,"26ad9c27-de38-495e-913c-6fb2428e76d3","32675","2741209","QB","T. Tagovailoa","QB","QB","https://www.fantasypros.com/nfl/players/tua-tagovailoa.php","tua-tagovailoa.php","https://images.fantasypros.com/images/players/nfl/19198/headshot/210x210.png","https://images.fantasypros.com/images/players/nfl/19198/headshot/210x210.png","11",91.5,90.9,92,"at DET","DET",NA,"Tagovailoa is a top-shelf QB1 this week. He's played well when on the field, ranking eighth in PFF passing grade and second in yards per attempt as the QB10 in fantasy points per game. The Lions have been ripped in half by quarterbacks all season. They are third in success rate per dropback, fourth in fantasy points per game, and 28th in DVOA against deep passing. Tagovailoa is 11th in deep passing rate, second in deep adjusted completion rate, and seventh in deep passing yards (minimum ten deep passing attempts). The only thing that could slow him is the Lions' blitz. Detroit is sixth in blitz rate (16th in pressure rate). Tagovailoa is 19th in PFF passing grade against the blitz and 21st in blitz-adjusted completion rate (ninth in yards per attempt against the blitz).","start",NA,"QB6","A","19.2"
"qb","QB",2022-10-29,"11177","Kirk Cousins","QB","MIN",7,7.44,0.91,5,9,"bbd0942c-6f77-4f83-a6d0-66ec6548019e","25812","1272574","QB","K. Cousins","QB","QB","https://www.fantasypros.com/nfl/players/kirk-cousins.php","kirk-cousins.php","https://images.fantasypros.com/images/players/nfl/11177/headshot/210x210.png","https://images.fantasypros.com/images/players/nfl/11177/headshot/210x210.png","7",82.5,74.9,90,"vs. ARI","ARI",NA,"Since Week 4, the Cardinals' pass defense has tightened up, ranking 11th in DVOA. Over their last four games, they are eighth in EPA per dropback and 13th in explosive pass rate allowed. Cousins is the QB13 in fantasy points per game. He's 11th in PFF passing grade, eighth in adjusted completion rate, and ninth in true completion rate, but all of that unravels when he's pressured. Cousins is 22nd in pressured completion rate and 29th in pressured accuracy rating. Arizona might only rank 23rd in pressure rate, but they are second in blitz rate. All I can say is I hope Cousins packed his brown pants because the blitz is coming. Cousins against the blitz is like the morning after a late-night Taco Bell run. It isn't pretty. Cousins is 33rd in PFF passing grade, 36th in yards per attempt, and 32nd in adjusted completion rate against the blitz. Cousins is a QB2.","sit",NA,"QB7","B+","18.8"
"qb","QB",2022-10-29,"9603","Tom Brady","QB","TB",8,8.1,1.21,6,11,"41c44740-d0f6-44ab-8347-3b5d515e5ecf","5228","187741","QB","T. Brady","QB","QB","https://www.fantasypros.com/nfl/players/tom-brady.php","tom-brady.php","https://images.fantasypros.com/images/players/nfl/9603/headshot/210x210.png","https://images.fantasypros.com/images/players/nfl/9603/headshot/210x210.png","11",94.5,92.9,96,"vs. BAL","BAL",NA,"Brady's real-life quarterback play and his fantasy production haven't matched up. The Buccaneers offense has been a tick-off all season with injuries and missed opportunities. Brady is seventh in PFF passing grade, tenth in big-time throw rate, 19th in adjusted completion rate, and holds the third-lowest turnover-worthy play rate (minimum 50 dropbacks). These numbers don't line up with a quarterback that's QB22 in fantasy points per game. Since Week 5, the Ravens have been a much improved secondary, ranking 13th in pass defense DVOA with the 14th-lowest yards per attempt allowed. They are, however, 17th in DVOA against deep passing. Brady is third in PFF deep passing grade and ninth in deep ball accuracy rating, but he's also 26th in deep adjusted completion rate. These metrics scream that deep ball regression is coming. Is it in Week 8? Possible. Brady remains a QB1 despite his lackluster fantasy numbers and the tough-on-paper matchup.","start",NA,"QB8","B+","18.4"
"qb","QB",2022-10-29,"15600","Dak Prescott","QB","DAL",9,9.19,1.9,6,16,"86197778-8d4b-4eba-affe-08ef7be7c70b","29369","1824864","QB","D. Prescott","QB","QB","https://www.fantasypros.com/nfl/players/dak-prescott.php","dak-prescott.php","https://images.fantasypros.com/images/players/nfl/15600/headshot/210x210.png","https://images.fantasypros.com/images/players/nfl/15600/headshot/210x210.png","9",90.9,88.7,93,"vs. CHI","CHI",NA,"In his first game back, Prescott wasn't asked to do much. He was, however, effective, ranking 14th in PFF passing grade, tenth in yards per attempt, and tenth in adjusted completion rate. The Bears have outperformed preseason projections for their pass defense, but there's an opportunity for Prescott to post a nice stat line this week if Dallas takes the training wheels off. Chicago is 12th in pass defense DVOA and second in DVOA against short passing, but there are cracks in their armor. The Bears are also 25th in DVOA against the deep ball and have allowed the ninth-highest success rate per dropback. Prescott should have time in the pocket against a defense that's 32nd in blitz rate and 18th in pressure rate. Prescott is a QB1 with upside if Dallas lets him rip it this week.","start",NA,"QB9","B","18.0"
"qb","QB",2022-10-29,"18232","Daniel Jones","QB","NYG",10,10.19,1.11,8,12,"0042266b-cb28-4012-bfd2-06650badad97","31838","2179245","QB","D. Jones","QB","QB","https://www.fantasypros.com/nfl/players/daniel-jones.php","daniel-jones.php","https://images.fantasypros.com/images/players/nfl/18232/headshot/210x210.png","https://images.fantasypros.com/images/players/nfl/18232/headshot/210x210.png","9",69.5,70,69,"at SEA","SEA",NA,"With last week's performance, Jones is up to QB9 in fantasy points per game. A better way to view him is an upside QB2, as Jones has only two top 12 weeks under his belt. His rushing upside is what has helped his floor and ceiling. Jones is third in rushing yards, second in rushing touchdowns, and fourth in red zone carries. He's been efficient but mundane as a passer. Jones is 21st in PFF passing grade and 32nd in aDOT, but he's first in adjusted completion rate and third in clean pocket completion rate. Jones can stack back-to-back QB1 outings this week against Seattle. The Seahawks are 11th in fantasy points per game allowed to quarterbacks. His short passing approach can serve him well if his playmakers can create after the catch. Seattle is ninth in passing touchdown rate and fourth in yards per attempt. The culprit is their inability to tackle. They are second in YAC and fourth in missed tackles. Jones is at the borderline of QB1/2.","start",NA,"QB10","B","17.7"
"qb","QB",2022-10-29,"11687","Geno Smith","QB","SEA",11,11.1,1.45,8,15,"cfc93f5e-105e-4a5e-88d3-f4279893cfa8","26662","1700358","QB","G. Smith","QB","QB","https://www.fantasypros.com/nfl/players/geno-smith.php","geno-smith.php","https://images.fantasypros.com/images/players/nfl/11687/headshot/210x210.png","https://images.fantasypros.com/images/players/nfl/11687/headshot/210x210.png","11",79.6,83.1,76,"vs. NYG","NYG",NA,"Smith has continued to play well as the QB7 in fantasy points per game. Smith has been a top-seven fantasy quarterback in three of his last five games. He's sixth in PFF passing grade, fourth in big-time throw rate and sixth in adjusted completion rate (minimum 50 dropbacks). This week, Smith is a low-end QB1 against an underrated Giants secondary that has held passers in check. The Giants are ninth in yards per attempt, eighth in passing touchdown rate, and 13th in success rate per dropback (since Week 4).","start",NA,"QB11","B-","17.3"
"qb","QB",2022-10-29,"12092","Derek Carr","QB","LV",12,11.35,0.95,9,14,"9f026fc0-4449-4dc5-a226-2e2830619381","27564","1664819","QB","D. Carr","QB","QB","https://www.fantasypros.com/nfl/players/derek-carr.php","derek-carr.php","https://images.fantasypros.com/images/players/nfl/12092/headshot/210x210.png","https://images.fantasypros.com/images/players/nfl/12092/headshot/210x210.png","6",80.2,77.4,83,"at NO","NO",NA,"Carr is a low-end QB1/high-end QB2. He's managed three top-12 performances this season (QB6, QB11, QB11), with his other three games finishing as the QB16 or lower. The Saints' pass defense is battered and bruised. Since Week 4, they are 22nd in pass defense, DVOA ranking 22nd in passing yards per game, 31st in EPA per drop back, and 26th in explosive pass rate allowed. New Orleans is only 28th in pressure rate. That should help Carr, who has been struggling this season, even from a clean pocket. Among quarterbacks with at least 25 dropbacks from a clean pocket, Carr is 31st in PFF passing grade, 22nd in yards per attempt, and 27th in adjusted completion rate.","start",NA,"QB12","B-","17.1"
"qb","QB",2022-10-29,"15501","Jared Goff","QB","DET",13,12.9,0.96,9,17,"aba8f925-ffbf-4654-bfa7-a25d3d237494","29235","2061053","QB","J. Goff","QB","QB","https://www.fantasypros.com/nfl/players/jared-goff.php","jared-goff.php","https://images.fantasypros.com/images/players/nfl/15501/headshot/210x210.png","https://images.fantasypros.com/images/players/nfl/15501/headshot/210x210.png","6",47.4,42.7,52,"vs. MIA","MIA",NA,"This is a nice bounce-back matchup for Goff, who hasn't finished as a QB1 since Week 4. The Dolphins have surrendered the fifth-most fantasy points per game to quarterbacks. Miami is fourth in success rate per dropback, 25th in passing yards per game, and 27th in EPA per dropback. Where the Dolphins struggle is right in Goff's wheelhouse as they are 30th in DVOA against short passing. This is a result of their inability to tackle, as they are sixth in YAC and eighth in missed tackles. Goff is a borderline QB1.","start",NA,"QB13","C+","16.8"
"qb","QB",2022-10-29,"12208","Jimmy Garoppolo","QB","SF",14,15.06,1.3,14,19,"42de9d1d-0352-460b-9172-9452414fd7fd","27590","1760229","QB","J. Garoppolo","QB","QB","https://www.fantasypros.com/nfl/players/jimmy-garoppolo.php","jimmy-garoppolo.php","https://images.fantasypros.com/images/players/nfl/12208/headshot/210x210.png","https://images.fantasypros.com/images/players/nfl/12208/headshot/210x210.png","9",36.3,23.5,49,"at LAR","LAR",NA,"Garoppolo has finished as the QB9 in three consecutive weeks. He's a borderline QB1/2 this week against the Rams. Garoppolo's numbers illustrate the worrisome highwire act that is Jimmy G. He's eighth in yards per attempt and 12th in big-time throw rate, which are great. Still, Garoppolo is also 27th in PFF passing grade, 22nd in aDOT, and 31st in adjusted completion rate (minimum 50 dropbacks). In his last two matchups against Los Angeles, he has finished as the QB13 and QB19 in fantasy. Los Angeles is eighth in passing yards per game, 13th in EPA per drop back, and second in explosive pass rate. After opening the season wobbly, since Week 4, Los Angeles is sixth in pass defense DVOA.",NA,NA,"QB14","C+","16.4"
"qb","QB",2022-10-29,"19780","Trevor Lawrence","QB","JAC",15,15.71,1.61,13,21,"aaa8b42c-4d87-45f6-bfd2-e31cfed9a736","33389","2967185","QB","T. Lawrence","QB","QB","https://www.fantasypros.com/nfl/players/trevor-lawrence.php","trevor-lawrence.php","https://images.fantasypros.com/images/players/nfl/19780/headshot/210x210.png","https://images.fantasypros.com/images/players/nfl/19780/headshot/210x210.png","11",62.6,55.2,70,"vs. DEN","DEN",NA,"Lawrence is a low-end QB2 in an absolutely brutal matchup. The Broncos are third in pass defense DVOA with the lowest yards per attempt and passing touchdown rates allowed in the NFL. They have yielded the lowest fantasy points per game to quarterbacks. Lawrence is the QB11 in fantasy points per game this season, but that's partially due to the dreadful state of the quarterback position and his three rushing touchdowns (second-most among quarterbacks). Lawrence will be under siege during this game. Denver is third in blitz rate and seventh in pressure rate. Among 36 quarterbacks with at least 25 pressured dropbacks, Lawrence is 30th in pressured PFF passing grade, 19th in yards per attempt, and 26th in QBR while pressured.","sit",NA,"QB15","C","16.0"
"qb","QB",2022-10-29,"13890","Marcus Mariota","QB","ATL",16,16.54,1.99,13,22,"7c16c04c-04de-41f3-ac16-ad6a9435e3f7","28390","1880862","QB","M. Mariota","QB","QB","https://www.fantasypros.com/nfl/players/marcus-mariota.php","marcus-mariota.php","https://images.fantasypros.com/images/players/nfl/13890/headshot/210x210.png","https://images.fantasypros.com/images/players/nfl/13890/headshot/210x210.png","14",25.1,24.1,26,"vs. CAR","CAR",NA,"The Falcons are desperately trying to cover up Mariota as much as possible. Since Week 3, he's thrown the ball more than 24 times once. Mariota has three top-12 fantasy finishes this year, all fueled by his rushing. In each of those games, he rushed for at least 50 yards, with rushing touchdowns in two of them. Among the same 43 quarterback sample as Walker, Mariota is 23rd in PFF passing grade, 26th in big-time throw rate, and 38th in adjusted completion rate. Mariota is the QB19 in fantasy points per game. That's how he should be valued weekly as a mid to low-end QB2 who can hop into the top 12 if his rushing equity hits the high water mark. Carolina has allowed the seventh-lowest yards per attempt and tenth-lowest passing touchdown rate. They might rank 22nd in pressure rate but also 11th in blitz rate. If the blitz gets home, Mariota is in trouble. Mariota is 30th in adjusted completion rate and 33rd in yards per attempt against the blitz (minimum 20 blitzed dropbacks).","sit",NA,"QB16","C","15.6"
"qb","QB",2022-10-29,"9451","Matthew Stafford","QB","LAR",17,17.69,1.67,14,22,"ade43b1a-0601-4672-83b6-d246bc066a19","9265","1114942","QB","M. Stafford","QB","QB","https://www.fantasypros.com/nfl/players/matthew-stafford.php","matthew-stafford.php","https://images.fantasypros.com/images/players/nfl/9451/headshot/210x210.png","https://images.fantasypros.com/images/players/nfl/9451/headshot/210x210.png","7",68.3,63.5,73,"vs. SF","SF",NA,"Stafford has been a mess this season as the QB29 in fantasy points per game. He's only managed two passing touchdowns over his last four games. The last time he faced the 49ers, he finished as the QB29 with 5.3 yards per attempt and 254 passing yards. Stafford is a QB2 in this matchup. Since losing Emmanuel Moseley, the 49ers' pass defense is first in success rate per dropback, 26th in passing yards per game, and 30th in explosive pass rate. Yes, in this two-week sample, Patrick Mahomes sways the numbers heavily, but also, they allowed Marcus Mariota to complete 92.8% of his passes with 9.2 yards per attempt. Overall the 49ers are 31st in DVOA against deep passing. The biggest worry for Stafford is the 49ers' pass rush. They are second in pressure rate. Stafford is third in pressure-adjusted completion rate but ninth in turnover-worthy play rate with pressure in his face (minimum 50 dropbacks).","sit",NA,"QB17","C-","15.2"
"qb","QB",2022-10-29,"9001","Aaron Rodgers","QB","GB",18,18,2.25,13,22,"0ce48193-e2fa-466e-a986-33f751add206","7200","419780","QB","A. Rodgers","QB","QB","https://www.fantasypros.com/nfl/players/aaron-rodgers.php","aaron-rodgers.php","https://images.fantasypros.com/images/players/nfl/9001/headshot/210x210.png","https://images.fantasypros.com/images/players/nfl/9001/headshot/210x210.png","14",86.7,85.3,88,"at BUF","BUF",NA,"Rodgers has flopped in fantasy while his real-life level of play has remained high. Rodgers is 12th in PFF passing grade, 13th in adjusted completion rate, and sixth in big-time throw rate (minimum 50 dropbacks). Despite those facts, Rodgers is the QB25 in fantasy points per game and a QB2 this week. The Bills are a quarterback-squashing pass defense. They have permitted the eighth-lowest yards per attempt, second-lowest passing touchdown rate, and the third-fewest fantasy points per game to quarterbacks.","sit",NA,"QB18","C-","14.8"
"qb","QB",2022-10-29,"19781","Justin Fields","QB","CHI",19,18.38,1.95,15,24,"cf15be8f-9117-4531-a517-2b9c7cb3e9e1","33399","1273205","QB","J. Fields","QB","QB","https://www.fantasypros.com/nfl/players/justin-fields.php","justin-fields.php","https://images.fantasypros.com/images/players/nfl/19781/headshot/210x210.png","https://images.fantasypros.com/images/players/nfl/19781/headshot/210x210.png","14",33.6,26.2,41,"at DAL","DAL",NA,"Since Week 4, Fields is the QB9 in fantasy points per game. Much of this is related to his 67.3 rushing yards per game over this span. Over his last four games, he's been volatile, but he's pushing the ball downfield. He ranks 29th in PFF passing grade and 32nd in adjusted completion rate (ouch) but he's also 12th in big-time throw rate, fourth in aDOT, and eighth in yards per attempt. Since Week 4 he's ninth in EPA per play and 13th in EPA + CPOE composite. Dallas has a strong secondary holding opposing quarterbacks to the third-lowest success rate per dropback, fourth-fewest passing yards per game, and seventh-lowest explosive pass rate. Fields is a QB2 that will again have to get it done with this rushing. That's possible though against a defense that is 24th in explosive run rate allowed.","start",NA,"QB19","C-","14.6"
"qb","QB",2022-10-29,"9907","Andy Dalton","QB","NO",20,20.46,3.45,10,28,"d2a0e5af-3850-4f16-8e40-a0b1d15c2ce1","24822","1125961","QB","A. Dalton","QB","QB","https://www.fantasypros.com/nfl/players/andy-dalton.php","andy-dalton.php","https://images.fantasypros.com/images/players/nfl/9907/headshot/210x210.png","https://images.fantasypros.com/images/players/nfl/9907/headshot/210x210.png","14",14.9,17.7,12,"vs. LV","LV",NA,"Dalton looks to remain the Saints' starter. News flash. He's playing better than most would like to admit. He's second in PFF passing grade, 16th in yards per attempt, 17th in adjusted completion rate, and 13th in big-time throw rate (minimum 50 dropbacks). He finished as the QB2 in fantasy last week, exploding for 361 passing yards and four passing scores. Dalton is a strong QB2 that could easily find himself in the top 12 again this week. The Raiders have allowed the sixth-highest success rate per dropback while ranking 27th in passing yards per game and 26th in explosive pass rate.","sit",NA,"QB20","D+","14.4"
"qb","QB",2022-10-29,"13932","Taylor Heinicke","QB","WAS",21,22.96,2.21,20,28,"2c259733-ec2c-4e3c-bb7b-34dc0d37dc34","28839","2174914","QB","T. Heinicke","QB","QB","https://www.fantasypros.com/nfl/players/taylor-heinicke.php","taylor-heinicke.php","https://images.fantasypros.com/images/players/nfl/13932/headshot/210x210.png","https://images.fantasypros.com/images/players/nfl/13932/headshot/210x210.png","14",8,9,7,"at IND","IND",NA,"In a down week for quarterback production last week, Heinicke was the QB13 in fantasy. Among 43 quarterbacks with at least 25 dropbacks, he's 43rd in PFF passing grade (Ewww), 41st in adjusted completion rate, and 38th in yards per attempt. Heinicke's fantasy value is tied to his legs. The Colts continue to be a run funnel. Since Week 4, they are 13th in pass defense DVOA (26th in rush DVOA), allowing the second-fewest passing yards per game while sitting at tenth in EPA per dropback and fourth in explosive pass rate. Heinicke is a low-floor QB2.",NA,NA,"QB21","D-","14.3"
"qb","QB",2022-10-29,"11180","Russell Wilson","QB","DEN",22,22.77,3.69,16,32,"409d4cac-ee90-4470-9710-ebe671678339","25785","1272242","QB","R. Wilson","QB","QB","https://www.fantasypros.com/nfl/players/russell-wilson.php","russell-wilson.php","https://images.fantasypros.com/images/players/nfl/11180/headshot/210x210.png","https://images.fantasypros.com/images/players/nfl/11180/headshot/210x210.png","9",62.7,60.4,65,"at JAC","JAC",3,NA,NA,NA,"QB22","F","14.1"
