"page","page_pos","scrape_date","fantasypros_id","player_name","pos","team","rank","ecr","sd","best","worst","player_positions","player_short_name","player_eligibility","player_page_url","player_filename","player_bye_week","player_owned_avg","player_opponent","player_opponent_id","player_ecr_delta","note","tag","recommendation","pos_rank","start_sit_grade","r2p_pts"
"qb","QB",2024-09-20,"17298","Josh Allen","QB","BUF",1,1.27,0.65,1,4,"QB","J. Allen","QB","https://www.fantasypros.com/nfl/players/josh-allen-qb.php","josh-allen-qb.php","12",100,"vs. JAC","JAC",NA,NA,NA,NA,"QB1","A+","22.1"
"qb","QB",2024-09-20,"17233","Lamar Jackson","QB","BAL",2,2.41,0.61,1,4,"QB","L. Jackson","QB","https://www.fantasypros.com/nfl/players/lamar-jackson.php","lamar-jackson.php","14",99.9,"at DAL","DAL",NA,NA,NA,NA,"QB2","A","21.7"
"qb","QB",2024-09-20,"19275","Jalen Hurts","QB","PHI",3,2.77,0.88,1,5,"QB","J. Hurts","QB","https://www.fantasypros.com/nfl/players/jalen-hurts.php","jalen-hurts.php","5",99.9,"at NO","NO",NA,NA,NA,NA,"QB3","A","21.1"
"qb","QB",2024-09-20,"18600","Kyler Murray","QB","ARI",4,4.05,0.95,1,6,"QB","K. Murray","QB","https://www.fantasypros.com/nfl/players/kyler-murray.php","kyler-murray.php","11",94.8,"vs. DET","DET",NA,NA,"start",NA,"QB4","A","20.6"
"qb","QB",2024-09-20,"16413","Patrick Mahomes","QB","KC",5,5.23,1.11,3,8,"QB","P. Mahomes II","QB","https://www.fantasypros.com/nfl/players/patrick-mahomes.php","patrick-mahomes.php","6",99.9,"at ATL","ATL",NA,NA,NA,NA,"QB5","A","20.0"
"qb","QB",2024-09-20,"19196","Joe Burrow","QB","CIN",6,5.57,0.86,3,8,"QB","J. Burrow","QB","https://www.fantasypros.com/nfl/players/joe-burrow.php","joe-burrow.php","12",97.3,"vs. WAS","WAS",NA,"Burrow showed some life last week as the QB10 in fantasy. This week, it's liftoff time. Among 34 qualifying quarterbacks, Burrow is 23rd in yards per attempt and 22nd in fantasy points per dropback, but he's also third in CPOE and 11th in passer rating. The matchup is right for a ceiling performance from Burrow. The Commanders have given up the sixth-highest yards per attempt, the highest passer rating, the ninth-highest CPOE, and the most fantasy points per passing.","start",NA,"QB6","A","19.4"
"qb","QB",2024-09-20,"23071","CJ Stroud","QB","HOU",7,7.68,1.12,6,12,"QB","C.J. Stroud","QB","https://www.fantasypros.com/nfl/players/cj-stroud.php","cj-stroud.php","14",99.3,"at MIN","MIN",NA,NA,NA,NA,"QB7","B+","18.9"
"qb","QB",2024-09-20,"22902","Jayden Daniels","QB","WAS",8,8,1.3,6,13,"QB","J. Daniels","QB","https://www.fantasypros.com/nfl/players/jayden-daniels.php","jayden-daniels.php","14",88.9,"at CIN","CIN",NA,"Daniels is the QB6 in fantasy points per game, which is all thanks to his legs, as his passing metrics are not great. Among quarterbacks, he is first in rushing attempts per game, second in rushing yards per game, and first in rushing touchdowns. Daniels has had a 5.2 and 4.7 aDOT in his first two games, with check-down rates of 16.7% and 6.9%. This is a brutal matchup for Daniels through the air as Cincy has allowed the fourth-lowest yards per attempt and the 12th-lowest passer rating and CPOE. Look for Daniels to be running often against a defense that is fifth in pressure rate.","start",NA,"QB8","B+","18.5"
"qb","QB",2024-09-20,"24347","Anthony Richardson","QB","IND",9,8.7,1.2,6,13,"QB","A. Richardson","QB","https://www.fantasypros.com/nfl/players/anthony-richardson.php","anthony-richardson.php","14",98.3,"vs. CHI","CHI",NA,NA,"start",NA,"QB9","B","18.1"
"qb","QB",2024-09-20,"15600","Dak Prescott","QB","DAL",10,10.73,1.32,8,14,"QB","D. Prescott","QB","https://www.fantasypros.com/nfl/players/dak-prescott.php","dak-prescott.php","7",95.9,"vs. BAL","BAL",3,"Prescott has had a rough start to the season as the QB16 in fantasy points per game. Among 34 qualifying quarterbacks, he ranks 22nd in yards per attempt, 25th in CPOE, and 23rd in fantasy points per dropback. As wild as it is to say, Baltimore's pass defense could be exactly what the doctor ordered for Prescott. The Ravens pass defense hasn't been the suffocating net of sadness of previous seasons. This season, they have allowed the third-highest yards per attempt, the ninth-highest passer rating, the third-highest CPOE, and the most passing yard per game. Prescott should have all day to dice them up, as Baltimore has the 11th-lowest pressure rate this season.","start",NA,"QB10","B","17.8"
"qb","QB",2024-09-20,"19797","Brock Purdy","QB","SF",11,11.55,1.88,8,17,"QB","B. Purdy","QB","https://www.fantasypros.com/nfl/players/brock-purdy.php","brock-purdy.php","9",91.1,"at LAR","LAR",NA,"Purdy might be the QB19 in fantasy, but that doesn't mean that he's playing bad football. Actually, it's quite the opposite. Among 34 qualifying quarterbacks, Purdy is fifth in yards per attempt, sixth in CPOE, and 12th in hero throw rate. Purdy could put up solid QB1 numbers this week. The Rams have allowed the highest yards per attempt, the ninth-most passing yards per game, and the third-highest passer rating. Purdy should have all day to throw against the Rams, which also have the 12th-lowest pressure rate.",NA,NA,"QB11","B-","17.6"
"qb","QB",2024-09-20,"15501","Jared Goff","QB","DET",12,11.84,1.24,9,15,"QB","J. Goff","QB","https://www.fantasypros.com/nfl/players/jared-goff.php","jared-goff.php","5",70.7,"at ARI","ARI",NA,"Through two games, Goff is the QB26 in fantasy. Goff has had a rough start to the 2024 season, but this week's matchup could be the ""get right"" elixir he needs desperately. Among 34 qualifying quarterbacks, Goff ranks 25th in yards per attempt, 27th in passer rating, 30th in CPOE, and 31st in fantasy points per dropback. The Cardinals are a wonderful matchup at just the right time. They have allowed the second-highest yards per attempt, the fifth-highest passer rating, the highest dropback success rate, and the 12th-highest CPOE.",NA,NA,"QB12","B-","17.3"
"qb","QB",2024-09-20,"17237","Baker Mayfield","QB","TB",13,12.66,1.36,10,15,"QB","B. Mayfield","QB","https://www.fantasypros.com/nfl/players/baker-mayfield.php","baker-mayfield.php","11",52.9,"vs. DEN","DEN",-2,"Mayfield sits on the throne of fantasy quarterbacks right now as the QB1 in fantasy. He has been playing amazing football to a level we haven't seen since Mayfield's rookie year. Currently, Mayfield ranks second in yards per attempt and passer rating, 10th in CPOE, and third in fantasy points per dropback. Mayfield should walk away from Week 3 with another solid game. Denver has allowed the 13th-highest passer rating and the 10th-highest CPOE. Denver is eighth in pressure rate, though. Good thing Mayfield has been stellar against pressure with the 12th-highest passing grade, fourth-highest yards per attempt, and the third-highest big-time throw rate.","start",NA,"QB13","C+","17.0"
"qb","QB",2024-09-20,"12092","Derek Carr","QB","NO",14,13.66,2.01,9,17,"QB","D. Carr","QB","https://www.fantasypros.com/nfl/players/derek-carr.php","derek-carr.php","12",31.7,"vs. PHI","PHI",NA,"I wanted to include Carr in the must-start section, but everyone isn't ready for that yet, so let's have that conversation right now. Carr is the QB2 in fantasy football. Let...that...sink...in. Derek Carr is the QB2 in fantasy football. Good lawd. He leads the NFL in yards per attempt, passer rating, CPOE, and fantasy points per dropback. Yes, right now, he is a must-start. Carr should have a field day against a Philly secondary that has allowed the seventh-highest passing yards per game and yards per attempt and the 10th-highest passer rating. He should have plenty of time in the pocket to dissect this pass defense. The Saints have allowed the sixth-lowest pressure rate, and the Eagles have the seventh-lowest pressure rate.","start",NA,"QB14","C+","16.8"
"qb","QB",2024-09-20,"11687","Geno Smith","QB","SEA",15,14.34,1.36,12,18,"QB","G. Smith","QB","https://www.fantasypros.com/nfl/players/geno-smith.php","geno-smith.php","10",26.5,"vs. MIA","MIA",NA,"Smith is currently the QB9 in fantasy as he fills up the stat sheets. He's seventh in passing yards per game, eighth in passer rating, second in CPOE, and 13th in fantasy points per dropback. Miami has been a relatively soft pass defense, allowing the ninth-highest yards per attempt and the seventh-highest passer rating and hero throw rate. The Dolphins' pass rush is tenth in pressure rate, which is surprising. Smith has been adept at navigating muddy pockets this year, ranking third in pressured passing grade and ninth in pressured yards per attempt. He could easily post another QB1 outing in Week 3.","start",NA,"QB15","C","16.6"
"qb","QB",2024-09-20,"17236","Sam Darnold","QB","MIN",16,17.23,1.29,14,21,"QB","S. Darnold","QB","https://www.fantasypros.com/nfl/players/sam-darnold.php","sam-darnold.php","6",14.4,"vs. HOU","HOU",NA,"OK, let's get this out of the way. Darnold hasn't been seeing ghosts this season. If anything he has become an honorary Ghostbuster in Kevin O'Connell's offense. Among 34 qualifying quarterbacks, he ranks third in yards per attempt, sixth in passer rating, and ninth in CPOE as the QB10 in fantasy. Yes, you read that correctly. Darnold is the QB10 in fantasy while also ranking seventh in fantasy points per dropback. With a tough matchup this week, Darnold will reside in the QB2 area code. Houston has allowed the 10th-lowest EPA per dropback, the fourth-lowest success rate per dropback, and the sixth-lowest CPOE.","sit",NA,"QB16","C-","16.3"
"qb","QB",2024-09-20,"19781","Justin Fields","QB","PIT",17,17.57,1.51,14,20,"QB","J. Fields","QB","https://www.fantasypros.com/nfl/players/justin-fields.php","justin-fields.php","9",10.5,"vs. LAC","LAC",-2,"Fields is the QB24 in fantasy points per game, which can be traced to his one touchdown for the season. He is the QB7 in expected fantasy points per game. Fields has limited weapons in the passing game outside of George Pickens and Pat Freiermuth, which can explain the fact that he is 24th in yards per attempt and has the highest check-down rate among quarterbacks. Fields is due positive regression, and it happens this week. His rushing profile remains strong as he is third in rushing attempts per game, first in red zone carries per game, and sixth in rushing yards per game among quarterbacks. He faces a Chargers defense that is a tad overrated after their Week 2 matchup with Carolina. Facing Bryce Young this season is an auto inflater of defensive stats. In Week 1 against Gardner Minshew, the Bolts allowed the 10th-highest yards per attempt, adjusted completion rate, and passer rating.","start",NA,"QB17","C-","16.2"
"qb","QB",2024-09-20,"16398","Deshaun Watson","QB","CLE",18,17.64,2.01,15,23,"QB","D. Watson","QB","https://www.fantasypros.com/nfl/players/deshaun-watson.php","deshaun-watson.php","10",34.3,"vs. NYG","NYG",NA,"Watson is the QB17 in fantasy, thanks to his rushing. He has averaged 29.5 rushing yards with one rushing touchdown. Without that, he would be a bottom-five fantasy quarterback that would be commensurate with his level of play. Among 34 qualifying quarterbacks, Watson is 32nd in yards per attempt, 30th in passer rating, and has the 12th-highest off-target throw rate. I don't have any faith after last week in Watson's ability to take advantage of a plus matchup, but he gets another chance this week against a porous Giants' secondary. New York has allowed the fifth-highest yards per attempt, the sixth-highest passer rating, and the fourth-highest CPOE.","sit",NA,"QB18","C-","16.0"
"qb","QB",2024-09-20,"23084","Caleb Williams","QB","CHI",19,18.98,1.73,16,23,"QB","C. Williams","QB","https://www.fantasypros.com/nfl/players/caleb-williams.php","caleb-williams.php","7",76.1,"at IND","IND",NA,"Williams is the QB30 in fantasy points per game. This isn't the start to the season anyone projected for Williams. It's been tough to watch. Among 34 qualifying quarterbacks, he has the lowest yards per attempt, the third-lowest passer rating, the sixth-lowest CPOE, and the lowest fantasy points per dropback. In a 1QB league, Williams isn't on your fantasy radar, but he could manage his best NFL game so far this week, which could help folks in 2QB or Superflex leagues. The Colts pass defense has been a pushover this year. They have the sixth-lowest pressure rate, which is huge for Williams, who has been pressured at the 10th-highest rate with the 10th-lowest time to pressure. He could enjoy more clean pockets this week which would be great against a secondary that has allowed the seventh-highest yards per attempt, the fourth-highest passer rating, and the second-lowest CPOE.","sit",NA,"QB19","D+","15.8"
"qb","QB",2024-09-20,"19780","Trevor Lawrence","QB","JAC",20,19.45,1.23,17,22,"QB","T. Lawrence","QB","https://www.fantasypros.com/nfl/players/trevor-lawrence.php","trevor-lawrence.php","12",60.3,"at BUF","BUF",NA,"Lawrence has been a disappointing QB2 in fantasy this season (QB23). I don't see that changing in Week 3. Lawrence ranks 14th in yards per attempt, 22nd in passer rating, and 23rd in CPOE. He faces a nasty Bills' pass defense that has shut down quarterbacks. Buffalo has allowed the third-lowest yards per attempt, the seventh-lowest passer rating, and the 14th-lowest CPOE.","sit",NA,"QB20","D+","15.7"
"qb","QB",2024-09-20,"11177","Kirk Cousins","QB","ATL",21,21.39,1.65,16,25,"QB","K. Cousins","QB","https://www.fantasypros.com/nfl/players/kirk-cousins.php","kirk-cousins.php","12",58.7,"vs. KC","KC",NA,"Last week, Cousins bounced back as the QB8 in fantasy. Among 33 qualifying quarterbacks, he ranked seventh in yards per attempt, 11th in CPOE and hero throw rate, and 12th in highly accurate throw rate. The Chiefs pass defense looks middle-of-the-road after two games, ranking 15th in yards per attempt, giving up the 11th-highest passer rating, and sitting at 14th in CPOE. The way this week goes sideways for Cousins is if Kansas City's pass rush gets home. Cousins has faced the seventh-lowest pressure rate, but he has fallen apart when pressured, ranking 19th in pressured passing grade with the fifth-highest turnover-worthy play rate. The Chiefs are fifth in blitz rate and seventh in pressure rate.","sit",NA,"QB21","D","15.5"
"qb","QB",2024-09-20,"18562","Gardner Minshew","QB","LV",22,21.59,1.32,19,25,"QB","G. Minshew II","QB","https://www.fantasypros.com/nfl/players/gardner-minshew.php","gardner-minshew.php","10",5,"vs. CAR","CAR",NA,"Minshew has been surprisingly effective as a passer this season. He's the QB17 in fantasy, which won't surprise many people, but he's also 13th in yards per attempt, third in passing yards per game, and fifth in CPOE. Mustache mania could be back. We'll find out this week as he gets a Carolina secondary that is struggling outside of Jaycee Horn. Carolina has allowed the tenth-highest yards per attempt, the second-highest passer rating, and the sixth-highest CPOE.","start",NA,"QB22","D","15.2"
"qb","QB",2024-09-20,"9001","Aaron Rodgers","QB","NYJ",23,22.77,1.11,19,25,"QB","A. Rodgers","QB","https://www.fantasypros.com/nfl/players/aaron-rodgers.php","aaron-rodgers.php","12",65.9,"vs. NE","NE",NA,"After two games of action this season, Rodgers looks like a player that is still shaking off the rust as this offense finds its legs. Rodgers is the QB21 in fantasy points per game, with a better showing in Week 2 (QB10). Among 38 qualifying quarterbacks, Rodgers is 20th in yards per attempt and 25th in CPOE. He has also quietly displayed that the arm talent is still there, as he is 14th in highly accurate throw rate and 10th in hero throw rate. Rodgers should have his best game of this young season in Week 3 against the Patriots. New England's pass defense outside of Christian Gonzalez has stunk. They have allowed the highest CPOE, the 11th-highest passer rating, and the eighth-most passing yards per game. Rodgers should have all day in the pocket against a pass rush that has generated the third-lowest pressure rate.",NA,NA,"QB23","D-","15.0"
"qb","QB",2024-09-20,"9451","Matthew Stafford","QB","LAR",24,25.39,1.9,20,29,"QB","M. Stafford","QB","https://www.fantasypros.com/nfl/players/matthew-stafford.php","matthew-stafford.php","6",46.9,"vs. SF","SF",NA,"It's tough to start Stafford this week outside of Superflex formats. Injuries have decimated the Rams receiver room and offensive line. Stafford and this offense will experience growing pains with all of the shuffling of the depth chart. It's not like Stafford has been playing lights out either before adding all of these elements into the equation. Stafford is the QB27 in fantasy points per game. Among 34 qualifying quarterbacks, he is 19th in yards per attempt, 24th in CPOE, and 29th in fantasy points per dropback. Stafford has also faced the tenth-highest pressure rate. San Francisco has given up the fourth-highest yards per attempt, the eighth-highest passer rating, and the fourth-most fantasy points from passing. They have not been a good pass defense, but they could be elevated this week against an offense that features plenty of backups that have been elevated because of injury armageddon.","sit",NA,"QB24","F","14.7"
"qb","QB",2024-09-20,"18232","Daniel Jones","QB","NYG",25,25.5,1.6,23,30,"QB","D. Jones","QB","https://www.fantasypros.com/nfl/players/daniel-jones.php","daniel-jones.php","11",6.5,"at CLE","CLE",NA,"Even in Superflex formats, you couldn't pay me to start Jones this week. His QB20 standing in fantasy doesn't really tell the full story of how incredibly bad he has played through two weeks. Among 34 qualifying signal callers, Jones is 30th in yards per attempt, 26th in CPOE, and 28th in catchable target rate. He has the eighth-highest off-target throw rate. The Browns still have a nasty pass defense. They have held quarterbacks to the 10th-lowest yards per attempt, the fifth-lowest CPOE, and the 13th-fewest fantasy points. Sit Jones.","sit",NA,"QB25","F","14.5"
"qb","QB",2024-09-20,"22987","Will Levis","QB","TEN",26,25.89,1.61,22,29,"QB","W. Levis","QB","https://www.fantasypros.com/nfl/players/will-levis.php","will-levis.php","5",11.4,"vs. GB","GB",NA,"Levis is a tough player to consider starting even in Superflex formats. He has been nothing short of dreadful through two games as the QB29 in fantasy. Among 34 qualifying quarterbacks, he has the seventh-lowest yards per attempt and passer rating while also checking in with the ninth-fewest fantasy points per dropback and the 12th-lowest catchable target rate. The Packers have tough against quarterbacks in the early going, forcing the most interceptions while allowing the third-lowest passer rating and the fifth-lowest CPOE. Levis is a desperation QB2 only.",NA,NA,"QB26","F","14.5"
"qb","QB",2024-09-20,"18635","Justin Herbert","QB","LAC",27,26.95,1.88,23,30,"QB","J. Herbert","QB","https://www.fantasypros.com/nfl/players/justin-herbert.php","justin-herbert.php","5",61.2,"at PIT","PIT",NA,"Herbert has been nerfed into a low-end QB2. He is the QB27 in fantasy points per game, ranking 26th in yards per attempt, 28th in passing attempts, and 15th in CPOE. This week, he gets a brutal matchup against a stout Steel Curtain. Pittsburgh has permitted the 14th-lowest yards per attempt, the lowest passer rating, the 10th-lowest CPOE, and the second-fewest fantasy points per game to quarterbacks. Herbert's offensive line, that has allowed the fifth-lowest pressure rate, will be tested by a Steelers' pass rush that ranks third in pressure rate.",NA,NA,"QB27","F","14.2"
"qb","QB",2024-09-20,"9907","Andy Dalton","QB","CAR",28,28.23,1.69,24,31,"QB","A. Dalton","QB","https://www.fantasypros.com/nfl/players/andy-dalton.php","andy-dalton.php","11",1.6,"at LV","LV",NA,"The last time we saw Dalton with an extended run as an NFL starter was in 2022 with the Saints. Dalton was low-key balling that season. Among 41 qualifying quarterbacks, he was first in highly accurate throw rate and CPOE, eighth in yards per attempt, and 11th in passer rating. Dalton should be able to post solid QB2 numbers this week against a Raiders' secondary that ranks 20th in yards per attempt while giving up the fifth-highest CPOE. Las Vegas also has the lowest pressure rate in the NFL.",NA,NA,"QB28","F","13.9"
"qb","QB",2024-09-20,"22910","Bo Nix","QB","DEN",29,28.41,1.81,25,32,"QB","Bo Nix","QB","https://www.fantasypros.com/nfl/players/bo-nix.php","bo-nix.php","14",12.3,"at TB","TB",NA,"Nix is unstartable in fantasy until further notice. It doesn't matter the opponent right now. Nix has been struggling at a monumental level despite even being a rookie. Nix is the QB24 in fantasy with the fourth-lowest yards per attempt, the second-lowest passer rating, and the fifth-fewest fantasy points per dropback. Even in Superflex, sit Nix.",NA,NA,"QB29","F","13.6"
"qb","QB",2024-09-20,"24170","Skylar Thompson","QB","MIA",30,29.86,1.59,27,33,"QB","S. Thompson","QB","https://www.fantasypros.com/nfl/players/skylar-thompson.php","skylar-thompson.php","6",1.1,"at SEA","SEA",NA,"Even in the most desperate of situations in Superflex, I'm likely still not starting Thompson. Anytime he has gotten an extended look, it hasn't ended well. In 2022, Thompson started in Week 18. He completed 64.5% of his passes for a measly 152 scoreless yards with 4.9 yards per attempt. This preseason, among 61 qualifying passers, he ranked 27th in passing grade, 37th in yards per attempt, and 25th in adjusted completion rate. I have to see it to believe it with Thompson before trusting him in any fantasy lineup.",NA,NA,"QB30","F","13.2"
"qb","QB",2024-09-20,"23499","Malik Willis","QB","GB",31,30.21,1.34,27,33,"QB","M. Willis","QB","https://www.fantasypros.com/nfl/players/malik-willis.php","malik-willis.php","10",1.1,"at TEN","TEN",NA,"Willis operated as a competent game manager in his first start for Green Bay, completing 85.7% of his 14 passes while adding 41 rushing yards as the QB20 for the week. Among 34 qualifying quarterbacks, he was eighth in yards per attempt, fifth in passer rating, and eighth in CPOE. The Packers tried to put as little as possible on his plate. He threw to his first read on 80% of his passes, which is the highest mark among qualifying quarterbacks. This week, if Willis posts solid QB2 numbers again, it will have to come via his legs. The Titans pass defense is legit through two games, allowing the second-lowest yards per attempt, the lowest CPOE, and the ninth-fewest fantasy points per game to quarterbacks.",NA,NA,"QB31","F","12.7"
"qb","QB",2024-09-20,"15642","Jacoby Brissett","QB","NE",32,31.73,0.62,29,32,"QB","J. Brissett","QB","https://www.fantasypros.com/nfl/players/jacoby-brissett.php","jacoby-brissett.php","14",1.4,"at NYJ","NYJ",NA,"Brissett has played the role of game manager so far. The Patriots have fielded an ultra-conservative offense as Brissett has the fifth-fewest passing yards per game, the sixth-lowest yards per attempt, and the 12th-fewest passing attempts. Brissett also ranks 18th in CPOE and 26th in fantasy points per dropback. Much like the New York offense, the defense for the Jets continues to find their way. While they have allowed the eighth-highest CPOE and the 11th-highest yards per attempt, this defense is still not one that I want to target in fantasy. New York has generated the 12th-best pressure rate and given up the third-fewest passing touchdowns. I don't expect that New England will attempt to test this defense much in Week 3. Brissett is the QB29 in fantasy points per game and is a sit this week in all formats.",NA,NA,"QB32","F","12.4"
"qb","QB",2024-09-20,"19246","Jordan Love","QB","GB",33,30.43,5.45,16,33,"QB","J. Love","QB","https://www.fantasypros.com/nfl/players/jordan-love.php","jordan-love.php","10",92.4,"at TEN","TEN",NA,NA,NA,NA,"QB33","F","0.0"
"qb","QB",2024-09-20,"22900","Bryce Young","QB","CAR",34,34.14,0.35,34,35,"QB","B. Young","QB","https://www.fantasypros.com/nfl/players/bryce-young.php","bryce-young.php","11",7.7,"at LV","LV",NA,NA,NA,NA,"QB34","F","0.0"
"qb","QB",2024-09-20,"23046","Drake Maye","QB","NE",35,34.67,0.6,33,35,"QB","D. Maye","QB","https://www.fantasypros.com/nfl/players/drake-maye.php","drake-maye.php","14",3.4,"at NYJ","NYJ",NA,NA,NA,NA,"QB35","F","0.0"
"qb","QB",2024-09-20,"13891","Jameis Winston","QB","CLE",36,34.67,2.36,33,38,"QB","J. Winston","QB","https://www.fantasypros.com/nfl/players/jameis-winston.php","jameis-winston.php","10",0.6,"vs. NYG","NYG",NA,NA,NA,NA,"QB36","F","0.0"
"qb","QB",2024-09-20,"10007","Tyrod Taylor","QB","NYJ",37,37.5,1.5,36,39,"QB","T. Taylor","QB","https://www.fantasypros.com/nfl/players/tyrod-taylor.php","tyrod-taylor.php","12",0.2,"vs. NE","NE",NA,NA,NA,NA,"QB37","F","0.0"
"ppr-rb","RB",2024-09-20,"23133","Bijan Robinson","RB","ATL",1,1.81,1.12,1,5,"RB","B. Robinson","RB","https://www.fantasypros.com/nfl/players/bijan-robinson.php","bijan-robinson.php","12",100,"vs. KC","KC",NA,NA,NA,NA,"RB1","A+","20.2"
"ppr-rb","RB",2024-09-20,"16421","Alvin Kamara","RB","NO",2,2.83,1.43,1,6,"RB","A. Kamara","RB","https://www.fantasypros.com/nfl/players/alvin-kamara.php","alvin-kamara.php","12",98.6,"vs. PHI","PHI",3,NA,NA,NA,"RB2","A+","19.5"
"ppr-rb","RB",2024-09-20,"22982","Breece Hall","RB","NYJ",3,2.93,1.14,1,5,"RB","B. Hall","RB","https://www.fantasypros.com/nfl/players/breece-hall.php","breece-hall.php","12",100,"vs. NE","NE",NA,NA,NA,NA,"RB3","A+","18.7"
"ppr-rb","RB",2024-09-20,"22969","Jordan Mason","RB","SF",4,3.81,1.52,1,8,"RB","J. Mason","RB","https://www.fantasypros.com/nfl/players/jordan-mason.php","jordan-mason.php","9",53.4,"at LAR","LAR",1,NA,NA,NA,"RB4","A","18.0"
"ppr-rb","RB",2024-09-20,"17240","Saquon Barkley","RB","PHI",5,4.52,1.3,1,7,"RB","S. Barkley","RB","https://www.fantasypros.com/nfl/players/saquon-barkley.php","saquon-barkley.php","5",100,"at NO","NO",-2,NA,NA,NA,"RB5","A","17.7"
"ppr-rb","RB",2024-09-20,"22968","Jahmyr Gibbs","RB","DET",6,6.95,0.92,6,9,"RB","J. Gibbs","RB","https://www.fantasypros.com/nfl/players/jahmyr-gibbs.php","jahmyr-gibbs.php","5",99.9,"at ARI","ARI",NA,NA,NA,NA,"RB6","A","17.5"
