"page","page_pos","scrape_date","fantasypros_id","player_name","pos","team","rank","ecr","sd","best","worst","sportradar_id","yahoo_id","cbs_id","player_positions","player_short_name","player_eligibility","player_yahoo_positions","player_page_url","player_filename","player_square_image_url","player_image_url","player_bye_week","player_owned_avg","player_owned_espn","player_owned_yahoo","player_opponent","player_opponent_id","player_ecr_delta","note","tag","recommendation","pos_rank","start_sit_grade","r2p_pts"
"qb","QB",2023-09-15,"19275","Jalen Hurts","QB","PHI",1,1.66,0.98,1,5,"64bd0f02-6a5d-407e-98f1-fd02048ea21d","32723","2240246","QB","J. Hurts","QB","QB","https://www.fantasypros.com/nfl/players/jalen-hurts.php","jalen-hurts.php","https://images.fantasypros.com/images/players/nfl/19275/headshot/210x210.png","https://images.fantasypros.com/images/players/nfl/19275/headshot/210x210.png","10",100,99.9,100,"vs. MIN","MIN",NA,"Hurts didn't play his best football in Week 1. Despite ranking tenth in passing grade and 11th in adjusted completion rate, he logged the eighth-lowest yards per attempt for the week as the QB19 in fantasy. Last season, Hurts finished with only two games outside the top 12 in weekly fantasy scoring at the quarterback position. This is a huge bounce-back opportunity for Hurts. Brian Flores' new-look defense was surprisingly majorly zone-heavy in Week 1. We'll see if that trend continues all season, but we can't ignore that his corners operated in zone coverage on 72-86% of their snaps in Week 1. Last season, Hurts was eighth in adjusted completion rate, eighth in yards per attempt, and third in passer rating against zone coverage (minimum 100 dropbacks per Fantasy Points Data). Hurts is a top-three fantasy option this week.",NA,NA,"QB1","A+","24.8"
"qb","QB",2023-09-15,"17298","Josh Allen","QB","BUF",2,2.2,0.99,1,5,"3069db07-aa43-4503-ab11-2ae5c0002721","30977","2181054","QB","J. Allen","QB","QB","https://www.fantasypros.com/nfl/players/josh-allen-qb.php","josh-allen-qb.php","https://images.fantasypros.com/images/players/nfl/17298/headshot/210x210.png","https://images.fantasypros.com/images/players/nfl/17298/headshot/210x210.png","13",100,99.9,100,"vs. LV","LV",NA,"Last week was arguably Allen's worst performance of his career. Since 2021, it was only his fourth game with a passer rating below 65.0 and the third game of his career with three interceptions. At times, Allen made head-scratching throw after head-scratching throw with only green jerseys around. He looked like a player trying to force a big play when the plan of attack should have been to take what the defense was giving him. In Week 1, Patrick Graham changed the flavor of the defensive ice cream. Last year, this secondary deployed man coverage on 36-41% of their coverage snaps. That plan was tossed in the dumpster so far for 2023, as the Raiders operated in zone coverage on 76% of their snaps in Week 1. In doing so, they held Russell Wilson to 177 passing yards with 5.2 yards per attempt (ninth-lowest), as he also had the third-highest adjusted completion rate for the week. This could be another rough week for Allen against a zone-centric defense. Last year, Allen was 27th in adjusted completion, 16th in passer rating, and 15th in CPOE on deep throws against zone coverage. Allen had a 10:10 passing touchdown to interception ratio against zone (third-most interceptions) in 2022. Allen can overcome any rough passing day with a strong rushing outing for fantasy purposes, so continue to start him as a locked-in strong QB1. Last year, Allen had the fourth-most scrambles and second-most rushing yards against zone coverage among quarterbacks.",NA,NA,"QB2","A","23.9"
"qb","QB",2023-09-15,"16413","Patrick Mahomes","QB","KC",3,2.57,0.84,1,5,"11cad59d-90dd-449c-a839-dddaba4fe16c","30123","2142052","QB","P. Mahomes II","QB","QB","https://www.fantasypros.com/nfl/players/patrick-mahomes.php","patrick-mahomes.php","https://images.fantasypros.com/images/players/nfl/16413/headshot/210x210.png","https://images.fantasypros.com/images/players/nfl/16413/headshot/210x210.png","10",100,99.9,100,"at JAC","JAC",NA,"It might not have been pretty, but Mahomes was still the QB7 in fantasy last week. He was seventh in passing grade, 18th in yards per attempt, and sixth in big-time throw rate. Jacksonville last season allowed the 11th-most passing touchdowns and ninth-most fantasy points per game to quarterbacks. Mahomes should attack this secondary deep. In 2022, Jacksonville surrendered the second-highest passer rating and the fourth-most passing touchdowns on deep balls. Mahomes is a top-five quarterback weekly.",NA,NA,"QB3","A","22.3"
"qb","QB",2023-09-15,"18635","Justin Herbert","QB","LAC",4,4.57,1.42,1,9,"f0a8f8e3-b9e9-46ed-85e4-eec6452a8a44","32676","2221960","QB","J. Herbert","QB","QB","https://www.fantasypros.com/nfl/players/justin-herbert.php","justin-herbert.php","https://images.fantasypros.com/images/players/nfl/18635/headshot/210x210.png","https://images.fantasypros.com/images/players/nfl/18635/headshot/210x210.png","5",98.7,98.3,99,"at TEN","TEN",NA,"In Week 1, Herbert, in this new-look Kellen Moore offense, only attempted 33 passes in a shootout. I expect the passing volume to climb massively this week against a Titans pass funnel defense. Moore has shown the willingness to adapt his offensive approach depending on the opponent. This week, the name of the game should be to attack through the air early and often for the Bolts. Last week, Tennessee allowed the fifth-most passing yards in the NFL to Derek Carr. This was a continuation of their smelly secondary stinking up the joint since 2022. Last year, the Titans allowed the most passing yards in the NFL, the fourth-highest adjusted completion rate, and the highest CPOE on deep passes. Herbert takes to the air as a top-five fantasy option in Week 2.",NA,NA,"QB4","A","21.1"
"qb","QB",2023-09-15,"19780","Trevor Lawrence","QB","JAC",5,5.28,1.29,2,10,"aaa8b42c-4d87-45f6-bfd2-e31cfed9a736","33389","2967185","QB","T. Lawrence","QB","QB","https://www.fantasypros.com/nfl/players/trevor-lawrence.php","trevor-lawrence.php","https://images.fantasypros.com/images/players/nfl/19780/headshot/210x210.png","https://images.fantasypros.com/images/players/nfl/19780/headshot/210x210.png","9",97.3,95.6,99,"vs. KC","KC",NA,"Lawrence picked up right where he left off in 2022. In Week 1, he ranked fourth in passing grade, tenth in adjusted completion rate, and ninth in yards per attempt as the QB8 in fantasy. Kansas City permitted the third-most fantasy points per game to quarterbacks, the most passing touchdowns, and the third-highest adjusted completion rate in 2022. Lawrence should follow Mahomes' lead and wind up and chuck it deep all day. Last year, Kansas City gave up the seventh-most passing touchdowns and sixth-highest passer rating on deep throws. Lawrence is a locked-in top 5-7 fantasy quarterback weekly.",NA,NA,"QB5","A-","20.0"
"qb","QB",2023-09-15,"17233","Lamar Jackson","QB","BAL",6,5.95,1.28,1,9,"e06a9c07-453a-4bb0-a7e9-2c3a64166dad","31002","2181169","QB","L. Jackson","QB","QB","https://www.fantasypros.com/nfl/players/lamar-jackson.php","lamar-jackson.php","https://images.fantasypros.com/images/players/nfl/17233/headshot/210x210.png","https://images.fantasypros.com/images/players/nfl/17233/headshot/210x210.png","13",99.8,99.6,100,"at CIN","CIN",NA,"Jackson operated at a meh level in Week 1 in a strange offense. Jackson was 16th in passing grade, sixth in yards per attempt, and second in adjusted completion rate. The last two figures sound great, huh? His incredibly high completion rate can be traced to his comical 5.1 aDOT (fifth-lowest). Much of this is related to the Ravens' psychotic use of the screen game in Week 1. Jackson utilized screens on 26.7% of his dropbacks in Week 1. To put that figure in context, only P.J. Walker (minimum 50 dropbacks) had a screen rate above 16.8% last season. I don't want to overreact to a one-game sample, but there's plenty to sift through and wonder why. Jackson remains a QB1 because of his rushing ability, but this is a tough matchup. In his last two games against the Bengals, they have had his number. He completed only 53.9% of his passes with 5.2 yards per attempt. Last season, Cincinnati allowed the tenth-lowest yards per attempt, the lowest passer rating, and the fewest fantasy points to quarterbacks.",NA,NA,"QB6","A-","19.2"
"qb","QB",2023-09-15,"19196","Joe Burrow","QB","CIN",7,7.09,1.54,2,14,"3023ac10-4e7f-425f-9fc5-2b8e6332c92e","32671","2179798","QB","J. Burrow","QB","QB","https://www.fantasypros.com/nfl/players/joe-burrow.php","joe-burrow.php","https://images.fantasypros.com/images/players/nfl/19196/headshot/210x210.png","https://images.fantasypros.com/images/players/nfl/19196/headshot/210x210.png","7",99.8,99.6,100,"vs. BAL","BAL",NA,"I had to refresh Burrow's stat page a few times to make sure I was seeing things right. Burrow finished Week 1 with a 45.2 PFF passing grade. You have to go all the way back to his rookie season to find any game (only one) with a lower passing grade. Burrow could only muster 2.6 yards per attempt and a 60.7% adjusted completion rate. To say this level of play is uncharacteristic of Burrow would be an understatement. Baltimore utilized zone on about half of their plays in Week 1. Last year, Burrow was sixth in passer rating and had the most passing touchdowns against zone coverage. He was also seventh in adjusted completion rate against the coverage type but was 23rd in first read rate, so expect him to spread the ball around some this week. Burrow remains a QB1.",NA,NA,"QB7","B+","18.9"
"qb","QB",2023-09-15,"19781","Justin Fields","QB","CHI",8,8.31,1.68,4,14,"cf15be8f-9117-4531-a517-2b9c7cb3e9e1","33399","1273205","QB","J. Fields","QB","QB","https://www.fantasypros.com/nfl/players/justin-fields.php","justin-fields.php","https://images.fantasypros.com/images/players/nfl/19781/headshot/210x210.png","https://images.fantasypros.com/images/players/nfl/19781/headshot/210x210.png","13",98.2,97.3,99,"at TB","TB",NA,"Fields played terribly in Week 1, but it's not all his fault. Head to social media and watch a few clips of this offense. You will be appalled and shocked at the brain-dead play designs that set up this young quarterback to fail before the ball was snapped. This isn't to say Fields didn't hesitate when his receivers ran wide-open last week. He did. Last week, he had the fourth-lowest passing grade, second-lowest aDOT, and 12th-lowest yards per attempt. Considering Fields' skill set, why were there zero designed runs last week? Yeah, I have no clue either, but there were zero. Luke Getsy had too much time this offseason to ponder ways to break this offense. If Chicago can get Fields moving on designed runs again and dial up some deep shots, he can have a good day in Week 2. Tampa Bay allowed the fifth-highest yards per attempt, seventh-highest CPOE on deep throws, and ninth-highest adjusted completion rate last week. Fields remains a QB1.","start",NA,"QB8","B","18.7"
"qb","QB",2023-09-15,"19198","Tua Tagovailoa","QB","MIA",9,9.58,1.86,3,15,"26ad9c27-de38-495e-913c-6fb2428e76d3","32675","2741209","QB","T. Tagovailoa","QB","QB","https://www.fantasypros.com/nfl/players/tua-tagovailoa.php","tua-tagovailoa.php","https://images.fantasypros.com/images/players/nfl/19198/headshot/210x210.png","https://images.fantasypros.com/images/players/nfl/19198/headshot/210x210.png","10",93.4,90.7,96,"at NE","NE",NA,"Tagovailoa was amazing in Week 1. He was the QB1 in fantasy, leading the NFL in passing grade, yards per attempt, and big-time throw rate. Tagovailoa faces a Patriots' secondary that held Philly to the eighth-lowest yards per attempt for the week while also ranking 18th in passer rating with the eighth-worst adjusted completion rate. New England utilized man coverage on 48-61% of their corner's snaps in Week 1. Last year, Tagovailoa had the ninth-highest yards per attempt and passer rating against man coverage. Tagovailoa is a QB1.",NA,NA,"QB9","B","18.5"
"qb","QB",2023-09-15,"24347","Anthony Richardson","QB","IND",10,9.68,2.14,4,18,"5fc5b4a6-a583-4345-a810-4f982204ea5e","40040","3163263","QB","A. Richardson","QB","QB","https://www.fantasypros.com/nfl/players/anthony-richardson.php","anthony-richardson.php","https://images.fantasypros.com/images/players/nfl/24347/headshot/210x210.png","https://images.fantasypros.com/images/players/nfl/24347/headshot/210x210.png","11",81.2,77.3,85,"at HOU","HOU",NA,"The Anthony Richardson show began with a bang. Richardson was the QB4 in fantasy in Week 1. We saw glimpses of the rushing upside with ten carries for 40 yards on the ground. Only one of those runs was a designed carry (four scrambles). Richardson has some growth needed as a passer, but we already knew that. He was 25th in passing grade, 16th in adjusted completion rate, and 15th in yards per attempt. Richardson is a QB1. He faces a Houston secondary that allowed the seventh-highest yards per attempt and second-highest adjusted completion rate last week. Another feather in Richardson's cap is that Houston gave up an 88.9% completion rate on play-action throws in Week 1. Richardson was tied for fifth-most play-action pass attempts in Week 1.","start",NA,"QB10","B","18.3"
"qb","QB",2023-09-15,"15501","Jared Goff","QB","DET",11,11.38,2,6,19,"aba8f925-ffbf-4654-bfa7-a25d3d237494","29235","2061053","QB","J. Goff","QB","QB","https://www.fantasypros.com/nfl/players/jared-goff.php","jared-goff.php","https://images.fantasypros.com/images/players/nfl/15501/headshot/210x210.png","https://images.fantasypros.com/images/players/nfl/15501/headshot/210x210.png","9",62.6,50.2,75,"vs. SEA","SEA",NA,"Goff started off this season strong. Last week, he ranked ninth in passing grade and tenth in yards per attempt despite it not showing up with his QB18 fantasy finish. This week, his play should cross over to the fantasy box score. Seattle got torched last week, allowing the third-most passing yards and fourth-highest yards per attempt. The Seahawks could only cobble together a 7.7% pressure rate (31st) while playing their corners in zone on 61-75% of their plays. Goff was 13th in yards per attempt and 20th in fantasy points per dropback last season against zone coverage (per Fantasy Points Data). Goff is a QB1 this week.","start",NA,"QB11","B-","18.0"
"qb","QB",2023-09-15,"18232","Daniel Jones","QB","NYG",12,12.17,2.26,6,19,"0042266b-cb28-4012-bfd2-06650badad97","31838","2179245","QB","D. Jones","QB","QB","https://www.fantasypros.com/nfl/players/daniel-jones.php","daniel-jones.php","https://images.fantasypros.com/images/players/nfl/18232/headshot/210x210.png","https://images.fantasypros.com/images/players/nfl/18232/headshot/210x210.png","13",76.1,74.1,78,"at ARI","ARI",NA,"Well, Jones has nowhere to go but up. Right? Week 1 was an abysmal failure against a monstrous defense in Dallas. Jones finished the week with the second-lowest passing grade, third-lowest yards per attempt, and fifth-lowest adjusted completion rate. Jones was destroyed by the Cowboys' pass rush, facing the sixth-highest pressure rate and fourth-most quarterback knockdowns. Luckily for Jones, that shouldn't be a problem against the Cardinals, who ranked 22nd in pressure rate last week while also sitting at 20th in blitz rate. The Cardinals allowed the 12th-highest yards per attempt and tenth-highest adjusted completion rate last week. Arizona deployed zone coverage on 58% of their cornerback's snaps in Week 1. Last year, Jones wasn't stellar against zone, ranking 16th in adjusted completion rate and 23rd in passer rating. He was, however, second in scrambles and fourth in rushing yards among quarterbacks. His rushing will have to compensate for any shortcomings as a passer, but that's possible for Jones. He's a QB2 with QB1 upside if he runs this week.",NA,NA,"QB12","B-","17.6"
"qb","QB",2023-09-15,"16398","Deshaun Watson","QB","CLE",13,13.35,2.08,7,23,"eec5265c-7731-4bb6-8af2-4f98a67f9ab7","30125","2133482","QB","D. Watson","QB","QB","https://www.fantasypros.com/nfl/players/deshaun-watson.php","deshaun-watson.php","https://images.fantasypros.com/images/players/nfl/16398/headshot/210x210.png","https://images.fantasypros.com/images/players/nfl/16398/headshot/210x210.png","5",93.4,92.7,94,"at PIT","PIT",NA,"Watson still looks like a shell of his former self on the NFL field. Last week, he was 17th in passing grade with the tenth-lowest yards per attempt and seventh-lowest adjusted completion rate. Watson finished as the QB5 in fantasy last week because of his 45 rushing yards and a rushing touchdown. Last year, we could tell ourselves a story about rust. Still, the more starts that Watson gets in a Browns' uniform, the more distant memory of his former excellence becomes. That said, if Cleveland can keep Watson clean in the pocket, this could be a good spot for him to pad his stats. Last week, Pittsburgh allowed the eighth-highest yards per attempt and third-highest passer rating to the 49ers. Pittsburgh also had the top pressure rate in the NFL. The Bengals were able to pressure Watson at the 14th-highest rate in Week 1, but they also blitzed at the seventh-highest rate. Watson is a QB2.",NA,NA,"QB13","C+","17.3"
"qb","QB",2023-09-15,"11687","Geno Smith","QB","SEA",14,14.09,2.01,9,23,"cfc93f5e-105e-4a5e-88d3-f4279893cfa8","26662","1700358","QB","G. Smith","QB","QB","https://www.fantasypros.com/nfl/players/geno-smith.php","geno-smith.php","https://images.fantasypros.com/images/players/nfl/11687/headshot/210x210.png","https://images.fantasypros.com/images/players/nfl/11687/headshot/210x210.png","5",78.1,78.2,78,"at DET","DET",NA,"Chef Geno is likely staring down another long day in Week 2. Smith played terribly last week, ranking 19th in passing grade with the fourth-lowest yards per attempt and tenth-lowest aDOT. He was pressured at the eighth-highest rate in the NFL last week. That number likely doesn't get much better against a Lions front that ranked ninth in pressure rate with the seventh-highest blitz rate last year. Smith ranked 28th in passing grade with the third-highest turnover-worthy play rate last season when blitzed. Smith is a QB2.","sit",NA,"QB14","C+","17.1"
"qb","QB",2023-09-15,"19797","Brock Purdy","QB","SF",15,15.29,2.12,10,24,"d5aef708-ad61-4ab8-a637-62ff96e92040","34218","2961306","QB","B. Purdy","QB","QB","https://www.fantasypros.com/nfl/players/brock-purdy.php","brock-purdy.php","https://images.fantasypros.com/images/players/nfl/19797/headshot/210x210.png","https://images.fantasypros.com/images/players/nfl/19797/headshot/210x210.png","9",58.1,47.1,69,"at LAR","LAR",NA,"Purdy quickly put any doubts about his arm to rest. In Week 1, he was the QB10 in fantasy, ranking 11th in passing grade, eighth in yards per attempt, and eighth in adjusted completion rate. The Rams utilized zone coverage on 50-61% of their corner's snaps in Week 1. Last year, Purdy was fourth in yards per attempt and passer rating against zone. Purdy is a QB2 with QB1 upside this week.",NA,NA,"QB15","C","16.9"
"qb","QB",2023-09-15,"11177","Kirk Cousins","QB","MIN",16,15.93,2.94,8,25,"bbd0942c-6f77-4f83-a6d0-66ec6548019e","25812","1272574","QB","K. Cousins","QB","QB","https://www.fantasypros.com/nfl/players/kirk-cousins.php","kirk-cousins.php","https://images.fantasypros.com/images/players/nfl/11177/headshot/210x210.png","https://images.fantasypros.com/images/players/nfl/11177/headshot/210x210.png","13",87.3,88.6,86,"at PHI","PHI",3,"Cousins heads into Week 2 fresh off a strong Week 1 performance. He finished as the QB9 in fantasy scoring. Cousins was 14th in passing grade, fifth in yards per attempt, and fifth in adjusted completion rate in Week 1. While the Eagles could deploy more man coverage in this game, they could remain a zone-heavy pass defense. In Week 1, they defended the second-most dropbacks in zone coverage. Last season, they allowed the eighth-lowest yards per attempt and held quarterbacks to the sixth-lowest passer rating in zone coverage. Cousins last season against zone ranked 16th in yards per attempt, 12th in passer rating, and fifth in CPOE on deep throws (per Fantasy Points Data). Cousins is a low-end QB1/high-end QB2.","start",NA,"QB16","C","16.6"
"qb","QB",2023-09-15,"15600","Dak Prescott","QB","DAL",17,16.91,1.91,10,22,"86197778-8d4b-4eba-affe-08ef7be7c70b","29369","1824864","QB","D. Prescott","QB","QB","https://www.fantasypros.com/nfl/players/dak-prescott.php","dak-prescott.php","https://images.fantasypros.com/images/players/nfl/15600/headshot/210x210.png","https://images.fantasypros.com/images/players/nfl/15600/headshot/210x210.png","7",90.5,87,94,"vs. NYJ","NYJ",-2,"Last week, Prescott was the QB29 in fantasy, as Dallas didn't have to throw at all. This week could be much of the same. Prescott attempted only 24 passes as he was 12th in passing grade and 14th in adjusted completion rate. New York held Buffalo to the 14th-lowest yards per play and net yards per pass attempt. The Jets held Josh Allen to the fifth-lowest passer rating of the week while picking him off three times. New York deployed their corners in zone on about 50% of their defensive plays. Last year, Prescott was 22nd in yards per attempt and 26th in passer rating against zone coverage. Prescott is a low-ceiling QB2.","sit",NA,"QB17","C-","16.3"
"qb","QB",2023-09-15,"19246","Jordan Love","QB","GB",18,17.75,2.46,9,24,"e5094779-e94f-4052-8597-bdbee3719f6b","32696","2239997","QB","J. Love","QB","QB","https://www.fantasypros.com/nfl/players/jordan-love.php","jordan-love.php","https://images.fantasypros.com/images/players/nfl/19246/headshot/210x210.png","https://images.fantasypros.com/images/players/nfl/19246/headshot/210x210.png","6",44.9,31.8,58,"at ATL","ATL",NA,"Love finished as the QB3 in fantasy as the rest of the position fell apart in Week 1. Love did so on the strength of three passing touchdowns as one of only three quarterbacks to do so. His other deeper metrics are more concerning. Love was 20th in passing grade and 30th in adjusted completion rate despite ranking third-best in yards per attempt. I didn't anticipate tossing cold water on Packers fans after Week 1, but here we are. The Falcons will be a good litmus test for where he is as a player and passer in Week 2. Atlanta is fresh off dismantling Bryce Young and the Panthers. After Week 1, the Falcons have allowed the third-lowest yards per attempt and fifth-lowest adjusted completion rate. Those numbers could be noisy, but they are impressive nonetheless. Atlanta finishing with the fifth-highest pressure rate last week should frighten Love. The sample size for Love against pressure over the last two seasons is miniscule, but it doesn't paint a pretty picture. Love has been pressured on ten dropbacks since 2022, completing only 42.8% of his passes with putrid passing grades. Love is an uninspiring QB2 this week.","sit",NA,"QB18","C-","16.0"
"qb","QB",2023-09-15,"12092","Derek Carr","QB","NO",19,18.95,2.08,12,24,"9f026fc0-4449-4dc5-a226-2e2830619381","27564","1664819","QB","D. Carr","QB","QB","https://www.fantasypros.com/nfl/players/derek-carr.php","derek-carr.php","https://images.fantasypros.com/images/players/nfl/12092/headshot/210x210.png","https://images.fantasypros.com/images/players/nfl/12092/headshot/210x210.png","11",33.7,27.4,40,"at CAR","CAR",NA,"Carr had a solid start to his career in the Big Easy. Last week, he tossed for 305 yards while ranking 13th in passing grade, second in yards per attempt, and fifth in big-time throw rate. Carr is set for another nice day against a secondary that allowed the ninth-highest passer rating, 12th-highest adjusted completion rate, and 11th-most passing touchdowns in 2022. Carr is a strong QB2 who could sneak into the top 12 this week.","start",NA,"QB19","D+","15.7"
"qb","QB",2023-09-15,"11180","Russell Wilson","QB","DEN",20,19.28,1.64,14,24,"409d4cac-ee90-4470-9710-ebe671678339","25785","1272242","QB","R. Wilson","QB","QB","https://www.fantasypros.com/nfl/players/russell-wilson.php","russell-wilson.php","https://images.fantasypros.com/images/players/nfl/11180/headshot/210x210.png","https://images.fantasypros.com/images/players/nfl/11180/headshot/210x210.png","9",57.9,64.7,51,"vs. WAS","WAS",NA,"Wilson still looks broken. We'll see if Sean Payton can mend Mr. Unlimited as the season rolls along, but Week 1 wasn't pretty. Wilson had the eighth-lowest yards per attempt and fourth-lowest aDOT as he dinked and dunked to the fourth-highest adjusted completion rate. Wilson is a QB2 staring down a Commanders defense that allowed the fifth-lowest yards per attempt in Week 1 while also dialing up the seventh-highest pressure rate.","sit",NA,"QB20","D+","15.4"
"qb","QB",2023-09-15,"20156","Mac Jones","QB","NE",21,21.04,2.21,15,30,"1fd00ec3-b758-46d2-a2c1-cca521ea8a54","33403","2741202","QB","M. Jones","QB","QB","https://www.fantasypros.com/nfl/players/mac-jones.php","mac-jones.php","https://images.fantasypros.com/images/players/nfl/20156/headshot/210x210.png","https://images.fantasypros.com/images/players/nfl/20156/headshot/210x210.png","11",14.8,9.6,20,"vs. MIA","MIA",NA,"Mac Jones faces a Miami secondary that had all three corners finish Week 1 inside the top 32 corners in man coverage snaps (29-31%). Last year, Jones had the 11th-best yards per attempt against man. Still, he also was second-worst in adjusted completion rate and 15th in passer rating against man coverage. In this new up-tempo Patriots passing attack, Jones squares off against a South Beach secondary that gave up the 11th-highest yards per attempt and ninth-highest passer rating in Week 1. Jones is a strong QB2 who could post fringe QB1 numbers if this game becomes an all-out shootout.","sit",NA,"QB21","D","15.2"
