"page","page_pos","scrape_date","fantasypros_id","player_name","pos","team","rank","ecr","sd","best","worst","player_positions","player_short_name","player_eligibility","player_page_url","player_filename","player_bye_week","player_owned_avg","player_opponent","player_opponent_id","player_ecr_delta","note","tag","recommendation","pos_rank","start_sit_grade","r2p_pts"
"ppr-wr","WR",2024-12-01,"18466","Terry McLaurin","WR","WAS",20,20.1,5.12,9,29,"WR","T. McLaurin","WR","https://www.fantasypros.com/nfl/players/terry-mclaurin.php","terry-mclaurin.php","14",94.1,"vs. TEN","TEN",NA,"McLaurin is the WR17 in fantasy points per game, ranking fifth in deep targets among wideouts and drawing three red zone targets over his last four games. Since Week 10, Tennessee has utilized two high coverage at the fourth-highest rate (64%). Against two high, McLaurin has had a 19.6% target share, a 41.1% air-yard share, 1.72 YPRR, and a 25.5% first-read share. The efficiency has dipped some against two-high, but McLaurin should still get plenty of volume against a burnable secondary to pay off in Week 13. Since Week 7, Tennessee has allowed the ninth-most receiving yards per game and the 11th-highest PPR points per target to perimeter wide receivers.","start",NA,"WR20","A-","14.3"
"ppr-wr","WR",2024-12-01,"17258","Calvin Ridley","WR","TEN",21,20.52,2.28,17,27,"WR","C. Ridley","WR","https://www.fantasypros.com/nfl/players/calvin-ridley.php","calvin-ridley.php","5",84.9,"at WAS","WAS",NA,"In the three games with Levis back, Ridley has finished as the WR3, WR41, and WR20 in weekly fantasy scoring. He has seen a 26.6% target share, a 52.5% air-yard share, and a 33.9% first-read share, producing 78.3 receiving yards per game with 2.67 YPRR. He also has two red zone targets and two scores. Since Week 6, Washington has the third-highest single-high rate in the NFL (62.9%). Ridley has seen a boost against single high all year, and in the last three games, that has remained true. In this small sample, he has had a 29.4% target share, 3.03 YPRR, and a 36% first-read share against single-high. Since Week 6, Washington has held perimeter wide receivers to the 12th-lowest PPR points per target. The matchup is tough, but Ridley can likely overcome it.","start",NA,"WR21","A-","14.0"
"ppr-wr","WR",2024-12-01,"22916","Zay Flowers","WR","BAL",22,21.55,1.91,18,25,"WR","Z. Flowers","WR","https://www.fantasypros.com/nfl/players/zay-flowers.php","zay-flowers.php","14",96.3,"vs. PHI","PHI",NA,"Flowers is the WR22 in fantasy points per game, ranking tenth in deep targets among wideouts. He has finally seen his red zone usage return with three red zone looks across his last four games after zero red zone targets in Weeks 3-8. Flowers has a 25% target share, 2.34 YPRR, and a 29.5% first-read share. Since Week 8, Philly has ranked ninth in single high rate (58%). Against single-high, Flowers has had a 28.5% target share, 3.18 YPRR, and a 32.3% first-read share. Philly's secondary has been exceptional, so starting Flowers this week is a bet on talent and offensive environment. Since Week 7, Philly has allowed the second-fewest fantasy points per game and the lowest PPR points per target to perimeter wide receivers.",NA,NA,"WR22","A-","14.0"
"ppr-wr","WR",2024-12-01,"18219","DK Metcalf","WR","SEA",23,23.97,3.31,18,30,"WR","DK Metcalf","WR","https://www.fantasypros.com/nfl/players/dk-metcalf.php","dk-metcalf.php","10",97.7,"at NYJ","NYJ",NA,NA,NA,NA,"WR23","B+","13.8"
"ppr-wr","WR",2024-12-01,"23000","Brian Thomas","WR","JAC",24,25.48,3.46,18,32,"WR","B. Thomas Jr.","WR","https://www.fantasypros.com/nfl/players/brian-thomas-jr.php","brian-thomas-jr.php","12",88.2,"vs. HOU","HOU",NA,"Thomas Jr. is the WR28 in fantasy, ranking 22nd in deep targets among wideouts. In Weeks 1-9, with Lawrence, he had seven red zone targets, an 18.4% target share, 2.52 YPRR, and a 21.9% first-read share. In the Jags Week 4 meeting with Houston, the Texans utilized single high on 68.6% of their defensive snaps. In Weeks 1-9, against single high, Thomas Jr. had a 20.5% target share, 2.84 YPRR, and a 23.3% first-read share. That's a sizable bump for Thomas Jr., and he'll need it against a Houston secondary that, since Week 7, has held perimeter wide receivers to the fourth-lowest PPR points per target while also ranking 19th in receiving yards per game allowed.","start",NA,"WR24","B+","13.6"
"ppr-wr","WR",2024-12-01,"23020","Jayden Reed","WR","GB",25,25.94,3.56,19,37,"WR","J. Reed","WR","https://www.fantasypros.com/nfl/players/jayden-reed.php","jayden-reed.php","10",92.4,"vs. MIA","MIA",NA,"Reed has fallen all the way to WR26 in fantasy points per game. Since Week 4, he has eclipsed 60 receiving yards in a game only twice and seen only three red zone targets during that span. This could be a bounce-back spot for Reed. With Kader Kohou in the starting slot corner spot, Miami has been tough against the slot. In Weeks 1-7, Miami held slot receivers to the 13th-lowest PPR points per target. Since Week 10, with his return to the lineup, Miami has kept slot receivers in check, giving up the eighth-lowest PPR points per target. The coverage matchup leans in Reed's direction, though. Since Week 7, Miami has utilized two high with 51% of their defensive snaps. Since Week 4, against two high, Reed has ranked second on the team with a 23% TPRR, first in YPRR (2.56), and first in first-read share (25%).",NA,NA,"WR25","B","12.8"
"ppr-wr","WR",2024-12-01,"18598","Jakobi Meyers","WR","LV",26,26.84,3.93,22,38,"WR","J. Meyers","WR","https://www.fantasypros.com/nfl/players/jakobi-meyers.php","jakobi-meyers.php","10",65.8,"at KC","KC",NA,"Meyers is the WR20 in fantasy points per game and has been a volume monster without Davante Adams on the team. Since Week 4, he has had a 24.5% target share, a 37% air-yard share, 1.89 YPRR, and a 32.9% first-read share. He averaged 71.2 receiving yards per game during that span, but sadly, he had only seen four red zone targets and scored one receiving touchdown. The last time Meyers faced Kansas City, he finished as the WR20 for the week with six receptions, 52 receiving yards, and a score. The Chiefs have been more vulnerable to perimeter wide receivers recently. Since Week 7, they have allowed the 13th-highest PPR points per target to the position. Meyers is a strong play again this week.",NA,NA,"WR26","B","12.8"
"ppr-wr","WR",2024-12-01,"17265","DJ Moore","WR","CHI",27,27.03,2.21,20,32,"WR","DJ Moore","WR","https://www.fantasypros.com/nfl/players/dj-moore-wr.php","dj-moore-wr.php","7",94.5,"at DET","DET",NA,NA,NA,NA,"WR27","B-","12.6"
"ppr-wr","WR",2024-12-01,"23064","Marvin Harrison","WR","ARI",28,27.32,2.97,23,32,"WR","M. Harrison Jr.","WR","https://www.fantasypros.com/nfl/players/marvin-harrison-jr.php","marvin-harrison-jr.php","11",97.5,"at MIN","MIN",NA,"Harrison Jr.'s rookie season has been a resounding disappointment. He is the WR39 in fantasy points per game, ranking tenth in deep targets among wide receivers. He has only two touchdowns and one red zone target since Week 5. This week's matchup won't help his season-long numbers either. Minnesota has the highest two high rate in the NFL (68.4%). Two high coverage has been Harrison Jr.'s kryptonite. Against two high, Harrison has a 17.9% target share, 1.46 YPRR, and a 25.7% first-read share. Since Week 7, Minnesota has allowed the tenth-highest receiving yards per game and PPR points per target to perimeter wide receivers. Still, I don't know if Harrison will be able to take advantage of the soft secondary.",NA,NA,"WR28","B","12.6"
"ppr-wr","WR",2024-12-01,"23748","Khalil Shakir","WR","BUF",29,29.03,4.04,23,39,"WR","K. Shakir","WR","https://www.fantasypros.com/nfl/players/khalil-shakir.php","khalil-shakir.php","12",78,"vs. SF","SF",NA,"Since Week 7, Shakir has been the WR22 in fantasy points per game. During this stretch, he has had a 23.5% target share, 2.38 YPRR, and a 31.2% first-read share. He has been Buffalo's high-volume underneath threat. He has six red zone targets across his last five games. Shakir will see plenty of volume this week, but keep expectations in check. Since Week 7, the 49ers have allowed the second-fewest receiving yards per game and the lowest PPR points per target to slot receivers.",NA,NA,"WR29","B-","12.5"
"ppr-wr","WR",2024-12-01,"11616","Keenan Allen","WR","CHI",30,29.45,5.68,22,39,"WR","K. Allen","WR","https://www.fantasypros.com/nfl/players/keenan-allen.php","keenan-allen.php","7",72.8,"at DET","DET",NA,NA,"start",NA,"WR30","B","12.5"
"ppr-wr","WR",2024-12-01,"25361","Tank Dell","WR","HOU",31,31.48,2.61,27,41,"WR","T. Dell","WR","https://www.fantasypros.com/nfl/players/nathaniel-dell.php","nathaniel-dell.php","14",91.3,"at JAC","JAC",NA,"Since Nico Collins' return to the lineup, Dell has had a 17.9% target share, a 37.6% air-yard share, 2.14 YPRR, and a 20% first-read share. Those are solid market share and efficiency numbers, but they haven't translated to big fantasy days as Dell has finished as the WR41 and WR33 in weekly fantasy scoring. He hasn't seen a red zone target over the last two weeks after seeing six in his previous five games. Dell hasn't smashed, but that's not because he has been playing bad. Over the last two weeks, among 86 qualifying receivers, Dell ranks first in separation and 12th in route win rate. C.J. Stroud hasn't been playing good football and the offensive line has been a big concern. Assuming Stroud can look closer to his 2023 self this week, Dell should crush. Since Week 7, Jacksonville has allowed the seventh-most receiving yards per game and the 12th-highest PPR points per target to perimeter wide receivers.",NA,NA,"WR31","C+","12.3"
"ppr-wr","WR",2024-12-01,"19810","Darnell Mooney","WR","ATL",32,32.71,2.64,29,42,"WR","D. Mooney","WR","https://www.fantasypros.com/nfl/players/darnell-mooney.php","darnell-mooney.php","12",75.9,"vs. LAC","LAC",NA,"While Mooney was on the injury report before the bye and had only a 56% snap rate against Denver, this was more due to the blowout nature of that game. In the first half of the game, Mooney played 100% of the offensive snaps. Mooney is the WR25 in fantasy points per game, ranking seventh in deep targets among wide receivers. He hasn't seen a red zone target since Week 7. Mooney has a 21.3% target share, 2.09 YPRR, and a 28.9% first-read share. Los Angeles has the second-highest two high rate in the NFL (60.8%). Mooney's target share against two high has remained stable while his YPRR has jumped to 2.71, and his first-read share has ticked up slightly to 29.2%. Mooney should have a solid day against the Chargers' secondary that, since Week 10, has ranked 18th in receiving yards per game and 16th in PPR points per target allowed to perimeter wide receivers.",NA,NA,"WR32","C+","12.0"
"ppr-wr","WR",2024-12-01,"19590","Jauan Jennings","WR","SF",33,32.94,4.51,19,42,"WR","J. Jennings","WR","https://www.fantasypros.com/nfl/players/jauan-jennings.php","jauan-jennings.php","9",72.6,"at BUF","BUF",NA,"Since Week 10, with Purdy under center, Jennings has had a 32.8% target share, a 38.8% air-yard share, 2.71 YPRR, and a 41.3% first-read share. In those two games, he had four red zone targets and finished as the WR15 and the WR7 in weekly fantasy scoring. Since Week 7, Buffalo has allowed the 14th-highest PPR points per target to perimeter wide receivers. Jennings should step up with another solid performance this week.",NA,NA,"WR33","C+","12.0"
"ppr-wr","WR",2024-12-01,"23677","Jameson Williams","WR","DET",34,33.32,2.93,28,37,"WR","J. Williams","WR","https://www.fantasypros.com/nfl/players/jameson-williams.php","jameson-williams.php","5",82.8,"vs. CHI","CHI",NA,NA,NA,NA,"WR34","C+","12.0"
"ppr-wr","WR",2024-12-01,"19278","Michael Pittman","WR","IND",35,35.87,2.23,30,39,"WR","M. Pittman Jr.","WR","https://www.fantasypros.com/nfl/players/michael-pittman.php","michael-pittman.php","14",86.3,"at NE","NE",NA,"Pittman Jr. might get the Christian Gonzalez shadow treatment this week. Last week, Gonzalez followed Tyreek Hill on 54.5% of his routes, allowing 48 receiving yards in his primary coverage. Gonzalez has followed eight receivers this season on at least 53.8% of their routes. Only D.K. Metcalf surpassed 67 receiving yards with Gonzalez attached to them. Over the last two games with Richardson back under center, Pittman Jr. has had a 24.1% target share, a 29.4% air-yard share, 2.96 YPRR, and a 28.3% first-read share while averaging 71 receiving yards per game. Pittman has one red zone target over the last two weeks. If Pittman can avoid a Gonzalez shadow on the majority of his routes, he could be productive this week. Since Week 7, New England has allowed the 14th-most receiving yards per game and the sixth-highest PPR points per target to perimeter wide receivers.","sit",NA,"WR35","C+","11.7"
"ppr-wr","WR",2024-12-01,"19790","Jaylen Waddle","WR","MIA",36,36.32,4.68,25,43,"WR","J. Waddle","WR","https://www.fantasypros.com/nfl/players/jaylen-waddle.php","jaylen-waddle.php","6",89.5,"at GB","GB",NA,"I'm not chasing Waddle's explosive outing last week. I love the player and the talent, but I hate his usage this season. Since Tua Tagovailoa's return, Waddle has had a 15.3% target share, 2.05 YPRR, and a 15.7% first-read share. It hasn't been pretty, as he has averaged only 55.8 receiving yards per game. Waddle has only one red zone target since Week 7. Since Week 6, Green Bay has utilized two high at the tenth-highest rate (52.8%). Across his last five games, against two high, Waddle has had only a 14.7% target share, 1.69 YPRR, and a 15% first-read share. Since Week 7, Green Bay has allowed the sixth-fewest PPR points per target and the fewest receiving yards per game to perimeter wide receivers.","sit",NA,"WR36","C+","11.7"
"ppr-wr","WR",2024-12-01,"23107","Jordan Addison","WR","MIN",37,36.65,2.57,32,43,"WR","J. Addison","WR","https://www.fantasypros.com/nfl/players/jordan-addison.php","jordan-addison.php","6",78.6,"vs. ARI","ARI",NA,"After last week's surprisingly massive game, Addison is now the WR33 in fantasy points per game. He has ten deep targets and only four red zone targets in his ten games played. He has seen three of those red-zone looks in the last four games. Since Week 6, Arizona has had the ninth-highest two high rate in the NFL (53.3%). Against two high, Addison has a 16.6% target share, 2.07 YPRR, and an 18.9% first-read share. Addison's efficiency is encouraging that he can possibly overcome this week's tough matchup. Since Week 7, Arizona has allowed the second-lowest PPR points per target and the tenth-fewest receiving yards per game to perimeter wide receivers.","sit",NA,"WR37","C+","11.6"
"ppr-wr","WR",2024-12-01,"18244","Deebo Samuel","WR","SF",38,37.1,4.45,29,47,"WR","D. Samuel Sr.","WR","https://www.fantasypros.com/nfl/players/deebo-samuel.php","deebo-samuel.php","9",98,"at BUF","BUF",NA,"Samuel has had a tough season as the WR42 in fantasy points per game. He has four red zone targets in his last three games with Purdy starting, but he hasn't scored a touchdown since Week 6. Since Week 8, he has had a 22.2% target share, producing only 51.7 receiving yards per game with 1.74 YPRR and a 28.6% first-read share. We'll see if Samuel can get back on track this week. Samuel could struggle, though, as Buffalo has limited yards after the catch this season. They have held receivers to the sixth-fewest yards after the catch per reception and the 12th-fewest missed tackles.",NA,NA,"WR38","C","11.6"
"ppr-wr","WR",2024-12-01,"19201","Jerry Jeudy","WR","CLE",39,38.94,3.24,30,43,"WR","J. Jeudy","WR","https://www.fantasypros.com/nfl/players/jerry-jeudy.php","jerry-jeudy.php","10",60.3,"at DEN","DEN",NA,"The Jeudy revenge game narratives could get squashed quickly this week if Patrick Surtain shadows him. For whatever reason, Surtain hasn't shadowed since Week 10, but don't count out Surtain shadowing Jeudy this week. Does anyone think that Denver wants Jeudy to pop off with a big game and rub it in their faces? I highly doubt it. The easiest way to keep that from happening is to put their best defensive player in his back pocket all game. Surtain has followed receivers on at least 60.4% of their routes five times this season. In those games, no receiver has eclipsed 30 receiving yards in his primary coverage. With Winston under center, Jeudy has had a 21.7% target share, 2.37 YPRR, and a 25.2% first-read share as the WR8 in fantasy points per game. He has two red zone targets in those four games. Since Week 7, Denver has allowed the 15th-most PPR points per target and receiving yards per game to perimeter wide receivers.","sit",NA,"WR39","C","11.6"
"ppr-wr","WR",2024-12-01,"11606","DeAndre Hopkins","WR","KC",40,39.45,3.44,29,44,"WR","D. Hopkins","WR","https://www.fantasypros.com/nfl/players/deandre-hopkins.php","deandre-hopkins.php","6",88.9,"vs. LV","LV",NA,"Kansas City has continued to water down Hopkins usage as they are utilizing a full-blown committee behind Xavier Worthy and Travis Kelce. Last week, Hopkins had a 44.7% route share, which ranked sixth on the team as he drew a 16.2% target share and 22.7% first-read share with two end zone targets, 1.67 YPRR (35 receiving yards), and a 23.8% air-yard share. This type of usage is nightmare fuel. When he's on the field, Hopkins is being targeted at strong rates, but the dwindling number of routes weekly is concerning that floor could drop out any week. This week against a middle-of-the-road secondary that has allowed the 17th-highest PPR points per target since Week 7 against perimeter wide receivers, Hopkins is a volatile flex play.","sit",NA,"WR40","C","11.1"
"ppr-wr","WR",2024-12-01,"25411","Rome Odunze","WR","CHI",41,40.45,2.38,32,43,"WR","R. Odunze","WR","https://www.fantasypros.com/nfl/players/rome-odunze.php","rome-odunze.php","7",68,"at DET","DET",NA,NA,"sit",NA,"WR41","C","11.0"
"ppr-wr","WR",2024-12-01,"23886","Christian Watson","WR","GB",42,43.06,5.95,36,56,"WR","C. Watson","WR","https://www.fantasypros.com/nfl/players/christian-watson.php","christian-watson.php","10",55.7,"vs. MIA","MIA",NA,"If Love is looking to attack Miami deep this week, Watson should be a big part of the equation. Watson leads the team with 14 deep targets. Miami has faced the eighth-fewest deep attempts, but they have allowed the fourth-highest passer rating and the seventh-highest adjusted completion rate to deep passing. Please, Watson, for the love of everything holy and sacred in this world...catch the dang ball when it's thrown your way deep. Since Week 7, Miami has utilized two high with 51% of their defensive snaps. Since Week 4, against two high, Watson ranks fifth on the team in TPRR (16%), but he ranks second behind only Reed in YPRR (2.13). Since Week 7, Miami has allowed the seventh-lowest PPR points per target and the 11th-fewest receiving yards per game to perimeter wide receivers.",NA,NA,"WR42","C","10.7"
"ppr-wr","WR",2024-12-01,"26136","Xavier Legette","WR","CAR",43,43.16,3.36,37,48,"WR","X. Legette","WR","https://www.fantasypros.com/nfl/players/xavier-legette.php","xavier-legette.php","11",39.3,"vs. TB","TB",NA,"Since Week 8, with Bryce Young as the starter, Legette has finished as a WR3 twice (WR33, WR28). He has seen three red zone targets and scored twice. He has had a 17.7% target share, a 29.7% air-yard share, 1.50 YPRR, and a 20.4% first-read share. Since Week 10, Tampa Bay has utilized single-high at the third-highest rate (70.7%). Since Week 8, against single-high, Legette has had an 18.8% target share, 1.74 YPRR, and an 18.5% first-read share. He's a strong flex this week against a secondary that, since Week 7, has allowed the 13th-most receiving yards per game and the seventh-highest PPR points per target to perimeter wide receivers.","sit",NA,"WR43","C","10.6"
"ppr-wr","WR",2024-12-01,"23123","Quentin Johnston","WR","LAC",44,44.97,2.92,41,53,"WR","Q. Johnston","WR","https://www.fantasypros.com/nfl/players/quentin-johnston.php","quentin-johnston.php","5",54.4,"at ATL","ATL",NA,"Johnston is the WR43 in fantasy points per game, with four weeks this season as a WR3 or higher in weekly fantasy scoring. He ranks 22nd among wide receivers in deep targets while seeing three red zone targets across his last five games. Since Week 6, Atlanta has had the fifth-highest rate of two high (55.6%). The matchup is fantastic this week for Johnston, but I worry he will be on the outside looking in, considering Atlanta's lean to more two-high coverage. Against two high, he ranks seventh on the team in separation score and fourth in route win rate. Among all of the Bolts receivers with a minimum of 25 routes against two high, he is sixth in TPRR (13%), second in YPRR (1.93), and third in first-read share (17.7%). Johnston is a volatile flex play this week. There's a wide range of outcomes for his Week 13 outlook. Since Week 7, Atlanta has allowed the second-most receiving yards per game and the second-highest PPR points per target to perimeter wide receivers.","sit",NA,"WR44","C","10.3"
"ppr-wr","WR",2024-12-01,"13894","Amari Cooper","WR","BUF",45,45.97,3.97,40,60,"WR","A. Cooper","WR","https://www.fantasypros.com/nfl/players/amari-cooper.php","amari-cooper.php","12",89.2,"vs. SF","SF",NA,"In his last two games played for Buffalo, Cooper has had only a 54.9% route share, a 6.8% target share, 1.29 YPRR, and a 10.5% first-read share. It's tough to get excited about Cooper right now. He practiced in full all week, so hopefully, his route share will increase this week. That's also making the assumption that he has had the necessary time to ingest the playbook fully. Since Week 7, San Francisco has allowed the seventh-fewest receiving yards per game and the tenth-fewest fantasy points per game to perimeter wide receivers. Cooper is a sketchy flex play this week.","sit",NA,"WR45","C","10.3"
"ppr-wr","WR",2024-12-01,"25304","DeMario Douglas","WR","NE",46,47.23,3.33,40,57,"WR","D. Douglas","WR","https://www.fantasypros.com/nfl/players/demario-douglas.php","demario-douglas.php","14",22.9,"vs. IND","IND",NA,"In his five full games with Maye under center, Douglas has had an 18.8% target share, 2.08 YPRR, 59.6 receiving yards per game, and a 23.1% first-read share. Douglas had only one red zone target during that stretch and scored only one touchdown this season. This lack of high-leverage usage caps his ceiling weekly. Douglas is still a decent weekly flex in PPR leagues. Since Week 7, Indy has limited slot receivers to the 13th-lowest PPR points per target and the sixth-fewest receiving yards per game.","sit",NA,"WR46","C-","10.3"
"ppr-wr","WR",2024-12-01,"22985","WanDale Robinson","WR","NYG",47,47.81,3.57,42,57,"WR","W. Robinson","WR","https://www.fantasypros.com/nfl/players/wandale-robinson.php","wandale-robinson.php","11",48.9,"at DAL","DAL",NA,"Robinson has dissolved into a low-end PPR flex play only. Last week, he had a 15.6% target share, a 5.8 aDOT, 47 receiving yards, and a 21.7% first-read share. Since Week 7, Robinson has managed double-digit fantasy points only once. He hasn't seen a red zone target since Week 8. Since Week 6, Dallas has allowed the 13th-most fantasy points per game and the highest PPR points per target to slot receivers, but it's a consistent theme with this offense. After considering the quarterback play and offensive environment, I don't know if Robinson can excel this week.",NA,NA,"WR47","C-","10.3"
"ppr-wr","WR",2024-12-01,"23019","Xavier Worthy","WR","KC",48,47.84,2.93,41,52,"WR","X. Worthy","WR","https://www.fantasypros.com/nfl/players/xavier-worthy.php","xavier-worthy.php","6",80.7,"vs. LV","LV",NA,"Since the Chiefs acquired DeAndre Hopkins, Worthy's route share has never dipped below 64.3%. In his five games with Hopkins, Worthy has played the field stretching role for two games, but in three games his role has been fairly consistent (Weeks 8, 11, & 12). In those games, Worthy has had a 10.3 aDOT, a 17.6% target share, 1.71 YPRR, and a 24.6% first-read share. In those games, (one of which was against Las Vegas), Worthy has seen three red zone targets. Worthy is just a middling flex play this week against a secondary that, since Week 7, has allowed the 17th-highest PPR points per target to perimeter wide receivers.","sit",NA,"WR48","C-","10.2"
"ppr-wr","WR",2024-12-01,"20114","Elijah Moore","WR","CLE",49,47.94,2.42,44,55,"WR","E. Moore","WR","https://www.fantasypros.com/nfl/players/elijah-moore.php","elijah-moore.php","10",13.8,"at DEN","DEN",NA,"With Winston starting, Moore has been the WR43 in fantasy points per game with two top 24 wide receiver weekly finishes (WR22, WR14). He has had a 20.5% target share, 1.49 YPRR, one red zone target, and a 22.7% first-read share. Moore is a flex play better left on your bench this week. Since Week 7, Denver has allowed the fifth-fewest PPR points per target to slot receivers.","sit",NA,"WR49","C-","10.1"
"ppr-wr","WR",2024-12-01,"16443","Noah Brown","WR","WAS",50,48.68,3.22,41,57,"WR","N. Brown","WR","https://www.fantasypros.com/nfl/players/noah-brown.php","noah-brown.php","14",8.4,"vs. TEN","TEN",NA,"Brown has three finishes this season as a WR3 or higher (WR23, WR35, WR23). He has two red zone targets across his last four games. Since Week 10, Tennessee has utilized two high coverage at the fourth-highest rate (64%). Since Week 3, against two high, Brown has had a 15.7% target share, 1.55 YPRR, and an 18.6% first-read share. Since Week 7, Tennessee has allowed the ninth-most receiving yards per game and the 11th-highest PPR points per target to perimeter wide receivers. Brown is a viable flex play this week.","sit",NA,"WR50","C-","9.9"
