"page","page_pos","scrape_date","fantasypros_id","player_name","pos","team","rank","ecr","sd","best","worst","sportradar_id","yahoo_id","cbs_id","player_positions","player_short_name","player_eligibility","player_yahoo_positions","player_page_url","player_filename","player_square_image_url","player_image_url","player_bye_week","player_owned_avg","player_owned_espn","player_owned_yahoo","player_opponent","player_opponent_id","player_ecr_delta","note","tag","recommendation","pos_rank","start_sit_grade","r2p_pts"
"qb","QB",2023-10-28,"19275","Jalen Hurts","QB","PHI",1,1.69,1.07,1,5,"64bd0f02-6a5d-407e-98f1-fd02048ea21d","32723","2240246","QB","J. Hurts","QB","QB","https://www.fantasypros.com/nfl/players/jalen-hurts.php","jalen-hurts.php","https://images.fantasypros.com/images/players/nfl/19275/headshot/210x210.png","https://images.fantasypros.com/images/players/nfl/19275/headshot/210x210.png","10",100,99.9,100,"at WAS","WAS",NA,"Hurts continues to ball as the QB2 in fantasy. He is fourth in fantasy points per dropback, eighth in yards per attempt, and fifth in highly accurate throw rate. Since the Commanders benched Emmanuel Forbes, their pass defense has seen some improvement. Since Week 6, while deploying zone coverage on 71.6% of their snaps, the Commanders have ranked 15th in passer rating with the sixth-lowest adjusted completion rate allowed. They have still given up plenty of yardage and passing scores, allowing the sixth-most passing yards per game and the second-most (tied) passing touchdowns. Hurts will still have a grand Week 8. Week 8 Positional Value: QB1",NA,NA,"QB1","A+","23.4"
"qb","QB",2023-10-28,"16413","Patrick Mahomes","QB","KC",2,2.18,0.77,1,4,"11cad59d-90dd-449c-a839-dddaba4fe16c","30123","2142052","QB","P. Mahomes II","QB","QB","https://www.fantasypros.com/nfl/players/patrick-mahomes.php","patrick-mahomes.php","https://images.fantasypros.com/images/players/nfl/16413/headshot/210x210.png","https://images.fantasypros.com/images/players/nfl/16413/headshot/210x210.png","10",100,99.9,100,"at DEN","DEN",NA,"Mahomes continues doing Mahomes things as the QB3 in fantasy. Mahomes ranks fourth in passing grade, fifth in yards per attempt, and eighth in adjusted completion rate. The reality is if you have him, you are starting him weekly regardless of the matchup, but this week's matchup is a doozy. Denver has given up the second-highest yards per attempt, the most passing touchdowns, and the highest passer rating to quarterbacks. Week 8 Positional Value: QB1",NA,NA,"QB2","A","23.0"
"qb","QB",2023-10-28,"17233","Lamar Jackson","QB","BAL",3,2.38,0.82,1,4,"e06a9c07-453a-4bb0-a7e9-2c3a64166dad","31002","2181169","QB","L. Jackson","QB","QB","https://www.fantasypros.com/nfl/players/lamar-jackson.php","lamar-jackson.php","https://images.fantasypros.com/images/players/nfl/17233/headshot/210x210.png","https://images.fantasypros.com/images/players/nfl/17233/headshot/210x210.png","13",99.8,99.6,100,"at ARI","ARI",NA,"Jackson is the QB5 in fantasy. HIs rushing equity remains outstanding as he ranks second in carries per game (9.9), second in red zone carries per game (2.6), first in rushing yards per game (51.9), and second in rushing touchdowns (five). He is excelling as a passer this season which has been beautiful to watch. Jackson is second in passing grade, third in yards per attempt, fifth in big-time throw rate, and sixth in adjusted completion rate. He ripped Detroit apart last week and is primed to do the same to Arizona in Week 8. The Cardinals have allowed the third-highest yards per attempt, the eighth-most passing yards per game, and the fourth-highest adjusted completion rate. They are also dreadful against deep passing with the highest deep passer rating and the second-most deep passing yards allowed. Jackson will dominate again this week. Week 8 Positional Value: QB1 overall",NA,NA,"QB3","A","22.0"
"qb","QB",2023-10-28,"17298","Josh Allen","QB","BUF",4,3.8,0.45,3,5,"3069db07-aa43-4503-ab11-2ae5c0002721","30977","2181054","QB","J. Allen","QB","QB","https://www.fantasypros.com/nfl/players/josh-allen-qb.php","josh-allen-qb.php","https://images.fantasypros.com/images/players/nfl/17298/headshot/210x210.png","https://images.fantasypros.com/images/players/nfl/17298/headshot/210x210.png","13",100,99.9,100,"vs. TB","TB",NA,"Allen has regained his crown as the QB1 in fantasy points per game. He is third in passing grade, sixth (tied) in yards per attempt, and third-best in fantasy points per dropback. Allen should shred the Buccaneers' middle-of-the-road pass defense this week. Tampa Bay ranks 16th in adjusted completion rate and 19th in passer rating while allowing the 11th-highest yards per attempt. They have specifically struggled to stop quarterbacks when they throw deep, giving up the 12th-highest passer rating, ninth-highest yards per attempt, and ninth-highest adjusted completion rate to deep balls. The Buccaneers continue to rely on the fifth-highest rate of zone coverage (80.5%, per Fantasy Points Data) in the NFL. Allen has had no problems against zone, ranking sixth in fantasy points per dropback, but he does tend to spread the ball around as he is 26th in rate of throwing to his first read. Week 8 Positional Value: QB1",NA,NA,"QB4","A-","21.1"
"qb","QB",2023-10-28,"18635","Justin Herbert","QB","LAC",5,5,0.37,4,6,"f0a8f8e3-b9e9-46ed-85e4-eec6452a8a44","32676","2221960","QB","J. Herbert","QB","QB","https://www.fantasypros.com/nfl/players/justin-herbert.php","justin-herbert.php","https://images.fantasypros.com/images/players/nfl/18635/headshot/210x210.png","https://images.fantasypros.com/images/players/nfl/18635/headshot/210x210.png","5",98.8,98.6,99,"vs. CHI","CHI",NA,"Herbert is the QB4 in fantasy points per game. He ranks 12th in passing grade, sixth in yards per attempt, and 13th in big-time throw rate. Prior to last week's QB22 finish, he had been a top-12 fantasy quarterback every week (QB6, QB11, QB1, QB5, QB5). Look for Herbert to get back on track this week, but Chicago hasn't been the pushover in recent weeks that their full-season stats might imply. Since Week 5, they have held passers to the third-lowest yards per attempt and the 14th-lowest passer rating while giving up the 14th-highest adjusted completion rate. In those three games, Chicago is tied for the third-most interceptions forced. Week 8 Positional Value: QB1",NA,NA,"QB5","A","20.0"
"qb","QB",2023-10-28,"19198","Tua Tagovailoa","QB","MIA",6,6.02,0.45,5,7,"26ad9c27-de38-495e-913c-6fb2428e76d3","32675","2741209","QB","T. Tagovailoa","QB","QB","https://www.fantasypros.com/nfl/players/tua-tagovailoa.php","tua-tagovailoa.php","https://images.fantasypros.com/images/players/nfl/19198/headshot/210x210.png","https://images.fantasypros.com/images/players/nfl/19198/headshot/210x210.png","10",97.7,97.4,98,"vs. NE","NE",NA,"Tagovailoa has been quite volatile this season, with three top-three weekly finishes married with three weeks as the QB18 or lower (QB26, QB18, QB23). His last meeting with New England was one of those rough weeks where he was the QB26. I don't want to take much away from this stellar season as the QB6 in fantasy. Tagovailoa is first in yards per attempt, second in passing touchdowns, and first in passer rating. New England remains a talented pass defense while giving up the 11th-highest passer rating and 13th-highest adjusted completion rate; they have held passers to the 12th-lowest yards per attempt and passing touchdowns. Quarterbacks have managed the ninth-fewest fantasy points per game against New England. Week 8 Positional Value: Worrisome QB1",NA,NA,"QB6","A-","18.9"
"qb","QB",2023-10-28,"15501","Jared Goff","QB","DET",7,7.04,0.42,6,8,"aba8f925-ffbf-4654-bfa7-a25d3d237494","29235","2061053","QB","J. Goff","QB","QB","https://www.fantasypros.com/nfl/players/jared-goff.php","jared-goff.php","https://images.fantasypros.com/images/players/nfl/15501/headshot/210x210.png","https://images.fantasypros.com/images/players/nfl/15501/headshot/210x210.png","9",83.1,74.2,92,"vs. LV","LV",NA,"Goff is the QB10 in fantasy. He has finished as a top-ten fantasy option in three of seven games (QB4, QB4, QB6). he is fifth in passing grade, tenth in yards per attempt, and second in adjusted completion rate. Goff can carve up a secondary that has given up the 12th-highest passer rating, sixth-highest adjusted completion rate, and the 13th-most passing touchdowns (tied). Week 8 Positional Value: Borderline QB1","start",NA,"QB7","B+","18.1"
"qb","QB",2023-10-28,"19780","Trevor Lawrence","QB","JAC",8,9.09,1.3,8,13,"aaa8b42c-4d87-45f6-bfd2-e31cfed9a736","33389","2967185","QB","T. Lawrence","QB","QB","https://www.fantasypros.com/nfl/players/trevor-lawrence.php","trevor-lawrence.php","https://images.fantasypros.com/images/players/nfl/19780/headshot/210x210.png","https://images.fantasypros.com/images/players/nfl/19780/headshot/210x210.png","9",92.5,89,96,"at PIT","PIT",NA,"Lawrence has posted top-12 fantasy weeks over the last two games (QB11, QB10). His efficiency metrics have screamed that he should have been posting top-12 numbers all season and they are still in that low-end QB1 area code. Lawrence is ninth in passing grade, 11th in highly accurate throw rate, and tenth in adjusted completion rate. With that said, pump the brakes on Lawrence this week. The Steelers have allowed the ninth-highest yards per attempt this season but they have also contained passers with the fifth-lowest adjusted completion rate and the 11th-lowest passer rating permitted. Pittsburgh has also utilized man coverage at the fifth-highest rate this season (37.5%). Against man, Lawrence ranks 18th in yards per attempt and 16th in fantasy points per dropback. He could finish as a borderline QB1 this week or a high-end QB2. Week 8 Positional Value: Borderline QB1","start",NA,"QB8","B","17.5"
"qb","QB",2023-10-28,"23071","CJ Stroud","QB","HOU",9,9.82,1.37,7,15,"7e91086f-9ca4-4bd9-a099-b88b2f37e6c6","40030","3163079","QB","C.J. Stroud","QB","QB","https://www.fantasypros.com/nfl/players/cj-stroud.php","cj-stroud.php","https://images.fantasypros.com/images/players/nfl/23071/headshot/210x210.png","https://images.fantasypros.com/images/players/nfl/23071/headshot/210x210.png","7",73.6,71.2,76,"at CAR","CAR",NA,"Stroud is the QB13 in fantasy, ranking 16th in passing grade, fourth in yards per attempt, and tenth in passer rating with the fourth-lowest turnover-worthy throw rate. Stroud is 13th in fantasy points per dropback. Stroud will tear the Panthers' secondary apart this week. Carolina hasn't been able to stop anyone from passing, especially deep. The Panthers have allowed the sixth-highest yards per attempt, ninth-highest passer rating, and the 11th-highest adjusted completion rate. Against deep passing, they have been one of the worst defenses in the league, giving up the sixth-highest deep passer rating and the seventh-highest deep-adjusted completion rate. Stroud will continue to shut the mouths of S2 stans in Week 8. Week 8 Positional Value: QB1","start",NA,"QB9","B","17.0"
"qb","QB",2023-10-28,"19196","Joe Burrow","QB","CIN",10,9.93,1.5,7,15,"3023ac10-4e7f-425f-9fc5-2b8e6332c92e","32671","2179798","QB","J. Burrow","QB","QB","https://www.fantasypros.com/nfl/players/joe-burrow.php","joe-burrow.php","https://images.fantasypros.com/images/players/nfl/19196/headshot/210x210.png","https://images.fantasypros.com/images/players/nfl/19196/headshot/210x210.png","7",97,96,98,"at SF","SF",NA,"Burrow has been on the rebound. In his last two starts, he has finished as the QB8 and QB14 in fantasy, and while that might not sound amazing, it is progress. Since Week 5, he ranks 14th in passing grade and ninth in adjusted completion rate, with this time to throw increasing from 2.29 (Weeks 1-4) to 2.48. The 49ers pass defense has been among the best in the league, allowing the third-fewest fantasy points per game, the second-lowest yards per attempt, and the third-lowest passer rating to quarterbacks. There's an avenue for Burrow to crush San Francisco this week if he can get his deep ball on track, though. Since Week 5, he has completed only one of six deep attempts, so I know there's a leap of faith here, but since Week 4, the 49ers have allowed the eighth-highest yards per attempt, the ninth-highest passer rating, and the 11th-highest adjusted completion rate to deep passes. This comes down to one question. Can the Bengals' offensive line buy enough time for him against a defensive front that is seventh in pressure rate? Cincinnati has kept Burrow clean with the eighth-lowest pressure rate faced. Week 8 Positional Value: QB1",NA,NA,"QB10","B","16.6"
"qb","QB",2023-10-28,"15600","Dak Prescott","QB","DAL",11,10.93,2.24,6,16,"86197778-8d4b-4eba-affe-08ef7be7c70b","29369","1824864","QB","D. Prescott","QB","QB","https://www.fantasypros.com/nfl/players/dak-prescott.php","dak-prescott.php","https://images.fantasypros.com/images/players/nfl/15600/headshot/210x210.png","https://images.fantasypros.com/images/players/nfl/15600/headshot/210x210.png","7",82.5,75.9,89,"vs. LAR","LAR",NA,"Since Week 4, Prescott has been playing much better. Among 35 qualifying quarterbacks, he ranks 12th in passing grade, ninth in yards per attempt, and 13th in big-time throw rate. He's also been 13th in fantasy points per dropback over that stretch. The Rams have been a stingy pass defense, but there's an avenue for Prescott to emerge with a strong outing and for this game to shoot out. Overall, the Rams have held passers to the 13th-lowest yards per attempt, the second-fewest passing touchdowns, and the third-lowest adjusted completion rate, but they have not faced stiff competition for parts of this season. Seattle and the 49ers both limited their passing games and stuck to running the ball. The Rams then faced a beaten-up Joe Burrow, Anthony Richardson, and Josh Dobbs. In that stretch, they did allow 7.9 yards per attempt and 303 passing yards to Jalen Hurts. Last week, Kenny Pickett dropped 9.2 yards per attempt while completing 68% of his passes. This defense has played above their heads this season. Prescott can post QB1 numbers this week. Week 8 Positional Value: QB1","start",NA,"QB11","B-","16.4"
"qb","QB",2023-10-28,"11177","Kirk Cousins","QB","MIN",12,10.98,1.22,8,12,"bbd0942c-6f77-4f83-a6d0-66ec6548019e","25812","1272574","QB","K. Cousins","QB","QB","https://www.fantasypros.com/nfl/players/kirk-cousins.php","kirk-cousins.php","https://images.fantasypros.com/images/players/nfl/11177/headshot/210x210.png","https://images.fantasypros.com/images/players/nfl/11177/headshot/210x210.png","13",92.5,91.9,93,"at GB","GB",NA,"Cousins is the QB7 in fantasy, ranking fourth in passer rating, first in passing touchdowns, and seventh in highly accurate throw rate. Cousins faces a Packers pass defense that has low-key flaws but has managed to keep quarterbacks held to the eighth-lowest adjusted completion rate, passing yards per game, and fantasy points per game. The Packers' secondary has been aided by their pass rush, which is 11th in pressure rate and sixth in blitz rate. Cousins has faced the seventh-highest pressure rate this season, so it's a stretch to think the Vikings offensive line can consistently buy him time. Cousins has navigated muddy pockets well all year, ranking fifth in pressured passing grade, third in pressured yards per attempt, and leading the NFL in pressured passing touchdowns. If he can continue to pull a rabbit out of his dad hat, Cousins can shred this secondary deep. Green Bay has allowed the second-highest deep passer rating and deep-adjusted completion rate. Week 8 Positional Value: QB1","start",NA,"QB12","B","16.1"
"qb","QB",2023-10-28,"11180","Russell Wilson","QB","DEN",13,13.87,1.85,10,19,"409d4cac-ee90-4470-9710-ebe671678339","25785","1272242","QB","R. Wilson","QB","QB","https://www.fantasypros.com/nfl/players/russell-wilson.php","russell-wilson.php","https://images.fantasypros.com/images/players/nfl/11180/headshot/210x210.png","https://images.fantasypros.com/images/players/nfl/11180/headshot/210x210.png","9",55.6,61.1,50,"vs. KC","KC",NA,"Wilson has enjoyed a fairly resurgent season as the QB14 in fantasy points per game. He is 15th in passing grade, 19th in yards per attempt, and seventh in big-time throw rate. The last time Wilson faced this pass defense, he faltered with 4.3 yards per attempt, only 95 passing yards, and a QB24 finish. While I don't think he fails to cross the century mark again in passing yards, I don't have much faith that he eclipses QB2 value this week. Kansas City has fielded one of the best pass defenses in the NFL. They have contained quarterbacks with the fourth-lowest yards per attempt, eighth-lowest passer rating, and the fifth-fewest fantasy points per game. Week 8 Positional Value: low-end QB2","sit",NA,"QB13","C+","15.8"
"qb","QB",2023-10-28,"19246","Jordan Love","QB","GB",14,15.2,2.39,12,22,"e5094779-e94f-4052-8597-bdbee3719f6b","32696","2239997","QB","J. Love","QB","QB","https://www.fantasypros.com/nfl/players/jordan-love.php","jordan-love.php","https://images.fantasypros.com/images/players/nfl/19246/headshot/210x210.png","https://images.fantasypros.com/images/players/nfl/19246/headshot/210x210.png","6",67.4,67.7,67,"vs. MIN","MIN",NA,"Love has struggled mightily this season. He has the tenth-lowest passing grade, the ninth-lowest yards per attempt, and the lowest adjusted completion rate. His recent fantasy finishes of QB13 and QB24 are beginning to reflect his real-life play level. While the season-long stats make this look like a smash matchup for Love, it isn't. Since Week 4, the Vikings defense has been playing better football. They have fielded an average pass defense ranking 15th in passer rating and 17th in yards per attempt while also holding passers to the 11th-lowest passing yards per game and seventh-fewest passing touchdowns. Over their last four games, Minnesota also ranks tenth in pressure rate while they still lead the NFL over the entire season in blitz rate. Love has the second-lowest adjusted completion rate and the 14th-lowest yards per attempt against the blitz. Love is a QB2. Week 8 Positional Value: QB2","sit",NA,"QB14","C","15.6"
"qb","QB",2023-10-28,"9451","Matthew Stafford","QB","LAR",15,15.51,1.5,13,20,"ade43b1a-0601-4672-83b6-d246bc066a19","9265","1114942","QB","M. Stafford","QB","QB","https://www.fantasypros.com/nfl/players/matthew-stafford.php","matthew-stafford.php","https://images.fantasypros.com/images/players/nfl/9451/headshot/210x210.png","https://images.fantasypros.com/images/players/nfl/9451/headshot/210x210.png","10",62.2,52.4,72,"at DAL","DAL",NA,"Stafford is the QB18 in fantasy despite ranking third in passing attempts and fourth in passing yards this season. The culprit is his 17th ranking in passing touchdowns. He has only one game this season with multiple passing scores. Despite the passing touchdown struggle, he continues to play at a high level. He is seventh in passing grade, third in big-time throw rate, and sixth in yards per attempt. Stafford faces a Dallas pass defense that hasn't been the same without Trevon Diggs. Since Week 3, the Cowboys have given up the ninth-highest passer rating and yards per attempt while also permitting the eighth-most passing touchdowns (tied). They have been especially vulnerable in that span to deep passing, with the third-highest deep yards per attempt, the fifth-highest deep passer rating, and the tenth-highest deep-adjusted completion rate. Since Week 3, Dallas still has ranked 12th in pressure rate, so Stafford will have to hold up against that pass rush to chuck it downfield. Stafford is 14th in yards per attempt and sixth in big-time throw rate against pressure this season. Week 8 Positional Value: QB1","start",NA,"QB15","C","15.4"
"qb","QB",2023-10-28,"23045","Sam Howell","QB","WAS",16,16.47,2.01,12,21,"7d85e9c2-f464-4654-9200-acfcffd7dfaf","34100","3123797","QB","S. Howell","QB","QB","https://www.fantasypros.com/nfl/players/sam-howell.php","sam-howell.php","https://images.fantasypros.com/images/players/nfl/23045/headshot/210x210.png","https://images.fantasypros.com/images/players/nfl/23045/headshot/210x210.png","14",37.8,30.6,45,"vs. PHI","PHI",NA,"Howell has been an inefficient volume monster under center. He is third in passing attempts and seventh in passing yards, but sadly, he is 22nd in yards per attempt, 19th in passer rating, and 23rd in fantasy points per dropback. The volume has propped him up to the QB15 in fantasy. In his first meeting against Philly this season, he was the QB13 for the week with 290 passing yards, one score, and 40 rushing yards. Philly is a pass-funnel defense. While their pass defense hasn't been bad by any stretch, their run defense is elite. This has led to teams passing more against them, as they have defended the third-highest passing attempt total. The Eagles have kept aerial attacks in check with the eighth-lowest yards per attempt, but they are also 17th in adjusted completion rate allowed with the fifth-most passing touchdowns surrendered. Howell's biggest concern this week isn't the defensive backs but the pass rush. Philly is fourth in pressure rate. Pressure has been Howell's undoing. He has the fifth-lowest passing grade, 12th-lowest yards per attempt, and the fourth-highest turnover-worthy play rate when pressured. Howell has endured the seventh-highest pressure rate while wearing the dubious crown of leading the NFL in sacks taken. Week 8 Positional Value: QB2","sit",NA,"QB16","C-","15.3"
"qb","QB",2023-10-28,"12092","Derek Carr","QB","NO",17,19.2,2.56,14,24,"9f026fc0-4449-4dc5-a226-2e2830619381","27564","1664819","QB","D. Carr","QB","QB","https://www.fantasypros.com/nfl/players/derek-carr.php","derek-carr.php","https://images.fantasypros.com/images/players/nfl/12092/headshot/210x210.png","https://images.fantasypros.com/images/players/nfl/12092/headshot/210x210.png","11",27.3,19.5,35,"at IND","IND",3,"Carr has stacked back-to-back QB1 outings (QB10, QB9). Since Week 6, he has averaged 52.5 passing attempts, 327 passing yards, and one passing touchdown. Carr's efficiency metrics have been quite bad. Among 33 qualifying quarterbacks, he ranks 23rd in passing grade, 28th in yards per attempt, and 30th in adjusted completion rate. What has propped him up is the wondrous volume as he is sixth in passing attempts and 14th in passing yards. Indy has been a middling pass defense, ranking 14th in passing yards per game, 16th in yards per attempt, and 21st in adjusted completion rate allowed. The Colts have the second-highest rate of zone coverage (83.0%). Against zone, Carr is 17th in adjusted completion rate and 24th in fantasy points per dropback. Week 8 Positional Value: QB2 with QB1 upside",NA,NA,"QB17","D+","15.2"
"qb","QB",2023-10-28,"18562","Gardner Minshew","QB","IND",18,19.22,2.38,16,27,"dabb52c0-455b-48fe-996b-abf758120623","32010","2183083","QB","G. Minshew II","QB","QB","https://www.fantasypros.com/nfl/players/gardner-minshew.php","gardner-minshew.php","https://images.fantasypros.com/images/players/nfl/18562/headshot/210x210.png","https://images.fantasypros.com/images/players/nfl/18562/headshot/210x210.png","11",11.4,6.8,16,"vs. NO","NO",3,"In Minshew's three starts this season, he has finished as the QB23, QB18, and QB3 in fantasy. Yeah, he went nuts against one of the best defenses in the NFL last week. That wasn't on my Week 7 bingo card. Kudos if you projected that one. The rollercoaster that is Minshew can easily be seen in his numbers. Among 33 qualifying quarterbacks, he ranks dead last in passing grade with the highest turnover-worthy play rate, but he is also tenth in yards per attempt and 15th in adjusted completion rate. Crazy enough, I'm projecting that Minshew struggles this week against an airtight Saints pass defense. New Orleans has held passers to the third-lowest yards per attempt, the second-lowest passer rating, and the lowest adjusted completion rate. If Minshew defies my logic again this week, I'll have to start considering that he's made a deal with the devil or that his mustache has magical powers. Week 8 Positional Value: QB2","sit",NA,"QB18","D+","15.1"
"qb","QB",2023-10-28,"20080","Desmond Ridder","QB","ATL",19,19.82,2.77,15,29,"6bf35760-217c-401d-b80b-2ae7cc5d7564","34030","2864759","QB","D. Ridder","QB","QB","https://www.fantasypros.com/nfl/players/desmond-ridder.php","desmond-ridder.php","https://images.fantasypros.com/images/players/nfl/20080/headshot/210x210.png","https://images.fantasypros.com/images/players/nfl/20080/headshot/210x210.png","11",9.9,6.7,13,"at TEN","TEN",NA,"I see it out there. Ridder hype, huh? Over the last three weeks, Atlanta has stacked two wins, and Arthur Smith has been saucy at the podium. I'm still not convinced Ridder is the long-term answer at quarterback. Since Week 5, among 32 qualifying quarterbacks, he ranks 17th in passing grade and 20th in big-time throw rate with the eighth-highest turnover-worthy play rate. He is the QB19 in fantasy points per game, with QB6 finishes in two of his last three games. He should be able to finish with a solid fantasy day against a secondary that has allowed the fourth-highest yards per attempt and passer rating while sitting at tenth in adjusted completion rate surrendered. Week 8 Positional Value: QB2","sit",NA,"QB19","D","14.9"
