"page","page_pos","scrape_date","fantasypros_id","player_name","pos","team","rank","ecr","sd","best","worst","player_positions","player_short_name","player_eligibility","player_page_url","player_filename","player_bye_week","player_owned_avg","player_opponent","player_opponent_id","player_ecr_delta","note","tag","recommendation","pos_rank","start_sit_grade","r2p_pts"
"ppr-wr","WR",2025-11-16,"18218","AJ Brown","WR","PHI",19,17.95,1.47,14,20,"WR","A.J. Brown","WR","https://www.fantasypros.com/nfl/players/aj-brown.php","aj-brown.php","9",98.6,"vs. DET","DET",NA,"A.J. Brown has had a rollercoaster season as the WR30 in fantasy points per game, with three weeks as a top-20 wide receiver in weekly scoring and five games with less than ten fantasy points. Brown has a 24% target share with 51 receiving yards per game, 1.72 yards per route run, and a 30.7% first-read share. Brown has five red zone targets and 11 deep targets this season. This week's matchup could swing the pendulum back in his direction after a down game against Green Bay. The Lions have the seventh-highest single high rate this season (57.1%). Brown's splits against two high and single have been massive. Against single high, he leads the team with a 26% target per route run rate and 2.24 yards per route run. Against two high, those numbers drop off the map to 19% and 1.32. Brown will have to contend with a Detroit secondary that, since Week 6, has allowed the tenth-fewest receiving yards per game to perimeter wide receivers while ranking 15th in PPR points per target. Given his track record this season, Brown is a dice roll, but one that I feel pretty good about this week.",NA,NA,"WR19","A-","13.8"
"ppr-wr","WR",2025-11-16,"25411","Rome Odunze","WR","CHI",20,20.16,3.57,15,27,"WR","R. Odunze","WR","https://www.fantasypros.com/nfl/players/rome-odunze.php","rome-odunze.php","5",94.6,"at MIN","MIN",NA,"After last week's strong game, Odunze is the WR15 in fantasy points per game, ranking first among wide receivers in deep targets and 17th in red zone targets. Odunze has a 22.4% target share with 62.1 receiving yards per game, 1.96 yards per route run, and a 26.6.% first-read share. This week, he faces a Minnesota pass defense that leads the NFL in two high rate (69.4%). Against two high, Odunze is third (tied) on the team with a 22% target per route run rate and 1.83 yards per route run. Against two high, he does lead the team with a 25.7% first-read share. Odunze should have another nice game this week against a secondary that, since Week 6, has allowed the most PPR points per target and the third-most receiving yards to perimeter wide receivers.","start",NA,"WR20","A-","13.6"
"ppr-wr","WR",2025-11-16,"22916","Zay Flowers","WR","BAL",21,20.16,1.6,17,24,"WR","Z. Flowers","WR","https://www.fantasypros.com/nfl/players/zay-flowers.php","zay-flowers.php","7",96.6,"at CLE","CLE",NA,"Zay Flowers is the WR21 in fantasy points per game, with ten deep targets and only five red zone targets. Flowers has all five of his red zone targets in the last five games as the team is using him more often inside the 20-yard line. This week, he faces a Browns' secondary that has utilized single high at the second-highest rate (65%). Against single high, Flowers has eaten with a 30.5% target share, 2.98 yards per route run, and a 35.6% first-read share. Flowers should have a strong game this week. Since Week 6, Cleveland has allowed the 14th-most PPR points per target to perimeter wide receivers.","start",NA,"WR21","A-","13.6"
"ppr-wr","WR",2025-11-16,"18219","DK Metcalf","WR","PIT",22,21.32,1.13,19,23,"WR","DK Metcalf","WR","https://www.fantasypros.com/nfl/players/dk-metcalf.php","dk-metcalf.php","5",97.5,"vs. CIN","CIN",NA,"The last time these two teams met, D.J. Turner (2025: 47.4% catch rate and 78.4 passer rating allowed) shadowed D.K. Metcalf on 78.1% of his routes, holding him to four targets, two receptions, and 45 scoreless receiving yards in his coverage. I expect Turner to be in Metcalf's back pocket again this week. Metcalf is the WR29 in fantasy points per game with a 19.9% target share, a 38.6% air-yard share, 1.95 yards per route run, 55.8 receiving yards per game, and a 25.5% first-read share. He has nine red zone targets and ten deep targets this season. Metcalf was the WR42 in weekly scoring his last time out against Cincy. I wouldn't expect a big game from him this week.","sit",NA,"WR22","A-","13.1"
"ppr-wr","WR",2025-11-16,"23794","Romeo Doubs","WR","GB",23,23.95,1.76,22,28,"WR","R. Doubs","WR","https://www.fantasypros.com/nfl/players/romeo-doubs.php","romeo-doubs.php","5",58.1,"at NYG","NYG",NA,"Romeo Doubs left last week's game with a chest injury. He practiced in full all week and doesn't carry an injury designation into Week 11. Doubs is the WR34 in fantasy points per game, ranking second on the team with ten red zone targets while leading the way with ten deep targets. Doubs has a 19.6% target share with 49.6 receiving yards per game, 1.85 yards per route run, and a 24.9% first-read share. Since Week 8, the Giants have had the second-highest single high rate (69.8%). Against single high, Doubs has seen his numbers improve across the board with a 20.3% target share, 1.91 yards per route run, and a 27.5% first-read share. Since Week 6, New York has allowed the seventh-most PPR points per target and receiving yards per game to perimeter wide receivers. Doubs is a strong play this week.",NA,NA,"WR23","B+","13.0"
"ppr-wr","WR",2025-11-16,"19590","Jauan Jennings","WR","SF",24,25.84,3.7,21,35,"WR","J. Jennings","WR","https://www.fantasypros.com/nfl/players/jauan-jennings.php","jauan-jennings.php","14",83.2,"at ARI","ARI",NA,"Since Week 7, Jauan Jennings has been the WR34 in fantasy points per game, soaking up a 23.1% target share with a 33.5% air-yard share and a 33.3% first-read share. He has churned out 47 receiving yards per game in that span with 1.77 yards per route run. In those four games, he has had five red zone targets and four deep targets. Arizona has the fifth-highest two-high rate in the NFL (58.2%). Since Week 7, against two high, Jennings has had a team-leading 27% target per route run rate with 1.73 yards per route run. Jennings is a strong flex play this week. Since Week 6, Arizona has allowed the 11th-most PPR points per target to perimeter wide receivers while ranking 15th in receiving yards per game.","start",NA,"WR24","B+","12.9"
"ppr-wr","WR",2025-11-16,"23748","Khalil Shakir","WR","BUF",25,25.89,2.65,22,32,"WR","K. Shakir","WR","https://www.fantasypros.com/nfl/players/khalil-shakir.php","khalil-shakir.php","7",82.7,"vs. TB","TB",NA,"Khalil Shakir is the WR30 in fantasy points per game, commanding a 20.8% target share and 24% first-read share while churning out 50.8 receiving yards per game with 1.98 yards per route run. Shakir leads the team with eight red zone targets while chipping in with four deep targets. Shakir is a mid-range flex play again this week with a rough matchup. Since Week 6, Tampa Bay has allowed the fifth-fewest PPR points per target to slot receivers while ranking 17th in receiving yards per game allowed.",NA,NA,"WR25","B","12.5"
"ppr-wr","WR",2025-11-16,"25417","Tetairoa McMillan","WR","CAR",26,27.21,2.63,23,33,"WR","T. McMillan","WR","https://www.fantasypros.com/nfl/players/tetairoa-mcmillan.php","tetairoa-mcmillan.php","14",94,"at ATL","ATL",NA,"Tetairoa McMillan is the WR34 in fantasy points per game, ranking 11th in red zone targets and 26th in deep targets among wide receivers. McMillan has a 24.5% target share, a 43.6% air-yard share, 61.8 receiving yards per game, 1.99 yards per route run, and a 30.1% first-read share. The volume constraints this offense has placed upon him have been capping his weekly upside. Across his last five games, he has surpassed 65 receiving yards only once. The matchup is good for McMillan, but it's fair like I said to question his weekly upside at this point because of the offense that he is stuck in. Atlanta has the highest single high rate in the NFL (71.3%). Against single high, McMillan has seen his target per route run rate increase to 26% with 2.05 yards per route run. It's a marginal increase, so don't hit a backflip out of your seat. Atlanta's issues covering perimeter wide receivers could help him this week, though. Since Week 6, they have allowed the eighth-most PPR points per target to perimeter wide receivers.",NA,NA,"WR26","B","12.4"
"ppr-wr","WR",2025-11-16,"23107","Jordan Addison","WR","MIN",27,27.42,3.17,23,37,"WR","J. Addison","WR","https://www.fantasypros.com/nfl/players/jordan-addison.php","jordan-addison.php","6",87.6,"vs. CHI","CHI",NA,"Since Week 9, with J.J. McCarthy under center, Addison has had a 19.4% target share, a 26.1% air-yard share, 41.5 receiving yards per game, 1.20 yards per route run, and a 22.2% first-read share. In those two games, Addison has had one red zone target and three deep targets. This week, he faces a Chicago pass defense that, since Week 6, has utilized single high at the ninth-highest rate (55.3%). Overall, against single high, Addison has seen his target per route run rate dip to 15% with 1.44 yards per route run. This coverage matchup isn't ideal for Addison, but Chicago's secondary has been hapless and could help him boost his stat line this week. Since Week 6, Chicago has allowed the 12th-most receiving yards per game and the tenth-most PPR points per target to perimeter wide receivers. Addison is a decent flex.",NA,NA,"WR27","B","12.2"
"ppr-wr","WR",2025-11-16,"23677","Jameson Williams","WR","DET",28,28.37,2.13,23,31,"WR","J. Williams","WR","https://www.fantasypros.com/nfl/players/jameson-williams.php","jameson-williams.php","8",90.3,"at PHI","PHI",NA,"Jameson Williams has raised his season-long ranking to WR37 in fantasy points per game with WR19 and WR2 weekly finishes in his last two games. Over the last two weeks, he has had an 18.1% target share with a 30% air-yard share, 92.5 receiving yards per game, 2.89 yards per route run, and a 20.4% first-read share. Since Week 9, only two of his 13 targets have been downfield, which is a departure from the rest of the season when he's been just a field stretcher for the offense. We'll see if Williams can keep the hot streak going in Week 11, but it won't be easy. Since Week 6, Philly has allowed the second-fewest PPR points per target and the 12th-fewest receiving yards per game to perimeter wide receivers.",NA,NA,"WR28","B-","12.1"
"ppr-wr","WR",2025-11-16,"18244","Deebo Samuel","WR","WAS",29,28.42,2.41,23,33,"WR","D. Samuel Sr.","WR","https://www.fantasypros.com/nfl/players/deebo-samuel.php","deebo-samuel.php","12",92.1,"at MIA","MIA",NA,"Deebo Samuel is the WR20 in fantasy points per game with a 24.4% target share, 44 receiving yards per game, 1.65 yards per route run, and a 29.7% first-read share. He has ten red zone targets this season and six deep targets as he is leading the team in both categories. Last week's 12.9 PPR point outing was the first time that Samuel had posted double-digit PPR points since Week 5. This week, he could easily do it again. Since Week 6, Miami has allowed the 11th-most PPR points per target and the 12th-most receiving yards per game to slot receivers.","start",NA,"WR29","B-","11.9"
"ppr-wr","WR",2025-11-16,"23123","Quentin Johnston","WR","LAC",30,31.32,4.85,23,45,"WR","Q. Johnston","WR","https://www.fantasypros.com/nfl/players/quentin-johnston.php","quentin-johnston.php","12",62.6,"at JAC","JAC",NA,"Quentin Johnston's usage has bounced back over the last two games despite not having monster fantasy days. Since Week 9, he has had a 21% target share, a 22.9% air-yard share, 47.5 receiving yards per game, 1.42 yards per route run, and a 27.3% first-read share. This week isn't the matchup to continue to ride with Johnston, though, if the Jaguars deploy two high. Jacksonville has utilized two high with 50-70.8% of their defensive snaps in six of their nine games. They do have three single high heavy games as well, so if they go single high heavy, then Johnston would lead the team in the passing game. It's a risk to fade Johnston this week, but if Jacksonville does lean on two high, he won't be heavily involved. Against two high, Johnston has a 15% target per route run rate (fifth on the team) and only 1.14 yards per route run (fifth on the team). Since Week 6, Jacksonville has allowed the fourth-most PPR points per target and the ninth-most receiving yards per game to perimeter wide receivers. Jacksonville's outside corners have struggled, which could also help Johnston. He's a volatile player this week who could be feast or famine. Johnston has been listed as questionable this week (shin). He was limited in practice all week before logging a full session on Friday.","sit",NA,"WR30","C+","11.7"
"ppr-wr","WR",2025-11-16,"23106","Parker Washington","WR","JAC",31,31.89,3.49,25,39,"WR","P. Washington","WR","https://www.fantasypros.com/nfl/players/parker-washington.php","parker-washington.php","8",24.6,"vs. LAC","LAC",NA,"Since Week 7, Parker Washington has been the WR18 in fantasy points per game with a 21.9% target share, a 34.2% air-yard share, 58.3 receiving yards per game, 1.68 yards per route run, and a 25% first-read share. In those three games, Washington has had four red zone targets and five deep targets. Last week, he ran 55.2% of his routes from the slot. I expect him to continue to be the team's slot receiver until Travis Hunter returns. Washington remains a strong volume-based flex option. Since Week 6, the Chargers have faced the eighth-fewest slot targets, but they have allowed the 14th-most PPR points per target to the position. ",NA,NA,"WR31","C+","11.6"
"ppr-wr","WR",2025-11-16,"17253","Courtland Sutton","WR","DEN",32,32.42,3.18,25,37,"WR","C. Sutton","WR","https://www.fantasypros.com/nfl/players/courtland-sutton.php","courtland-sutton.php","12",94.4,"vs. KC","KC",NA,"Courtland Sutton is the WR25 in fantasy points per game with an 18.6% target share, 59 receiving yards per game, 1.93 yards per route run, and a 23.2% first-read share. Sutton is second on the team in red zone targets (six) and third in deep targets (ten). This week, he faces a Kansas City pass defense that, since Week 5, has had the ninth-highest single-high rate (56%). Sutton leads the team against single high with a 23.2% target share, 2.29 yards per route run, and a 27.7% first-read share. Sutton has a nice matchup this week as the Chiefs, since Week 6, have allowed the fifth-most PPR points per target and the fourth-highest passer rating when targeted to perimeter wide receivers.","start",NA,"WR32","C+","11.5"
"ppr-wr","WR",2025-11-16,"25337","Tre Tucker","WR","LV",33,32.79,3.35,25,41,"WR","T. Tucker","WR","https://www.fantasypros.com/nfl/players/tre-tucker.php","tre-tucker.php","8",53.1,"vs. DAL","DAL",NA,"Last week, with Tyler Lockett becoming a full-time player, Tre Tucker took a step back. He still led the team with a 94.3% route share, but he had only an 11.1% target share, 28 receiving yards, 0.85 yards per route run, and a 15.8% first-read share. Excluding his monster Week 3 game, Tucker has had a 15.4% target share, 38.8 receiving yards per game, 1.25 yards per route run, and a 20.1% first-read share. In those eight games, he has had only three red zone targets and six deep targets. Tucker is a low-end flex play this week and only viable because the matchup with Dallas is that good. Since Week 6, Dallas has allowed the sixth-most PPR points per target and the fourth-most receiving yards per game to perimeter wide receivers.",NA,NA,"WR33","C+","11.4"
"ppr-wr","WR",2025-11-16,"27147","Tez Johnson","WR","TB",34,33.16,2.01,29,38,"WR","T. Johnson","WR","https://www.fantasypros.com/nfl/players/tez-johnson.php","tez-johnson.php","9",45.5,"at BUF","BUF",NA,"Since assuming a starting spot in Week 6, Tez Johnson has been the WR21 in fantasy points per game. During that stretch, he has had a 15% target share with 47 receiving yards per game, 1.55 yards per route run, and a 14.8% first-read share. None of those metrics are eye popping. What has carried Johnson's fantasy value has been touchdowns, with four in his last four games. Johnson has been getting plenty of high-leverage usage to suggest he can continue to ride the lightning with four red zone targets and three deep targets in his last four games. Buffalo has the ninth-highest two-high rate in the NFL (54.7%). Since Week 6, against two high, Johnson has had a 20% target per route run rate and 1.98 yards per route run. Johnson is a solid flex play again this week against a Buffalo secondary that, since Week 6, has ranked 15th in PPR points per target allowed to perimeter wide receivers.","start",NA,"WR34","C+","10.9"
"ppr-wr","WR",2025-11-16,"23092","Troy Franklin","WR","DEN",35,34.53,1.63,32,37,"WR","T. Franklin","WR","https://www.fantasypros.com/nfl/players/troy-franklin.php","troy-franklin.php","12",62.1,"vs. KC","KC",NA,"Troy Franklin is in the midst of a breakout season. Franklin is the WR32 in fantasy points per game with top-26 weekly finishes in three of his last four games. Franklin has been giving Courtland Sutton a run for his money, leading the team with a 20.3% target share while averaging 42.5 receiving yards per game with 1.50 yards per route run and a 23.2% first-read share (tied for the team lead). Franklin leads the team in red zone targets (14) and deep targets (16). Franklin is tied for fifth in the NFL in red zone targets. This week, he faces a Kansas City pass defense that, since Week 5, has had the ninth-highest single-high rate (56%). Against single high, Franklin is second on the team with a 22.1% target share with 1.80 yards per route run and a 24.1% first-read share (second on the team). Franklin should have another strong week. Since Week 6, Kansas City has allowed the fifth-most PPR points per target and the fourth-highest passer rating when targeted to perimeter wide receivers.","start",NA,"WR35","C+","10.6"
"ppr-wr","WR",2025-11-16,"23019","Xavier Worthy","WR","KC",36,36.37,4.17,29,42,"WR","X. Worthy","WR","https://www.fantasypros.com/nfl/players/xavier-worthy.php","xavier-worthy.php","10",88.1,"at DEN","DEN",NA,"Since Rashee Rice's return, Xavier Worthy hasn't finished higher than WR38 in weekly scoring (WR47, WR38, WR57). Since Week 7, Worthy has had a 17.5% target share with 37 receiving yards per game, 1.21 yards per route run, and a 24.3% first-read share. In those three games, Worthy has had two red zone targets and three deep targets. Worthy is a sit this week. Since Week 8, Denver has had the fourth-highest two-high rate (63.7%). Against two high, Worthy has disappeared this season with a 16% target per route run rate and 0.67 yards per route run. Since Week 6, Denver has allowed the fourth-fewest PPR points per target to perimeter wide receivers.","sit",NA,"WR36","C+","10.6"
"ppr-wr","WR",2025-11-16,"11616","Keenan Allen","WR","LAC",37,37.32,2.99,34,46,"WR","K. Allen","WR","https://www.fantasypros.com/nfl/players/keenan-allen.php","keenan-allen.php","12",86.1,"at JAC","JAC",NA,"Keenan Allen has seen his usage dip since Week 8 with a 54.9% route share, a 16.1% target share, 34.7 receiving yards per game, 1.68 yards per route run, and a 15.8% first-read share. In those three games, he has had one red zone target and two deep targets. Since Week 8, he has been the WR74 in fantasy points per game. It has been a tough run out for Keenan Allen during crunch time in the fantasy season. Jacksonville has utilized two high with 50-70.8% of their defensive snaps in six of their nine games. Allen has led the team with a 24% target per route run rate against two high while ranking second in yards per route run (1.88). This is a good bounce-back spot for him if the Chargers increase his playing time this week, but there's an equal possibility that they keep him in this new part-time role and it caps his ceiling in Week 11. Since Week 6, Jacksonville has allowed the fourth-most PPR points per target and the ninth-most receiving yards per game to perimeter wide receivers.","sit",NA,"WR37","C","10.5"
"ppr-wr","WR",2025-11-16,"17265","DJ Moore","WR","CHI",38,39.16,3.22,36,47,"WR","DJ Moore","WR","https://www.fantasypros.com/nfl/players/dj-moore-wr.php","dj-moore-wr.php","5",84.4,"at MIN","MIN",NA,"D.J. Moore is the WR42 in fantasy points per game with three top-36 weekly finishes this season (WR29, WR31, WR4). Moore could post a wonderful stat line this week. He has had a 15.4% target share with 44.8 receiving yards per game, 1.50 yards per route run, and a 16.3% first-read share. Moore has seen four red zone targets and seven deep targets. This week, he faces a Minnesota pass defense that leads the NFL in two high rate (69.4%). Against two high, Moore's target share has jumped to 19% with 1.95 yards per route run with an 18.9% first-read share. Moore should excel this week against a secondary that, since Week 6, has allowed the most PPR points per target and the third-most receiving yards to perimeter wide receivers.",NA,NA,"WR38","C","10.3"
"ppr-wr","WR",2025-11-16,"25333","Michael Wilson","WR","ARI",39,41.37,4.22,35,52,"WR","M. Wilson","WR","https://www.fantasypros.com/nfl/players/michael-wilson.php","michael-wilson.php","8",21.5,"vs. SF","SF",NA,"Michael Wilson will operate as the team's second option in the passing game this week behind Trey McBride. Wilson hasn't finished as a top-36 wide receiver in weekly scoring this season in any week. He has only an 11.6% target share with 25.7 receiving yards per game, 0.78 yards per route run, and a 14.9% first-read share. Wilson has six red zone targets and five deep targets this season. He's a low-end flex play this week. San Francisco has shut down perimeter wide receivers. Since Week 6, they have allowed the 13th-fewest PPR points per target and the sixth-fewest receiving yards per game to the position.",NA,NA,"WR39","C","9.8"
"ppr-wr","WR",2025-11-16,"19201","Jerry Jeudy","WR","CLE",40,41.42,2.74,35,46,"WR","J. Jeudy","WR","https://www.fantasypros.com/nfl/players/jerry-jeudy.php","jerry-jeudy.php","9",74.5,"vs. BAL","BAL",NA,"Last week, Jerry Jeudy hit a lot of first-time milestones for the 2025 season. His first top 24 weekly finish of the season (WR11). He scored his first touchdown of the season. Jeudy also managed more than 70 receiving yards for the first time. Do I think this is the beginning of Jeudy's reemergence? Naw, I wish I could say yes, but I can't. With Dillon Gabriel under center, Jeudy has had a 20% target share, 30.6 receiving yards per game, 0.90 yards per route run, and a 27% first-read share. In those five games, Jeudy has six red zone targets and three deep targets. If you want/need to flex Jeudy this week, I get it, but let that be related to the plus matchup and not that you're chasing last week's fantasy points. Since Week 6, Baltimore has allowed the 12th-most fantasy points per game and the sixth-most receiving yards per game to perimeter wide receivers.","sit",NA,"WR40","C","9.7"
"ppr-wr","WR",2025-11-16,"18598","Jakobi Meyers","WR","JAC",41,42.95,3.65,37,53,"WR","J. Meyers","WR","https://www.fantasypros.com/nfl/players/jakobi-meyers.php","jakobi-meyers.php","8",77.7,"vs. LAC","LAC",NA,"Last week, Jakobi Meyers had only a 50% route share with a 13% target share and a 21.4% first-read share. He turned that into three receptions and 41 receiving yards. I'm avoiding flexing Meyers this week with his route share up in the air, although I do expect it to increase some. The matchup isn't great, so it's tough to expect Meyers to maximize a part-time role in Week 11. Since Week 6, the Bolts have allowed the third-fewest PPR points per target and the ninth-fewest receiving yards per game to perimeter wide receivers.",NA,NA,"WR41","C","9.6"
"ppr-wr","WR",2025-11-16,"26314","Malik Washington","WR","MIA",42,43.53,2.09,41,51,"WR","M. Washington","WR","https://www.fantasypros.com/nfl/players/malik-washington.php","malik-washington.php","12",20.3,"vs. WAS","WAS",NA,"Since becoming Jaylen Waddle's running mate in the Dolphins' passing attack in Week 5, Malik Washington has had a 61.8% route share, a 14.9% target share, 24.2 receiving yards per game, 1.15 yards per route run, and a 16.4% first-read share. During that span, he had seven red-zone targets and two deep targets. Malik Washington isn't an awe-inspiring flex option, but he's definitely a viable one for Week 11. Since Week 6, the Commanders have allowed the fifth-most PPR points and the most receiving yards per game to slot receivers.",NA,NA,"WR42","C","9.6"
"ppr-wr","WR",2025-11-16,"16489","Mack Hollins","WR","NE",43,43.95,3.32,37,49,"WR","M. Hollins","WR","https://www.fantasypros.com/nfl/players/mack-hollins.php","mack-hollins.php","14",3.3,"vs. NYJ","NYJ",8,"I hope you read the Primer last week. Mack Hollins stepped up in a big way with an 80.6% route share, a 32.3% target share, a 44.6% air-yard share, 106 receiving yards, and a 36.8% first-read share. Hollins had a red zone target and three deep targets. I don't think he'll equal that performance this week, but the coverage matchup is again in his favor to be a strong flex play. Hollins has excelled against two high coverage this season. This week, he faces a Jets' pass defense that, since Week 8, has utilized two high at the fifth-highest rate (62%). Against two-high, Hollins is second on the team with a 23% target per route run rate, and he leads the team with 2.36 yards per route run. Hollins should excel in Week 11 running against Brandon Stephens (2025: 64.1% catch rate and 117.1 passer rating allowed) and Jarvis Brownlee Jr. (2025: 75% catch rate and 105.4 passer rating allowed) all game.",NA,NA,"WR43","C","9.5"
