"page","page_pos","scrape_date","fantasypros_id","player_name","pos","team","rank","ecr","sd","best","worst","sportradar_id","yahoo_id","cbs_id","player_positions","player_short_name","player_eligibility","player_yahoo_positions","player_page_url","player_filename","player_square_image_url","player_image_url","player_bye_week","player_owned_avg","player_owned_espn","player_owned_yahoo","player_opponent","player_opponent_id","player_ecr_delta","note","tag","recommendation","pos_rank","start_sit_grade","r2p_pts"
"qb","QB",2021-12-24,"18635","Justin Herbert","QB","LAC",1,1.05,0.22,1,2,"f0a8f8e3-b9e9-46ed-85e4-eec6452a8a44","32676","2221960","QB","J. Herbert","QB","QB","https://www.fantasypros.com/nfl/players/justin-herbert.php","justin-herbert.php","https://images.fantasypros.com/images/players/nfl/18635/headshot/210x210.png","https://images.fantasypros.com/images/players/nfl/18635/headshot/210x210.png","7",98.6,98.2,99,"at HOU","HOU",NA,"Herbert comes into a Week 16 matchup against the Texans having thrown multiple TD passes in five consecutive games and in 10 of his 14 starts this season. He's averaging 289.9 passing yards a game and has topped the 300-yard mark seven times. Herbert also adds value with his legs, with 284 rushing yards and three TD runs on the year. The Texans have a respectable pass defense, but Herbert is still the overall QB1 this week.",NA,NA,"QB1","A+","23.1"
"qb","QB",2021-12-24,"16413","Patrick Mahomes","QB","KC",2,3.08,1.77,2,9,"11cad59d-90dd-449c-a839-dddaba4fe16c","30123","2142052","QB","P. Mahomes II","QB","QB","https://www.fantasypros.com/nfl/players/patrick-mahomes.php","patrick-mahomes.php","https://images.fantasypros.com/images/players/nfl/16413/headshot/210x210.png","https://images.fantasypros.com/images/players/nfl/16413/headshot/210x210.png","12",100,99.9,100,"vs. PIT","PIT",NA,"It's hard to assess Mahomes' Week 16 fantasy prospects when his two best weapons, TE Travis Kelce and WR Tyreek Hill, are both on the COVID-19 list and the Chiefs are experiencing a viral outbreak. We don't know whether the Chiefs will have Kelce and Hill for this week. Mahomes has had an erratic year, but he was magnificent down the stretch last week in the Chiefs' 34-28 overtime victory over the Chargers. He threw for 410 yards with three touchdowns and one interception, with all three TD passes coming in the fourth quarter and overtime. Mahomes will be a top-five QB option against the Steelers this week if Kelce and Hill are able to play, but he'll rank several spots lower if both pass catchers are out.",NA,NA,"QB2","A","22.4"
"qb","QB",2021-12-24,"9001","Aaron Rodgers","QB","GB",3,4.03,1.13,2,7,"0ce48193-e2fa-466e-a986-33f751add206","7200","419780","QB","A. Rodgers","QB","QB","https://www.fantasypros.com/nfl/players/aaron-rodgers.php","aaron-rodgers.php","https://images.fantasypros.com/images/players/nfl/9001/headshot/210x210.png","https://images.fantasypros.com/images/players/nfl/9001/headshot/210x210.png","13",98.2,97.4,99,"vs. CLE","CLE",2,"Rodgers has been on an absolute tear his past four games. Since Week 11, Rodgers is averaging 325 passing yards and 3.5 touchdowns per contest and he's the QB4 over that time frame, despite playing one less game than the players above him on that list. He's picked apart opposing defenses here recently and that doesn't figure to stop any time soon. In Week 16 against Cleveland, Rodgers can be viewed as a mid-range QB1.",NA,NA,"QB3","A","21.7"
"qb","QB",2021-12-24,"18600","Kyler Murray","QB","ARI",4,4.13,1.52,2,7,"dd5a6b6e-ffae-45a5-b8e6-718a9251f374","31833","2180829","QB","K. Murray","QB","QB","https://www.fantasypros.com/nfl/players/kyler-murray.php","kyler-murray.php","https://images.fantasypros.com/images/players/nfl/18600/headshot/210x210.png","https://images.fantasypros.com/images/players/nfl/18600/headshot/210x210.png","12",99.8,99.6,100,"vs. IND","IND",NA,"In one of the most shocking events of Week 15 - and there were plenty of them - the Cardinals lost 30 to 12 to the Detroit Lions. Arizona could barely move the ball on offense and Murray was not effective (to put it lightly). He went 23-for-41 for just 257 yards and one touchdown to one interception while adding an abysmal three yards rushing on the ground. Murray and the Cardinals simply looked lost out there and it came through in the fantasy production. Looking ahead to Week 16, Murray will try to get back on track against a Colts defense that's allowing just 248.6 passing yards per game to opposing QBs, but 2 passing touchdowns on average. We should still view him as a mid-range QB1 due to his upside, but his fantasy finish is going to be completely dependent upon what version of this Arizona offense we see out there.",NA,NA,"QB4","A","21.1"
"qb","QB",2021-12-24,"17298","Josh Allen","QB","BUF",5,4.5,1.58,1,8,"3069db07-aa43-4503-ab11-2ae5c0002721","30977","2181054","QB","J. Allen","QB","QB","https://www.fantasypros.com/nfl/players/josh-allen-qb.php","josh-allen-qb.php","https://images.fantasypros.com/images/players/nfl/17298/headshot/210x210.png","https://images.fantasypros.com/images/players/nfl/17298/headshot/210x210.png","7",100,99.9,100,"at NE","NE",-2,"Allen continued his streak of being a dominant fantasy option this past week against Carolina. While he only threw for 210 yards, he was able to finish the game with 22 fantasy points on the back of three total touchdowns. This next matchup against New England is brutal for opposing QBs, but we should see Allen do enough to keep fantasy lineups afloat. He doesn't come with ridiculous upside, but even if the passing game doesn't work for Buffalo, we know that Allen has the rushing ability in his back pocket to compensate. He can be viewed as a high-end/mid-range QB1 in Week 16.",NA,NA,"QB5","A","20.6"
"qb","QB",2021-12-24,"19275","Jalen Hurts","QB","PHI",6,5.95,1.77,2,9,"64bd0f02-6a5d-407e-98f1-fd02048ea21d","32723","2240246","QB","J. Hurts","QB","QB","https://www.fantasypros.com/nfl/players/jalen-hurts.php","jalen-hurts.php","https://images.fantasypros.com/images/players/nfl/19275/headshot/210x210.png","https://images.fantasypros.com/images/players/nfl/19275/headshot/210x210.png","14",94.4,94.7,94,"vs. NYG","NYG",2,"Things weren't looking particularly good for Hurts as the game against Washington got underway, but he rebounded and put up a dominant fantasy performance in Week 15. He ended the game 20-of-26 for 296 yards passing while adding 38 yards on the ground. With three total touchdowns and one interception - that wasn't his fault - Hurts finished as the QB3 on the entire week. Looking forward to Week 16, Hurts struggled mightily the last time he faced off against this Giants team, which should have us concerned. However, due to the upside that he presents each week, Hurts still belongs in starting lineups for the second round of the playoffs. He can be viewed as a mid-range/low-end QB1.",NA,NA,"QB6","B+","20.2"
"qb","QB",2021-12-24,"9451","Matthew Stafford","QB","LAR",7,6.58,1.16,4,9,"ade43b1a-0601-4672-83b6-d246bc066a19","9265","1114942","QB","M. Stafford","QB","QB","https://www.fantasypros.com/nfl/players/matthew-stafford.php","matthew-stafford.php","https://images.fantasypros.com/images/players/nfl/9451/headshot/210x210.png","https://images.fantasypros.com/images/players/nfl/9451/headshot/210x210.png","11",97.2,96.4,98,"at MIN","MIN",NA,"Stafford wasn't perfect this past week against Seattle, but he did enough from a fantasy perspective to finish as a top-12 option. He completed 21-of-29 passes for 244 yards and had two touchdowns to one interception. Looking ahead to Week 16, Stafford now gets to take on the Minnesota Vikings defense that is allowing the third-most fantasy points to opposing QBs this season and a whopping 272.4 passing yards per game. At this point, Stafford is locked into your starting lineup and he comes with top-5 upside in this particular matchup.",NA,NA,"QB7","B+","19.9"
"qb","QB",2021-12-24,"9603","Tom Brady","QB","TB",8,7.83,1.14,4,10,"41c44740-d0f6-44ab-8347-3b5d515e5ecf","5228","187741","QB","T. Brady","QB","QB","https://www.fantasypros.com/nfl/players/tom-brady.php","tom-brady.php","https://images.fantasypros.com/images/players/nfl/9603/headshot/210x210.png","https://images.fantasypros.com/images/players/nfl/9603/headshot/210x210.png","9",99.1,99.2,99,"at CAR","CAR",NA,"The 44-year-old Brady has been enjoying a marvelous season, leading the league in passing yardage (4,348) and TD passes (36), but now he has to deal with a depleted cache of weapons. Buccaneers WR Chris Godwin tore his ACL against the Saints in Week 15 and is out for the season. WR Mike Evans and RB Leonard Fournette sustained hamstring injuries against the Saints and are both unlikely to suit up against the Panthers this week. Godwin, Evans, and Fournette have accounted for 311 targets, 231 receptions, 2,456 receiving yards and 18 TD catches this season. The good news is that Brady and the Bucs are getting WR Antonio Brown back from an ankle injury and fake-vaccination-card suspension. Still, Brady struggled against the Saints last week, completing 26 of 48 passes for 214 yards with no touchdowns and one interception, and the absence of so many good pass catchers is likely to limit his ceiling this week in a road game against a Panthers pass defense that ranks eighth in DVOA. Brady is the QB8 this week.",NA,NA,"QB8","B","19.5"
"qb","QB",2021-12-24,"15600","Dak Prescott","QB","DAL",9,9.43,1.2,6,11,"86197778-8d4b-4eba-affe-08ef7be7c70b","29369","1824864","QB","D. Prescott","QB","QB","https://www.fantasypros.com/nfl/players/dak-prescott.php","dak-prescott.php","https://images.fantasypros.com/images/players/nfl/15600/headshot/210x210.png","https://images.fantasypros.com/images/players/nfl/15600/headshot/210x210.png","7",98.4,97.8,99,"vs. WAS","WAS",NA,"Over the last five weeks, Prescott is the QB17 despite averaging 41.2 pass attempts per game. He's thrown five TD passes and five interceptions in his last five games, averaging just 6.1 yards per pass attempt over that span. As noted by Dallas Cowboys insider Bobby Belt on Twitter, Dak has had 17 career games in which he's averaged under 6.0 yards per attempt, and five of those games have occurred since the start of November. So what's going on? Well, the Dallas offense has been seeing more of the two-high safety looks that vexed the Chiefs' Patrick Mahomes and some other QBs earlier in the season. Dak's ball placement had been off, too - he's simply missing receivers. Dak is too good to stay down for long, but even a seemingly favorable matchup against Washington isn't that encouraging, because Dak just faced the Football Team in Week 14 and threw for 211 yards with one touchdown and two interceptions, averaging 5.4 yards per attempt. He's the QB11 this week and a riskier play than usual.","start",NA,"QB9","B","19.1"
"qb","QB",2021-12-24,"19196","Joe Burrow","QB","CIN",10,10.78,0.96,9,13,"3023ac10-4e7f-425f-9fc5-2b8e6332c92e","32671","2179798","QB","J. Burrow","QB","QB","https://www.fantasypros.com/nfl/players/joe-burrow.php","joe-burrow.php","https://images.fantasypros.com/images/players/nfl/19196/headshot/210x210.png","https://images.fantasypros.com/images/players/nfl/19196/headshot/210x210.png","10",85.8,81.6,90,"vs. BAL","BAL",2,"This looks like a great spot for Burrow, who blistered the Ravens for 416 passing yards and three touchdowns when he faced them in Week 7. Baltimore has since lost its best cornerback, Marlon Humphrey, to a season-ending pectoral injury. Burrow simply didn't get enough passing volume last week in the Bengals' 15-10 win over the Broncos, completing 15 of 22 passes for 157 yards with one touchdown and no interceptions. Burrow ranks 15th in pass attempts this season, averaging 31.1 attempts per game, and volume is always a potential concern for a QB playing in an offense that ranks 31st in pace, burning an average of 29.8 seconds between offensive snaps. As well as Burrow has been throwing the ball lately, the TD gravy train has been derailed. In his first eight starts, Burrow threw 20 TD passes. In his last six starts, he's thrown six TD passes. Despite the touchdown slump, Burrow checks in at QB9 this week.",NA,NA,"QB10","B","18.6"
"qb","QB",2021-12-24,"17233","Lamar Jackson","QB","BAL",11,11.38,7.06,4,38,"e06a9c07-453a-4bb0-a7e9-2c3a64166dad","31002","2181169","QB","L. Jackson","QB","QB","https://www.fantasypros.com/nfl/players/lamar-jackson.php","lamar-jackson.php","https://images.fantasypros.com/images/players/nfl/17233/headshot/210x210.png","https://images.fantasypros.com/images/players/nfl/17233/headshot/210x210.png","8",98.8,98.6,99,"at CIN","CIN",NA,"Jackson is dealing with a bone bruise of his ankle and didn't play in Week 15. He wasn't practicing as of Wednesday, making it unclear whether Jackson will be able to start against the Bengals in Week 15. With Huntley having played reasonably well in Weeks 14 and 15, the Ravens will have a dilemma if Jackson is healthy enough to play but at less than 100% of capacity. Jackson hasn't been very effective as a passer since the start of November, averaging 6.0 yards per pass attempt and throwing six TD passes and eight interceptions. Jackson's rushing yardage offers a stable floor, but his passing production has become a wild card, and his fast start as a passer in Weeks 1-5 is pretty much a distant memory. In an earlier meeting with the Bengals in Week 7, Jackson threw for 257 yards with one touchdown and no interceptions, rushing 12 times for 88 yards. He'll rank as a top-10 QB if he plays, but with an uncertain ceiling. Huntley, who over the last two weeks has thrown for 485 yards and three TDs and run for 118 yards and two TDs, would be a high-end QB2 if Jackson had to sit again.",NA,NA,"QB11","C+","18.1"
"qb","QB",2021-12-24,"11177","Kirk Cousins","QB","MIN",12,12.35,1.13,10,15,"bbd0942c-6f77-4f83-a6d0-66ec6548019e","25812","1272574","QB","K. Cousins","QB","QB","https://www.fantasypros.com/nfl/players/kirk-cousins.php","kirk-cousins.php","https://images.fantasypros.com/images/players/nfl/11177/headshot/210x210.png","https://images.fantasypros.com/images/players/nfl/11177/headshot/210x210.png","7",79.5,74.9,84,"vs. LAR","LAR",2,"Apparently there is something to be said for the ""Primetime Kirk Cousins"" narrative out there. In Week 15, Cousins completed just 50% of his passes for 87 yards passing and two touchdowns to one interception against a beatable Chicago Bears defense. He fell completely flat after being one of the more consistent fantasy options over the better part of the season and fantasy managers now have to figure out who to turn to in Week 16. Against the Rams defense that's allowing the fourth-fewest fantasy points to opposing QBs, Cousins can't be trusted in your starting lineup.","sit",NA,"QB12","B-","17.5"
"qb","QB",2021-12-24,"11180","Russell Wilson","QB","SEA",13,12.93,0.88,11,15,"409d4cac-ee90-4470-9710-ebe671678339","25785","1272242","QB","R. Wilson","QB","QB","https://www.fantasypros.com/nfl/players/russell-wilson.php","russell-wilson.php","https://images.fantasypros.com/images/players/nfl/11180/headshot/210x210.png","https://images.fantasypros.com/images/players/nfl/11180/headshot/210x210.png","9",90.4,86.7,94,"vs. CHI","CHI",NA,"Since coming back from a finger injury in Week 10, Wilson has averaged 13.3 fantasy points per game, making him the QB27 in that category among passers with at least three starts over that span. Wilson has averaged 239.3 passing yards a game since returning to the lineup and has thrown six TD passes over that six-game stretch. The absence of Tyler Lockett, who was on the COVID-19 list, was a major hindrance to Wilson last week since he simply hasn't been clicking with D.K. Metcalf. With Lockett sidelined, Wilson threw for 156 yards and no touchdowns in a 20-10 loss to the Rams. Lockett is expected back this week, but Wilson is still only the QB15 in this week's rankings, even in a favorable matchup with the Bears.","sit",NA,"QB13","B-","17.1"
"qb","QB",2021-12-24,"12208","Jimmy Garoppolo","QB","SF",14,14.45,0.95,13,17,"42de9d1d-0352-460b-9172-9452414fd7fd","27590","1760229","QB","J. Garoppolo","QB","QB","https://www.fantasypros.com/nfl/players/jimmy-garoppolo.php","jimmy-garoppolo.php","https://images.fantasypros.com/images/players/nfl/12208/headshot/210x210.png","https://images.fantasypros.com/images/players/nfl/12208/headshot/210x210.png","6",30,20,40,"at TEN","TEN",NA,"Garoppolo was efficient in Week 15 against the Falcons, as he completed 18 of his 23 pass attempts, but it didn't lead to much fantasy production. He put up just 14 fantasy points, but due to the chaos of Week 15, that most likely didn't crush your fantasy lineup. Regardless, Garoppolo has another favorable matchup this week against the Titans secondary that's struggling to contain opposing passing games. With the fact that Tennessee is shutting down opposing RBs, we could see the 49ers lean more on their passing game and Garoppolo could put up solid numbers as a result. He can be viewed as a mid-range QB2 for Week 16.","sit",NA,"QB14","C+","16.8"
"qb","QB",2021-12-24,"19781","Justin Fields","QB","CHI",15,15.03,1.47,10,19,"cf15be8f-9117-4531-a517-2b9c7cb3e9e1","33399","1273205","QB","J. Fields","QB","QB","https://www.fantasypros.com/nfl/players/justin-fields.php","justin-fields.php","https://images.fantasypros.com/images/players/nfl/19781/headshot/210x210.png","https://images.fantasypros.com/images/players/nfl/19781/headshot/210x210.png","10",25.5,24.9,26,"at SEA","SEA",NA,"Fields has averaged 51.6 rushing yards over his last seven starts, raising his fantasy floor to the point where investors no longer tremble the thought of starting him in season-long leagues. But Fields' passing is still a work in progress. He's thrown for fewer than 200 yards in 6 of 10 starts, and he's thrown for multiple touchdowns only once all season. Fields had 285 passing yards and a touchdown last week against the Vikings, but those numbers were padded by a meaningless 19-yard TD pass on the final play of regulation, where Bears TE Jesper Horsted may or may not have actually crossed the goal line with the ball. Fields is the QB17 this week.","sit",NA,"QB15","C","16.6"
"qb","QB",2021-12-24,"11174","Ryan Tannehill","QB","TEN",16,17.1,1.09,15,20,"5812204c-6dae-4450-8011-99e0f72864ac","25718","1273654","QB","R. Tannehill","QB","QB","https://www.fantasypros.com/nfl/players/ryan-tannehill.php","ryan-tannehill.php","https://images.fantasypros.com/images/players/nfl/11174/headshot/210x210.png","https://images.fantasypros.com/images/players/nfl/11174/headshot/210x210.png","13",61,58,64,"vs. SF","SF",3,"While a large portion of it is due to the fact that Tannehill doesn't have his main receiving weapons in the lineup, he's been a massive disappointment for fantasy managers recently. Over the course of his past four games, Tannehill has finished with more than 15 fantasy points just once. Reinforcements appear to be coming this week with AJ Brown set to return to the lineup, but that still doesn't put Tannehill on the streaming radar. There's very little upside with the veteran QB at this point and there are better options you can turn to on your waiver wire for Week 16 if you were still rolling him out there. He can be viewed as a low-end QB2 this week.","sit",NA,"QB16","C-","16.3"
"qb","QB",2021-12-24,"19198","Tua Tagovailoa","QB","MIA",17,17.13,1.29,15,20,"26ad9c27-de38-495e-913c-6fb2428e76d3","32675","2741209","QB","T. Tagovailoa","QB","QB","https://www.fantasypros.com/nfl/players/tua-tagovailoa.php","tua-tagovailoa.php","https://images.fantasypros.com/images/players/nfl/19198/headshot/210x210.png","https://images.fantasypros.com/images/players/nfl/19198/headshot/210x210.png","14",46.7,52.4,41,"at NO","NO",NA,"Tua didn't have a very good game against the Jets last week, throwing two interceptions and misfiring on some other throws. He threw for 196 and two touchdowns, however, and the Jets came away with a 31-24 win. It wasn't exactly the sort of game that inspires confidence in Tua's stakeholders, and this week he'll face a Saints defense that terrorized the Buccaneers' Tom Brady last week, sacking him four times and harassing him throughout the game. But if the Miami offensive line can keep the New Orleans pass rush at bay, Tua might be able to do some damage. The Saints are giving up 19.9 fantasy points per game to opposing quarterbacks, the second-highest total in the league. And Dolphins WR Jaylen Waddle is expected to come off the COVID-19 list after missing Week 15. Tua lands at QB16 in this week's rankings.","sit",NA,"QB17","C-","16.1"
"qb","QB",2021-12-24,"9444","Matt Ryan","QB","ATL",18,18.58,2.59,14,24,"7e648a0b-fdc8-4661-a587-5826f2cac11b","8780","420095","QB","M. Ryan","QB","QB","https://www.fantasypros.com/nfl/players/matt-ryan.php","matt-ryan.php","https://images.fantasypros.com/images/players/nfl/9444/headshot/210x210.png","https://images.fantasypros.com/images/players/nfl/9444/headshot/210x210.png","6",37,28.9,45,"vs. DET","DET",4,"Did you know that Ryan has finished as a top-12 QB just three times this entire year? Without top-tier playmakers around him, Ryan is struggling to produce for fantasy football and we normally wouldn't be looking his way at all in the fantasy playoffs, but he has an enticing matchup this week against Detroit. The Lions shut down Kyler and the Cardinals this past week, but otherwise they've been an exploitable matchup on defense. With that being said, we can't view Ryan as anything more than a mid-range/low-end QB2 that still probably doesn't come with a ton of upside, but he should provide a safe floor.","sit",NA,"QB18","D+","16.0"
"qb","QB",2021-12-24,"12092","Derek Carr","QB","LV",19,19.23,1.15,17,22,"9f026fc0-4449-4dc5-a226-2e2830619381","27564","1664819","QB","D. Carr","QB","QB","https://www.fantasypros.com/nfl/players/derek-carr.php","derek-carr.php","https://images.fantasypros.com/images/players/nfl/12092/headshot/210x210.png","https://images.fantasypros.com/images/players/nfl/12092/headshot/210x210.png","8",58.7,57.4,60,"vs. DEN","DEN",NA,"TE Darren Waller has missed three games with an iliotibial band injury, and in those three games Carr has averaged 249.3 yards and thrown only two TD passes. Before the Waller injury, Carr was averaging 310.4 passing yards a game and had thrown 17 TD passes in 11 games. Waller's status for Week 16 isn't clear yet. If he's able to play, Carr will be a decent option against a good Denver pass defense. Carr threw for 341 yards and two touchdowns when he played the Broncos in Week 6. If Waller can't go this week, you might want to find another option at quarterback.","sit",NA,"QB19","D+","15.7"
"qb","QB",2021-12-24,"15520","Carson Wentz","QB","IND",20,20.25,1.16,18,23,"e9a5c16b-4472-4be9-8030-3f77be7890cb","29236","1907522","QB","C. Wentz","QB","QB","https://www.fantasypros.com/nfl/players/carson-wentz.php","carson-wentz.php","https://images.fantasypros.com/images/players/nfl/15520/headshot/210x210.png","https://images.fantasypros.com/images/players/nfl/15520/headshot/210x210.png","14",44.4,40.8,48,"at ARI","ARI",NA,"Wentz wasn't needed much in Week 15, but when he was asked to throw the ball...it wasn't pretty. On just 12 total pass attempts, Wentz completed five passes for just 57 yards with one touchdown and one interception. The matchup against New England wasn't a cakewalk and the run game was certainly working, but Wentz should have been able to do more than just 57 yards passing. This matchup against Arizona should be enticing due to the fact that Jared Goff just shredded them, but we absolutely cannot trust Wentz in our starting lineups in 1QB formats. He's nothing more than a low-end QB2 in Superflex formats.","sit",NA,"QB20","D","15.5"
"qb","QB",2021-12-24,"9039","Ben Roethlisberger","QB","PIT",21,20.68,1.63,17,24,"ea357add-1a41-4a8b-8f34-bbfade7f4d98","6770","493043","QB","B. Roethlisberger","QB","QB","https://www.fantasypros.com/nfl/players/ben-roethlisberger.php","ben-roethlisberger.php","https://images.fantasypros.com/images/players/nfl/9039/headshot/210x210.png","https://images.fantasypros.com/images/players/nfl/9039/headshot/210x210.png","7",22.1,19.2,25,"at KC","KC",NA,"Entering Week 15, Roethlisberger had attempted 40 or more passes on seven different occasions this season, and he was facing a pass-funnel Titans defense. It seemed like a great spot for Big Ben, but the Steelers only ran 45 offensive plays against the Titans in a 19-13 Pittsburgh win, and Roethlisberger threw only 25 passes. He finished with a season-low 148 passing yards, no touchdowns, and no interceptions. Roethlisberger gets a tough matchup this week against a Chiefs defense that's gotten stronger over the course of the season, but the elevated shootout prospects make Big Ben a mid-range QB2.","sit",NA,"QB21","D","15.2"
"qb","QB",2021-12-24,"9869","Cam Newton","QB","CAR",22,22.28,1.6,18,28,"214e55e4-a089-412d-9598-a16495df0d25","24788","1273186","QB","C. Newton","QB","QB","https://www.fantasypros.com/nfl/players/cam-newton.php","cam-newton.php","https://images.fantasypros.com/images/players/nfl/9869/headshot/210x210.png","https://images.fantasypros.com/images/players/nfl/9869/headshot/210x210.png","13",24.9,27.7,22,"vs. TB","TB",NA,"Newton is coming off the ugliest 25-point fantasy week in history. He did most of his damage on the ground, rushing for 71 yards and a touchdown in an unsightly 31-14 loss to the Bills. Newton completed 18 of 38 passes for 156 yards, with one touchdown and one outrageously bad interception. Newton is always a threat to pile up fantasy points as a runner, but his passing is substandard, and Panthers head coach Matt Rhule has intermittently used backup P.J. Walker in games where Newton has struggled. Newton comes with a wide range of possible outcomes, but the low floor lands him at QB22 against the Buccaneers.",NA,NA,"QB22","D-","15.0"
