"page","page_pos","scrape_date","fantasypros_id","player_name","pos","team","rank","ecr","sd","best","worst","sportradar_id","yahoo_id","cbs_id","player_positions","player_short_name","player_eligibility","player_yahoo_positions","player_page_url","player_filename","player_square_image_url","player_image_url","player_bye_week","player_owned_avg","player_owned_espn","player_owned_yahoo","player_opponent","player_opponent_id","player_ecr_delta","note","tag","recommendation","pos_rank","start_sit_grade","r2p_pts"
"ppr-wr","WR",2021-11-13,"18218","AJ Brown","WR","TEN",5,6.4,1.82,4,15,"a9e580f2-1fbe-46fb-887c-c84089b507e4","31883","2258303","WR","A.J. Brown","WR","WR","https://www.fantasypros.com/nfl/players/aj-brown.php","aj-brown.php","https://images.fantasypros.com/images/players/nfl/18218/headshot/210x210.png","https://images.fantasypros.com/images/players/nfl/18218/headshot/210x210.png","13",99.1,99.2,99,"vs. NO","NO",NA,"AJB has averaged 10 targets a game since Week 6, racking up 30-421-2 over that span. His 5-42-0 stat line against the Rams in Week 9 was slightly disappointing, but it's not surprising that Brown's production slipped in a game where he had to face Rams CB Jalen Ramsey, one of the best cover men in the league. AJB faces New Orleans this week. The Saints haven't been moving Marshon Lattimore from his usual spot on the right side of the formation very often, which means that Julio Jones will probably get most of the face time with Lattimore, while Brown gets to work against rookie Paulson Adebo. This looks like a potential smash spot for AJB, who ranks WR5.",NA,NA,"WR5","A+","18.4"
"ppr-wr","WR",2021-11-13,"12119","Mike Evans","WR","TB",6,6.71,2.04,3,15,"c48c21d9-0ae5-478c-ad34-30a660cfa9b8","27535","1824909","WR","M. Evans","WR","WR","https://www.fantasypros.com/nfl/players/mike-evans.php","mike-evans.php","https://images.fantasypros.com/images/players/nfl/12119/headshot/210x210.png","https://images.fantasypros.com/images/players/nfl/12119/headshot/210x210.png","9",99,98.9,99,"at WAS","WAS",NA,"If Antonio Brown, Chris Godwin, and Rob Gronkowski are all out this week, Evans is an excellent bet to see double-digit targets this weekend against Washington, which may have the NFL's worst defensive backfield. Brown and Gronk are almost certainly out, and Evans should see ample targets even if Godwin plays. Evans has been TD-dependent this season, but the touchdowns keep coming. He has eight touchdowns on the season and three multiple-TD games. Evans hasn't topped 76 receiving yards in any of his last three games, but he has four TD catches over that stretch. He's a midrange WR1 this week.",NA,NA,"WR6","A","18.3"
"ppr-wr","WR",2021-11-13,"18615","Diontae Johnson","WR","PIT",7,7.97,2.59,4,11,"244c00c7-fe9a-4f4f-adff-1d5b9c8877e7","31898","2194164","WR","D. Johnson","WR","WR","https://www.fantasypros.com/nfl/players/diontae-johnson.php","diontae-johnson.php","https://images.fantasypros.com/images/players/nfl/18615/headshot/210x210.png","https://images.fantasypros.com/images/players/nfl/18615/headshot/210x210.png","7",96.9,96.7,97,"vs. DET","DET",3,"JuJu Smith-Schuster is already out for the season, and if Chase Claypool misses Week 10 with a toe injury, the sky will be the limit for Johnson's target total against the Lions this weekend. Johnson only saw six targets against the Bears in Week 9, but he's had double-digit targets in 5 of 7 games this year. Johnson is the WR13 for now but will move into WR1 range if Claypool is scratched. He's a solid DraftKings option at $6,800.",NA,NA,"WR7","A","18.1"
"ppr-wr","WR",2021-11-13,"19236","Justin Jefferson","WR","MIN",8,9.49,2.06,6,14,"4131d4ee-0318-4bb5-832a-4dec80668a4f","32692","2871343","WR","J. Jefferson","WR","WR","https://www.fantasypros.com/nfl/players/justin-jefferson.php","justin-jefferson.php","https://images.fantasypros.com/images/players/nfl/19236/headshot/210x210.png","https://images.fantasypros.com/images/players/nfl/19236/headshot/210x210.png","7",99.8,99.6,100,"at LAC","LAC",NA,"It's absurd that Jefferson has been targeted only nine times over his last two games. The first of his five targets against the Ravens in Week 9 resulted in a 50-yard touchdown less than 7 minutes into the game. The second was a seven-yard completion late in the first quarter. Somehow Jefferson saw only three more targets after that - and the game went deep into overtime. Over his last four games, Jefferson has topped 100 yards just one time and scored one touchdown. He's due for an eruption, but it may not come against a quality Chargers pass defense that's giving up 197 passing yards per game and has allowed only 19 completions of 20 or more yards, tied for the second-lowest total in the league. Jefferson is a low-end WR1 this week. At $7,700 on DraftKings, Jefferson is a little too expensive in light of the tricky matchup.",NA,NA,"WR8","A","18.0"
"ppr-wr","WR",2021-11-13,"11616","Keenan Allen","WR","LAC",9,10.23,1.27,6,13,"5f424505-f29f-433c-b3f2-1a143a04a010","26699","1737096","WR","K. Allen","WR","WR","https://www.fantasypros.com/nfl/players/keenan-allen.php","keenan-allen.php","https://images.fantasypros.com/images/players/nfl/11616/headshot/210x210.png","https://images.fantasypros.com/images/players/nfl/11616/headshot/210x210.png","7",99,98.9,99,"vs. MIN","MIN",2,"Allen had a season-high 12 catches for 104 yards against the Eagles last week. It was the first time Allen had hit the 100-yard mark since Week 2. Allen investors were no doubt pleased with the result, though it should be noted that slot receivers have been beating up the Eagles all year. Allen will try to keep the momentum rolling this week against the Vikings, and he gets a juicy individual matchup against Vikings slot corner Mackensie Alexander, who currently grades out 112th among the 117 cornerbacks PFF has graded. Allen profiles as a mid-range WR2. He has some appeal at $7,000 on DraftKings, particularly in cash games.",NA,NA,"WR9","A","18.0"
"ppr-wr","WR",2021-11-13,"19278","Michael Pittman","WR","IND",10,10.31,2.49,6,17,"1aefd5e2-1f85-471a-91a5-4aad4cf6fe6d","32704","2240188","WR","M. Pittman Jr.","WR","WR","https://www.fantasypros.com/nfl/players/michael-pittman.php","michael-pittman.php","https://images.fantasypros.com/images/players/nfl/19278/headshot/210x210.png","https://images.fantasypros.com/images/players/nfl/19278/headshot/210x210.png","14",93,91.9,94,"vs. JAC","JAC",-2,"Pittman got his fifth TD catch of the season in Week 9, and all of them have come in his last five games. He finished with 5-64-1 against the Jets and managed to finish as the WR13 in fantasy scoring for the week even though the game script was less than ideal for him, with the Colts racing out to a 28-10 halftime lead and running the ball on nearly half of their offensive plays. Pittman is the WR9 for the season and has entrenched himself as a must-start for fantasy. He's the WR12 in this week's rankings and a screaming DraftKings value at only $6,300.",NA,NA,"WR10","A","17.5"
"ppr-wr","WR",2021-11-13,"19202","CeeDee Lamb","WR","DAL",11,11.4,1.99,6,15,"a72ea15b-5199-4101-a300-846e1c655add","32687","2865251","WR","C. Lamb","WR","WR","https://www.fantasypros.com/nfl/players/ceedee-lamb.php","ceedee-lamb.php","https://images.fantasypros.com/images/players/nfl/19202/headshot/210x210.png","https://images.fantasypros.com/images/players/nfl/19202/headshot/210x210.png","7",99.5,98.9,100,"vs. ATL","ATL",NA,NA,NA,NA,"WR11","A","17.4"
"ppr-wr","WR",2021-11-13,"16406","Chris Godwin","WR","TB",12,11.66,7.36,5,33,"baa61bb5-f8d0-4f90-bbe2-028576b8d33d","30197","2818150","WR","C. Godwin","WR","WR","https://www.fantasypros.com/nfl/players/chris-godwin.php","chris-godwin.php","https://images.fantasypros.com/images/players/nfl/16406/headshot/210x210.png","https://images.fantasypros.com/images/players/nfl/16406/headshot/210x210.png","9",98.6,98.2,99,"at WAS","WAS",-6,"The Buccaneers have been dealing with a rash of injuries to their pass-catchers, and Godwin may be the latest casualty. He's dealing with a foot injury that leaves his Week 10 status up in the air. This is a cruel injury for Godwin stakeholders. The ace slot receiver has had 16-251-2 on 23 targets over his last two games and was set up with a smash spot against a woeful Washington secondary. If Godwin plays, he'll be a top-10 WR option unless he's on some sort of snap count.",NA,NA,"WR12","A","17.0"
"ppr-wr","WR",2021-11-13,"18219","DK Metcalf","WR","SEA",13,12.54,3.54,7,17,"754faf0f-40f7-45f0-b23b-6ce990ecaf26","31896","2260185","WR","D.K. Metcalf","WR","WR","https://www.fantasypros.com/nfl/players/dk-metcalf.php","dk-metcalf.php","https://images.fantasypros.com/images/players/nfl/18219/headshot/210x210.png","https://images.fantasypros.com/images/players/nfl/18219/headshot/210x210.png","9",99.9,99.8,100,"at GB","GB",NA,"In the three games that Russell Wilson missed with a finger injury, Metcalf continued to produce, catching 14-197-3 on 26 targets with Geno Smith as his quarterback. But Metcalf stakeholders no doubt feel much better about having Wilson back at the controls of the Seattle offense. Metcalf faces a Green Bay defense that's giving up 18.0 fantasy points per game to wide receivers, the third-lowest total in the league. Metcalf is a high-end WR2, and his $6,800 price tag on DraftKings makes him a solid value.",NA,NA,"WR13","A","17.0"
"ppr-wr","WR",2021-11-13,"18244","Deebo Samuel","WR","SF",14,13.57,1.96,10,18,"628a6a0a-4fde-4024-8d7c-28674953d5af","31868","2139735","WR","D. Samuel","WR","WR","https://www.fantasypros.com/nfl/players/deebo-samuel.php","deebo-samuel.php","https://images.fantasypros.com/images/players/nfl/18244/headshot/210x210.png","https://images.fantasypros.com/images/players/nfl/18244/headshot/210x210.png","6",98.2,98.3,98,"vs. LAR","LAR",NA,"Samuel has been dealing with a calf injury lately and apparently had a setback last week. Perhaps that was one reason that the prolific Samuel had ""only"" 5-63-0 on nine targets last week against the Cardinals. Or maybe it was because TE George Kittle was back in the lineup for the first time in weeks, or because WR Brandon Aiyuk was finally getting involved. I don't think we have to worry about Deebo getting caught in a target squeeze. He's averaging 10.1 targets a game and hasn't seen fewer than eight targets in any game this season. The greater concern this week is that Samuel might run a lot of his Week 10 routes against Rams CB Jalen Ramsey, a sublime cover man who kept Titans star A.J. Brown bottled up last week. Samuel lands at WR15 in this week's rankings.",NA,NA,"WR14","A","16.8"
"ppr-wr","WR",2021-11-13,"18226","Marquise Brown","WR","BAL",15,14.63,2.1,9,20,"feeee40a-dd63-41a7-89cd-6c95b5456833","31857","2804128","WR","M. Brown","WR","WR","https://www.fantasypros.com/nfl/players/marquise-brown.php","marquise-brown.php","https://images.fantasypros.com/images/players/nfl/18226/headshot/210x210.png","https://images.fantasypros.com/images/players/nfl/18226/headshot/210x210.png","8",93.9,93.7,94,"at MIA","MIA",NA,"When first-round rookie Rashod Bateman returned from a core injury and made his NFL debut in Week 6, he out-targeted Brown 6-5 in a blowout win over the Chargers, and there were concerns that Bateman's presence might cut into Brown's target share and fantasy value. Those worries appear unfounded now that Brown has seen 26 targets in his last two games, with 14 catches for 196 yards and a touchdown. (By comparison, Bateman has seen 14 targets over Baltimore's last two games.) Brown gets a plum Thursday-night matchup against a Dolphins pass defense that's given up 2,528 passing yards and 41 receptions of 20 or more yards - both league highs. Brown is a low-end WR1 this week.",NA,NA,"WR15","A","16.6"
"ppr-wr","WR",2021-11-13,"18466","Terry McLaurin","WR","WAS",16,15.2,2.25,11,19,"7e8c4641-2beb-4213-ba22-69fe0307005f","31908","2139279","WR","T. McLaurin","WR","WR","https://www.fantasypros.com/nfl/players/terry-mclaurin.php","terry-mclaurin.php","https://images.fantasypros.com/images/players/nfl/18466/headshot/210x210.png","https://images.fantasypros.com/images/players/nfl/18466/headshot/210x210.png","9",98.9,98.8,99,"vs. TB","TB",NA,"It's been a boom-or-bust season for Washington's best pass catcher. McLaurin has had three 100-yard games, but he's had five scoreless games with 62 or fewer yards. Although opponents have thrown on the Buccaneers 68% of the time, the Bucs haven't been especially generous to opposing wide receivers, mainly because Tampa's opponents are targeting RBs and TEs on 44.1% of their throws. McLaurin ranks WR16 but is a DraftKings fade at $7,600.",NA,NA,"WR16","A","16.3"
"ppr-wr","WR",2021-11-13,"13971","Tyler Lockett","WR","SEA",17,16.54,1.32,13,19,"dffa69ad-331e-4f09-ae38-40a5a4406be6","28457","1860834","WR","T. Lockett","WR","WR","https://www.fantasypros.com/nfl/players/tyler-lockett.php","tyler-lockett.php","https://images.fantasypros.com/images/players/nfl/13971/headshot/210x210.png","https://images.fantasypros.com/images/players/nfl/13971/headshot/210x210.png","9",97.7,97.4,98,"at GB","GB",NA,"Lockett is having another roller-coaster year. After opening the season with 12-278-3 in his first two games, he was held to 57 or fewer receiving yards in his next five. Then he went off again in Seattle's most recent game, catching 12-142-0 with Geno Smith as his QB in a Week 8 win over the Jaguars. The return of Russell Wilson this week undoubtedly boosts Lockett's value, but can he find any consistency? He's a midrange WR2 against the Packers.",NA,NA,"WR17","A","16.2"
"ppr-wr","WR",2021-11-13,"13894","Amari Cooper","WR","DAL",18,17.14,1.59,12,19,"00f88be8-45f9-4237-b2b8-3271ec790d07","28392","1984220","WR","A. Cooper","WR","WR","https://www.fantasypros.com/nfl/players/amari-cooper.php","amari-cooper.php","https://images.fantasypros.com/images/players/nfl/13894/headshot/210x210.png","https://images.fantasypros.com/images/players/nfl/13894/headshot/210x210.png","7",98.1,98.2,98,"vs. ATL","ATL",NA,NA,NA,NA,"WR18","A-","16.1"
"ppr-wr","WR",2021-11-13,"11610","Robert Woods","WR","LAR",19,18.69,1.04,16,20,"618bedee-9259-4536-b0ff-fec98d2a20de","26664","1754280","WR","R. Woods","WR","WR","https://www.fantasypros.com/nfl/players/robert-woods.php","robert-woods.php","https://images.fantasypros.com/images/players/nfl/11610/headshot/210x210.png","https://images.fantasypros.com/images/players/nfl/11610/headshot/210x210.png","11",97.6,97.2,98,"at SF","SF",NA,"Woods is averaging 12.7 fantasy points per game, slightly higher than the 12.5 FPPG he averaged in both 2019 and 2020. So for all the concern about Woods earlier this season, he's proving to be the same guy he's been. It just seems like he's having a lesser season because he's been operating in the shadow of Cooper Kupp, who's in the midst of a historic performance. Woods is a lower-end WR2 this week against the 49ers.",NA,NA,"WR19","A-","16.0"
"ppr-wr","WR",2021-11-13,"13429","Adam Thielen","WR","MIN",20,21.06,1.22,19,23,"2fa2b2da-4aa9-44b5-b27e-56876dfe2ad4","27277","2059362","WR","A. Thielen","WR","WR","https://www.fantasypros.com/nfl/players/adam-thielen.php","adam-thielen.php","https://images.fantasypros.com/images/players/nfl/13429/headshot/210x210.png","https://images.fantasypros.com/images/players/nfl/13429/headshot/210x210.png","7",98.2,98.3,98,"at LAC","LAC",NA,"Week 9 offered a comical example of Thielen's continued defiance of touchdown regression. Thielen was targeted seven times and had just two catches for six yards against the Ravens, but one of those catches was a 1-yard touchdown with 1:03 left in regulation that tied the game and forced overtime. The Vikings eventually lost 34-31. Thielen is averaging a career-low 10.6 yards per catch. His 7.2 yards per target would also be a career-low. His average depth of target of 9.2 yards is 2.3 yards shallower than his 2020 aDOT. There are some worrisome signs here, but Thielen is still on pace for a 1,000-yard season, and the touchdowns keep on coming. He's a high-end WR3 this week in a tough matchup vs. the Chargers.","start",NA,"WR20","A-","16.0"
"ppr-wr","WR",2021-11-13,"16377","Mike Williams","WR","LAC",21,21.14,1.17,16,23,"12f27311-7cd6-4ca5-ba7d-571e9de5e1eb","30120","2082516","WR","M. Williams","WR","WR","https://www.fantasypros.com/nfl/players/mike-williams-wr.php","mike-williams-wr.php","https://images.fantasypros.com/images/players/nfl/16377/headshot/210x210.png","https://images.fantasypros.com/images/players/nfl/16377/headshot/210x210.png","7",96,95.9,96,"vs. MIN","MIN",NA,"Big Mike's slump continued with another two-catch game - his third in a row - against the Eagles in Week 9. Strangely, Williams has also seen exactly five targets in three consecutive games. He's averaged just 34.7 receiving yards over that barren, touchdown-less stretch. Williams had at least seven catches in four of his first five games, and it's possible his downturn is connected to a knee injury that first arose in Week 5. Williams is just a midrange WR2 this week against the Vikings and not very appealing at a cost of $6,600 on DraftKings.",NA,NA,"WR21","A-","16.0"
"ppr-wr","WR",2021-11-13,"17265","DJ Moore","WR","CAR",22,22.63,1.74,20,27,"d8202e6d-d03b-4cd1-a793-ff8fd39d9755","30994","2179328","WR","D.J. Moore","WR","WR","https://www.fantasypros.com/nfl/players/dj-moore-wr.php","dj-moore-wr.php","https://images.fantasypros.com/images/players/nfl/17265/headshot/210x210.png","https://images.fantasypros.com/images/players/nfl/17265/headshot/210x210.png","13",97.9,97.8,98,"at ARI","ARI",NA,NA,NA,NA,"WR22","B+","15.2"
"ppr-wr","WR",2021-11-13,"19790","Jaylen Waddle","WR","MIA",23,24.06,1.76,22,29,"0ff9a975-669d-4851-a95d-ab28d9fc29c4","33394","2962110","WR","J. Waddle","WR","WR","https://www.fantasypros.com/nfl/players/jaylen-waddle.php","jaylen-waddle.php","https://images.fantasypros.com/images/players/nfl/19790/headshot/210x210.png","https://images.fantasypros.com/images/players/nfl/19790/headshot/210x210.png","14",88.6,88.2,89,"vs. BAL","BAL",NA,"DeVante Parker is going to miss Week 10 with a hamstring injury, and Will Fuller continues to be out with a broken finger. Waddle's averages in the four games that both Parker and Fuller have missed this season: 9.3 targets, 6.8 catches, 66.8 receiving yards, 0.5 touchdowns. Waddle's target volume should be enhanced against the Ravens on Thursday night with Parker and Fuller both out, and he'll run a lot of his routes against oft-injured Ravens slot corner Tavon Young, who's giving up an 81% catch rate in his coverage. Consider Waddle a high-end WR3.","start",NA,"WR23","B","15.0"
"ppr-wr","WR",2021-11-13,"18345","Hunter Renfrow","WR","LV",24,24.11,0.98,20,27,"34c523c7-bc58-49f0-a9cc-f9edd91fe00f","31981","2144726","WR","H. Renfrow","WR","WR","https://www.fantasypros.com/nfl/players/hunter-renfrow.php","hunter-renfrow.php","https://images.fantasypros.com/images/players/nfl/18345/headshot/210x210.png","https://images.fantasypros.com/images/players/nfl/18345/headshot/210x210.png","8",72.8,75.6,70,"vs. KC","KC",NA,"In the Raiders' first game without Henry Ruggs, who's facing a felony DUI charge and other charges after a fatal car crash in Las Vegas, Renfrow had 7-49-1 on nine targets. Those Week 9 catch and target totals tied season highs for Renfrow, and he's likely to remain heavily involved with Ruggs gone, even though the Raiders have signed DeSean Jackson to take Ruggs' place as their designated field stretcher. Renfrow is averaging 10.7 half-point PPR fantasy points per game. He's a high-end WR3 this week in a favorable matchup against the Chiefs. Renfrow will likely be running a lot of his routes against Chiefs CB L'Jarius Sneed, who's giving up 0.33 fantasy points per route run against him, according to PFF.","start",NA,"WR24","B","13.5"
"ppr-wr","WR",2021-11-13,"19201","Jerry Jeudy","WR","DEN",25,26.17,1.86,22,31,"eaaa4a61-c2a7-4926-8e9b-3ec71be2f991","32685","2741201","WR","J. Jeudy","WR","WR","https://www.fantasypros.com/nfl/players/jerry-jeudy.php","jerry-jeudy.php","https://images.fantasypros.com/images/players/nfl/19201/headshot/210x210.png","https://images.fantasypros.com/images/players/nfl/19201/headshot/210x210.png","11",86,84,88,"vs. PHI","PHI",NA,NA,"start",NA,"WR25","B","13.4"
"ppr-wr","WR",2021-11-13,"11459","Cole Beasley","WR","BUF",26,27.14,1.55,25,30,"7092bb09-a161-4ab9-8d19-fdcf1a91bb3d","26060","1977145","WR","C. Beasley","WR","WR","https://www.fantasypros.com/nfl/players/cole-beasley.php","cole-beasley.php","https://images.fantasypros.com/images/players/nfl/11459/headshot/210x210.png","https://images.fantasypros.com/images/players/nfl/11459/headshot/210x210.png","7",75.8,76.6,75,"at NYJ","NYJ",NA,"A lot of the write-ups for Bills players this week mention the Cover-2 shell defense that Buffalo struggled to solve in the Week 9 loss to Jacksonville. The one Bills player who stands to hit the fantasy jackpot is defenses continue to throw Cover-2 looks at the Bills is Beasley, who'd get a ton of action as Buffalo's primary short-area receiver. Over his last three games, Beasley has 25-231-0 on 33 targets. In the loss to the Jaguars, Beasley had 8-33-0 on 11 targets and undoubtedly would have gotten more looks if not for a foot injury that limited him to just one fourth-quarter snap. We'll have to monitor Beasley's status, though there didn't seem to be any immediate concern that it might be a longer-term injury. Assuming Beasley is good to go for the Week 10 matchup against the Jets, he'll be a mid-range WR3.","start",NA,"WR26","B-","13.0"
"ppr-wr","WR",2021-11-13,"9707","Emmanuel Sanders","WR","BUF",27,27.89,1.85,25,33,"fd4e8681-f2f4-47c7-b954-a72be9b1ca00","24057","564943","WR","E. Sanders","WR","WR","https://www.fantasypros.com/nfl/players/emmanuel-sanders.php","emmanuel-sanders.php","https://images.fantasypros.com/images/players/nfl/9707/headshot/210x210.png","https://images.fantasypros.com/images/players/nfl/9707/headshot/210x210.png","7",79.4,78.8,80,"at NYJ","NYJ",NA,"With opponents giving the Bills more Cover-2 shell looks to take away the deep ball, Sanders becomes a less appealing option for fantasy. He was shut out in Week 8 and had 4-65-0 on eight targets in Week 10. Through the first six weeks of the season, Sanders had been the WR16 in half-point PPR fantasy scoring. Against a Jets defense that's better against the pass than the run, Sanders is just a boom-or-bust WR3 option for Week 10.","start",NA,"WR27","B-","12.7"
"ppr-wr","WR",2021-11-13,"19222","DeVonta Smith","WR","PHI",28,28.49,1.52,25,32,"3555d07e-57ae-43de-97d5-b1b5bf055f17","33398","2866975","WR","D. Smith","WR","WR","https://www.fantasypros.com/nfl/players/devonta-smith.php","devonta-smith.php","https://images.fantasypros.com/images/players/nfl/19222/headshot/210x210.png","https://images.fantasypros.com/images/players/nfl/19222/headshot/210x210.png","14",86.4,85.7,87,"at DEN","DEN",NA,NA,"start",NA,"WR28","C+","12.4"
"ppr-wr","WR",2021-11-13,"12128","Jarvis Landry","WR","CLE",29,29.77,1.85,26,35,"06e41dc1-d5dc-4bdc-8fc3-e0d7c3a99ac4","27591","1824833","WR","J. Landry","WR","WR","https://www.fantasypros.com/nfl/players/jarvis-landry.php","jarvis-landry.php","https://images.fantasypros.com/images/players/nfl/12128/headshot/210x210.png","https://images.fantasypros.com/images/players/nfl/12128/headshot/210x210.png","13",75.9,79.7,72,"at NE","NE",NA,"A target and reception monster early in his career, Landry has become just another possession receiver in Cleveland. Strangely, Landry's fantasy value has been largely unaffected by Odell Beckham Jr.'s presence or lack thereof. The Browns released OBJ last week, and Landry produced only 3-11-0 on five targets against the Bengals in Week 10. Obviously, the fact that the Browns were in control for most of that game and won a 41-16 blowout held down their passing volume. But Landry simply isn't the PPR machine he used to be. That said, there could be heavier target volume for Landry this week with Beckham gone for good and RBs Nick Chubb (COVID-19) and Kareem Hunt (calf) both out. Landry profiles as a low-end WR3 this week. He's an intriguing DraftKings play at a sale price of $5,200.","sit",NA,"WR29","C+","12.2"
"ppr-wr","WR",2021-11-13,"17268","Christian Kirk","WR","ARI",30,32.2,2.7,28,39,"ebcd87ce-218c-4144-810b-921c2f59d6e8","31017","2180820","WR","C. Kirk","WR","WR","https://www.fantasypros.com/nfl/players/christian-kirk.php","christian-kirk.php","https://images.fantasypros.com/images/players/nfl/17268/headshot/210x210.png","https://images.fantasypros.com/images/players/nfl/17268/headshot/210x210.png","12",62.3,54.5,70,"vs. CAR","CAR",NA,NA,NA,NA,"WR30","C+","12.1"
"ppr-wr","WR",2021-11-13,"17253","Courtland Sutton","WR","DEN",31,32.4,2.75,28,39,"b55ae5ba-593f-4560-9cab-14e10698e01d","31010","2218461","WR","C. Sutton","WR","WR","https://www.fantasypros.com/nfl/players/courtland-sutton.php","courtland-sutton.php","https://images.fantasypros.com/images/players/nfl/17253/headshot/210x210.png","https://images.fantasypros.com/images/players/nfl/17253/headshot/210x210.png","11",90.4,90.8,90,"vs. PHI","PHI",NA,NA,"start",NA,"WR31","C+","11.9"
"ppr-wr","WR",2021-11-13,"11215","Marvin Jones","WR","JAC",32,34.09,2.09,32,40,"1a2fbc23-e6db-4d2f-a152-2c774341b7c4","25876","1631804","WR","M. Jones Jr.","WR","WR","https://www.fantasypros.com/nfl/players/marvin-jones.php","marvin-jones.php","https://images.fantasypros.com/images/players/nfl/11215/headshot/210x210.png","https://images.fantasypros.com/images/players/nfl/11215/headshot/210x210.png","7",75.7,77.4,74,"at IND","IND",NA,"The arrival of TE Dan Arnold via trade in late September and the emergence of Jamal Agnew in October have really dinged Jones' fantasy value. Jones has scored one touchdown since Week 3 and has finished with 35 or fewer receiving yards in four of his last five games. He has a soft matchup against the Colts this week, but it's hard to project Jones as anything but a low-end WR3.","sit",NA,"WR32","C+","11.9"
