"page","page_pos","scrape_date","fantasypros_id","player_name","pos","team","rank","ecr","sd","best","worst","sportradar_id","yahoo_id","cbs_id","player_positions","player_short_name","player_eligibility","player_yahoo_positions","player_page_url","player_filename","player_square_image_url","player_image_url","player_bye_week","player_owned_avg","player_owned_espn","player_owned_yahoo","player_opponent","player_opponent_id","player_ecr_delta","note","tag","recommendation","pos_rank","start_sit_grade","r2p_pts"
"ppr-te","TE",2022-12-04,"18290","TJ Hockenson","TE","MIN",3,3.48,0.64,3,5,"bd1120b6-38b3-4225-a4b0-20660a149d0d","31840","2251097","TE","T.J. Hockenson","TE","TE","https://www.fantasypros.com/nfl/players/tj-hockenson.php","tj-hockenson.php","https://images.fantasypros.com/images/players/nfl/18290/headshot/210x210.png","https://images.fantasypros.com/images/players/nfl/18290/headshot/210x210.png","7",98.4,98.7,98,"vs. NYJ","NYJ",NA,"Hockenson has been a volume behemoth since arriving in Minnesota with a 22.1% target share (8.5 targets per game) and 14.2% air yard share. The problem is he hasn't done much with it. Since Week 9 among 23 tight ends (minimum eight targets), he's 19th in PFF receiving grade, 17th in yards per route run, and 19th in YAC per reception. Hockenson has finished as the TE5, TE7, TE11, and TE5 over this span, just based on the volume. That keeps him in the top 5-8 tight-end conversation despite his inefficiencies and the horrible matchup this week. New York is 15th in catch rate and yards per reception allowed to tight ends, but they are only one of two teams (Buffalo) yet to allow a touchdown to tight ends.",NA,NA,"TE3","A","13.5"
"ppr-te","TE",2022-12-04,"20163","Pat Freiermuth","TE","PIT",4,4.52,0.5,4,5,"04f0fefe-9d9d-44f5-94ea-6df2a42df3c6","33443","2961270","TE","P. Freiermuth","TE","TE","https://www.fantasypros.com/nfl/players/pat-freiermuth.php","pat-freiermuth.php","https://images.fantasypros.com/images/players/nfl/20163/headshot/210x210.png","https://images.fantasypros.com/images/players/nfl/20163/headshot/210x210.png","9",94.5,95,94,"at ATL","ATL",-1,"Without Claypool, Freiermuth has been a volume monster and seen the biggest uptick in the Steelers' passing attack. Sans Claypool, he has a 24.7% target share averaging 51.3 receiving yards per game with 1.6 yards per route run. Despite only one touchdown this season, he's seen a recent boom in his red zone usage with four targets inside the 20 yards line in his last three games. Freiermuth is fourth in PFF receiving grade and fifth in yards per route run (minimum 25 targets). The Falcons have given up the 13th-highest catch rate and ninth-most receiving yards per game to tight ends. Freiermuth is a strong TE1 with weekly usage to creep into the top five.","start",NA,"TE4","A-","13.4"
"ppr-te","TE",2022-12-04,"16499","George Kittle","TE","SF",5,4.64,1.35,3,6,"2ada91b0-036e-454f-83c3-6d939ff584a9","30259","2818265","TE","G. Kittle","TE","TE","https://www.fantasypros.com/nfl/players/george-kittle.php","george-kittle.php","https://images.fantasypros.com/images/players/nfl/16499/headshot/210x210.png","https://images.fantasypros.com/images/players/nfl/16499/headshot/210x210.png","9",99.5,99,100,"vs. MIA","MIA",1,"Kittle could blow up with a vintage game this week. He's the TE6 seeing an 18.4% target share (eighth-best) and 15.3% air yard share (seventh-best). Kittle is ranked ninth in PFF receiving grade and sits at 11th in yards per route run (minimum 20 targets). Miami can't guard tight ends this season, ranking 29th in DVOA, bleeding out the third-highest catch rate, sixth-highest receiving yards per game, and third-most fantasy points per game. Kittle could fight Kelce for TE1 overall this week.",NA,NA,"TE5","A","13.0"
"ppr-te","TE",2022-12-04,"17349","Dalton Schultz","TE","DAL",6,5.36,0.62,4,6,"8caec1b4-e0b6-4a84-b8c8-617d6e91ef6a","31107","2136748","TE","D. Schultz","TE","TE","https://www.fantasypros.com/nfl/players/dalton-schultz.php","dalton-schultz.php","https://images.fantasypros.com/images/players/nfl/17349/headshot/210x210.png","https://images.fantasypros.com/images/players/nfl/17349/headshot/210x210.png","9",95.7,94.3,97,"vs. IND","IND",NA,"With Prescott back, Schultz has a 19.1% target share, 50% end zone target share, and 2.42 yards per route run. Schultz has had a 59.6% route run rate since Week 10. Schultz is the TE10 in fantasy points per game with the fifth-most red zone targets among tight ends as he continues to operate as the Cowboys' WR2. Schultz is a top-five tight end against a Colts' defense that's 28th in DVOA, allowing the third-highest catch rate and 12th-highest yards per reception.",NA,NA,"TE6","A-","9.9"
"ppr-te","TE",2022-12-04,"16459","Gerald Everett","TE","LAC",7,7.92,0.8,7,10,"ebeceb00-57e0-4b74-9cf7-853da2afed18","30157","2142692","TE","G. Everett","TE","TE","https://www.fantasypros.com/nfl/players/gerald-everett.php","gerald-everett.php","https://images.fantasypros.com/images/players/nfl/16459/headshot/210x210.png","https://images.fantasypros.com/images/players/nfl/16459/headshot/210x210.png","8",81.5,81,82,"at LV","LV",NA,"Everett is the TE9 in fantasy points per game with a 14.3% target share and 62.1% route participation clip. He's sixth among tight ends in red zone targets while also ranking 21st in yards per route run. Everett has been a top-ten fantasy tight end four times this season. This week's matchup against the Raiders could be his fifth. The Raiders have surrendered the eighth-highest catch rate and fifth-most receiving touchdowns (tied) to tight ends. Everett is a TE1.","start",NA,"TE7","B+","8.8"
"ppr-te","TE",2022-12-04,"18397","Foster Moreau","TE","LV",8,8.96,1.99,7,16,"9c3a67fd-5c6e-4689-9e08-9ff6d4db6c9a","31969","2180634","TE","F. Moreau","TE","TE","https://www.fantasypros.com/nfl/players/foster-moreau.php","foster-moreau.php","https://images.fantasypros.com/images/players/nfl/18397/headshot/210x210.png","https://images.fantasypros.com/images/players/nfl/18397/headshot/210x210.png","6",52.3,45.5,59,"vs. LAC","LAC",NA,"Since assuming the starting role, Moreau has a 15.6% target share, 38.5% end zone target share, and 81.4% route run rate. Since Week 7, he's 17th in PFF receiving grade and 23rd in yards per route run (minimum 15 targets). Moreau is a TE1. Los Angeles is 26th in DVOA, allowing the highest yards per reception and 11th-most fantasy points per game to tight ends.","start",NA,"TE8","B","8.6"
"ppr-te","TE",2022-12-04,"17283","Hayden Hurst","TE","CIN",9,9.6,1.67,7,14,"1b125fc4-5dd9-4eb9-a42f-048e61ca42b7","30995","2185053","TE","H. Hurst","TE","TE","https://www.fantasypros.com/nfl/players/hayden-hurst.php","hayden-hurst.php","https://images.fantasypros.com/images/players/nfl/17283/headshot/210x210.png","https://images.fantasypros.com/images/players/nfl/17283/headshot/210x210.png","10",68.5,65,72,"vs. KC","KC",NA,"Hurst is the TE11 in fantasy with a 14.9% target share and seven red zone targets (14th). Hurst has four top-12 fantasy tight-end games on his resume. He's ranked 21st in PFF receiving grade and 36th in yards per route run. Hurst is a borderline TE1. The Chiefs are 20th in DVOA, allowing the 11th-highest yards per reception and eighth-most receiving touchdowns (tied) to tight ends.","start",NA,"TE9","B-","8.5"
"ppr-te","TE",2022-12-04,"19229","Cole Kmet","TE","CHI",10,10.84,2.22,7,15,"036feeb6-9a22-43c5-a8e3-7ac611d8ff49","32713","2868619","TE","C. Kmet","TE","TE","https://www.fantasypros.com/nfl/players/cole-kmet.php","cole-kmet.php","https://images.fantasypros.com/images/players/nfl/19229/headshot/210x210.png","https://images.fantasypros.com/images/players/nfl/19229/headshot/210x210.png","14",74.1,71.2,77,"vs. GB","GB",NA,"Since Kmet awoke from his season-long slumber (Week 8), he has a 22.1% target share (five targets per game) with a 33.3% end zone target share and 67.3% route run rate. Since Week 8, he has been ninth in PFF receiving grade, 17th in yards per route run (minimum ten targets), and has five of his six red zone targets for the season. Kmet is a low-end TE1/high-end TE2. Green Bay has shut down tight ends allowing the lowest receiving yards per game and fourth-lowest yards per reception. Kmet had only one target and zero receiving yards the last time these teams met. Last year he finished as the TE19 and TE28 in his two games against the Packers.","sit",NA,"TE10","C+","8.5"
"ppr-te","TE",2022-12-04,"18631","Dawson Knox","TE","BUF",11,11,1.88,7,15,"5fb525c5-4e70-4ede-8c49-94ad0cf66b7d","31928","2186345","TE","D. Knox","TE","TE","https://www.fantasypros.com/nfl/players/dawson-knox.php","dawson-knox.php","https://images.fantasypros.com/images/players/nfl/18631/headshot/210x210.png","https://images.fantasypros.com/images/players/nfl/18631/headshot/210x210.png","7",78.5,77,80,"at NE","NE",NA,"Knox put up a dud in Week 12 with only two receptions for 17 yards. He snagged at least four balls in his two games prior and posted at least 57 receiving yards in each. Over his last six games, Knox has a 12.5% target share, a 26.7% end zone target share, and a 73.6% route run rate. Knox is a TE2 against a Patriots defense that's 11th in DVOA against tight ends allowing the fourth-lowest catch rate and 12th-lowest receiving yards per game.","sit",NA,"TE11","C+","8.3"
"ppr-te","TE",2022-12-04,"17598","Tyler Conklin","TE","NYJ",12,12.28,2.31,8,16,"f0d17dfa-ebf3-416c-a8d2-c6bc30675103","31127","2165249","TE","T. Conklin","TE","TE","https://www.fantasypros.com/nfl/players/tyler-conklin.php","tyler-conklin.php","https://images.fantasypros.com/images/players/nfl/17598/headshot/210x210.png","https://images.fantasypros.com/images/players/nfl/17598/headshot/210x210.png","10",33.2,36.3,30,"at MIN","MIN",NA,"Conklin is the TE12 this season which is more an indictment of the position than a reason to feel good about playing him. Conklin has a 16.0% target share (13th-best), 69.2% route participation (16th), and 13.6% air yard share (12th). He's 12th among tight ends with four deep targets, but he has only three red zone targets this season. Conklin rolls back into the TE1 borderline, and our streaming good graces this week with a plus matchup. Minnesota has allowed the ninth-highest catch rate, ninth-highest yards per reception, and eighth-most touchdowns to tight ends.","start",NA,"TE12","C","8.3"
"ppr-te","TE",2022-12-04,"23153","Greg Dulcich","TE","DEN",13,13.2,1.41,9,16,"b9e4a022-d15c-4cef-9879-170277f17207","34036","2964274","TE","G. Dulcich","TE","TE","https://www.fantasypros.com/nfl/players/greg-dulcich.php","greg-dulcich.php","https://images.fantasypros.com/images/players/nfl/23153/headshot/210x210.png","https://images.fantasypros.com/images/players/nfl/23153/headshot/210x210.png","9",38.8,39.5,38,"at BAL","BAL",NA,"Dulcich's stat lines have sunk like the Titanic as this entire offense prays for the Week 18 iceberg to end this dreadful Broncos' season. Dulcich's peripherals still look fine, as he has a 14.9% target share, 68.3% route run rate, and 1.43 yards per route run. The problem is that the meat of those statistics came in his first three games. He hasn't crossed the 40-yard receiving threshold since Week 8. Dulcich is a TE2 with a favorable matchup. Baltimore has allowed the sixth-highest catch rate and eighth-most touchdowns (tied) to tight ends.",NA,NA,"TE13","C","8.2"
"ppr-te","TE",2022-12-04,"16411","Evan Engram","TE","JAC",14,13.56,1.63,10,16,"e21365af-8d66-416e-b0a5-8816d18fcfd9","30136","2079887","TE","E. Engram","TE","TE","https://www.fantasypros.com/nfl/players/evan-engram.php","evan-engram.php","https://images.fantasypros.com/images/players/nfl/16411/headshot/210x210.png","https://images.fantasypros.com/images/players/nfl/16411/headshot/210x210.png","11",38.4,34.8,42,"at DET","DET",NA,"Engram arrives on the streamer radar again as a low-end TE1. He's managed four top-12 fantasy finishes this year and could compile a fifth in Week 13. Engram has a 14.0% target share and 72% route participation (14th). His deep role is quite nice, as he's ranked fifth in deep targets, but he's only drawn four red zone targets (33rd). The Lions have allowed the third-most receiving touchdowns (tied), seventh-highest yards per reception, and eighth-most receiving yards per game to tight ends.","start",NA,"TE14","C-","7.8"
"ppr-te","TE",2022-12-04,"15623","Tyler Higbee","TE","LAR",15,13.88,2.94,9,20,"0df7912d-9e81-47ea-b4f7-d04986df4ee8","29344","1853103","TE","T. Higbee","TE","TE","https://www.fantasypros.com/nfl/players/tyler-higbee.php","tyler-higbee.php","https://images.fantasypros.com/images/players/nfl/15623/headshot/210x210.png","https://images.fantasypros.com/images/players/nfl/15623/headshot/210x210.png","7",80.5,82,79,"vs. SEA","SEA",NA,"Higbee played 59% of the snaps last week and didn't draw a single target. With the quarterback play for this offense hitting a new low and running the ball now the main focus, we can toss out most of the full-season stats for Higbee. Higbee becomes a low-end TE1/high-end TE2 weekly based on the matchups. This week's opponent makes his streamer worthy. Seattle is 27th in DVOA against tight ends allowing the second-most receiving yards per game and fantasy points per game.",NA,NA,"TE15","C-","7.5"
"ppr-te","TE",2022-12-04,"17115","Taysom Hill","TE","NO",16,17.92,3.32,12,21,"3c8a55dd-20a8-4375-b711-49eb5e6e1d0e","30614","2818935","TE","T. Hill","QB,TE","QB,TE","https://www.fantasypros.com/nfl/players/taysom-hill.php","taysom-hill.php","https://images.fantasypros.com/images/players/nfl/17115/headshot/210x210.png","https://images.fantasypros.com/images/players/nfl/17115/headshot/210x210.png","14",44.8,40.6,49,"at TB","TB",4,NA,NA,NA,"TE16","D+","7.3"
"ppr-te","TE",2022-12-04,"17527","Noah Fant","TE","SEA",17,18.8,2.3,15,22,"cdc98acc-9eb6-4b44-81bb-61d7b8a3b55f","31852","2251095","TE","N. Fant","TE","TE","https://www.fantasypros.com/nfl/players/noah-fant.php","noah-fant.php","https://images.fantasypros.com/images/players/nfl/17527/headshot/210x210.png","https://images.fantasypros.com/images/players/nfl/17527/headshot/210x210.png","11",22.8,32.5,13,"at LAR","LAR",NA,NA,"sit",NA,"TE17","D+","6.9"
"ppr-te","TE",2022-12-04,"16502","Robert Tonyan","TE","GB",18,19.08,2.83,16,25,"7c9c7800-69d0-459b-812b-a07ac48e9f2a","30777","2820026","TE","R. Tonyan","TE","TE","https://www.fantasypros.com/nfl/players/robert-tonyan.php","robert-tonyan.php","https://images.fantasypros.com/images/players/nfl/16502/headshot/210x210.png","https://images.fantasypros.com/images/players/nfl/16502/headshot/210x210.png","14",34.4,32.8,36,"at CHI","CHI",NA,"Tonyan is a TE2. Over his last five games, he has an 11.8% target share and 53.8% route run rate. Tonyan has seen his usage fluctuate weekly, which has been frustrating if you've looked at him as a streaming option previously. Thankfully he's not popping on the streaming radar this week against a defense that's held tight ends to the tenth-lowest yards per reception and sixth-lowest receiving yards per game.","sit",NA,"TE18","D","6.8"
"ppr-te","TE",2022-12-04,"15561","Hunter Henry","TE","NE",19,19.4,1.57,17,24,"705899da-3c20-4bc3-b5d0-2e6e40655131","29269","2079848","TE","H. Henry","TE","TE","https://www.fantasypros.com/nfl/players/hunter-henry.php","hunter-henry.php","https://images.fantasypros.com/images/players/nfl/15561/headshot/210x210.png","https://images.fantasypros.com/images/players/nfl/15561/headshot/210x210.png","10",30.6,26.1,35,"vs. BUF","BUF",NA,"Last week Henry saw his route run rate climb back to 75.6% as he saw five targets securing three for 63 receiving yards and a score. This could simply be a flash in the pan, as Henry has an 8.9% target share and 57.2% route run rate over his last four games. Henry is a mid TE2 against a Buffalo defense that has shut down tight ends. The Bills are second in DVOA, holding tight ends to the 11th-lowest receiving yards per game and eighth-fewest fantasy points per game.","sit",NA,"TE19","D","6.7"
"ppr-te","TE",2022-12-04,"12095","Logan Thomas","TE","WAS",20,20.4,3.25,16,28,"b24625a0-d402-4d59-a778-aa4b073bfe5e","27648","1691193","TE","L. Thomas","TE","TE","https://www.fantasypros.com/nfl/players/logan-thomas.php","logan-thomas.php","https://images.fantasypros.com/images/players/nfl/12095/headshot/210x210.png","https://images.fantasypros.com/images/players/nfl/12095/headshot/210x210.png","14",9.5,10,9,"at NYG","NYG",NA,"Since Week 9, Thomas has had a 16.7% target share (four targets per game) and a 65.2% route run rate. In Week 11, Thomas secured five of his six targets for 65 yards. That outing was his only game since Week 2, where he's crested 30 receiving yards, so bare with me because this play is scary. Thomas does fall on the lower spectrum of the streaming radar this week. The Giants are an amazing team to target tight ends with. They are 32nd in DVOA, giving up the fourth-highest catch rate, fifth-highest yards per reception, and fourth-most receiving yards per game. Thomas is a TE2 with TE1 upside.","sit",NA,"TE20","D","6.3"
"ppr-te","TE",2022-12-04,"19389","Harrison Bryant","TE","CLE",21,20.44,4.79,13,28,"f58a5899-8b78-46e8-a29a-ba6273b7d872","32785","2241240","TE","H. Bryant","TE","TE","https://www.fantasypros.com/nfl/players/harrison-bryant.php","harrison-bryant.php","https://images.fantasypros.com/images/players/nfl/19389/headshot/210x210.png","https://images.fantasypros.com/images/players/nfl/19389/headshot/210x210.png","9",3.9,1.8,6,"at HOU","HOU",6,NA,NA,NA,"TE21","D","6.3"
"ppr-te","TE",2022-12-04,"15581","Austin Hooper","TE","TEN",22,22.2,1.62,17,26,"90c2a93f-d837-4e1b-b57c-56648903a8db","29315","2067004","TE","A. Hooper","TE","TE","https://www.fantasypros.com/nfl/players/austin-hooper.php","austin-hooper.php","https://images.fantasypros.com/images/players/nfl/15581/headshot/210x210.png","https://images.fantasypros.com/images/players/nfl/15581/headshot/210x210.png","6",12.2,10.4,14,"at PHI","PHI",NA,NA,NA,NA,"TE22","D-","6.3"
"ppr-te","TE",2022-12-04,"17415","Jordan Akins","TE","HOU",23,22.4,2.48,17,25,"0cb5a32a-a340-4671-ba2a-93f5fa6aee8d","31068","2142712","TE","J. Akins","TE","TE","https://www.fantasypros.com/nfl/players/jordan-akins.php","jordan-akins.php","https://images.fantasypros.com/images/players/nfl/17415/headshot/210x210.png","https://images.fantasypros.com/images/players/nfl/17415/headshot/210x210.png","6",0.9,0.7,1,"vs. CLE","CLE",NA,NA,NA,NA,"TE23","F","6.0"
"ppr-te","TE",2022-12-04,"17272","Mike Gesicki","TE","MIA",24,23.6,1.67,21,28,"1012cbe0-7eba-4169-bfca-183a0204e1a7","31012","2139298","TE","M. Gesicki","TE","TE","https://www.fantasypros.com/nfl/players/mike-gesicki.php","mike-gesicki.php","https://images.fantasypros.com/images/players/nfl/17272/headshot/210x210.png","https://images.fantasypros.com/images/players/nfl/17272/headshot/210x210.png","11",41.3,47.5,35,"at SF","SF",NA,"Gesicki has become an afterthought in this offense. Since Week 8, he has had a 7.5% target share (2.5 targets per game), averaging 18 receiving yards with a 57.9% route run rate and 0.82 yards per route run. Gesicki is a TE2. The 49ers are ninth in DVOA against the tight end, holding them to the second-lowest yards per reception and fifth-lowest fantasy points per game.",NA,NA,"TE24","F","5.9"
"ppr-te","TE",2022-12-04,"18049","Will Dissly","TE","SEA",25,25.54,1.63,23,30,"383f4814-6836-4766-a297-fc063e8509cc","31090","2139628","TE","W. Dissly","TE","TE","https://www.fantasypros.com/nfl/players/will-dissly.php","will-dissly.php","https://images.fantasypros.com/images/players/nfl/18049/headshot/210x210.png","https://images.fantasypros.com/images/players/nfl/18049/headshot/210x210.png","11",4.1,3.2,5,"at LAR","LAR",NA,NA,NA,NA,"TE25","F","5.8"
"ppr-te","TE",2022-12-04,"13470","Cameron Brate","TE","TB",26,27.92,2.23,25,34,"5afe93fd-0caf-4cca-83fc-7f405bebfa3e","28267","2132787","TE","C. Brate","TE","TE","https://www.fantasypros.com/nfl/players/cameron-brate.php","cameron-brate.php","https://images.fantasypros.com/images/players/nfl/13470/headshot/210x210.png","https://images.fantasypros.com/images/players/nfl/13470/headshot/210x210.png","11",1.4,0.8,2,"vs. NO","NO",NA,"Brate is a low-end TE2. Plain and simple, the Saints are the no-fly zone for tight ends. New Orleans is first in DVOA, holding tight ends to the lowest catch rate and seventh-lowest yards per reception. They've only allowed one receiving touchdown to a tight end this season.",NA,NA,"TE26","F","5.3"
"ppr-te","TE",2022-12-04,"23982","Chigoziem Okonkwo","TE","TEN",27,30.74,2.57,25,37,"14e11f9b-58c8-437f-abc0-a4e4df9a7c47","34099","2965208","TE","C. Okonkwo","TE","TE","https://www.fantasypros.com/nfl/players/chigoziem-okonkwo.php","chigoziem-okonkwo.php","https://images.fantasypros.com/images/players/nfl/23982/headshot/210x210.png","https://images.fantasypros.com/images/players/nfl/23982/headshot/210x210.png","6",0.2,0.2,0,"at PHI","PHI",NA,NA,NA,NA,"TE27","F","5.2"
"ppr-te","TE",2022-12-04,"23181","Cade Otton","TE","TB",28,31.17,4.08,25,39,"f23517bd-ae85-484a-8ecb-1f7a2d851e48","34062","2815179","TE","C. Otton","TE","TE","https://www.fantasypros.com/nfl/players/cade-otton.php","cade-otton.php","https://images.fantasypros.com/images/players/nfl/23181/headshot/210x210.png","https://images.fantasypros.com/images/players/nfl/23181/headshot/210x210.png","11",6.1,5.2,7,"vs. NO","NO",NA,NA,NA,NA,"TE28","F","4.6"
"ppr-te","TE",2022-12-04,"16460","Jonnu Smith","TE","NE",29,32.87,7.19,28,62,"e4f25a37-74de-4bfb-b6c9-f50a4fab0b87","30213","2081506","TE","J. Smith","TE","TE","https://www.fantasypros.com/nfl/players/jonnu-smith.php","jonnu-smith.php","https://images.fantasypros.com/images/players/nfl/16460/headshot/210x210.png","https://images.fantasypros.com/images/players/nfl/16460/headshot/210x210.png","10",1.1,1.2,1,"vs. BUF","BUF",NA,NA,NA,NA,"TE29","F","4.6"
"ppr-te","TE",2022-12-04,"23341","Brock Wright","TE","DET",30,32.82,3.01,29,39,"8f182089-7730-499e-8f2e-87bda32debfb","33774","2807423","TE","B. Wright","TE","TE","https://www.fantasypros.com/nfl/players/brock-wright.php","brock-wright.php","https://images.fantasypros.com/images/players/nfl/23341/headshot/210x210.png","https://images.fantasypros.com/images/players/nfl/23341/headshot/210x210.png","6",0.2,0.2,0,"vs. JAC","JAC",NA,NA,NA,NA,"TE30","F","4.6"
"ppr-te","TE",2022-12-04,"23193","Jack Stoll","TE","PHI",31,33.95,3.11,30,43,"0560d134-d316-4cda-9d48-34d32267af68","33891","2239684","TE","J. Stoll","TE","TE","https://www.fantasypros.com/nfl/players/jack-stoll.php","jack-stoll.php","https://images.fantasypros.com/images/players/nfl/23193/headshot/210x210.png","https://images.fantasypros.com/images/players/nfl/23193/headshot/210x210.png","7",0.7,0.4,1,"vs. TEN","TEN",NA,NA,NA,NA,"TE31","F","4.6"
"ppr-te","TE",2022-12-04,"23829","Jelani Woods","TE","IND",32,28.58,4.04,23,36,"321af8f8-b4de-4ed2-a86f-7f97a85a13d4","34029","2787078","TE","J. Woods","TE","TE","https://www.fantasypros.com/nfl/players/jelani-woods.php","jelani-woods.php","https://images.fantasypros.com/images/players/nfl/23829/headshot/210x210.png","https://images.fantasypros.com/images/players/nfl/23829/headshot/210x210.png","14",3.3,1.5,5,"at DAL","DAL",4,NA,NA,NA,"TE32","F","4.5"
"ppr-te","TE",2022-12-04,"13964","MyCole Pruitt","TE","ATL",33,39.41,7.11,32,59,"f22b34cf-6ecf-4522-9c77-1da275dfda7d","28531","1760327","TE","M. Pruitt","TE","TE","https://www.fantasypros.com/nfl/players/mycole-pruitt.php","mycole-pruitt.php","https://images.fantasypros.com/images/players/nfl/13964/headshot/210x210.png","https://images.fantasypros.com/images/players/nfl/13964/headshot/210x210.png","14",0.1,0.1,0,"vs. PIT","PIT",NA,NA,NA,NA,"TE33","F","4.4"
"ppr-te","TE",2022-12-04,"22841","Kylen Granson","TE","IND",34,35.7,3.7,32,48,"bcc0167c-05fd-4b23-981e-60b8784ceb33","33515","2247146","TE","K. Granson","TE","TE","https://www.fantasypros.com/nfl/players/kylen-granson.php","kylen-granson.php","https://images.fantasypros.com/images/players/nfl/22841/headshot/210x210.png","https://images.fantasypros.com/images/players/nfl/22841/headshot/210x210.png","14",0.7,0.3,1,"at DAL","DAL",NA,NA,NA,NA,"TE34","F","4.3"
"ppr-te","TE",2022-12-04,"19539","Noah Gray","TE","KC",35,34.47,2.2,30,37,"c97dfcb6-b999-476f-8487-f3848e92df17","33550","2866903","TE","N. Gray","TE","TE","https://www.fantasypros.com/nfl/players/noah-gray.php","noah-gray.php","https://images.fantasypros.com/images/players/nfl/19539/headshot/210x210.png","https://images.fantasypros.com/images/players/nfl/19539/headshot/210x210.png","8",0.3,0.3,0,"at CIN","CIN",NA,NA,NA,NA,"TE35","F","4.3"
"ppr-te","TE",2022-12-04,"19423","Adam Trautman","TE","NO",36,31.63,8.27,18,44,"4e14183b-f974-4745-9d7f-8f5eb2a92a7d","32775","2182228","TE","A. Trautman","TE","TE","https://www.fantasypros.com/nfl/players/adam-trautman.php","adam-trautman.php","https://images.fantasypros.com/images/players/nfl/19423/headshot/210x210.png","https://images.fantasypros.com/images/players/nfl/19423/headshot/210x210.png","14",0.2,0.2,0,"at TB","TB",NA,NA,NA,NA,"TE36","F","4.2"
"ppr-te","TE",2022-12-04,"24238","Daniel Bellinger","TE","NYG",37,34.44,10.22,26,61,"42a1c03e-790e-46ba-b0d5-d304e44c02c7","34068","2963615","TE","D. Bellinger","TE","TE","https://www.fantasypros.com/nfl/players/daniel-bellinger.php","daniel-bellinger.php","https://images.fantasypros.com/images/players/nfl/24238/headshot/210x210.png","https://images.fantasypros.com/images/players/nfl/24238/headshot/210x210.png","9",1.9,1.7,2,"vs. WAS","WAS",NA,NA,NA,NA,"TE37","F","4.1"
"ppr-te","TE",2022-12-04,"14084","CJ Uzomah","TE","NYJ",38,34.63,4.97,27,43,"19858900-5c8e-49a7-ab02-34ef625724ca","28545","2174118","TE","C.J. Uzomah","TE","TE","https://www.fantasypros.com/nfl/players/cj-uzomah.php","cj-uzomah.php","https://images.fantasypros.com/images/players/nfl/14084/headshot/210x210.png","https://images.fantasypros.com/images/players/nfl/14084/headshot/210x210.png","10",0.3,0.3,0,"at MIN","MIN",NA,NA,NA,NA,"TE38","F","3.9"
